[I 2024-04-21 01:37:23,259] Trial 140 finished with values: [5.366952764045568, 0.21781574240804533, -0.0574777134249842, 70.53670511725628] and parameters: {'dropout': 0.4573666223298326, 'num_heads': 8, 'bias': True, 'loss_fn': 'MSE', 'optimizer': 'Adam', 'lr': 0.026274383492988353, 'weight_decay': 2.3330272265854954e-05}. 
[I 2024-04-21 01:38:23,647] Trial 141 finished with values: [5.434476923227569, 0.17838088290864243, -0.11328095734088484, 74.25893671676074] and parameters: {'dropout': 0.626088838661456, 'num_heads': 8, 'bias': True, 'loss_fn': 'MSE', 'optimizer': 'Adam', 'lr': 0.0518227826558114, 'weight_decay': 0.05307017177396677}. 
[I 2024-04-21 01:39:12,388] Trial 142 finished with values: [8.103536807993382, 0.12897189163364903, -0.7627913755396001, 117.58308838203229] and parameters: {'dropout': 0.5100719399581917, 'num_heads': 8, 'bias': True, 'loss_fn': 'MSE', 'optimizer': 'Adam', 'lr': 0.0008516195332639563, 'weight_decay': 0.005696155225234225}. 
[I 2024-04-21 01:40:14,161] Trial 143 finished with values: [4.8439262424981635, 0.4426182689752105, 0.17811125939224615, 54.82226528224115] and parameters: {'dropout': 0.36021406582955795, 'num_heads': 1, 'bias': False, 'loss_fn': 'MAE', 'optimizer': 'Adam', 'lr': 0.002386297911470172, 'weight_decay': 2.6428916322772236e-05}. 
[I 2024-04-21 01:41:24,221] Trial 144 finished with values: [5.381338796343393, 0.16809623399651416, -0.10012553425450887, 73.38143340188613] and parameters: {'dropout': 0.35454470180501174, 'num_heads': 4, 'bias': True, 'loss_fn': 'MAE', 'optimizer': 'Adam', 'lr': 0.005756458005859107, 'weight_decay': 0.08220975779411431}. 
[I 2024-04-21 01:42:18,793] Trial 145 finished with values: [6.030837511799917, 0.05521652978137183, -0.06936434931198932, 71.32957679649223] and parameters: {'dropout': 0.31494613823127937, 'num_heads': 1, 'bias': True, 'loss_fn': 'MSE', 'optimizer': 'Adam', 'lr': 0.07754675794637712, 'weight_decay': 1.195900659167233e-05}. 
[I 2024-04-21 01:43:50,673] Trial 146 finished with values: [5.044959892711738, 0.43399431070192657, 0.17095018903289239, 55.299928595471336] and parameters: {'dropout': 0.32012678495573904, 'num_heads': 8, 'bias': False, 'loss_fn': 'MAE', 'optimizer': 'Adam', 'lr': 0.00018846401954415756, 'weight_decay': 7.011871824250725e-05}. 
[I 2024-04-21 01:45:12,675] Trial 147 finished with values: [9.340426526201119, 0.11814661345288541, -1.3124427890008739, 154.24636664917404] and parameters: {'dropout': 0.44019580455912544, 'num_heads': 1, 'bias': True, 'loss_fn': 'MAE', 'optimizer': 'Adam', 'lr': 0.00018846401954415756, 'weight_decay': 0.00045917349837111597}. 
[I 2024-04-21 01:45:56,152] Trial 148 finished with values: [5.399584277885041, 0.2035273987753673, 0.03080898658760267, 64.64773663545832] and parameters: {'dropout': 0.46401939383716423, 'num_heads': 8, 'bias': True, 'loss_fn': 'MSE', 'optimizer': 'Adam', 'lr': 0.0518227826558114, 'weight_decay': 0.05307017177396677}. 
[I 2024-04-21 01:46:55,624] Trial 149 finished with values: [5.249018987617955, 0.32472151329659893, -0.03574383052721952, 69.08699466988678] and parameters: {'dropout': 0.44019580455912544, 'num_heads': 8, 'bias': True, 'loss_fn': 'MAE', 'optimizer': 'Adam', 'lr': 0.0003139835604020809, 'weight_decay': 0.002914526952378704}. 
[I 2024-04-21 01:47:49,726] Trial 150 finished with values: [5.395793975398167, 0.20788415219743164, -0.03631052010325342, 69.12479444099331] and parameters: {'dropout': 0.626088838661456, 'num_heads': 4, 'bias': False, 'loss_fn': 'MSE', 'optimizer': 'RMSprop', 'lr': 0.07754675794637712, 'weight_decay': 0.0015978339728337685}. 
[I 2024-04-21 01:48:42,057] Trial 151 finished with values: [5.193097232644344, 0.2964751952878272, 0.050131369256910197, 63.35887996150212] and parameters: {'dropout': 0.31961758477836855, 'num_heads': 4, 'bias': True, 'loss_fn': 'MSE', 'optimizer': 'Adam', 'lr': 0.00883097964134523, 'weight_decay': 1.195900659167233e-05}. 
[I 2024-04-21 01:49:38,447] Trial 152 finished with values: [6.385994761931409, 0.26747421669252724, -0.24579305466830204, 83.09786222317166] and parameters: {'dropout': 0.6966193868431158, 'num_heads': 8, 'bias': False, 'loss_fn': 'MSE', 'optimizer': 'RMSprop', 'lr': 0.00022343489096155288, 'weight_decay': 0.0015978339728337685}. 
[I 2024-04-21 01:50:50,940] Trial 153 finished with values: [5.234498252649113, 0.4214167115065067, 0.17554112663216437, 54.99370028678884] and parameters: {'dropout': 0.626088838661456, 'num_heads': 1, 'bias': True, 'loss_fn': 'MSE', 'optimizer': 'RMSprop', 'lr': 0.0008516195332639563, 'weight_decay': 0.00016773746443731933}. 
[I 2024-04-21 01:51:27,264] Trial 154 finished with values: [5.3716356048749745, 0.24401896045579335, -0.09859931994586524, 73.27963066196278] and parameters: {'dropout': 0.44019580455912544, 'num_heads': 2, 'bias': True, 'loss_fn': 'MAE', 'optimizer': 'RMSprop', 'lr': 0.0003139835604020809, 'weight_decay': 0.002914526952378704}. 
[I 2024-04-21 01:52:24,390] Trial 155 finished with values: [5.307381847737062, 0.17937658705105577, -0.05642841001093024, 70.46671366064587] and parameters: {'dropout': 0.4472634833863586, 'num_heads': 4, 'bias': False, 'loss_fn': 'MAE', 'optimizer': 'SGD', 'lr': 0.0012780472815281188, 'weight_decay': 0.00018005416692111982}. 
[I 2024-04-21 01:53:26,048] Trial 156 finished with values: [5.16129723030626, 0.40395418761237606, 0.15444518533290774, 56.40085825494791] and parameters: {'dropout': 0.5700265537579589, 'num_heads': 2, 'bias': True, 'loss_fn': 'MSE', 'optimizer': 'RMSprop', 'lr': 0.0015212116786850456, 'weight_decay': 0.001168696876803426}. 
[I 2024-04-21 01:54:05,659] Trial 157 finished with values: [5.429197819939629, 0.20380684679750766, -0.11531487056336598, 74.39460438652523] and parameters: {'dropout': 0.6966193868431158, 'num_heads': 8, 'bias': False, 'loss_fn': 'MAE', 'optimizer': 'RMSprop', 'lr': 0.002592353885586466, 'weight_decay': 0.0015978339728337685}. 
[I 2024-04-21 01:55:12,670] Trial 158 finished with values: [14.541820679514467, 0.0807816055633388, -3.8645387534290485, 324.4782667530243] and parameters: {'dropout': 0.44019580455912544, 'num_heads': 4, 'bias': True, 'loss_fn': 'MSE', 'optimizer': 'RMSprop', 'lr': 0.0015212116786850456, 'weight_decay': 0.08220975779411431}. 
[I 2024-04-21 01:56:08,585] Trial 159 finished with values: [5.438832446632989, 0.0885889286601349, -0.08734478692786207, 72.52892200243734] and parameters: {'dropout': 0.24104348656224273, 'num_heads': 2, 'bias': False, 'loss_fn': 'MAE', 'optimizer': 'Adam', 'lr': 0.0006568544474822875, 'weight_decay': 0.033819847535106105}. 
[I 2024-04-21 01:57:02,065] Trial 160 finished with values: [5.258587994035972, 0.23320658118233986, -0.02176718498144692, 68.15471353254013] and parameters: {'dropout': 0.627239093738081, 'num_heads': 2, 'bias': True, 'loss_fn': 'MAE', 'optimizer': 'Adam', 'lr': 0.026274383492988353, 'weight_decay': 1.1991207122543926e-05}. 
[I 2024-04-21 01:58:06,934] Trial 161 finished with values: [12.298403881979851, 0.13746490053241944, -2.2964645106380184, 219.88335277844996] and parameters: {'dropout': 0.5311365350726444, 'num_heads': 4, 'bias': True, 'loss_fn': 'MSE', 'optimizer': 'RMSprop', 'lr': 0.00016356007653725102, 'weight_decay': 7.736699491287808e-05}. 
[I 2024-04-21 01:59:06,181] Trial 162 finished with values: [5.297625219263129, 0.26171620170007526, -0.015592906636008985, 67.74287199164044] and parameters: {'dropout': 0.5193595144407694, 'num_heads': 4, 'bias': True, 'loss_fn': 'MSE', 'optimizer': 'Adam', 'lr': 0.00883097964134523, 'weight_decay': 1.195900659167233e-05}. 
[I 2024-04-21 02:00:04,919] Trial 163 finished with values: [5.253095268536624, 0.24360463151228473, -0.007485767405784438, 67.20210325300219] and parameters: {'dropout': 0.42257222338709355, 'num_heads': 1, 'bias': True, 'loss_fn': 'MSE', 'optimizer': 'Adam', 'lr': 0.026274383492988353, 'weight_decay': 0.0004661851350818042}. 
[I 2024-04-21 02:01:04,868] Trial 164 finished with values: [5.6832235758271485, 0.22378066031663574, 0.03435892106751248, 64.41094613064098] and parameters: {'dropout': 0.5700265537579589, 'num_heads': 4, 'bias': False, 'loss_fn': 'MSE', 'optimizer': 'RMSprop', 'lr': 0.041784184662472634, 'weight_decay': 0.00018005416692111982}. 
[I 2024-04-21 02:01:58,076] Trial 165 finished with values: [5.300878861057647, 0.23840689200635568, -0.05926493594336879, 70.65591783082724] and parameters: {'dropout': 0.44019580455912544, 'num_heads': 8, 'bias': False, 'loss_fn': 'MAE', 'optimizer': 'RMSprop', 'lr': 0.0029779843699816494, 'weight_decay': 0.002914526952378704}. 
[I 2024-04-21 02:04:05,164] Trial 166 finished with values: [8.183896596250836, 0.12848803687822566, -1.1546229961213488, 143.71934744991862] and parameters: {'dropout': 0.3635622435900131, 'num_heads': 4, 'bias': True, 'loss_fn': 'MSE', 'optimizer': 'RMSprop', 'lr': 0.0015212116786850456, 'weight_decay': 0.0002608929985313556}. 
[I 2024-04-21 02:04:56,869] Trial 167 finished with values: [5.3728739612216145, 0.3716804906199136, 0.033386868267518244, 64.4757847564022] and parameters: {'dropout': 0.5700265537579589, 'num_heads': 8, 'bias': False, 'loss_fn': 'MSE', 'optimizer': 'RMSprop', 'lr': 0.0015212116786850456, 'weight_decay': 0.00018005416692111982}. 
[I 2024-04-21 02:05:44,179] Trial 168 finished with values: [5.3074385233295445, 0.2085593016551184, -0.053251084489463585, 70.25477720985927] and parameters: {'dropout': 0.44019580455912544, 'num_heads': 8, 'bias': True, 'loss_fn': 'MAE', 'optimizer': 'Adam', 'lr': 0.029711206746133093, 'weight_decay': 0.002914526952378704}. 
[I 2024-04-21 02:06:47,546] Trial 169 finished with values: [5.207721028657553, 0.39982199927189976, 0.11554269148884988, 58.99576281110795] and parameters: {'dropout': 0.31961758477836855, 'num_heads': 1, 'bias': True, 'loss_fn': 'MAE', 'optimizer': 'RMSprop', 'lr': 0.002310234514292926, 'weight_decay': 0.00016123382618607942}. 
[I 2024-04-21 02:07:46,066] Trial 170 finished with values: [5.233685022054182, 0.2749592714243736, 0.006992813276028853, 66.23634164582681] and parameters: {'dropout': 0.626088838661456, 'num_heads': 4, 'bias': False, 'loss_fn': 'MSE', 'optimizer': 'RMSprop', 'lr': 0.007998144896696134, 'weight_decay': 0.00045917349837111597}. 
[I 2024-04-21 02:09:42,177] Trial 171 finished with values: [7.340414840071133, 0.33332898865687827, -0.6194107063562575, 108.01919889925148] and parameters: {'dropout': 0.5311365350726444, 'num_heads': 4, 'bias': True, 'loss_fn': 'MSE', 'optimizer': 'Adam', 'lr': 0.0003255565571680538, 'weight_decay': 0.0004661851350818042}. 
[I 2024-04-21 02:10:15,200] Trial 172 finished with values: [5.596184061119418, 0.3091514594811265, 0.08846194804944363, 60.80212373019977] and parameters: {'dropout': 0.6966193868431158, 'num_heads': 8, 'bias': False, 'loss_fn': 'MSE', 'optimizer': 'RMSprop', 'lr': 0.0006528022794616931, 'weight_decay': 0.003322500735489408}. 
[I 2024-04-21 02:11:27,174] Trial 173 finished with values: [5.166823834630524, 0.38071859013013526, 0.1375457048138965, 57.528100615586915] and parameters: {'dropout': 0.5311365350726444, 'num_heads': 2, 'bias': False, 'loss_fn': 'MAE', 'optimizer': 'Adam', 'lr': 0.0015212116786850456, 'weight_decay': 1.195900659167233e-05}. 
[I 2024-04-21 02:12:34,325] Trial 174 finished with values: [5.239291457956872, 0.31342475371213446, 0.007562858801925865, 66.19831802352901] and parameters: {'dropout': 0.31961758477836855, 'num_heads': 8, 'bias': True, 'loss_fn': 'MAE', 'optimizer': 'Adam', 'lr': 0.0003139835604020809, 'weight_decay': 0.05390662290337038}. 
[I 2024-04-21 02:14:13,960] Trial 175 finished with values: [5.994325042113698, 0.3945531182089031, -0.0178283310972962, 67.89198102158589] and parameters: {'dropout': 0.5700265537579589, 'num_heads': 8, 'bias': False, 'loss_fn': 'MSE', 'optimizer': 'RMSprop', 'lr': 0.0015212116786850456, 'weight_decay': 0.00018005416692111982}. 
[I 2024-04-21 02:14:56,080] Trial 176 finished with values: [5.267855483862153, 0.25296126919886136, 0.0026256747103450273, 66.52764193641747] and parameters: {'dropout': 0.626088838661456, 'num_heads': 1, 'bias': True, 'loss_fn': 'MSE', 'optimizer': 'RMSprop', 'lr': 0.015345532811316795, 'weight_decay': 0.00016773746443731933}. 
[I 2024-04-21 02:16:23,845] Trial 177 finished with values: [7.462291677915464, 0.26239413105958365, -0.7523282898616723, 116.8851714616934] and parameters: {'dropout': 0.626088838661456, 'num_heads': 8, 'bias': True, 'loss_fn': 'MSE', 'optimizer': 'Adam', 'lr': 0.00022343489096155288, 'weight_decay': 0.00016773746443731933}. 
[I 2024-04-21 02:17:05,625] Trial 178 finished with values: [5.1900262126896815, 0.3120266507652404, 0.0017999595306134042, 66.58271943583344] and parameters: {'dropout': 0.2512662173869412, 'num_heads': 2, 'bias': False, 'loss_fn': 'MAE', 'optimizer': 'RMSprop', 'lr': 0.002310234514292926, 'weight_decay': 2.0032993856203536e-05}. 
Training finished at Epoch 41, with validation result for [5.108846960013204, 0.4907023891389797, 0.17403839489599626, 68.13940998910229]
Training finished at Epoch 49, with validation result for [5.500745267256627, 0.12006685079182167, -0.010622108760109938, 91.48867857789598]
Training finished at Epoch 79, with validation result for [5.08853790734576, 0.017561458109981092, -0.012326947708989344, 74.38397954546298]
Training finished at Epoch 65, with validation result for [6.094985387765049, 0.39229797095627045, 0.02915251152405207, 106.00504451191667]
Training finished at Epoch 52, with validation result for [5.343304353850281, 0.00529137579661387, -0.03276182254020288, 89.05154307454104]
Training finished at Epoch 45, with validation result for [4.965254241267594, 0.4428549596670268, 0.11508303714268009, 81.48274810674982]
Training finished at Epoch 63, with validation result for [5.412933884832736, 0.40170159303974856, -0.10957430845347194, 75.58341491042222]
Training finished at Epoch 36, with validation result for [4.9990327550395035, 0.447073613759533, 0.09076072621724918, 71.09648087149618]
Training finished at Epoch 31, with validation result for [5.195917003073249, 0.05243097159510631, -0.043260394272959024, 85.53943125967943]
Training finished at Epoch 40, with validation result for [5.309663865159112, 0.0279240072319454, -0.04191353160612299, 93.0520261637098]
Training finished at Epoch 37, with validation result for [5.749759056484517, 0.006076482516615055, -0.09085968675707412, 113.96078293590513]
Training finished at Epoch 40, with validation result for [5.573080915702783, -0.1231623766294743, -0.03575206469454684, 105.23548857993212]
Training finished at Epoch 59, with validation result for [4.639295732981764, 0.4324496568909098, 0.15392579181811905, 73.63797239460416]
Training finished at Epoch 97, with validation result for [5.7853036855632185, 0.03995437081569547, -0.0122254095471801, 108.93970530074189]
Training finished at Epoch 59, with validation result for [4.839516603941392, 0.4002207810861945, 0.13604847376141738, 86.97479029925103]
Training finished at Epoch 88, with validation result for [454.4202496292137, 0.028484399579009067, -3062.2205789671575, 289873.6374466675]
Training finished at Epoch 30, with validation result for [6.127286314137913, -0.038602519606047034, -0.029312536351169927, 109.53281131806091]
Training finished at Epoch 42, with validation result for [6.142399798953221, -0.021647341520701295, -0.10175761686528317, 115.2676674287356]
Training finished at Epoch 49, with validation result for [5.414115405017856, 0.08682732152561766, -0.006044047344730075, 95.82172813002654]
Training finished at Epoch 33, with validation result for [5.541195171836922, 0.08210827460875914, -0.004364473262343127, 93.25811420987027]
Training finished at Epoch 49, with validation result for [5.745731437139273, -0.1733244773958161, -0.07982136431725295, 101.81794114017198]
Training finished at Epoch 41, with validation result for [5.410596157899795, 0.6667551389455183, 0.3356789281731851, 59.404412210166505]
Training finished at Epoch 53, with validation result for [5.151367808086815, 0.3750548638440818, 0.09352554785112221, 90.36896278960675]
Training finished at Epoch 59, with validation result for [4.972867004727551, -0.14991591071844262, -0.03330809584665384, 79.30813128413888]
Training finished at Epoch 45, with validation result for [6.108520134749921, -0.045678811094751456, -0.029047452980409005, 111.524850146442]
Training finished at Epoch 84, with validation result for [5.009554137999118, 0.3378652244827466, 0.005926216714213894, 80.59428911703866]
Training finished at Epoch 72, with validation result for [5.220702406101615, 0.40721922469227567, 0.1459867346821888, 93.56875214610476]
Training finished at Epoch 40, with validation result for [5.701362752431411, 0.19251088680853348, 0.014204277756665884, 93.28057223322118]
Training finished at Epoch 53, with validation result for [5.291062725042816, 0.10815701935671189, -0.00875346525361631, 89.59073720593086]
Training finished at Epoch 63, with validation result for [5.866649697191676, -0.03958869795587544, -0.1528325711786176, 102.70941731461266]
Training finished at Epoch 47, with validation result for [5.787178772183019, 0.17970738701807246, -0.0019739798345101978, 105.3827286586749]
Training finished at Epoch 57, with validation result for [4.925456704023358, 0.48459499491781205, 0.14200448642369035, 73.87332490136214]
Training finished at Epoch 81, with validation result for [5.8249920943930595, 0.5771384582585924, 0.2501582022402915, 80.34129172954533]
Training finished at Epoch 34, with validation result for [5.8063790647862, 0.025677527382802566, -0.0613609779531159, 112.56653300804375]
Training finished at Epoch 71, with validation result for [5.509069090314813, 0.05907127712655394, -0.018214029378787355, 102.44676323788521]
Training finished at Epoch 55, with validation result for [6.533210057978974, 0.37793005685849723, -0.07855226104443447, 82.64218260201595]
Training finished at Epoch 38, with validation result for [5.383710657899742, 0.10170669210245743, -0.04255351039330968, 93.54822478589976]
Training finished at Epoch 70, with validation result for [8.91675908018327, 0.3872993977289105, -0.5217641459798337, 142.14949207307325]
Training finished at Epoch 45, with validation result for [5.516153791551408, 0.026414778336066005, -0.03366445044478272, 108.7397964611987]
Training finished at Epoch 45, with validation result for [5.135720005400292, 0.15844704999240455, -0.01196397452632092, 99.81061785665668]
Training finished at Epoch 64, with validation result for [5.1875009575805455, 0.44946695621145516, 0.0802447557429593, 83.16790082947271]
Training finished at Epoch 50, with validation result for [5.019341803530877, 0.1818320737390041, -0.060760508595725016, 68.58046940576229]
Training finished at Epoch 46, with validation result for [5.677954497669138, 0.13701009270040096, 0.008700547499735034, 107.57242145285]
Training finished at Epoch 64, with validation result for [5.80760249406842, 0.006041645595992462, -0.038234218895653926, 110.709193434469]
Training finished at Epoch 52, with validation result for [5.826169007366334, 0.0828716975823609, -0.02404492519118584, 113.07676094349972]
Training finished at Epoch 146, with validation result for [12.326038925180413, 0.4777359181208095, -1.0035340315581576, 207.22431186034746]
Training finished at Epoch 55, with validation result for [5.32368031697089, 0.6454806794458373, 0.3117361203630442, 74.54710830495135]
Training finished at Epoch 42, with validation result for [5.588016266741493, -0.1405182306637685, -0.0484586515284644, 101.24672105446297]
Training finished at Epoch 68, with validation result for [28.06646366300897, 0.027395182483877636, -8.247865757300161, 863.9914589961276]
Training finished at Epoch 63, with validation result for [11.469240188531302, 0.16637446060714578, -1.321042727769862, 197.60941342401392]
Training finished at Epoch 107, with validation result for [4.996464479308731, 0.5417179566800621, 0.2782647301877743, 71.68643860105196]
Training finished at Epoch 34, with validation result for [13.841665412975416, 0.5312010900057024, -2.3015368339711126, 279.24224746619365]
Training finished at Epoch 64, with validation result for [4.620170584014386, 0.4095987103343419, 0.1451085264858052, 72.92134258292954]
Training finished at Epoch 58, with validation result for [5.432911693594654, -0.02879943601491854, -0.07201180334585011, 103.17547586855555]
Training finished at Epoch 106, with validation result for [4.639675695034588, 0.6217911890862788, 0.3709489859699905, 63.97064139949231]
Training finished at Epoch 44, with validation result for [9.658360558380835, 0.13224259517143871, -0.9301620890483968, 162.5398541704001]
Training finished at Epoch 75, with validation result for [4.991876386183956, 0.5476988354293755, 0.27991378054587457, 77.8617582583522]
Training finished at Epoch 43, with validation result for [5.410695627556183, 0.00037619798103243285, -0.046745283899112255, 104.99851229585607]
[I 2024-04-21 02:18:43,904] Trial 179 finished with values: [5.560670211537848, 0.37086011081134457, 0.011987732111614524, 65.90316666490999] and parameters: {'dropout': 0.5700265537579589, 'num_heads': 8, 'bias': False, 'loss_fn': 'MSE', 'optimizer': 'RMSprop', 'lr': 0.0015212116786850456, 'weight_decay': 0.00018005416692111982}. 
[I 2024-04-21 02:19:11,357] Trial 180 finished with values: [5.623100981871001, 0.30193662981646513, -0.09035262775744535, 72.72955335281237] and parameters: {'dropout': 0.31961758477836855, 'num_heads': 4, 'bias': False, 'loss_fn': 'MSE', 'optimizer': 'RMSprop', 'lr': 0.00022343489096155288, 'weight_decay': 5.6512801921698944e-05}. 
[I 2024-04-21 02:20:29,117] Trial 181 finished with values: [5.21787747245821, 0.3166431357223428, -0.009589972691405269, 67.3424595989126] and parameters: {'dropout': 0.6684625967476364, 'num_heads': 8, 'bias': False, 'loss_fn': 'MAE', 'optimizer': 'Adam', 'lr': 0.00018846401954415756, 'weight_decay': 2.6428916322772236e-05}. 
