[I 2024-04-21 11:12:32,435] Trial 152 finished with values: [5.42150940095533, 0.19104102865574166, -0.003912581990139996, 66.96376184609323] and parameters: {'dropout': 0.21669632530564809, 'num_heads': 8, 'bias': True, 'loss_fn': 'MSE', 'optimizer': 'RMSprop', 'lr': 0.03157589555285054, 'weight_decay': 0.0001233670278662728}. 
[I 2024-04-21 11:14:56,235] Trial 153 finished with values: [22.492214882011055, 0.01262507885365242, -8.889423674207412, 659.6520689101649] and parameters: {'dropout': 0.6106799664039466, 'num_heads': 8, 'bias': True, 'loss_fn': 'MSE', 'optimizer': 'Adam', 'lr': 0.0003684458595362331, 'weight_decay': 0.05801989614776756}. 
[I 2024-04-21 11:16:21,849] Trial 154 finished with values: [5.296311758000448, 0.17684058042692027, -0.042296396258098, 69.52406903169384] and parameters: {'dropout': 0.5729750064921451, 'num_heads': 4, 'bias': True, 'loss_fn': 'MAE', 'optimizer': 'Adam', 'lr': 0.0026986227128158484, 'weight_decay': 0.0013381668139352799}. 
[I 2024-04-21 11:17:34,898] Trial 155 finished with values: [5.317232290511004, 0.13655639869315203, -0.05910923016323966, 70.64553182215907] and parameters: {'dropout': 0.6391309603013053, 'num_heads': 4, 'bias': True, 'loss_fn': 'MAE', 'optimizer': 'Adam', 'lr': 0.00638788575113871, 'weight_decay': 1.8515060707525556e-05}. 
[I 2024-04-21 11:18:40,396] Trial 156 finished with values: [5.359417955427363, 0.19364890351705058, 0.026720185153531584, 64.92047106510788] and parameters: {'dropout': 0.5968208698337486, 'num_heads': 8, 'bias': True, 'loss_fn': 'MSE', 'optimizer': 'Adam', 'lr': 0.0011461249545361423, 'weight_decay': 0.0001233670278662728}. 
Training finished at Epoch 101, with validation result for [5.550656000969188, -0.0031952504641240436, -0.017850010198455335, 106.95428518906704]
Training finished at Epoch 63, with validation result for [5.524061594399143, 0.13811478615746178, -0.03322532652484145, 92.65072031874276]
Training finished at Epoch 99, with validation result for [6.081706480996302, 0.06836265250205643, -0.06161669422901639, 114.66940849760961]
Training finished at Epoch 46, with validation result for [5.224796950271354, 0.5455934493289583, 0.28336899733755083, 73.41978976922609]
Training finished at Epoch 64, with validation result for [5.1323749791666105, 0.05983395381120809, -0.027838698583544597, 88.3618955720911]
Training finished at Epoch 66, with validation result for [5.986034131636884, 0.36821175619549, -0.0013053990964801976, 108.34486347432552]
Training finished at Epoch 30, with validation result for [5.800488686917157, -0.019838644591226143, -0.10479371889987354, 116.22012608582351]
Training finished at Epoch 36, with validation result for [5.435119882899063, 0.5013637353499769, 0.18684651592103874, 88.7269095060592]
Training finished at Epoch 52, with validation result for [5.751704387173958, -0.10701922050904304, -0.0243442690653779, 98.04336525996517]
Training finished at Epoch 41, with validation result for [7.192959836192237, 0.03268577540842395, -0.23293557053369462, 103.29414593560284]
Training finished at Epoch 63, with validation result for [5.103472864097514, 0.518734978304251, 0.2183050817535631, 52.625032194279264]
Training finished at Epoch 53, with validation result for [5.441648444935193, 0.5342084294246786, 0.2852906648306479, 73.44510684694843]
Training finished at Epoch 40, with validation result for [5.313727690487267, 0.4987401617035616, 0.1790385248007863, 75.87051485754472]
Training finished at Epoch 90, with validation result for [5.521601916702809, 0.313238544800723, 0.09481984210279071, 90.7192608234207]
Training finished at Epoch 66, with validation result for [4.424129571246929, 0.5147891165069314, 0.24998518033633632, 59.30117028204165]
Training finished at Epoch 48, with validation result for [5.601721025596991, 0.07766416528111753, -0.05340788020728837, 106.1149061981453]
Training finished at Epoch 78, with validation result for [5.4420847470255, 0.34177312687938527, 0.0478052568014089, 89.390727439581]
Training finished at Epoch 41, with validation result for [5.319281371895313, 0.12584970044150748, -0.015200579374832435, 103.29839453977779]
Training finished at Epoch 60, with validation result for [4.789857177237951, 0.4207802394399325, 0.16392089529377196, 82.51994380154979]
Training finished at Epoch 119, with validation result for [4.583199657271586, 0.42891403102547954, 0.14895828192702798, 77.12125269422278]
Training finished at Epoch 39, with validation result for [4.984709277352272, 0.06602082201277773, -0.008169774286544529, 90.14151364180843]
Training finished at Epoch 79, with validation result for [5.9733611873069705, -0.1402705511337308, -0.10187422919559852, 113.94010851963043]
Training finished at Epoch 110, with validation result for [4.935709322163794, 0.4456317702046959, 0.17203396041110375, 85.21541163212788]
Training finished at Epoch 62, with validation result for [4.5275310023876365, 0.4275284302228539, 0.035357531444910384, 61.79678498033574]
Training finished at Epoch 63, with validation result for [5.441866789641529, 0.0029502355480782974, -0.012242194213534674, 100.40363941527578]
Training finished at Epoch 35, with validation result for [5.2044134965495665, -0.08379255502461677, -0.04394925249927972, 89.0222268530473]
Training finished at Epoch 66, with validation result for [5.173420218592141, 0.03372358298167142, -0.030791444264790524, 95.28434277323248]
Training finished at Epoch 41, with validation result for [5.543486501493812, -0.14661408631227654, -0.03910171999532319, 97.74213245865492]
Training finished at Epoch 81, with validation result for [5.791724874706596, -0.05472650474168815, -0.037828156132387214, 113.07161247987925]
Training finished at Epoch 34, with validation result for [5.780218825626174, -0.1802704116580486, -0.024863442965432414, 108.73593515659054]
Training finished at Epoch 67, with validation result for [5.75123770734411, -0.12826179687299608, -0.04282345968555146, 112.08964506646298]
Training finished at Epoch 42, with validation result for [5.382506722962728, 0.07610914550434393, -0.0019428048825795852, 97.1856110496828]
Training finished at Epoch 50, with validation result for [5.750553067252784, -0.10244272520648166, -0.09384671806198641, 104.24814391701727]
Training finished at Epoch 67, with validation result for [5.339278281609004, -0.013801339425067682, -0.02474277712723638, 105.09286999994883]
Training finished at Epoch 42, with validation result for [5.723171291190641, -0.15692803213465914, -0.02798377249144246, 110.1095967890803]
Training finished at Epoch 35, with validation result for [5.0342432355157, 0.46821392826170094, 0.17997652025406197, 77.30631677282481]
Training finished at Epoch 46, with validation result for [16.619650249564526, 0.5473730151897522, -2.4357253658602938, 313.32535216276364]
Training finished at Epoch 32, with validation result for [5.496337275619029, 0.060716816586118674, -0.011676021840121065, 104.65677721475015]
Training finished at Epoch 32, with validation result for [5.342104597276116, 0.08255070562795142, -0.050737925343765866, 104.11698819781027]
Training finished at Epoch 66, with validation result for [5.728857048283557, 0.45847095765754914, 0.048287454119455786, 79.57217087216576]
Training finished at Epoch 37, with validation result for [5.0466012968339555, 0.025109898924717, -0.039330222733068965, 89.08617243479712]
Training finished at Epoch 32, with validation result for [5.522868477924849, 0.09004925289151942, -0.01753940080943961, 94.24286008178596]
Training finished at Epoch 30, with validation result for [4.820459355918979, 0.5032527972664393, 0.2286234540622325, 68.6387667934511]
Training finished at Epoch 87, with validation result for [5.690936430903418, 0.04443043941472182, -0.042758491433841694, 103.4785103105686]
Traceback (most recent call last):
  File "/public/home/yyang/anaconda3/envs/Pon-DT/lib/python3.11/site-packages/optuna/study/_optimize.py", line 208, in _run_trial
    frozen_trial = _tell_with_warning(
                   ^^^^^^^^^^^^^^^^^^^
  File "/public/home/yyang/anaconda3/envs/Pon-DT/lib/python3.11/site-packages/optuna/study/_tell.py", line 106, in _tell_with_warning
    frozen_trial = _get_frozen_trial(study, trial)
                   ^^^^^^^^^^^^^^^^^^^^^^^^^^^^^^^
  File "/public/home/yyang/anaconda3/envs/Pon-DT/lib/python3.11/site-packages/optuna/study/_tell.py", line 40, in _get_frozen_trial
    return study._storage.get_trial(trial_id)
           ^^^^^^^^^^^^^^^^^^^^^^^^^^^^^^^^^^
  File "/public/home/yyang/anaconda3/envs/Pon-DT/lib/python3.11/site-packages/optuna/storages/_cached_storage.py", line 213, in get_trial
    return self._backend.get_trial(trial_id)
           ^^^^^^^^^^^^^^^^^^^^^^^^^^^^^^^^^
  File "/public/home/yyang/anaconda3/envs/Pon-DT/lib/python3.11/site-packages/optuna/storages/_rdb/storage.py", line 776, in get_trial
    trial_model = models.TrialModel.find_or_raise_by_id(trial_id, session)
                  ^^^^^^^^^^^^^^^^^^^^^^^^^^^^^^^^^^^^^^^^^^^^^^^^^^^^^^^^
  File "/public/home/yyang/anaconda3/envs/Pon-DT/lib/python3.11/site-packages/optuna/storages/_rdb/models.py", line 256, in find_or_raise_by_id
    raise KeyError(NOT_FOUND_MSG)
KeyError: 'Record does not exist.'

During handling of the above exception, another exception occurred:

Traceback (most recent call last):
  File "/public/home/yyang/anaconda3/envs/Pon-DT/lib/python3.11/site-packages/optuna/study/_optimize.py", line 216, in _run_trial
    frozen_trial = study._storage.get_trial(trial._trial_id)
                   ^^^^^^^^^^^^^^^^^^^^^^^^^^^^^^^^^^^^^^^^^
  File "/public/home/yyang/anaconda3/envs/Pon-DT/lib/python3.11/site-packages/optuna/storages/_cached_storage.py", line 213, in get_trial
    return self._backend.get_trial(trial_id)
           ^^^^^^^^^^^^^^^^^^^^^^^^^^^^^^^^^
  File "/public/home/yyang/anaconda3/envs/Pon-DT/lib/python3.11/site-packages/optuna/storages/_rdb/storage.py", line 776, in get_trial
    trial_model = models.TrialModel.find_or_raise_by_id(trial_id, session)
                  ^^^^^^^^^^^^^^^^^^^^^^^^^^^^^^^^^^^^^^^^^^^^^^^^^^^^^^^^
  File "/public/home/yyang/anaconda3/envs/Pon-DT/lib/python3.11/site-packages/optuna/storages/_rdb/models.py", line 256, in find_or_raise_by_id
    raise KeyError(NOT_FOUND_MSG)
KeyError: 'Record does not exist.'

During handling of the above exception, another exception occurred:

Traceback (most recent call last):
  File "/public/home/yyang/kjh/MutTm-pred/DeepLearning/Models/Extraction_BioInfo_MultipleRegression/Adjustment.py", line 267, in <module>
    ESM3B()
  File "/public/home/yyang/kjh/MutTm-pred/DeepLearning/Models/Extraction_BioInfo_MultipleRegression/Adjustment.py", line 111, in ESM3B
    study02.optimize(lambda trial: objective(trial, train_dataset, test_dataset,
  File "/public/home/yyang/anaconda3/envs/Pon-DT/lib/python3.11/site-packages/optuna/study/study.py", line 451, in optimize
    _optimize(
  File "/public/home/yyang/anaconda3/envs/Pon-DT/lib/python3.11/site-packages/optuna/study/_optimize.py", line 62, in _optimize
    _optimize_sequential(
  File "/public/home/yyang/anaconda3/envs/Pon-DT/lib/python3.11/site-packages/optuna/study/_optimize.py", line 159, in _optimize_sequential
    frozen_trial = _run_trial(study, func, catch)
                   ^^^^^^^^^^^^^^^^^^^^^^^^^^^^^^
  File "/public/home/yyang/anaconda3/envs/Pon-DT/lib/python3.11/site-packages/optuna/study/_optimize.py", line 219, in _run_trial
    if frozen_trial.state == TrialState.COMPLETE:
       ^^^^^^^^^^^^
UnboundLocalError: cannot access local variable 'frozen_trial' where it is not associated with a value
