[I 2024-04-21 00:35:38,968] Trial 100 finished with values: [5.40623994167562, 0.28405601228456273, -0.10758543643883067, 73.8790296291152] and parameters: {'dropout': 0.30506597731706453, 'num_heads': 2, 'bias': True, 'loss_fn': 'MAE', 'optimizer': 'Adam', 'lr': 0.0003139835604020809, 'weight_decay': 0.05390662290337038}. 
[I 2024-04-21 00:36:37,216] Trial 101 finished with values: [5.437740545680891, 0.33007719510282135, 0.036708335748480425, 64.25423363595128] and parameters: {'dropout': 0.6709270573722722, 'num_heads': 4, 'bias': False, 'loss_fn': 'MAE', 'optimizer': 'Adam', 'lr': 0.0020271903886286326, 'weight_decay': 3.154105850837904e-05}. 
[I 2024-04-21 00:37:55,124] Trial 102 finished with values: [5.2911096264542765, 0.21690264743354887, -0.0469405572026651, 69.83384748556122] and parameters: {'dropout': 0.5261639393894102, 'num_heads': 8, 'bias': True, 'loss_fn': 'MAE', 'optimizer': 'Adam', 'lr': 0.054002842887268705, 'weight_decay': 2.128207138988108e-05}. 
[I 2024-04-21 00:39:14,085] Trial 103 finished with values: [5.315651833257485, 0.18913410733097613, -0.05763798888880478, 70.54739593653835] and parameters: {'dropout': 0.4573666223298326, 'num_heads': 2, 'bias': False, 'loss_fn': 'MSE', 'optimizer': 'SGD', 'lr': 0.0020205499559266616, 'weight_decay': 0.0008245593546644686}. 
[I 2024-04-21 00:39:53,352] Trial 104 finished with values: [5.285366113966261, 0.21703866018309395, -0.04794807411822144, 69.90105166648252] and parameters: {'dropout': 0.4342255747374618, 'num_heads': 8, 'bias': True, 'loss_fn': 'MAE', 'optimizer': 'RMSprop', 'lr': 0.0029779843699816494, 'weight_decay': 0.0037481133355170156}. 
[I 2024-04-21 00:41:20,215] Trial 105 finished with values: [5.298741113873093, 0.19973005691802806, -0.05491865209900282, 70.36600860816097] and parameters: {'dropout': 0.38417652551568193, 'num_heads': 2, 'bias': True, 'loss_fn': 'MAE', 'optimizer': 'SGD', 'lr': 0.0020205499559266616, 'weight_decay': 2.3330272265854954e-05}. 
[I 2024-04-21 00:42:19,426] Trial 106 finished with values: [5.318066560140436, 0.22535943818658258, 0.030980187229119327, 64.63631707643287] and parameters: {'dropout': 0.38545950668573836, 'num_heads': 8, 'bias': True, 'loss_fn': 'MSE', 'optimizer': 'Adam', 'lr': 0.041784184662472634, 'weight_decay': 0.0011294581876141276}. 
[I 2024-04-21 00:43:19,479] Trial 107 finished with values: [5.377848197645141, 0.293071704068389, 0.08494962171837339, 61.03640566687328] and parameters: {'dropout': 0.5700265537579589, 'num_heads': 1, 'bias': False, 'loss_fn': 'MAE', 'optimizer': 'Adam', 'lr': 0.0015212116786850456, 'weight_decay': 0.00019454966924148474}. 
[I 2024-04-21 00:44:09,122] Trial 108 finished with values: [5.571774023300391, 0.16425877783040702, -0.14372487318757732, 76.28963059090171] and parameters: {'dropout': 0.3121300419506455, 'num_heads': 8, 'bias': True, 'loss_fn': 'MSE', 'optimizer': 'Adam', 'lr': 0.041784184662472634, 'weight_decay': 1.195900659167233e-05}. 
[I 2024-04-21 00:45:39,797] Trial 109 finished with values: [5.242212797110009, 0.23498095485695758, -0.015060196463603237, 67.7073387412779] and parameters: {'dropout': 0.5311365350726444, 'num_heads': 4, 'bias': True, 'loss_fn': 'MSE', 'optimizer': 'Adam', 'lr': 0.041784184662472634, 'weight_decay': 1.195900659167233e-05}. 
[I 2024-04-21 00:46:34,192] Trial 110 finished with values: [6.487332964504826, 0.24543046575172048, -0.21849714679722165, 81.2771492379549] and parameters: {'dropout': 0.22424570365431884, 'num_heads': 2, 'bias': True, 'loss_fn': 'MSE', 'optimizer': 'RMSprop', 'lr': 0.015345532811316795, 'weight_decay': 2.3330272265854954e-05}. 
[I 2024-04-21 00:48:11,863] Trial 111 finished with values: [6.422652817258971, 0.4030348389932823, -0.2643035417826449, 84.33256320512649] and parameters: {'dropout': 0.5311365350726444, 'num_heads': 4, 'bias': True, 'loss_fn': 'MSE', 'optimizer': 'RMSprop', 'lr': 0.0003255565571680538, 'weight_decay': 1.195900659167233e-05}. 
[I 2024-04-21 00:50:37,979] Trial 112 finished with values: [5.294489085778812, 0.20456539752913497, -0.05618747777243516, 70.45064281012655] and parameters: {'dropout': 0.5311365350726444, 'num_heads': 4, 'bias': True, 'loss_fn': 'MAE', 'optimizer': 'Adam', 'lr': 0.041784184662472634, 'weight_decay': 2.0032993856203536e-05}. 
[I 2024-04-21 00:51:29,763] Trial 113 finished with values: [5.345107608280989, 0.16078553151768055, -0.0834430127891026, 72.26866281364703] and parameters: {'dropout': 0.24104348656224273, 'num_heads': 2, 'bias': True, 'loss_fn': 'MAE', 'optimizer': 'SGD', 'lr': 0.002386297911470172, 'weight_decay': 0.033819847535106105}. 
[I 2024-04-21 00:53:10,177] Trial 114 finished with values: [5.30580494631867, 0.20856383893299998, -0.024044317327662768, 68.30660459443095] and parameters: {'dropout': 0.25973151789220145, 'num_heads': 1, 'bias': True, 'loss_fn': 'MAE', 'optimizer': 'SGD', 'lr': 0.007998144896696134, 'weight_decay': 0.00045917349837111597}. 
[I 2024-04-21 00:54:24,601] Trial 115 finished with values: [5.1758654085893365, 0.3017836120200539, 0.05365122229147967, 63.124095972767854] and parameters: {'dropout': 0.4342255747374618, 'num_heads': 2, 'bias': True, 'loss_fn': 'MSE', 'optimizer': 'RMSprop', 'lr': 0.0029779843699816494, 'weight_decay': 0.001168696876803426}. 
[I 2024-04-21 00:55:04,011] Trial 116 finished with values: [5.246227580368425, 0.22081784367335724, -0.007858690118825784, 67.22697823533741] and parameters: {'dropout': 0.626088838661456, 'num_heads': 4, 'bias': True, 'loss_fn': 'MSE', 'optimizer': 'Adam', 'lr': 0.07754675794637712, 'weight_decay': 0.00016773746443731933}. 
[I 2024-04-21 00:56:42,384] Trial 117 finished with values: [5.427947059481342, 0.4603554212195516, 0.13969194982394095, 57.384940103113735] and parameters: {'dropout': 0.5700265537579589, 'num_heads': 8, 'bias': False, 'loss_fn': 'MSE', 'optimizer': 'RMSprop', 'lr': 0.0015212116786850456, 'weight_decay': 0.00018005416692111982}. 
[I 2024-04-21 00:57:24,177] Trial 118 finished with values: [5.304926885444527, 0.09819312273266684, -0.0343450485742558, 68.99369202257142] and parameters: {'dropout': 0.44055600551134144, 'num_heads': 8, 'bias': True, 'loss_fn': 'MSE', 'optimizer': 'Adam', 'lr': 0.0518227826558114, 'weight_decay': 0.05307017177396677}. 
[I 2024-04-21 00:58:25,176] Trial 119 finished with values: [5.499727579797432, 0.3168425768076459, 0.08497994078518056, 61.03438330077737] and parameters: {'dropout': 0.5700265537579589, 'num_heads': 4, 'bias': False, 'loss_fn': 'MSE', 'optimizer': 'Adam', 'lr': 0.0015212116786850456, 'weight_decay': 0.00018005416692111982}. 
Training finished at Epoch 36, with validation result for [5.202258319723432, 0.015250830861471897, -0.039898473033335824, 88.80096160439096]
Training finished at Epoch 45, with validation result for [5.807844837568436, 0.1164432030744984, -0.02152469110390376, 110.87869096725416]
Training finished at Epoch 72, with validation result for [5.632534170474625, -0.05861901716631848, -0.029514938667256407, 106.6284411770065]
Training finished at Epoch 113, with validation result for [6.3275754361143095, 0.06346124797103364, -0.15762804284615317, 121.20334014115976]
Training finished at Epoch 31, with validation result for [5.761180293365978, -0.14796281924225718, -0.016226780385464767, 107.24581828076458]
Training finished at Epoch 61, with validation result for [5.463220631535479, 0.388081830983107, 0.09032553679829869, 89.24844734878354]
Training finished at Epoch 106, with validation result for [4.901918166874232, 0.3844258084904792, 0.1332896404988939, 83.64017619836746]
Training finished at Epoch 38, with validation result for [5.2789049774461265, 0.08642210599139213, -0.017989079452900292, 103.7419983711697]
Training finished at Epoch 41, with validation result for [5.437226527541648, 0.00862799318339533, -0.03884642212505063, 105.28218395304002]
Training finished at Epoch 46, with validation result for [5.121449693205455, 0.21700201171436648, -0.01030059825494134, 85.33792120046469]
Training finished at Epoch 42, with validation result for [5.171770589003299, 0.08236500301331247, -0.05168896800794087, 90.97965627972319]
Training finished at Epoch 36, with validation result for [4.6928690988256445, 0.5618194989309679, 0.2949219183232934, 66.92859638958019]
Training finished at Epoch 60, with validation result for [5.563235163430037, -0.0846938890644775, -0.025285135511730505, 108.21404495751288]
Training finished at Epoch 56, with validation result for [5.61566914034294, -0.12008421333102838, -0.03901652957272517, 104.97065600027514]
Training finished at Epoch 45, with validation result for [5.586681198072296, 0.0007619381712508774, -0.021814304599589773, 109.87814710163202]
Training finished at Epoch 57, with validation result for [5.496011169636418, -0.08840771206488489, -0.034313360206662535, 104.40812096630098]
Training finished at Epoch 39, with validation result for [5.637532735060209, 0.04933248030826841, -0.07174026122477839, 101.81823111306164]
Training finished at Epoch 35, with validation result for [5.1360932148601535, 0.17066570638195702, -0.06938701420851845, 80.20145132811713]
Training finished at Epoch 35, with validation result for [5.741138884532024, -0.053345104528454756, -0.034200371087563575, 112.70044250653991]
Training finished at Epoch 63, with validation result for [5.525085919502028, -0.0951583026228904, -0.02603503450012523, 102.96060422490409]
Training finished at Epoch 97, with validation result for [5.563141730597131, 0.0797522840653414, -0.036291234917646076, 94.92504838331153]
Training finished at Epoch 50, with validation result for [5.664585955645788, -0.12302515114613363, -0.023972921999854346, 109.63324736554189]
Training finished at Epoch 42, with validation result for [5.936559459550703, 0.5610831520167631, 0.16499234320123934, 73.80386710936146]
Training finished at Epoch 33, with validation result for [5.51900564699723, -0.09171085705960987, -0.05952620682977816, 108.79795157319188]
Training finished at Epoch 70, with validation result for [5.409906603917725, 0.10310095571730775, -0.02700308057716061, 94.264401472761]
Training finished at Epoch 80, with validation result for [5.999007505656317, -0.05328257502073659, -0.15682964058783888, 110.67734745022896]
Training finished at Epoch 60, with validation result for [5.45650234791054, 0.5006382534139818, 0.1852525126515958, 85.61985975413704]
Training finished at Epoch 63, with validation result for [5.502910808731346, 0.5321044549528685, 0.16274994905561968, 85.49712767366164]
Training finished at Epoch 121, with validation result for [4.57546924650131, 0.4411509932079587, 0.18498632566402817, 77.6153624011749]
Training finished at Epoch 40, with validation result for [4.561955865941067, 0.5997680227594769, 0.35533116423119826, 64.41709059877691]
Training finished at Epoch 59, with validation result for [5.37925291397189, -0.12523468212646843, -0.019530216078269325, 83.30777455151576]
Training finished at Epoch 32, with validation result for [5.628400307214913, 0.12020707794618676, -0.043391950546401326, 97.12824869332803]
Training finished at Epoch 56, with validation result for [5.056117826139303, 0.05667316833785967, -0.03767712518428312, 84.27159128401689]
Training finished at Epoch 64, with validation result for [5.528195028035728, 0.06150805592035173, -0.043240054054777266, 102.68008749690762]
Training finished at Epoch 72, with validation result for [4.89203205918686, -0.017168222996719336, -0.01365942515651919, 77.4963087748351]
Training finished at Epoch 89, with validation result for [5.8219817107437875, 0.10989512489916203, -0.038831415441729744, 112.01519519340168]
Training finished at Epoch 37, with validation result for [5.15615302594303, 0.051494987964124425, -0.03407528680897154, 86.34583905054268]
Training finished at Epoch 40, with validation result for [5.512503130566597, -0.1396981538846186, -0.014544705545581404, 94.51552625903555]
Training finished at Epoch 48, with validation result for [4.701866540966882, 0.07104351649157722, -0.07115428998440199, 65.78410027660844]
Training finished at Epoch 41, with validation result for [4.911954922594217, 0.44526920243253554, 0.1620721228579547, 86.04821999096619]
Training finished at Epoch 53, with validation result for [5.469748218382982, 0.0418129084615078, -0.06928952396535748, 94.27598158261605]
Training finished at Epoch 75, with validation result for [5.720313735101766, -0.07060043532101966, -0.046496639958230945, 111.60425914228274]
Training finished at Epoch 31, with validation result for [5.144601454064609, 0.10088746841258159, -0.04614099412784034, 87.24464518415668]
Training finished at Epoch 96, with validation result for [5.872269327161837, 0.23245263593760856, -0.012501020489279258, 112.73284613601197]
Training finished at Epoch 39, with validation result for [5.095315505385259, 0.1045565801132832, 0.0011461169288412565, 76.34391109127982]
Training finished at Epoch 40, with validation result for [4.852559209954755, 0.358815311570629, 0.09737091136478881, 86.91809326395746]
Training finished at Epoch 34, with validation result for [5.935733834339628, 0.05468751291094967, -0.01726978233752474, 111.88784874621963]
Training finished at Epoch 61, with validation result for [5.097293307949332, 0.12336061537841515, -0.04474547470362, 85.30124060646408]
Training finished at Epoch 47, with validation result for [5.2263447541736925, 0.3126534172186938, -0.05054133352855095, 84.27402070302917]
Training finished at Epoch 70, with validation result for [4.467879658464485, 0.5797509667462579, 0.3188264520307823, 61.46549823465423]
Training finished at Epoch 106, with validation result for [5.5309439937985205, -0.06082448960732885, -0.030893291492830155, 107.900002565622]
Training finished at Epoch 48, with validation result for [5.157675202352804, -0.07331300123724366, -0.033235226061929746, 88.02281602059162]
Training finished at Epoch 95, with validation result for [5.288647399914504, 0.07064937554090109, -0.007038237854992246, 95.19891024079175]
Training finished at Epoch 55, with validation result for [5.015106124204405, 0.11425134308580094, -0.05806317081213175, 82.23836607285278]
Training finished at Epoch 34, with validation result for [5.45441699016445, 0.08502362641144834, -0.012012057726908054, 87.84559304643874]
Training finished at Epoch 103, with validation result for [5.302772445217324, 0.46520616416912947, 0.19608931319469702, 81.01187580265919]
Training finished at Epoch 36, with validation result for [5.590782521643944, -0.11511738694951767, -0.06721563349009041, 100.3042299483863]
Training finished at Epoch 54, with validation result for [5.19448802605472, 0.46926363034955454, 0.1790998802086161, 82.58521198399579]
[I 2024-04-21 00:59:03,260] Trial 120 finished with values: [22.75950243307608, 0.024437195407090297, -10.082327328992697, 739.2220610363923] and parameters: {'dropout': 0.3696563637141852, 'num_heads': 1, 'bias': True, 'loss_fn': 'MSE', 'optimizer': 'RMSprop', 'lr': 0.0006528022794616931, 'weight_decay': 0.01682811038810614}. 
[I 2024-04-21 01:00:00,712] Trial 121 finished with values: [5.472169634027646, 0.22272100735224445, 0.048916405248083605, 63.43992144060915] and parameters: {'dropout': 0.5232220588059606, 'num_heads': 4, 'bias': True, 'loss_fn': 'MSE', 'optimizer': 'Adam', 'lr': 0.034134792005353944, 'weight_decay': 0.008935352618623058}. 
[I 2024-04-21 01:01:11,557] Trial 122 finished with values: [5.181866828770821, 0.334750340539034, 0.010323899823380778, 66.01414890688991] and parameters: {'dropout': 0.6315905101420694, 'num_heads': 4, 'bias': True, 'loss_fn': 'MAE', 'optimizer': 'RMSprop', 'lr': 0.00010292402149222344, 'weight_decay': 0.012372557046162126}. 
[I 2024-04-21 01:02:12,175] Trial 123 finished with values: [6.3659799084876365, 0.2619844272813797, -0.04663858793999465, 69.81370529574005] and parameters: {'dropout': 0.5844570198627566, 'num_heads': 2, 'bias': False, 'loss_fn': 'MAE', 'optimizer': 'RMSprop', 'lr': 0.0002186488302429688, 'weight_decay': 0.0015015021808628256}. 
[W 2024-04-21 01:22:57,167] Trial 124 failed with parameters: {'dropout': 0.44055600551134144, 'num_heads': 2, 'bias': True, 'loss_fn': 'MSE', 'optimizer': 'SGD', 'lr': 0.041784184662472634, 'weight_decay': 0.05307017177396677} because of the following error: The value nan is not acceptable.
[W 2024-04-21 01:22:57,168] Trial 124 failed with value [nan, nan, nan, nan].
[I 2024-04-21 01:24:02,721] Trial 125 finished with values: [5.28328942859616, 0.2278621791394579, -0.04644112534523237, 69.80053399137911] and parameters: {'dropout': 0.32012678495573904, 'num_heads': 4, 'bias': True, 'loss_fn': 'MAE', 'optimizer': 'Adam', 'lr': 0.0372978013982493, 'weight_decay': 7.011871824250725e-05}. 
[I 2024-04-21 01:25:01,897] Trial 126 finished with values: [5.892889978650528, 0.23306134881553264, -0.029956154698972615, 68.70094059231279] and parameters: {'dropout': 0.5327758530434905, 'num_heads': 8, 'bias': True, 'loss_fn': 'MAE', 'optimizer': 'Adam', 'lr': 0.0011734761923647191, 'weight_decay': 2.6428916322772236e-05}. 
[I 2024-04-21 01:26:18,867] Trial 127 finished with values: [5.59267628314397, 0.2692026207188473, 0.01030080923042409, 66.01568911367224] and parameters: {'dropout': 0.6684625967476364, 'num_heads': 4, 'bias': False, 'loss_fn': 'MAE', 'optimizer': 'Adam', 'lr': 0.002386297911470172, 'weight_decay': 2.6428916322772236e-05}. 
[I 2024-04-21 01:27:03,122] Trial 128 finished with values: [5.760586306786861, 0.3183897789454829, -0.0810552414714949, 72.10939182459514] and parameters: {'dropout': 0.5311365350726444, 'num_heads': 8, 'bias': True, 'loss_fn': 'MSE', 'optimizer': 'Adam', 'lr': 0.00022343489096155288, 'weight_decay': 1.195900659167233e-05}. 
[I 2024-04-21 01:27:37,133] Trial 129 finished with values: [5.369412698117375, 0.02079932270385467, -0.04775992459826184, 69.88850157011748] and parameters: {'dropout': 0.22424570365431884, 'num_heads': 2, 'bias': True, 'loss_fn': 'MSE', 'optimizer': 'Adam', 'lr': 0.015345532811316795, 'weight_decay': 0.05390662290337038}. 
[I 2024-04-21 01:28:26,094] Trial 130 finished with values: [5.31545583910907, 0.21654473958345619, -0.02551756161414276, 68.40487408652696] and parameters: {'dropout': 0.5311365350726444, 'num_heads': 4, 'bias': True, 'loss_fn': 'MSE', 'optimizer': 'Adam', 'lr': 0.041784184662472634, 'weight_decay': 1.195900659167233e-05}. 
[I 2024-04-21 01:29:03,273] Trial 131 finished with values: [5.278544072306634, 0.20487620715861368, -0.023745845554798306, 68.28669569690895] and parameters: {'dropout': 0.5796533080555868, 'num_heads': 4, 'bias': True, 'loss_fn': 'MAE', 'optimizer': 'RMSprop', 'lr': 0.007998144896696134, 'weight_decay': 0.00045917349837111597}. 
/public/home/yyang/anaconda3/envs/Pon-DT/lib/python3.11/site-packages/torchmetrics/utilities/prints.py:43: UserWarning: The variance of predictions or target is close to zero. This can cause instability in Pearson correlationcoefficient, leading to wrong results. Consider re-scaling the input if possible or computing using alarger dtype (currently using torch.float64).
  warnings.warn(*args, **kwargs)  # noqa: B028
[I 2024-04-21 01:29:42,723] Trial 132 finished with values: [5.467571424399621, -0.13465718830473355, -0.10606797112978827, 73.77781047180272] and parameters: {'dropout': 0.26513708856568596, 'num_heads': 4, 'bias': True, 'loss_fn': 'MAE', 'optimizer': 'RMSprop', 'lr': 0.03544065845080749, 'weight_decay': 0.04833360806106617}. 
[I 2024-04-21 01:30:55,927] Trial 133 finished with values: [5.521957626562418, 0.31765295357139056, -0.055386659286685624, 70.39722598945539] and parameters: {'dropout': 0.6684625967476364, 'num_heads': 8, 'bias': False, 'loss_fn': 'MAE', 'optimizer': 'Adam', 'lr': 0.002386297911470172, 'weight_decay': 2.6428916322772236e-05}. 
[I 2024-04-21 01:32:22,235] Trial 134 finished with values: [9.340279297271453, -0.029691574894020314, -1.2259791624630152, 148.47900223946334] and parameters: {'dropout': 0.6966193868431158, 'num_heads': 2, 'bias': True, 'loss_fn': 'MSE', 'optimizer': 'RMSprop', 'lr': 0.015345532811316795, 'weight_decay': 0.0015978339728337685}. 
[I 2024-04-21 01:33:24,386] Trial 135 finished with values: [6.309068657266146, 0.2047133416998693, -0.23363506257157685, 82.28689032990398] and parameters: {'dropout': 0.618246431676777, 'num_heads': 1, 'bias': False, 'loss_fn': 'MAE', 'optimizer': 'Adam', 'lr': 0.002386666196056272, 'weight_decay': 3.154105850837904e-05}. 
[I 2024-04-21 01:34:45,973] Trial 136 finished with values: [5.659368669659476, 0.19304347191699175, -0.1589136800480686, 77.30276625986201] and parameters: {'dropout': 0.3696563637141852, 'num_heads': 1, 'bias': True, 'loss_fn': 'MSE', 'optimizer': 'RMSprop', 'lr': 0.026274383492988353, 'weight_decay': 1.1991207122543926e-05}. 
[I 2024-04-21 01:35:13,507] Trial 137 finished with values: [5.672526215073562, 0.08677197849908974, -0.18186583587196514, 78.83373890032736] and parameters: {'dropout': 0.23484747623504593, 'num_heads': 8, 'bias': False, 'loss_fn': 'MSE', 'optimizer': 'RMSprop', 'lr': 0.030192325832367823, 'weight_decay': 0.009477483128562624}. 
[I 2024-04-21 01:35:56,375] Trial 138 finished with values: [5.30763087430382, 0.23322864564300286, 0.041900679508972916, 63.90788986335766] and parameters: {'dropout': 0.21991699235528095, 'num_heads': 2, 'bias': False, 'loss_fn': 'MSE', 'optimizer': 'RMSprop', 'lr': 0.04224929070702908, 'weight_decay': 0.005489225711772834}. 
[I 2024-04-21 01:36:45,220] Trial 139 finished with values: [5.28047801480918, 0.26766048485625227, 0.016925670786857916, 65.57379241919219] and parameters: {'dropout': 0.626088838661456, 'num_heads': 4, 'bias': True, 'loss_fn': 'MSE', 'optimizer': 'RMSprop', 'lr': 0.007998144896696134, 'weight_decay': 0.0004661851350818042}. 
