[I 2024-04-20 22:46:17,370] Trial 58 finished with values: [5.527373110916409, 0.1347725944074375, 0.016265942008880874, 65.61779816387953] and parameters: {'dropout': 0.41564916544714203, 'num_heads': 1, 'bias': True, 'loss_fn': 'MSE', 'optimizer': 'SGD', 'lr': 0.0029779843699816494, 'weight_decay': 1.1619116197205573e-05}. 
ESM3B-Attention-BioInf-Subtration(MultipleRegression)
Training finished at Epoch 59, with validation result for [5.053743133708429, 0.4051626853179017, 0.15311648471166417, 85.86758410567298]
Training finished at Epoch 52, with validation result for [4.64022088826307, 0.46969115391063465, 0.1861127243199454, 68.77748482597893]
Training finished at Epoch 37, with validation result for [5.049825119189099, 0.41773473923426785, 0.1562458645530106, 80.85004994718899]
Training finished at Epoch 41, with validation result for [5.115652498577346, -0.03337729836515185, -0.040237347414981084, 96.30669494626534]
Training finished at Epoch 90, with validation result for [5.434382705840586, 0.2721626959871525, 0.0720277199127003, 88.27633860412743]
Training finished at Epoch 55, with validation result for [4.81313047738839, 0.6077608036365992, 0.3383744249012681, 64.76966460656715]
Training finished at Epoch 82, with validation result for [4.976538712352869, 0.12294366298775751, -0.003612800641072278, 72.30812979878208]
Training finished at Epoch 36, with validation result for [5.62440789493274, 0.14114793265901918, -0.0018487944776921506, 108.16789141092217]
Training finished at Epoch 40, with validation result for [5.494789771839824, 0.5797179397918403, 0.24918285921020678, 67.72298944093973]
Training finished at Epoch 136, with validation result for [5.181588316077222, 0.03734914269758475, -0.07930239406802109, 89.39535997039782]
Training finished at Epoch 33, with validation result for [4.932636248249319, 0.3944048123347704, 0.12713786318616727, 75.80377239768018]
Training finished at Epoch 57, with validation result for [6.175103002298009, -0.12579153051149558, -0.1852080793072972, 108.53746416460363]
Training finished at Epoch 71, with validation result for [109.25792991438705, -0.031851788236358106, -119.0621423527306, 12148.544410635819]
Training finished at Epoch 34, with validation result for [5.973218331755137, 0.4144408828496967, 0.15713809697311676, 82.25799088050309]
Training finished at Epoch 33, with validation result for [5.319522031937269, 0.11690903566117318, -0.03109903529332647, 98.07877721614962]
Training finished at Epoch 72, with validation result for [5.175511342670672, -0.05339841778002989, -0.044035010336705094, 82.75794131927896]
Training finished at Epoch 35, with validation result for [5.354780554714446, 0.3199441428389617, 0.07626118083007483, 92.23695935094925]
Training finished at Epoch 74, with validation result for [5.440840205946006, -0.03481738899634619, -0.019997325792791676, 102.97517616630955]
Training finished at Epoch 42, with validation result for [5.851117382255659, -0.12480467902477883, -0.13677502319696422, 107.1848564575405]
Training finished at Epoch 41, with validation result for [4.99975466912628, 0.46324840895649333, 0.18765603596021296, 58.15672039803845]
Training finished at Epoch 49, with validation result for [5.42321473711088, 0.06380455370424491, -0.03596511204766162, 86.8210401044686]
Training finished at Epoch 59, with validation result for [5.551347055685532, 0.19346827357347174, -0.00599286489184947, 105.16569979084024]
Training finished at Epoch 72, with validation result for [35.418395284319125, 0.0616274920375459, -11.014672650408196, 1334.4673758468741]
Training finished at Epoch 105, with validation result for [5.871711535173024, -0.10096878569597535, -0.030923479233294193, 112.95135683340402]
Training finished at Epoch 84, with validation result for [5.307298957590997, -0.05915867722601589, -0.042356137898836854, 81.48174885398097]
Training finished at Epoch 66, with validation result for [5.827506766373354, 0.1045549191440865, -0.050893528047124326, 112.8433328152155]
Training finished at Epoch 53, with validation result for [5.225660055871494, 0.1930339729606169, -0.026543783819209965, 81.94921599186489]
Training finished at Epoch 30, with validation result for [5.428748887598452, 0.08497855217885465, -0.06747493005950589, 97.31102819640103]
Training finished at Epoch 91, with validation result for [4.9558693474793705, 0.4381427318282436, 0.17993153495702352, 77.27002204260947]
Training finished at Epoch 115, with validation result for [5.602469288169772, -0.046811446598355046, -0.09057247371913046, 100.26656166909423]
Training finished at Epoch 63, with validation result for [8.700215560538888, 0.2319636469011661, -0.6722839437517756, 157.7739118444335]
Training finished at Epoch 93, with validation result for [5.099717259279142, 0.10953916547494867, -0.013417486576491777, 85.44991188879096]
Training finished at Epoch 67, with validation result for [5.561374283571131, 0.004658119924045436, -0.03829804533887948, 107.70310104025454]
Training finished at Epoch 79, with validation result for [5.674404145156916, 0.37505268957796656, 0.01200005476525845, 83.92035136802697]
Training finished at Epoch 71, with validation result for [22.931368049146617, 0.5543160679905912, -5.9952751947471965, 639.2267462395679]
Training finished at Epoch 76, with validation result for [5.958035404488444, -0.023606220526871134, -0.031504487819078886, 113.94111282502433]
Training finished at Epoch 44, with validation result for [5.493164929113486, -0.1132194204919108, -0.060966716448670466, 92.48307777534488]
Training finished at Epoch 38, with validation result for [5.285072557270084, -0.14005584648936992, -0.033639776802599775, 92.08702018307906]
Training finished at Epoch 41, with validation result for [5.309989063723934, -0.07603422733290308, -0.03562596693189568, 100.70787797193925]
Training finished at Epoch 45, with validation result for [5.176894616588367, 0.14449174746667434, -0.009609968304338246, 78.92782370676372]
Training finished at Epoch 47, with validation result for [5.650332316060716, -0.1342999463109801, -0.026684003341370888, 106.1198914880544]
Training finished at Epoch 31, with validation result for [5.879406004832248, 0.04053920474433913, -0.01816286943608536, 111.96975160080994]
Training finished at Epoch 62, with validation result for [5.5816753343504075, 0.0185473709375213, -0.042053870495136314, 107.87174324912841]
Training finished at Epoch 35, with validation result for [5.348009406224893, -0.08670579846784192, -0.021210169366976173, 89.03144348573926]
Training finished at Epoch 66, with validation result for [5.335715072619803, -0.011283264558388847, -0.038647616645633764, 85.3407458211512]
Training finished at Epoch 56, with validation result for [7.040710743953756, 0.5178926064442272, -0.01706662565010597, 107.38868642931625]
Training finished at Epoch 66, with validation result for [5.379705636716243, 0.6470410364040196, 0.371717002125568, 67.37188875608145]
Training finished at Epoch 88, with validation result for [5.995692082760864, 0.33480824934984454, 0.09547834025040802, 94.47791011918657]
Training finished at Epoch 43, with validation result for [5.555389582673669, 0.008823875298974874, -0.03341405344868176, 107.93662437440946]
Training finished at Epoch 99, with validation result for [4.877199491314211, 0.49980089566049063, 0.24361015858550172, 66.38490159682169]
Training finished at Epoch 70, with validation result for [5.0082544611106385, 0.46344704901156625, 0.12138403899489314, 63.862312604357165]
Training finished at Epoch 32, with validation result for [5.4178119226577115, 0.43563025768621394, 0.14892610884141344, 65.69346668174394]
Training finished at Epoch 106, with validation result for [5.811651618104039, -0.0959905274699033, -0.015961435379531874, 105.34609528742949]
Training finished at Epoch 31, with validation result for [6.914988960293079, 0.40189865004921344, -0.05291988628444, 101.30547978065054]
Training finished at Epoch 39, with validation result for [5.515675899949074, 0.22634413436861894, 0.025652815570129883, 100.2696226519285]
Training finished at Epoch 38, with validation result for [5.519089061211212, -0.14742217294103954, -0.035912496899951574, 101.70860097993273]
Training finished at Epoch 30, with validation result for [5.502933071486417, -0.1269106643993453, -0.030714434780059197, 102.57152041123345]
[I 2024-04-20 22:46:57,988] Trial 59 finished with values: [5.330527565445246, 0.23163863389080444, -0.0673782221230046, 71.19709658809046] and parameters: {'dropout': 0.6907057440700127, 'num_heads': 1, 'bias': False, 'loss_fn': 'MAE', 'optimizer': 'RMSprop', 'lr': 0.0015594073676940246, 'weight_decay': 0.0015015021808628256}. 
[I 2024-04-20 22:47:57,824] Trial 60 finished with values: [5.257928488671492, 0.25722296962223234, -0.006605913263465046, 67.1434145341809] and parameters: {'dropout': 0.626088838661456, 'num_heads': 8, 'bias': True, 'loss_fn': 'MSE', 'optimizer': 'RMSprop', 'lr': 0.007998144896696134, 'weight_decay': 0.00045917349837111597}. 
[I 2024-04-20 22:49:08,444] Trial 61 finished with values: [5.3456376139212285, 0.18934722408088053, -0.08057461836325364, 72.0773329263052] and parameters: {'dropout': 0.6327734327667937, 'num_heads': 8, 'bias': True, 'loss_fn': 'MAE', 'optimizer': 'SGD', 'lr': 0.0006568544474822875, 'weight_decay': 0.033819847535106105}. 
[I 2024-04-20 22:51:07,865] Trial 62 finished with values: [5.293663743925324, 0.21748589180529698, -0.04265602262777635, 69.54805711093972] and parameters: {'dropout': 0.4813333673165718, 'num_heads': 4, 'bias': False, 'loss_fn': 'MAE', 'optimizer': 'RMSprop', 'lr': 0.009718371313030966, 'weight_decay': 0.003868910808916872}. 
[I 2024-04-20 22:51:48,482] Trial 63 finished with values: [5.4003027617315, 0.21362045937141988, 0.033522303353054395, 64.46675085945127] and parameters: {'dropout': 0.44055600551134144, 'num_heads': 8, 'bias': True, 'loss_fn': 'MSE', 'optimizer': 'Adam', 'lr': 0.0518227826558114, 'weight_decay': 0.05307017177396677}. 
[I 2024-04-20 22:52:57,627] Trial 64 finished with values: [5.42276029305171, 0.2859626537594418, 0.08071166817181785, 61.31908895732848] and parameters: {'dropout': 0.3635622435900131, 'num_heads': 4, 'bias': True, 'loss_fn': 'MAE', 'optimizer': 'RMSprop', 'lr': 0.002386297911470172, 'weight_decay': 0.0005023644237111914}. 
[I 2024-04-20 22:55:21,547] Trial 65 finished with values: [6.13811169691645, 0.26888164031302764, -0.007445886128720103, 67.19944306088253] and parameters: {'dropout': 0.5796533080555868, 'num_heads': 1, 'bias': True, 'loss_fn': 'MAE', 'optimizer': 'Adam', 'lr': 0.00018846401954415756, 'weight_decay': 0.00045917349837111597}. 
[I 2024-04-20 22:56:04,881] Trial 66 finished with values: [5.333012061159919, 0.2907491708769164, -0.05764569809328246, 70.54791016192203] and parameters: {'dropout': 0.44019580455912544, 'num_heads': 8, 'bias': True, 'loss_fn': 'MAE', 'optimizer': 'RMSprop', 'lr': 0.0003139835604020809, 'weight_decay': 0.002914526952378704}. 
[I 2024-04-20 22:56:53,633] Trial 67 finished with values: [5.7152335983001485, 0.1736088196489345, -0.18119174686489936, 78.78877528841332] and parameters: {'dropout': 0.5193595144407694, 'num_heads': 1, 'bias': False, 'loss_fn': 'MAE', 'optimizer': 'RMSprop', 'lr': 0.0015594073676940246, 'weight_decay': 0.01682811038810614}. 
[I 2024-04-20 22:57:39,907] Trial 68 finished with values: [5.32013641640996, 0.16676343232634522, -0.062080424978237625, 70.84371878142146] and parameters: {'dropout': 0.32012678495573904, 'num_heads': 4, 'bias': False, 'loss_fn': 'MAE', 'optimizer': 'SGD', 'lr': 0.0020271903886286326, 'weight_decay': 0.0002076432622487999}. 
[I 2024-04-20 22:58:41,083] Trial 69 finished with values: [5.278264375987716, 0.20345587995237266, -0.04258450065381081, 69.54328639632043] and parameters: {'dropout': 0.6113094297733728, 'num_heads': 8, 'bias': False, 'loss_fn': 'MAE', 'optimizer': 'Adam', 'lr': 0.0006528022794616931, 'weight_decay': 0.013248538642750664}. 
[W 2024-04-20 23:19:47,100] Trial 70 failed with parameters: {'dropout': 0.626088838661456, 'num_heads': 1, 'bias': False, 'loss_fn': 'MSE', 'optimizer': 'SGD', 'lr': 0.07754675794637712, 'weight_decay': 2.3330272265854954e-05} because of the following error: The value nan is not acceptable.
[W 2024-04-20 23:19:47,100] Trial 70 failed with value [nan, nan, nan, nan].
[I 2024-04-20 23:20:27,677] Trial 71 finished with values: [5.985697971626567, 0.30860414719426205, -0.06258785439493475, 70.87756573505366] and parameters: {'dropout': 0.4573666223298326, 'num_heads': 2, 'bias': True, 'loss_fn': 'MSE', 'optimizer': 'RMSprop', 'lr': 0.0020205499559266616, 'weight_decay': 7.736699491287808e-05}. 
[I 2024-04-20 23:21:28,604] Trial 72 finished with values: [5.326265064882073, 0.19314117761791497, -0.06416597043720929, 70.9828304649875] and parameters: {'dropout': 0.6327734327667937, 'num_heads': 4, 'bias': True, 'loss_fn': 'MAE', 'optimizer': 'SGD', 'lr': 0.0028078774054756833, 'weight_decay': 5.790794460670452e-05}. 
[I 2024-04-20 23:22:29,102] Trial 73 finished with values: [5.399824969714666, 0.010341679381412788, -0.016409165353297617, 67.79731871870602] and parameters: {'dropout': 0.4472634833863586, 'num_heads': 8, 'bias': True, 'loss_fn': 'MSE', 'optimizer': 'SGD', 'lr': 0.007998144896696134, 'weight_decay': 2.1538230304464623e-05}. 
[I 2024-04-20 23:23:33,057] Trial 74 finished with values: [5.283436570105642, 0.22582307564097473, 0.012957545095075629, 65.83847744114212] and parameters: {'dropout': 0.5311365350726444, 'num_heads': 4, 'bias': True, 'loss_fn': 'MSE', 'optimizer': 'Adam', 'lr': 0.041784184662472634, 'weight_decay': 0.00020865770861739082}. 
[I 2024-04-20 23:24:31,322] Trial 75 finished with values: [5.484406373592033, 0.13660665250770618, 0.014008782588812663, 65.76835697603674] and parameters: {'dropout': 0.5458344966975266, 'num_heads': 8, 'bias': False, 'loss_fn': 'MSE', 'optimizer': 'RMSprop', 'lr': 0.0518227826558114, 'weight_decay': 0.05307017177396677}. 
[I 2024-04-20 23:25:29,355] Trial 76 finished with values: [5.365808373227188, 0.2614846154503678, -0.08794295759802395, 72.56882165009453] and parameters: {'dropout': 0.2880184170750688, 'num_heads': 8, 'bias': True, 'loss_fn': 'MAE', 'optimizer': 'Adam', 'lr': 0.0004845261972377886, 'weight_decay': 0.08218855734055823}. 
[I 2024-04-20 23:26:17,190] Trial 77 finished with values: [5.293743098577979, 0.23608309581831202, -0.027713322478667868, 68.5513374442344] and parameters: {'dropout': 0.3034912033003917, 'num_heads': 8, 'bias': False, 'loss_fn': 'MAE', 'optimizer': 'Adam', 'lr': 0.0006516845044855386, 'weight_decay': 0.001168696876803426}. 
[I 2024-04-20 23:27:08,166] Trial 78 finished with values: [5.578856113649285, 0.20087109136037856, -0.13800949629777182, 75.90839905363887] and parameters: {'dropout': 0.5458344966975266, 'num_heads': 8, 'bias': True, 'loss_fn': 'MSE', 'optimizer': 'Adam', 'lr': 0.0518227826558114, 'weight_decay': 0.05307017177396677}. 
[W 2024-04-20 23:48:34,880] Trial 79 failed with parameters: {'dropout': 0.41564916544714203, 'num_heads': 8, 'bias': True, 'loss_fn': 'MSE', 'optimizer': 'SGD', 'lr': 0.05605023301103856, 'weight_decay': 1.1619116197205573e-05} because of the following error: The value nan is not acceptable.
[W 2024-04-20 23:48:34,880] Trial 79 failed with value [nan, nan, nan, nan].
[I 2024-04-20 23:49:53,578] Trial 80 finished with values: [5.329574587749415, 0.1176725374520765, -0.058722215679443135, 70.6197168795148] and parameters: {'dropout': 0.21991699235528095, 'num_heads': 8, 'bias': True, 'loss_fn': 'MAE', 'optimizer': 'RMSprop', 'lr': 0.07754675794637712, 'weight_decay': 0.00016773746443731933}. 
[I 2024-04-20 23:51:32,299] Trial 81 finished with values: [5.298766915751521, 0.20611658377182782, -0.058600644651247924, 70.61160775375475] and parameters: {'dropout': 0.30506597731706453, 'num_heads': 8, 'bias': False, 'loss_fn': 'MAE', 'optimizer': 'SGD', 'lr': 0.0003139835604020809, 'weight_decay': 5.790794460670452e-05}. 
[I 2024-04-20 23:52:29,840] Trial 82 finished with values: [5.3673556440542844, 0.2082148441907813, -0.09338632419614368, 72.93190934423906] and parameters: {'dropout': 0.43690473759063186, 'num_heads': 8, 'bias': True, 'loss_fn': 'MAE', 'optimizer': 'RMSprop', 'lr': 0.0029779843699816494, 'weight_decay': 0.05307017177396677}. 
[I 2024-04-20 23:53:23,960] Trial 83 finished with values: [7.234218210916729, 0.2779386818541104, -0.3755043569197656, 91.74996690692284] and parameters: {'dropout': 0.5844570198627566, 'num_heads': 2, 'bias': False, 'loss_fn': 'MSE', 'optimizer': 'RMSprop', 'lr': 0.0002186488302429688, 'weight_decay': 0.0029624459345695777}. 
[I 2024-04-20 23:54:06,383] Trial 84 finished with values: [5.312942679835459, 0.2459525654392067, -0.0668451530097729, 71.16153939537634] and parameters: {'dropout': 0.44019580455912544, 'num_heads': 4, 'bias': True, 'loss_fn': 'MAE', 'optimizer': 'RMSprop', 'lr': 0.03544065845080749, 'weight_decay': 0.00014950281068972876}. 
[I 2024-04-20 23:55:25,238] Trial 85 finished with values: [5.325764417354962, 0.22121819444098373, 0.022338233591720713, 65.21275942374616] and parameters: {'dropout': 0.4342255747374618, 'num_heads': 4, 'bias': True, 'loss_fn': 'MSE', 'optimizer': 'RMSprop', 'lr': 0.041784184662472634, 'weight_decay': 1.195900659167233e-05}. 
[I 2024-04-20 23:56:54,130] Trial 86 finished with values: [5.348161977137162, 0.2121070945641961, 0.0008443726698256215, 66.64645973764557] and parameters: {'dropout': 0.44019580455912544, 'num_heads': 4, 'bias': True, 'loss_fn': 'MSE', 'optimizer': 'RMSprop', 'lr': 0.005756458005859107, 'weight_decay': 0.08220975779411431}. 
[I 2024-04-20 23:58:10,379] Trial 87 finished with values: [7.010068207692258, 0.20998257263916253, -0.8113037750314533, 120.81900037719335] and parameters: {'dropout': 0.31961758477836855, 'num_heads': 8, 'bias': True, 'loss_fn': 'MSE', 'optimizer': 'RMSprop', 'lr': 0.002310234514292926, 'weight_decay': 2.0032993856203536e-05}. 
[I 2024-04-20 23:59:44,817] Trial 88 finished with values: [5.472900291930642, 0.445688788983166, 0.05533132983949707, 63.012028125686754] and parameters: {'dropout': 0.32012678495573904, 'num_heads': 8, 'bias': True, 'loss_fn': 'MSE', 'optimizer': 'Adam', 'lr': 0.0008516195332639563, 'weight_decay': 7.011871824250725e-05}. 
[W 2024-04-21 00:21:51,377] Trial 89 failed with parameters: {'dropout': 0.5458344966975266, 'num_heads': 8, 'bias': True, 'loss_fn': 'MSE', 'optimizer': 'SGD', 'lr': 0.0518227826558114, 'weight_decay': 0.05307017177396677} because of the following error: The value nan is not acceptable.
[W 2024-04-21 00:21:51,377] Trial 89 failed with value [nan, nan, nan, nan].
[I 2024-04-21 00:24:30,484] Trial 90 finished with values: [5.980954744670145, 0.24987905224404386, -0.19919502696147418, 79.98964415136318] and parameters: {'dropout': 0.5327758530434905, 'num_heads': 8, 'bias': False, 'loss_fn': 'MAE', 'optimizer': 'Adam', 'lr': 0.002386297911470172, 'weight_decay': 2.6428916322772236e-05}. 
[I 2024-04-21 00:25:32,824] Trial 91 finished with values: [5.088040980102399, 0.35058005234337664, 0.10622678054342016, 59.617159985643305] and parameters: {'dropout': 0.6966193868431158, 'num_heads': 8, 'bias': False, 'loss_fn': 'MSE', 'optimizer': 'RMSprop', 'lr': 0.00022343489096155288, 'weight_decay': 0.0015978339728337685}. 
[I 2024-04-21 00:26:38,296] Trial 92 finished with values: [5.3285150317133505, 0.1703733091707415, -0.010205689716639377, 67.38352963726257] and parameters: {'dropout': 0.44019580455912544, 'num_heads': 4, 'bias': False, 'loss_fn': 'MSE', 'optimizer': 'SGD', 'lr': 0.005756458005859107, 'weight_decay': 0.021335126211440684}. 
[I 2024-04-21 00:27:08,876] Trial 93 finished with values: [5.434743690046122, 0.08301516182799128, -0.10925655535206769, 73.99049790925235] and parameters: {'dropout': 0.2648027849348546, 'num_heads': 1, 'bias': True, 'loss_fn': 'MAE', 'optimizer': 'SGD', 'lr': 0.0028078774054756833, 'weight_decay': 2.6428916322772236e-05}. 
[I 2024-04-21 00:28:26,017] Trial 94 finished with values: [5.299561404595208, 0.22713835247526135, -0.0021550033085635523, 66.84652645889892] and parameters: {'dropout': 0.30506597731706453, 'num_heads': 4, 'bias': True, 'loss_fn': 'MAE', 'optimizer': 'Adam', 'lr': 0.034134792005353944, 'weight_decay': 8.57593926099762e-05}. 
[I 2024-04-21 00:29:35,924] Trial 95 finished with values: [5.039001408565561, 0.3643986708383981, 0.04838205283642394, 63.47556423289822] and parameters: {'dropout': 0.2512662173869412, 'num_heads': 2, 'bias': False, 'loss_fn': 'MAE', 'optimizer': 'RMSprop', 'lr': 0.002310234514292926, 'weight_decay': 2.0032993856203536e-05}. 
[I 2024-04-21 00:30:47,859] Trial 96 finished with values: [5.335371169239094, 0.19441598040216804, -0.06421581418788835, 70.98615518181032] and parameters: {'dropout': 0.6709270573722722, 'num_heads': 1, 'bias': False, 'loss_fn': 'MAE', 'optimizer': 'SGD', 'lr': 0.0020271903886286326, 'weight_decay': 0.0002076432622487999}. 
[I 2024-04-21 00:32:39,443] Trial 97 finished with values: [5.33885874971174, 0.19576035870320535, -0.07781664211877959, 71.89336823881615] and parameters: {'dropout': 0.24104348656224273, 'num_heads': 2, 'bias': False, 'loss_fn': 'MAE', 'optimizer': 'RMSprop', 'lr': 0.0034975151877234137, 'weight_decay': 0.033819847535106105}. 
[I 2024-04-21 00:33:35,699] Trial 98 finished with values: [5.294787866010961, 0.20709242201984915, 0.023211610657115522, 65.15450274397331] and parameters: {'dropout': 0.626088838661456, 'num_heads': 1, 'bias': True, 'loss_fn': 'MSE', 'optimizer': 'Adam', 'lr': 0.07754675794637712, 'weight_decay': 0.00016773746443731933}. 
[I 2024-04-21 00:34:28,567] Trial 99 finished with values: [5.328883014970234, 0.18000507842191826, -0.06536700944634677, 71.06294310787949] and parameters: {'dropout': 0.3635622435900131, 'num_heads': 2, 'bias': True, 'loss_fn': 'MAE', 'optimizer': 'Adam', 'lr': 0.09605454481221487, 'weight_decay': 0.033819847535106105}. 
