[I 2024-04-21 05:25:14,392] Trial 19 finished with values: [5.693267513503854, 0.23084544555287045, -0.17940239231908084, 78.66942036268176] and parameters: {'dropout': 0.5380027110594164, 'num_heads': 4, 'bias': True, 'loss_fn': 'MAE', 'optimizer': 'Adam', 'lr': 0.00018793361448710884, 'weight_decay': 0.0063406834865273425}. 
[I 2024-04-21 05:27:56,599] Trial 20 finished with values: [5.195987910756749, 0.36771575380334354, 0.0042519382503589664, 66.41916563445042] and parameters: {'dropout': 0.26590282951288446, 'num_heads': 4, 'bias': False, 'loss_fn': 'MAE', 'optimizer': 'Adam', 'lr': 0.00010399357095935304, 'weight_decay': 0.004209658587267496}. 
[I 2024-04-21 05:29:07,388] Trial 21 finished with values: [5.722564729778456, 0.04249124541069607, -0.119395935205858, 74.66682275065469] and parameters: {'dropout': 0.21064063493357266, 'num_heads': 8, 'bias': False, 'loss_fn': 'MSE', 'optimizer': 'SGD', 'lr': 0.003641934062729508, 'weight_decay': 0.0007914943835988409}. 
[I 2024-04-21 05:30:55,431] Trial 22 finished with values: [5.329048861602556, 0.19309233077145208, -0.06125429308963515, 70.78861348636462] and parameters: {'dropout': 0.5256422487215591, 'num_heads': 8, 'bias': False, 'loss_fn': 'MAE', 'optimizer': 'SGD', 'lr': 0.046442766130357034, 'weight_decay': 0.0018149806984605697}. 
[I 2024-04-21 05:32:10,040] Trial 23 finished with values: [5.249610636241382, 0.23852050638907085, 0.013978908408728286, 65.77034966695068] and parameters: {'dropout': 0.6001573045542861, 'num_heads': 8, 'bias': True, 'loss_fn': 'MSE', 'optimizer': 'RMSprop', 'lr': 0.03157589555285054, 'weight_decay': 0.0024022863776146748}. 
[I 2024-04-21 05:34:23,811] Trial 24 finished with values: [5.348411706095636, 0.19176308961824903, -0.08547040461498812, 72.40389548811773] and parameters: {'dropout': 0.5873622501701085, 'num_heads': 1, 'bias': False, 'loss_fn': 'MAE', 'optimizer': 'SGD', 'lr': 0.00012933317620565567, 'weight_decay': 0.006184003098268536}. 
[I 2024-04-21 05:36:04,347] Trial 25 finished with values: [5.339953841025085, 0.11598416751107143, -0.06467700967422396, 71.01691820367648] and parameters: {'dropout': 0.23491429552990067, 'num_heads': 2, 'bias': True, 'loss_fn': 'MAE', 'optimizer': 'SGD', 'lr': 0.0032012464237138995, 'weight_decay': 0.0044688876794784635}. 
[I 2024-04-21 05:37:25,492] Trial 26 finished with values: [5.478235239895242, 0.12414172877268055, -0.13448320913012046, 75.67318589032995] and parameters: {'dropout': 0.5645255597208424, 'num_heads': 4, 'bias': True, 'loss_fn': 'MAE', 'optimizer': 'SGD', 'lr': 0.00010597543956195971, 'weight_decay': 0.007612069588855354}. 
[I 2024-04-21 05:38:42,038] Trial 27 finished with values: [5.330303882540631, 0.17920856074960442, -0.054561147393013876, 70.3421620497851] and parameters: {'dropout': 0.6679233161172613, 'num_heads': 8, 'bias': True, 'loss_fn': 'MAE', 'optimizer': 'SGD', 'lr': 0.0018310475159348336, 'weight_decay': 0.00011407224951813356}. 
[I 2024-04-21 05:40:06,477] Trial 28 finished with values: [13.223711711861425, 0.1308683636196451, -3.5839854823024337, 305.76458314162636] and parameters: {'dropout': 0.5773079461370471, 'num_heads': 4, 'bias': False, 'loss_fn': 'MSE', 'optimizer': 'Adam', 'lr': 0.001344127677841538, 'weight_decay': 0.01497218751993592}. 
[I 2024-04-21 05:41:09,587] Trial 29 finished with values: [5.610867586374222, 0.17678705768360437, -0.158377479726578, 77.2670002068468] and parameters: {'dropout': 0.3941831645249131, 'num_heads': 8, 'bias': True, 'loss_fn': 'MAE', 'optimizer': 'SGD', 'lr': 0.00015913174093055846, 'weight_decay': 0.04283968605566765}. 
[I 2024-04-21 05:42:32,630] Trial 30 finished with values: [5.407849598303533, 0.21888069225426968, -0.10738355401409838, 73.86556350980041] and parameters: {'dropout': 0.5096115813599797, 'num_heads': 2, 'bias': True, 'loss_fn': 'MAE', 'optimizer': 'SGD', 'lr': 0.00013536465491515882, 'weight_decay': 4.157631571601503e-05}. 
[I 2024-04-21 05:43:36,962] Trial 31 finished with values: [7.545119661165826, 0.1779609891297673, -0.6160403574500346, 107.79438725176007] and parameters: {'dropout': 0.3281862444060871, 'num_heads': 2, 'bias': True, 'loss_fn': 'MSE', 'optimizer': 'Adam', 'lr': 0.0001224652516405315, 'weight_decay': 0.00019854046851875573}. 
[I 2024-04-21 05:46:01,488] Trial 32 finished with values: [5.270634690028753, 0.2358854881909372, 0.001126412606465066, 66.62764688930895] and parameters: {'dropout': 0.44470961277411203, 'num_heads': 2, 'bias': True, 'loss_fn': 'MSE', 'optimizer': 'Adam', 'lr': 0.009584155726690476, 'weight_decay': 0.006632926684142983}. 
[I 2024-04-21 05:47:37,099] Trial 33 finished with values: [5.480622596766232, 0.18742277340891333, -0.12469773478055757, 75.02046753053394] and parameters: {'dropout': 0.591680209746032, 'num_heads': 1, 'bias': False, 'loss_fn': 'MAE', 'optimizer': 'RMSprop', 'lr': 0.002453903431924565, 'weight_decay': 0.001757309792283472}. 
[I 2024-04-21 05:50:09,019] Trial 34 finished with values: [439.50066818387234, -0.11338156957773608, -4870.25117965573, 324926.00425459235] and parameters: {'dropout': 0.3335372050352221, 'num_heads': 2, 'bias': True, 'loss_fn': 'MSE', 'optimizer': 'Adam', 'lr': 0.004010049265221723, 'weight_decay': 3.689981644869592e-05}. 
[I 2024-04-21 05:52:26,099] Trial 35 finished with values: [5.330867308991978, 0.22125475745036471, -0.001327557172841498, 66.7913334999033] and parameters: {'dropout': 0.22971657344274188, 'num_heads': 1, 'bias': True, 'loss_fn': 'MSE', 'optimizer': 'Adam', 'lr': 0.03047807714922662, 'weight_decay': 3.5642266538570554e-05}. 
[I 2024-04-21 05:56:42,551] Trial 36 finished with values: [9.166007419032171, 0.18260531238784994, -1.0406046791392614, 136.1140085374954] and parameters: {'dropout': 0.37574144418126854, 'num_heads': 1, 'bias': True, 'loss_fn': 'MSE', 'optimizer': 'Adam', 'lr': 0.00011848617983124927, 'weight_decay': 0.00022445131310385374}. 
[I 2024-04-21 05:58:27,343] Trial 37 finished with values: [7.613020407244157, 0.2054986731649786, -0.5488306214461991, 103.31131090005455] and parameters: {'dropout': 0.5380028577606399, 'num_heads': 1, 'bias': False, 'loss_fn': 'MSE', 'optimizer': 'RMSprop', 'lr': 0.0008832583458381545, 'weight_decay': 0.005657397137805395}. 
[I 2024-04-21 05:59:27,130] Trial 38 finished with values: [5.308691670165338, 0.2081055775929862, 0.019669748271950227, 65.39075481761668] and parameters: {'dropout': 0.6388259958261888, 'num_heads': 8, 'bias': True, 'loss_fn': 'MSE', 'optimizer': 'Adam', 'lr': 0.07529747648502974, 'weight_decay': 0.0001556725605174705}. 
[I 2024-04-21 06:00:22,510] Trial 39 finished with values: [5.452075454662456, 0.13989892491992847, -0.12381224115565104, 74.96140264253648] and parameters: {'dropout': 0.4732429300231492, 'num_heads': 4, 'bias': True, 'loss_fn': 'MAE', 'optimizer': 'SGD', 'lr': 0.0017058118255259584, 'weight_decay': 0.00017114543177745108}. 
[I 2024-04-21 06:02:09,231] Trial 40 finished with values: [5.225243207096176, 0.3091164558489193, -0.011553997773224411, 67.47346553528403] and parameters: {'dropout': 0.20421297783875053, 'num_heads': 2, 'bias': True, 'loss_fn': 'MAE', 'optimizer': 'Adam', 'lr': 0.00041951699272833453, 'weight_decay': 0.006380321497280199}. 
[I 2024-04-21 06:06:01,078] Trial 41 finished with values: [6.329522136220845, 0.2367333888440216, -0.1386770501742116, 75.9529267541611] and parameters: {'dropout': 0.5801534733693252, 'num_heads': 1, 'bias': False, 'loss_fn': 'MAE', 'optimizer': 'Adam', 'lr': 0.0002171122202198803, 'weight_decay': 2.7597715056702133e-05}. 
[I 2024-04-21 06:08:20,744] Trial 42 finished with values: [13.170335411573523, 0.16673929196308546, -2.824798207700471, 255.1246800613702] and parameters: {'dropout': 0.42423060754744846, 'num_heads': 8, 'bias': True, 'loss_fn': 'MSE', 'optimizer': 'Adam', 'lr': 0.00013330051891696687, 'weight_decay': 0.021766982135234623}. 
[I 2024-04-21 06:10:07,830] Trial 43 finished with values: [5.295258021777037, 0.21865918835579162, -0.041290064873285015, 69.45694392897097] and parameters: {'dropout': 0.44029061757042265, 'num_heads': 4, 'bias': True, 'loss_fn': 'MAE', 'optimizer': 'SGD', 'lr': 0.0004925078494031119, 'weight_decay': 6.726755738094533e-05}. 
[I 2024-04-21 06:11:48,871] Trial 44 finished with values: [5.28941006050701, 0.19066012968237728, -0.043228438684328685, 69.58623885422644] and parameters: {'dropout': 0.26636388810605455, 'num_heads': 4, 'bias': True, 'loss_fn': 'MAE', 'optimizer': 'Adam', 'lr': 0.0005423218123817099, 'weight_decay': 0.0015379044637375773}. 
[I 2024-04-21 06:13:46,609] Trial 45 finished with values: [5.294167162198464, 0.19710693335919968, -0.021693251526937463, 68.14978196546043] and parameters: {'dropout': 0.560709797427448, 'num_heads': 8, 'bias': False, 'loss_fn': 'MSE', 'optimizer': 'SGD', 'lr': 0.00017482693978880756, 'weight_decay': 0.05801989614776756}. 
[I 2024-04-21 06:16:26,112] Trial 46 finished with values: [5.353886789140765, 0.0002686344021060408, -0.07195714869918524, 71.50252372812118] and parameters: {'dropout': 0.6416782089163486, 'num_heads': 2, 'bias': False, 'loss_fn': 'MAE', 'optimizer': 'Adam', 'lr': 0.04086423010476377, 'weight_decay': 0.004715718853887477}. 
[I 2024-04-21 06:17:39,816] Trial 47 finished with values: [5.330913532124706, 0.09441339660535163, -0.0559202282805058, 70.43281652559531] and parameters: {'dropout': 0.6106799664039466, 'num_heads': 1, 'bias': True, 'loss_fn': 'MSE', 'optimizer': 'SGD', 'lr': 0.0005776903862598507, 'weight_decay': 0.0029569244214549045}. 
[I 2024-04-21 06:20:30,899] Trial 48 finished with values: [5.349748270156771, 0.17927697510982926, -0.08000721191789562, 72.03948533802061] and parameters: {'dropout': 0.5999986270553703, 'num_heads': 8, 'bias': True, 'loss_fn': 'MAE', 'optimizer': 'SGD', 'lr': 0.017817102890301296, 'weight_decay': 0.009332673144591437}. 
[I 2024-04-21 06:22:11,168] Trial 49 finished with values: [5.364255170294368, 0.17338242994607958, -0.08973993203186814, 72.68868484355399] and parameters: {'dropout': 0.6910830894028372, 'num_heads': 4, 'bias': True, 'loss_fn': 'MAE', 'optimizer': 'SGD', 'lr': 0.024580253180660136, 'weight_decay': 0.04896412393798375}. 
[I 2024-04-21 06:23:15,390] Trial 50 finished with values: [5.357394944954361, 0.17969146168942662, -0.0836436591218519, 72.28204648218805] and parameters: {'dropout': 0.6398142541391234, 'num_heads': 4, 'bias': True, 'loss_fn': 'MAE', 'optimizer': 'RMSprop', 'lr': 0.08708195131265879, 'weight_decay': 0.00036388981450777936}. 
[I 2024-04-21 06:24:58,244] Trial 51 finished with values: [5.319357997605973, 0.20533552605673022, -0.0675710219715202, 71.20995687430619] and parameters: {'dropout': 0.591680209746032, 'num_heads': 1, 'bias': False, 'loss_fn': 'MAE', 'optimizer': 'SGD', 'lr': 0.0004438407308662206, 'weight_decay': 0.0017281066774227586}. 
[I 2024-04-21 06:29:12,279] Trial 52 finished with values: [5.212502768057464, 0.3327145950664581, -0.02126483432746018, 68.12120534650852] and parameters: {'dropout': 0.6213902221456433, 'num_heads': 2, 'bias': True, 'loss_fn': 'MAE', 'optimizer': 'Adam', 'lr': 0.0001176103965336431, 'weight_decay': 0.021393723281926534}. 
Training finished at Epoch 65, with validation result for [5.115901392428311, 0.46453276102593977, 0.1889638096157097, 85.95569475319992]
Training finished at Epoch 67, with validation result for [5.332054853614298, 0.3152841168316435, 0.050533105965704816, 97.06139854681106]
Training finished at Epoch 60, with validation result for [91.8768998163863, -0.10565047235883292, -85.09647932879017, 9077.36536141281]
Training finished at Epoch 66, with validation result for [5.1163689832463595, 0.11126349368666683, -0.03232043138002738, 86.97412521445658]
Training finished at Epoch 58, with validation result for [5.221181612119582, 0.47662094733680016, 0.19170295748798127, 83.37238576352323]
ESM3B-Attention-BioInf-Combnation(MultipleRegression)
Training finished at Epoch 35, with validation result for [5.158361361186529, 0.024957640859888417, -0.03348135449076195, 85.03786749651712]
Training finished at Epoch 53, with validation result for [5.706109480208338, -0.023208736417399553, -0.04960643676569809, 107.79525410186803]
Training finished at Epoch 45, with validation result for [5.508842256699855, 0.015620483810756591, -0.035457448951546455, 107.45955841991326]
Training finished at Epoch 82, with validation result for [5.509256644801276, -0.015999608379103424, -0.055332461079624196, 98.15965755975115]
Training finished at Epoch 41, with validation result for [5.5334838149339385, 0.48718638124717417, 0.1677314313022985, 73.44612221676174]
Training finished at Epoch 75, with validation result for [5.418551226917638, -0.18226473447731653, -0.055237012699056454, 96.20114443327452]
Training finished at Epoch 62, with validation result for [5.389059613842854, 0.04001496404246133, -0.01838586106216522, 96.32251465829206]
Training finished at Epoch 67, with validation result for [5.288925369202022, 0.567935065192389, 0.26182680586782725, 78.34876975392191]
Training finished at Epoch 73, with validation result for [5.547472473576806, 0.06492069212200982, -0.013896646675489066, 109.08001195386657]
Training finished at Epoch 45, with validation result for [5.224705964306016, -0.02272552512865419, -0.016508093309478333, 93.0386184867137]
Training finished at Epoch 63, with validation result for [5.649065795828338, -0.12139826129756971, -0.022516110168829373, 99.83940834428064]
Training finished at Epoch 36, with validation result for [5.178796247417616, -0.008200276575052368, -0.029886971198049617, 96.49421133970388]
Training finished at Epoch 50, with validation result for [4.656788573825854, 0.041925598914791, -0.051810200070367296, 66.99546619728476]
Training finished at Epoch 76, with validation result for [7.159366870611308, 0.46257892054302197, -0.0901419499953584, 111.2387459628731]
Training finished at Epoch 54, with validation result for [5.982738051211989, 0.042796934462862396, -0.0027244964920267734, 109.01444343656935]
Training finished at Epoch 78, with validation result for [4.912623713368695, 0.1441574381835999, -0.0520394409712861, 69.53546406239457]
Training finished at Epoch 52, with validation result for [5.6053778084184485, 0.4908149813351895, 0.1660243445955396, 79.44454696290963]
Training finished at Epoch 43, with validation result for [5.82265028824765, 0.0055810074405629765, -0.04304717512938061, 106.41699540752028]
Training finished at Epoch 36, with validation result for [5.5613244130036925, -0.0397972939188898, -0.03333236675148443, 105.5224153271899]
Training finished at Epoch 81, with validation result for [5.318526300647128, 0.1344705906954167, -0.0065735046140835696, 91.19811250895367]
Training finished at Epoch 45, with validation result for [5.924311748821061, -0.09743472869045537, -0.05827314716426213, 115.73784423095178]
Training finished at Epoch 72, with validation result for [5.164896307517551, 0.010310032330386786, -0.0379114146450652, 76.38196195868572]
Training finished at Epoch 39, with validation result for [4.632999290947683, 0.11673828356950315, -0.01576437240049633, 57.92568726021957]
Training finished at Epoch 101, with validation result for [5.4984161808851155, -0.041200949054138604, -0.05472274275606881, 98.51089661654778]
Training finished at Epoch 70, with validation result for [5.618829437712705, 0.20011966739330575, -0.016217790529708953, 106.57047692405119]
Training finished at Epoch 63, with validation result for [5.263585350269579, 0.006479005513085156, -0.03829970866604304, 90.09079114663932]
Training finished at Epoch 58, with validation result for [5.038605786974914, -0.0017314041404206662, -0.019429504081774462, 88.27346577629224]
Training finished at Epoch 45, with validation result for [5.539494437455265, 0.5132632332320385, 0.16089059391960303, 87.5312662973595]
Training finished at Epoch 53, with validation result for [5.186374884912389, 0.04436967687211455, -0.018847964110444648, 85.39833120555504]
Training finished at Epoch 57, with validation result for [5.692934173794957, 0.00994553259788127, -0.05610143691371472, 111.0488590115469]
Training finished at Epoch 32, with validation result for [5.330664222112527, 0.6226442119064641, 0.3708206439160979, 61.69161432314795]
Training finished at Epoch 72, with validation result for [5.418992139682107, 0.013719342961524704, -0.054543283324830716, 94.625215135134]
Training finished at Epoch 52, with validation result for [5.413047982471615, 0.042115878342012136, -0.058142393611914533, 97.02905072654248]
Training finished at Epoch 79, with validation result for [5.654597760832796, 0.053717941532635594, -0.04469820761668597, 101.68119221522431]
Training finished at Epoch 68, with validation result for [5.678133220904243, 0.13627232077949455, -0.0013629048147989486, 108.8444176854534]
Training finished at Epoch 123, with validation result for [4.610944624520678, 0.5121396850051975, 0.18129516639194443, 66.11592001817401]
Training finished at Epoch 60, with validation result for [5.238086233869929, 0.5149581904224684, 0.24134227119346163, 71.60346898573275]
Training finished at Epoch 30, with validation result for [5.449380656923971, 0.09428087355132292, -0.000809783618154869, 83.98192373001451]
Training finished at Epoch 33, with validation result for [5.247627373226632, -0.0037563809420072102, -0.013268972143752, 91.2723636552932]
Training finished at Epoch 53, with validation result for [5.7021141413001315, 0.024265006334595877, -0.08621211400915696, 101.97123445859103]
Training finished at Epoch 113, with validation result for [4.893403339965438, 0.4281356485740141, 0.14901221162539713, 87.80016620843475]
Training finished at Epoch 63, with validation result for [5.991313728442228, 0.4987199342930113, 0.22407116797045334, 83.45023033459091]
Training finished at Epoch 71, with validation result for [5.332827762410069, 0.011304107187488683, -0.02694313708584617, 93.83753688378476]
Training finished at Epoch 48, with validation result for [5.128717622950383, 0.09639522037802767, -0.09693172437061692, 73.67097756740321]
Training finished at Epoch 80, with validation result for [5.423863753995299, -0.0438187451072106, -0.032756450598737885, 103.01708070304797]
Training finished at Epoch 80, with validation result for [5.120666335805583, -0.17185016021043759, -0.036749167768918456, 85.88496400603223]
Training finished at Epoch 56, with validation result for [5.79262712791856, -0.14760448756697622, -0.07929484803549824, 113.88039489635277]
Training finished at Epoch 129, with validation result for [5.038239882376359, -0.12025836017160231, -0.015034159109141632, 88.54752185858547]
Training finished at Epoch 77, with validation result for [5.59144154783247, -0.1371719168649602, -0.037762529251871735, 106.91892165507458]
Training finished at Epoch 35, with validation result for [4.956331241460543, 0.04197195018047141, -0.03454462089724197, 72.14296856621678]
Training finished at Epoch 74, with validation result for [4.939914851377666, 0.21889900659330705, -0.049011687467877874, 73.15871931950362]
Training finished at Epoch 134, with validation result for [5.594882119682175, 0.04400509466402173, -0.03259108400967503, 106.65745224365351]
[I 2024-04-21 06:31:00,102] Trial 53 finished with values: [5.3344251718735896, 0.16925361497964217, -0.06816494439089227, 71.24957315181815] and parameters: {'dropout': 0.4764075035487058, 'num_heads': 1, 'bias': False, 'loss_fn': 'MAE', 'optimizer': 'SGD', 'lr': 0.007433413186728296, 'weight_decay': 1.8515060707525556e-05}. 
[I 2024-04-21 06:32:24,696] Trial 54 finished with values: [5.3112887379370655, 0.17508555718845176, -0.005374141536496291, 67.06125193351903] and parameters: {'dropout': 0.6388259958261888, 'num_heads': 8, 'bias': True, 'loss_fn': 'MSE', 'optimizer': 'SGD', 'lr': 0.0018310475159348336, 'weight_decay': 0.00011407224951813356}. 
[I 2024-04-21 06:33:41,209] Trial 55 finished with values: [5.3657742327225835, 0.17170778856468633, 0.0033821409828976856, 66.47718353174302] and parameters: {'dropout': 0.4732429300231492, 'num_heads': 2, 'bias': True, 'loss_fn': 'MSE', 'optimizer': 'SGD', 'lr': 0.0017058118255259584, 'weight_decay': 0.006380321497280199}. 
[I 2024-04-21 06:35:42,215] Trial 56 finished with values: [5.2726383332067694, 0.25762752006980993, -0.023359405815635004, 68.2609190913305] and parameters: {'dropout': 0.560709797427448, 'num_heads': 1, 'bias': True, 'loss_fn': 'MSE', 'optimizer': 'Adam', 'lr': 0.00017482693978880756, 'weight_decay': 0.05801989614776756}. 
[I 2024-04-21 06:36:27,690] Trial 57 finished with values: [5.299338649755154, 0.18951639646497237, -0.02295082348831423, 68.23366551352696] and parameters: {'dropout': 0.4764075035487058, 'num_heads': 8, 'bias': True, 'loss_fn': 'MSE', 'optimizer': 'SGD', 'lr': 0.00024227980333987306, 'weight_decay': 0.05801989614776756}. 
[I 2024-04-21 06:37:48,709] Trial 58 finished with values: [5.351331742313114, 0.17162217012708503, -0.07793188776583526, 71.9010554440586] and parameters: {'dropout': 0.44029061757042265, 'num_heads': 2, 'bias': True, 'loss_fn': 'MAE', 'optimizer': 'SGD', 'lr': 0.0004925078494031119, 'weight_decay': 0.00016110486713333613}. 
[I 2024-04-21 06:38:29,824] Trial 59 finished with values: [5.329677279790569, 0.09800080151397374, -0.032731966217727226, 68.88609494220952] and parameters: {'dropout': 0.6106799664039466, 'num_heads': 8, 'bias': True, 'loss_fn': 'MSE', 'optimizer': 'SGD', 'lr': 0.0005776903862598507, 'weight_decay': 0.005519560907196492}. 
[W 2024-04-21 07:18:40,168] Trial 60 failed with parameters: {'dropout': 0.40448917205749835, 'num_heads': 2, 'bias': True, 'loss_fn': 'MSE', 'optimizer': 'SGD', 'lr': 0.04135750773706829, 'weight_decay': 0.0012791368483229565} because of the following error: The value nan is not acceptable.
[W 2024-04-21 07:18:40,169] Trial 60 failed with value [nan, nan, nan, nan].
