[I 2024-04-21 07:19:29,682] Trial 61 finished with values: [5.372745909455583, 0.1684267563540786, -0.09264557476747859, 72.88249929677215] and parameters: {'dropout': 0.5968208698337486, 'num_heads': 8, 'bias': True, 'loss_fn': 'MAE', 'optimizer': 'SGD', 'lr': 0.0032012464237138995, 'weight_decay': 0.0001233670278662728}. 
[I 2024-04-21 07:23:31,189] Trial 62 finished with values: [8.637367584391908, 0.21154935425061563, -1.003381917555357, 133.631146795672] and parameters: {'dropout': 0.5519832871533943, 'num_heads': 8, 'bias': False, 'loss_fn': 'MAE', 'optimizer': 'Adam', 'lr': 0.00015913174093055846, 'weight_decay': 0.0006850267097265221}. 
[I 2024-04-21 07:25:12,363] Trial 63 finished with values: [5.324881942276871, 0.13078041569601334, -0.015347548829513613, 67.72650594342471] and parameters: {'dropout': 0.6482578952366056, 'num_heads': 1, 'bias': True, 'loss_fn': 'MAE', 'optimizer': 'RMSprop', 'lr': 0.00846902563312967, 'weight_decay': 0.0001233670278662728}. 
[I 2024-04-21 07:26:26,814] Trial 64 finished with values: [5.094497343769226, 0.28622899248429934, 0.03784636557452914, 64.1783238808467] and parameters: {'dropout': 0.5968208698337486, 'num_heads': 8, 'bias': True, 'loss_fn': 'MSE', 'optimizer': 'RMSprop', 'lr': 0.0011461249545361423, 'weight_decay': 0.0001233670278662728}. 
[I 2024-04-21 07:28:06,198] Trial 65 finished with values: [5.320621649299143, 0.15772118074264266, -0.02120536300520781, 68.11723844388032] and parameters: {'dropout': 0.23491429552990067, 'num_heads': 1, 'bias': True, 'loss_fn': 'MSE', 'optimizer': 'Adam', 'lr': 0.03047807714922662, 'weight_decay': 0.0044688876794784635}. 
[I 2024-04-21 07:29:53,102] Trial 66 finished with values: [5.339193686312746, 0.1836750658318095, -0.07412621816329512, 71.6472066951723] and parameters: {'dropout': 0.2209284709748457, 'num_heads': 2, 'bias': True, 'loss_fn': 'MAE', 'optimizer': 'SGD', 'lr': 0.004213421808896818, 'weight_decay': 0.028155367035976854}. 
[I 2024-04-21 07:31:23,569] Trial 67 finished with values: [5.601754906316744, 0.28124205382423073, 0.04797148933054207, 63.50294996082293] and parameters: {'dropout': 0.44470961277411203, 'num_heads': 8, 'bias': True, 'loss_fn': 'MAE', 'optimizer': 'Adam', 'lr': 0.0018310475159348336, 'weight_decay': 0.00011407224951813356}. 
[I 2024-04-21 07:32:24,306] Trial 68 finished with values: [5.437000321246482, 0.1854550747561663, -0.11764214854144828, 74.54984030155383] and parameters: {'dropout': 0.5968208698337486, 'num_heads': 4, 'bias': True, 'loss_fn': 'MAE', 'optimizer': 'SGD', 'lr': 0.0005162881586727135, 'weight_decay': 0.0001233670278662728}. 
[I 2024-04-21 07:34:01,835] Trial 69 finished with values: [5.3696845154565205, 0.16873988535409237, -0.09338269281596112, 72.93166712107931] and parameters: {'dropout': 0.37061759286604334, 'num_heads': 2, 'bias': True, 'loss_fn': 'MAE', 'optimizer': 'Adam', 'lr': 0.03631074638994933, 'weight_decay': 0.042116233473394625}. 
[I 2024-04-21 07:35:08,388] Trial 70 finished with values: [5.423698888227042, 0.22027221939952046, -0.10440643538137984, 73.66698141541752] and parameters: {'dropout': 0.6213902221456433, 'num_heads': 2, 'bias': True, 'loss_fn': 'MAE', 'optimizer': 'Adam', 'lr': 0.0001176103965336431, 'weight_decay': 0.021393723281926534}. 
[I 2024-04-21 07:36:12,987] Trial 71 finished with values: [5.39678980174562, 0.16768102703701315, -0.10665190414022852, 73.81676042795098] and parameters: {'dropout': 0.3301841780187851, 'num_heads': 4, 'bias': False, 'loss_fn': 'MAE', 'optimizer': 'SGD', 'lr': 0.0004438407308662206, 'weight_decay': 6.594281231337641e-05}. 
[I 2024-04-21 07:37:14,494] Trial 72 finished with values: [5.443276924409092, 0.15168055675641706, -0.1124664837929108, 74.20460906545433] and parameters: {'dropout': 0.44029061757042265, 'num_heads': 4, 'bias': True, 'loss_fn': 'MAE', 'optimizer': 'SGD', 'lr': 0.0002171122202198803, 'weight_decay': 2.7597715056702133e-05}. 
[I 2024-04-21 07:38:55,739] Trial 73 finished with values: [5.35668393306457, -0.13437395658868534, -0.07680338510781914, 71.82578117756394] and parameters: {'dropout': 0.6398142541391234, 'num_heads': 4, 'bias': True, 'loss_fn': 'MAE', 'optimizer': 'RMSprop', 'lr': 0.08708195131265879, 'weight_decay': 0.00036388981450777936}. 
[I 2024-04-21 07:40:10,891] Trial 74 finished with values: [5.275506954486964, 0.17359289540641074, -0.0018392203793284878, 66.82546285909181] and parameters: {'dropout': 0.5310152851853307, 'num_heads': 8, 'bias': False, 'loss_fn': 'MSE', 'optimizer': 'RMSprop', 'lr': 0.002453903431924565, 'weight_decay': 0.000104860869337513}. 
[I 2024-04-21 07:41:34,438] Trial 75 finished with values: [5.353809648794672, 0.1809270690825269, -0.06734280498944045, 71.19473416676034] and parameters: {'dropout': 0.25529970759751935, 'num_heads': 8, 'bias': True, 'loss_fn': 'MSE', 'optimizer': 'SGD', 'lr': 0.007433413186728296, 'weight_decay': 0.0001961412911287214}. 
[I 2024-04-21 07:43:08,360] Trial 76 finished with values: [5.346859464983407, 0.18902489942368916, -0.07294776256940128, 71.56860042889834] and parameters: {'dropout': 0.5672710103896051, 'num_heads': 4, 'bias': False, 'loss_fn': 'MAE', 'optimizer': 'SGD', 'lr': 0.0010162881905153198, 'weight_decay': 0.03077388532154081}. 
[I 2024-04-21 07:44:27,312] Trial 77 finished with values: [5.277308955079054, 0.23033753036602944, -0.020571328432376523, 68.07494657415089] and parameters: {'dropout': 0.40330429094156395, 'num_heads': 4, 'bias': True, 'loss_fn': 'MAE', 'optimizer': 'Adam', 'lr': 0.002529114770389958, 'weight_decay': 0.004017571036866159}. 
[I 2024-04-21 07:45:44,859] Trial 78 finished with values: [5.306536174530597, 0.21055694985929752, -0.05803484755405108, 70.57386751346931] and parameters: {'dropout': 0.5310152851853307, 'num_heads': 2, 'bias': True, 'loss_fn': 'MAE', 'optimizer': 'Adam', 'lr': 0.05944231950941618, 'weight_decay': 0.000104860869337513}. 
[I 2024-04-21 07:47:30,977] Trial 79 finished with values: [5.3382462353580085, 0.173606975294437, -0.0750374815766317, 71.70799049974298] and parameters: {'dropout': 0.6106799664039466, 'num_heads': 2, 'bias': True, 'loss_fn': 'MAE', 'optimizer': 'SGD', 'lr': 0.0005162881586727135, 'weight_decay': 1.8515060707525556e-05}. 
[I 2024-04-21 07:48:37,798] Trial 80 finished with values: [5.3259311438490595, 0.18900435890525966, -0.06402308363685338, 70.97329951792932] and parameters: {'dropout': 0.5873622501701085, 'num_heads': 2, 'bias': True, 'loss_fn': 'MAE', 'optimizer': 'SGD', 'lr': 0.0062852834533710595, 'weight_decay': 0.006184003098268536}. 
[I 2024-04-21 07:51:28,775] Trial 81 finished with values: [6.36519068615589, 0.21422393093130468, -0.12483019859674505, 75.029303235554] and parameters: {'dropout': 0.6106799664039466, 'num_heads': 1, 'bias': True, 'loss_fn': 'MAE', 'optimizer': 'Adam', 'lr': 0.0005776903862598507, 'weight_decay': 0.0006850267097265221}. 
[I 2024-04-21 07:52:35,672] Trial 82 finished with values: [5.318829457201393, 0.17017453217167702, -0.05813676772645593, 70.58066587248449] and parameters: {'dropout': 0.47253235109455244, 'num_heads': 1, 'bias': True, 'loss_fn': 'MAE', 'optimizer': 'SGD', 'lr': 0.049451172069310996, 'weight_decay': 0.005519560907196492}. 
[I 2024-04-21 07:53:25,292] Trial 83 finished with values: [5.399010850897804, 0.15697168603037903, -0.09791453142943851, 73.23395336301108] and parameters: {'dropout': 0.38524071935374793, 'num_heads': 2, 'bias': True, 'loss_fn': 'MAE', 'optimizer': 'SGD', 'lr': 0.0004925078494031119, 'weight_decay': 0.005519560907196492}. 
[I 2024-04-21 07:54:52,666] Trial 84 finished with values: [5.3110362973203085, 0.24556624814655778, -0.07214546834290259, 71.51508517221409] and parameters: {'dropout': 0.47028779658474795, 'num_heads': 1, 'bias': True, 'loss_fn': 'MAE', 'optimizer': 'Adam', 'lr': 0.0002171122202198803, 'weight_decay': 0.0044688876794784635}. 
[I 2024-04-21 07:56:37,828] Trial 85 finished with values: [5.363881561744613, 0.1748483277703048, -0.08944292579933544, 72.66887370164888] and parameters: {'dropout': 0.26590282951288446, 'num_heads': 8, 'bias': False, 'loss_fn': 'MAE', 'optimizer': 'Adam', 'lr': 0.03157589555285054, 'weight_decay': 0.02175680583932085}. 
[I 2024-04-21 07:57:41,900] Trial 86 finished with values: [5.382567711855237, 0.08761992862129299, -0.015675279057515645, 67.7483664612939] and parameters: {'dropout': 0.5663635226551282, 'num_heads': 8, 'bias': True, 'loss_fn': 'MSE', 'optimizer': 'SGD', 'lr': 0.007433413186728296, 'weight_decay': 0.04283968605566765}. 
[I 2024-04-21 07:59:50,358] Trial 87 finished with values: [5.284261803521389, 0.26278485944753865, -0.056444227192266494, 70.46776871064034] and parameters: {'dropout': 0.6391309603013053, 'num_heads': 4, 'bias': True, 'loss_fn': 'MAE', 'optimizer': 'Adam', 'lr': 0.00638788575113871, 'weight_decay': 1.8515060707525556e-05}. 
[I 2024-04-21 08:01:39,133] Trial 88 finished with values: [5.412213070586955, -0.05790846063434548, -0.10643112309852709, 73.80203371831325] and parameters: {'dropout': 0.26590282951288446, 'num_heads': 2, 'bias': False, 'loss_fn': 'MAE', 'optimizer': 'Adam', 'lr': 0.030243366248325267, 'weight_decay': 0.0007432233016966393}. 
[I 2024-04-21 08:02:38,580] Trial 89 finished with values: [5.3426122919907595, 0.010461698294118811, -0.06453773463231283, 71.00762817095355] and parameters: {'dropout': 0.6106799664039466, 'num_heads': 1, 'bias': True, 'loss_fn': 'MSE', 'optimizer': 'SGD', 'lr': 0.0005776903862598507, 'weight_decay': 0.0002679820139670278}. 
[I 2024-04-21 08:04:37,132] Trial 90 finished with values: [5.359235583788535, 0.19511392059108726, -0.0931309740915427, 72.91487678194366] and parameters: {'dropout': 0.560709797427448, 'num_heads': 8, 'bias': False, 'loss_fn': 'MAE', 'optimizer': 'SGD', 'lr': 0.00017482693978880756, 'weight_decay': 0.05801989614776756}. 
[I 2024-04-21 08:05:48,204] Trial 91 finished with values: [5.526106428277441, 0.23536518209925608, -0.14310804496217644, 76.24848643240954] and parameters: {'dropout': 0.6388259958261888, 'num_heads': 8, 'bias': True, 'loss_fn': 'MAE', 'optimizer': 'Adam', 'lr': 0.0005423218123817099, 'weight_decay': 0.0015379044637375773}. 
[I 2024-04-21 08:07:17,520] Trial 92 finished with values: [5.435255383660398, 0.2258117750216146, 0.04671360314953277, 63.58685446821302] and parameters: {'dropout': 0.21669632530564809, 'num_heads': 8, 'bias': True, 'loss_fn': 'MSE', 'optimizer': 'RMSprop', 'lr': 0.03157589555285054, 'weight_decay': 0.0024022863776146748}. 
[I 2024-04-21 08:08:21,257] Trial 93 finished with values: [5.4096176819816595, -0.11674938338930389, -0.09905185300739427, 73.3098158759977] and parameters: {'dropout': 0.5663635226551282, 'num_heads': 8, 'bias': False, 'loss_fn': 'MSE', 'optimizer': 'SGD', 'lr': 0.0015962151009028664, 'weight_decay': 0.0001556725605174705}. 
[I 2024-04-21 08:11:54,706] Trial 94 finished with values: [5.695974451042837, 0.23201866964973053, -0.013402710182948807, 67.59677979565647] and parameters: {'dropout': 0.6213902221456433, 'num_heads': 8, 'bias': True, 'loss_fn': 'MAE', 'optimizer': 'Adam', 'lr': 0.0001176103965336431, 'weight_decay': 0.0001233670278662728}. 
[I 2024-04-21 08:13:08,078] Trial 95 finished with values: [5.298954635165684, 0.21750811295934822, -0.05578509361663708, 70.42380266760529] and parameters: {'dropout': 0.5380027110594164, 'num_heads': 4, 'bias': True, 'loss_fn': 'MAE', 'optimizer': 'RMSprop', 'lr': 0.002529114770389958, 'weight_decay': 0.0063406834865273425}. 
[I 2024-04-21 08:14:08,896] Trial 96 finished with values: [5.250445515523075, 0.22496909464019443, 0.018967117577181614, 65.43762223949615] and parameters: {'dropout': 0.5054921648556425, 'num_heads': 4, 'bias': True, 'loss_fn': 'MSE', 'optimizer': 'RMSprop', 'lr': 0.004213421808896818, 'weight_decay': 0.00016110486713333613}. 
[I 2024-04-21 08:18:11,877] Trial 97 finished with values: [12.793772026131581, 0.11958856685505709, -3.2678377802036938, 284.6766519698089] and parameters: {'dropout': 0.4764075035487058, 'num_heads': 4, 'bias': False, 'loss_fn': 'MAE', 'optimizer': 'Adam', 'lr': 0.0005162881586727135, 'weight_decay': 1.8515060707525556e-05}. 
[I 2024-04-21 08:20:56,243] Trial 98 finished with values: [5.351639255966828, 0.18042409870122897, -0.08121557779587651, 72.12008670344592] and parameters: {'dropout': 0.3281862444060871, 'num_heads': 4, 'bias': True, 'loss_fn': 'MAE', 'optimizer': 'Adam', 'lr': 0.00638788575113871, 'weight_decay': 0.03310572876438284}. 
[I 2024-04-21 08:23:34,257] Trial 99 finished with values: [5.3387649566154, 0.21511270671378738, -0.07730235715378275, 71.85906400104199] and parameters: {'dropout': 0.5519832871533943, 'num_heads': 1, 'bias': True, 'loss_fn': 'MAE', 'optimizer': 'Adam', 'lr': 0.033206590722584896, 'weight_decay': 0.0006850267097265221}. 
[I 2024-04-21 08:24:29,834] Trial 100 finished with values: [5.317462291725868, 0.03632009210283223, -0.06820392728294689, 71.25217341915861] and parameters: {'dropout': 0.40448917205749835, 'num_heads': 2, 'bias': True, 'loss_fn': 'MAE', 'optimizer': 'SGD', 'lr': 0.07529747648502974, 'weight_decay': 0.0001556725605174705}. 
[I 2024-04-21 08:26:06,901] Trial 101 finished with values: [5.33685500843346, -0.03827958973891263, -0.07938066520822051, 71.99769292959301] and parameters: {'dropout': 0.5380028577606399, 'num_heads': 1, 'bias': False, 'loss_fn': 'MAE', 'optimizer': 'RMSprop', 'lr': 0.05806606741703017, 'weight_decay': 0.005519560907196492}. 
[I 2024-04-21 08:27:16,715] Trial 102 finished with values: [5.326228889232736, 0.23293549035845904, -0.06484071640418443, 71.02783789795498] and parameters: {'dropout': 0.560709797427448, 'num_heads': 4, 'bias': True, 'loss_fn': 'MAE', 'optimizer': 'Adam', 'lr': 0.0018310475159348336, 'weight_decay': 0.0056970609060946415}. 
[I 2024-04-21 08:28:38,982] Trial 103 finished with values: [5.355169449595737, 0.20270555886627425, -0.08467874443969325, 72.35108955222998] and parameters: {'dropout': 0.26590282951288446, 'num_heads': 4, 'bias': False, 'loss_fn': 'MAE', 'optimizer': 'Adam', 'lr': 0.00796964740550948, 'weight_decay': 0.021393723281926534}. 
[I 2024-04-21 08:31:04,052] Trial 104 finished with values: [5.291645008272375, 0.23512232655143267, -0.05130332126998405, 70.1248559849422] and parameters: {'dropout': 0.40330429094156395, 'num_heads': 8, 'bias': True, 'loss_fn': 'MAE', 'optimizer': 'Adam', 'lr': 0.002529114770389958, 'weight_decay': 0.004017571036866159}. 
[I 2024-04-21 08:32:27,596] Trial 105 finished with values: [5.517659679515635, 0.23631243844222885, -0.1439948226184744, 76.30763696887263] and parameters: {'dropout': 0.5096115813599797, 'num_heads': 4, 'bias': True, 'loss_fn': 'MAE', 'optimizer': 'SGD', 'lr': 0.00013536465491515882, 'weight_decay': 0.021393723281926534}. 
[I 2024-04-21 08:35:17,632] Trial 106 finished with values: [5.292363144256093, 0.21722081124965562, -0.0528407670182065, 70.22740789312844] and parameters: {'dropout': 0.40330429094156395, 'num_heads': 2, 'bias': True, 'loss_fn': 'MAE', 'optimizer': 'Adam', 'lr': 0.002529114770389958, 'weight_decay': 0.0037267203012420346}. 
[I 2024-04-21 08:37:14,068] Trial 107 finished with values: [9.49805842336194, 0.205456464769026, -1.1722795468336615, 144.89708849842597] and parameters: {'dropout': 0.40330429094156395, 'num_heads': 8, 'bias': False, 'loss_fn': 'MSE', 'optimizer': 'Adam', 'lr': 0.0011461249545361423, 'weight_decay': 0.0001233670278662728}. 
[I 2024-04-21 08:38:52,929] Trial 108 finished with values: [34.56257250850302, 0.00792367021202018, -26.065180742116524, 1805.3228438911628] and parameters: {'dropout': 0.2305332625748669, 'num_heads': 2, 'bias': False, 'loss_fn': 'MSE', 'optimizer': 'Adam', 'lr': 0.00017482693978880756, 'weight_decay': 0.05801989614776756}. 
[I 2024-04-21 08:42:27,702] Trial 109 finished with values: [5.9579443389122675, 0.263655551969139, 0.010246694974239134, 66.01929868509175] and parameters: {'dropout': 0.6391309603013053, 'num_heads': 4, 'bias': True, 'loss_fn': 'MAE', 'optimizer': 'Adam', 'lr': 0.002529114770389958, 'weight_decay': 0.0004098049557541385}. 
[I 2024-04-21 08:44:12,988] Trial 110 finished with values: [5.710178143627772, 0.3289204227827831, 0.07873982548051284, 61.450616349999216] and parameters: {'dropout': 0.6213902221456433, 'num_heads': 2, 'bias': True, 'loss_fn': 'MAE', 'optimizer': 'Adam', 'lr': 0.001545532033538484, 'weight_decay': 0.00016110486713333613}. 
