[I 2024-04-21 02:21:28,235] Trial 182 finished with values: [10.142344232346918, 0.1856256712747512, -1.5030488859505557, 166.9603235329988] and parameters: {'dropout': 0.44019580455912544, 'num_heads': 8, 'bias': True, 'loss_fn': 'MSE', 'optimizer': 'Adam', 'lr': 0.00012877224601593124, 'weight_decay': 0.002914526952378704}. 
[I 2024-04-21 02:22:11,335] Trial 183 finished with values: [5.356354107501063, 0.24329360772695488, -0.09577356342735044, 73.09114484164789] and parameters: {'dropout': 0.5700265537579589, 'num_heads': 8, 'bias': True, 'loss_fn': 'MAE', 'optimizer': 'Adam', 'lr': 0.0004845261972377886, 'weight_decay': 0.002929922977379294}. 
[I 2024-04-21 02:23:50,044] Trial 184 finished with values: [5.304497436768334, 0.3983786927258784, 0.14197998640068943, 57.23232169871362] and parameters: {'dropout': 0.4418808344386026, 'num_heads': 8, 'bias': True, 'loss_fn': 'MSE', 'optimizer': 'RMSprop', 'lr': 0.002386297911470172, 'weight_decay': 0.0015978339728337685}. 
[I 2024-04-21 02:24:49,322] Trial 185 finished with values: [5.26502323746445, 0.24328913928128948, -0.03804768071615339, 69.24066788620907] and parameters: {'dropout': 0.6709270573722722, 'num_heads': 4, 'bias': False, 'loss_fn': 'MAE', 'optimizer': 'RMSprop', 'lr': 0.0020271903886286326, 'weight_decay': 0.00018005416692111982}. 
[I 2024-04-21 02:26:12,032] Trial 186 finished with values: [5.715786346927219, 0.4363170385985281, 0.04423625794025332, 63.75210028501102] and parameters: {'dropout': 0.6966193868431158, 'num_heads': 8, 'bias': False, 'loss_fn': 'MSE', 'optimizer': 'RMSprop', 'lr': 0.0004232772260006149, 'weight_decay': 0.0015978339728337685}. 
[I 2024-04-21 02:27:11,438] Trial 187 finished with values: [5.290353625036239, 0.19835043754552972, -0.019774172670522283, 68.02177406735231] and parameters: {'dropout': 0.30506597731706453, 'num_heads': 8, 'bias': True, 'loss_fn': 'MSE', 'optimizer': 'Adam', 'lr': 0.0518227826558114, 'weight_decay': 0.05390662290337038}. 
[I 2024-04-21 02:29:10,618] Trial 188 finished with values: [5.213020594761031, 0.3173279822923765, -0.008776961087744395, 67.28822946335863] and parameters: {'dropout': 0.5700265537579589, 'num_heads': 4, 'bias': False, 'loss_fn': 'MAE', 'optimizer': 'Adam', 'lr': 0.0015212116786850456, 'weight_decay': 0.0005023644237111914}. 
[I 2024-04-21 02:29:44,248] Trial 189 finished with values: [7.754398323435405, 0.1355791029922363, -0.4013856598452181, 93.47632180719802] and parameters: {'dropout': 0.30506597731706453, 'num_heads': 2, 'bias': True, 'loss_fn': 'MSE', 'optimizer': 'RMSprop', 'lr': 0.0003139835604020809, 'weight_decay': 0.08220975779411431}. 
[I 2024-04-21 02:30:24,991] Trial 190 finished with values: [5.314608413695908, 0.2709083532823886, 0.042034526757343316, 63.898961879562634] and parameters: {'dropout': 0.6684625967476364, 'num_heads': 8, 'bias': False, 'loss_fn': 'MSE', 'optimizer': 'Adam', 'lr': 0.002386297911470172, 'weight_decay': 0.001168696876803426}. 
[I 2024-04-21 02:30:59,290] Trial 191 finished with values: [5.536473328341086, -0.016427967042719642, -0.005339037699569227, 67.05891040994612] and parameters: {'dropout': 0.38545950668573836, 'num_heads': 1, 'bias': True, 'loss_fn': 'MSE', 'optimizer': 'SGD', 'lr': 0.007998144896696134, 'weight_decay': 0.0011294581876141276}. 
[I 2024-04-21 02:31:48,761] Trial 192 finished with values: [5.408871446270259, 0.10367765229208424, -0.10827946274855527, 73.92532311457703] and parameters: {'dropout': 0.5311365350726444, 'num_heads': 4, 'bias': True, 'loss_fn': 'MAE', 'optimizer': 'RMSprop', 'lr': 0.041784184662472634, 'weight_decay': 0.0005023644237111914}. 
[I 2024-04-21 02:32:35,504] Trial 193 finished with values: [11.232115413416519, 0.1568873896243109, -3.2217180600395583, 281.6003383416269] and parameters: {'dropout': 0.31961758477836855, 'num_heads': 1, 'bias': True, 'loss_fn': 'MSE', 'optimizer': 'RMSprop', 'lr': 0.002310234514292926, 'weight_decay': 2.0032993856203536e-05}. 
[I 2024-04-21 02:33:31,722] Trial 194 finished with values: [5.032072284207027, 0.42324437116175057, 0.1518332206430647, 56.57508356557638] and parameters: {'dropout': 0.5311365350726444, 'num_heads': 4, 'bias': True, 'loss_fn': 'MSE', 'optimizer': 'Adam', 'lr': 0.0015212116786850456, 'weight_decay': 0.00018005416692111982}. 
[I 2024-04-21 02:34:36,053] Trial 195 finished with values: [5.42886425875553, 0.38045451585346113, 0.06324832893199883, 62.48394226315572] and parameters: {'dropout': 0.626088838661456, 'num_heads': 8, 'bias': True, 'loss_fn': 'MAE', 'optimizer': 'Adam', 'lr': 0.002386297911470172, 'weight_decay': 2.6428916322772236e-05}. 
[I 2024-04-21 02:36:11,290] Trial 196 finished with values: [20.437427955056705, 0.07728916587771165, -7.477094610284686, 565.4457916092534] and parameters: {'dropout': 0.6315905101420694, 'num_heads': 8, 'bias': True, 'loss_fn': 'MSE', 'optimizer': 'RMSprop', 'lr': 0.00010292402149222344, 'weight_decay': 0.012372557046162126}. 
[I 2024-04-21 02:36:50,845] Trial 197 finished with values: [5.407098151797792, 0.05156179788662563, -0.10243020907916289, 73.53516162370488] and parameters: {'dropout': 0.3635622435900131, 'num_heads': 4, 'bias': True, 'loss_fn': 'MSE', 'optimizer': 'RMSprop', 'lr': 0.034134792005353944, 'weight_decay': 0.0005023644237111914}. 
[I 2024-04-21 02:37:34,063] Trial 198 finished with values: [5.19563630321735, 0.40955075491646825, 0.07130384071655316, 61.946617218757986] and parameters: {'dropout': 0.626088838661456, 'num_heads': 2, 'bias': True, 'loss_fn': 'MAE', 'optimizer': 'RMSprop', 'lr': 0.0008516195332639563, 'weight_decay': 7.736699491287808e-05}. 
[I 2024-04-21 02:38:59,097] Trial 199 finished with values: [5.214597588901374, 0.33244106091486814, -0.008220698933251391, 67.25112523027528] and parameters: {'dropout': 0.44019580455912544, 'num_heads': 4, 'bias': True, 'loss_fn': 'MAE', 'optimizer': 'RMSprop', 'lr': 0.005756458005859107, 'weight_decay': 8.57593926099762e-05}. 
[I 2024-04-21 02:39:38,451] Trial 200 finished with values: [5.327375365706304, 0.23969144566143194, -0.05124443477866647, 70.1209280921642] and parameters: {'dropout': 0.30506597731706453, 'num_heads': 2, 'bias': True, 'loss_fn': 'MAE', 'optimizer': 'Adam', 'lr': 0.0003139835604020809, 'weight_decay': 0.05390662290337038}. 
[I 2024-04-21 02:40:39,406] Trial 201 finished with values: [5.293146096688507, 0.1925599789463863, -0.04828296085712669, 69.92338954353652] and parameters: {'dropout': 0.6684625967476364, 'num_heads': 4, 'bias': True, 'loss_fn': 'MAE', 'optimizer': 'Adam', 'lr': 0.030918783275270336, 'weight_decay': 2.6428916322772236e-05}. 
[I 2024-04-21 02:41:37,996] Trial 202 finished with values: [5.411305794075675, 0.299996785519507, 0.08657526404230398, 60.92797080174706] and parameters: {'dropout': 0.6709270573722722, 'num_heads': 4, 'bias': False, 'loss_fn': 'MAE', 'optimizer': 'Adam', 'lr': 0.0020271903886286326, 'weight_decay': 3.154105850837904e-05}. 
[I 2024-04-21 02:42:34,693] Trial 203 finished with values: [5.109184204870127, 0.46332430555611576, 0.06232435451218232, 62.54557392721736] and parameters: {'dropout': 0.3121300419506455, 'num_heads': 2, 'bias': True, 'loss_fn': 'MAE', 'optimizer': 'RMSprop', 'lr': 0.0029779843699816494, 'weight_decay': 0.0004661851350818042}. 
[I 2024-04-21 02:43:21,508] Trial 204 finished with values: [6.151293012033391, 0.16574204030151413, -0.12893147391343263, 75.30286970787323] and parameters: {'dropout': 0.36021406582955795, 'num_heads': 1, 'bias': False, 'loss_fn': 'MAE', 'optimizer': 'Adam', 'lr': 0.002386297911470172, 'weight_decay': 2.6428916322772236e-05}. 
[I 2024-04-21 02:44:19,711] Trial 205 finished with values: [6.187946966508154, 0.40418958702406793, -0.12322842233099385, 74.9224603028976] and parameters: {'dropout': 0.5311365350726444, 'num_heads': 4, 'bias': True, 'loss_fn': 'MSE', 'optimizer': 'RMSprop', 'lr': 0.0003255565571680538, 'weight_decay': 1.195900659167233e-05}. 
[I 2024-04-21 02:45:44,268] Trial 206 finished with values: [11.85443950960084, 0.14827383161749624, -2.5951043126001627, 239.8034583086682] and parameters: {'dropout': 0.3635622435900131, 'num_heads': 8, 'bias': False, 'loss_fn': 'MAE', 'optimizer': 'RMSprop', 'lr': 0.00022343489096155288, 'weight_decay': 0.0015978339728337685}. 
[I 2024-04-21 02:46:41,973] Trial 207 finished with values: [5.9528417846680215, 0.20667099591826377, 0.007466242104461673, 66.20476262601275] and parameters: {'dropout': 0.626088838661456, 'num_heads': 2, 'bias': True, 'loss_fn': 'MSE', 'optimizer': 'RMSprop', 'lr': 0.07754675794637712, 'weight_decay': 0.00016773746443731933}. 
[I 2024-04-21 02:47:58,896] Trial 208 finished with values: [5.510360639789436, 0.2960368190478024, 0.0755058003259017, 61.6663348240404] and parameters: {'dropout': 0.30506597731706453, 'num_heads': 8, 'bias': True, 'loss_fn': 'MAE', 'optimizer': 'Adam', 'lr': 0.0015212116786850456, 'weight_decay': 0.0005023644237111914}. 
[I 2024-04-21 02:48:25,381] Trial 209 finished with values: [5.3240026435859855, 0.14619421867897545, -0.053975254078884705, 70.30308133592774] and parameters: {'dropout': 0.31961758477836855, 'num_heads': 4, 'bias': True, 'loss_fn': 'MAE', 'optimizer': 'RMSprop', 'lr': 0.005756458005859107, 'weight_decay': 0.00016123382618607942}. 
[I 2024-04-21 02:49:38,018] Trial 210 finished with values: [7.3723660230941475, 0.26321968006611846, -0.4257701245878147, 95.10283343685677] and parameters: {'dropout': 0.22424570365431884, 'num_heads': 4, 'bias': True, 'loss_fn': 'MSE', 'optimizer': 'Adam', 'lr': 0.0003139835604020809, 'weight_decay': 5.790794460670452e-05}. 
[I 2024-04-21 02:50:20,573] Trial 211 finished with values: [5.275557914052311, 0.2534036877301825, -0.009050938571700362, 67.3065045236736] and parameters: {'dropout': 0.44019580455912544, 'num_heads': 4, 'bias': True, 'loss_fn': 'MAE', 'optimizer': 'RMSprop', 'lr': 0.005756458005859107, 'weight_decay': 8.57593926099762e-05}. 
[I 2024-04-21 02:51:07,788] Trial 212 finished with values: [5.275344707554154, 0.2604443970756129, -0.042304025183039995, 69.52457790220917] and parameters: {'dropout': 0.6966193868431158, 'num_heads': 2, 'bias': True, 'loss_fn': 'MAE', 'optimizer': 'RMSprop', 'lr': 0.0004232772260006149, 'weight_decay': 0.0015978339728337685}. 
[I 2024-04-21 02:51:38,138] Trial 213 finished with values: [5.305466443641246, 0.20519566694869587, -0.06411346181065336, 70.97932799353069] and parameters: {'dropout': 0.6966193868431158, 'num_heads': 8, 'bias': False, 'loss_fn': 'MAE', 'optimizer': 'RMSprop', 'lr': 0.0015212116786850456, 'weight_decay': 0.003322500735489408}. 
[I 2024-04-21 02:52:37,988] Trial 214 finished with values: [6.100796543125642, 0.2415487306853267, -0.11347736029770239, 74.27203734032314] and parameters: {'dropout': 0.30506597731706453, 'num_heads': 2, 'bias': True, 'loss_fn': 'MSE', 'optimizer': 'Adam', 'lr': 0.002538135557249289, 'weight_decay': 0.00018005416692111982}. 
[I 2024-04-21 02:53:32,748] Trial 215 finished with values: [5.532729253416476, 0.31167949266771194, 0.08468859542814322, 61.05381684653983] and parameters: {'dropout': 0.36021406582955795, 'num_heads': 1, 'bias': True, 'loss_fn': 'MSE', 'optimizer': 'RMSprop', 'lr': 0.002386297911470172, 'weight_decay': 0.001168696876803426}. 
[I 2024-04-21 02:54:31,426] Trial 216 finished with values: [5.410583238316424, 0.31857487751502844, 0.09869707406399364, 60.1194123535335] and parameters: {'dropout': 0.5700265537579589, 'num_heads': 4, 'bias': False, 'loss_fn': 'MAE', 'optimizer': 'RMSprop', 'lr': 0.0015212116786850456, 'weight_decay': 0.0005023644237111914}. 
[I 2024-04-21 02:55:24,565] Trial 217 finished with values: [6.033658350647025, 0.3259577361408418, 0.013254699276434745, 65.81865643063874] and parameters: {'dropout': 0.5700265537579589, 'num_heads': 8, 'bias': False, 'loss_fn': 'MSE', 'optimizer': 'RMSprop', 'lr': 0.0015212116786850456, 'weight_decay': 0.00018005416692111982}. 
[I 2024-04-21 02:56:06,292] Trial 218 finished with values: [5.2709691918283745, 0.2085245985740176, -0.02327226262253257, 68.25510639794057] and parameters: {'dropout': 0.3121300419506455, 'num_heads': 1, 'bias': True, 'loss_fn': 'MAE', 'optimizer': 'RMSprop', 'lr': 0.0029779843699816494, 'weight_decay': 0.0004661851350818042}. 
[I 2024-04-21 02:57:05,138] Trial 219 finished with values: [5.205114847482966, 0.24100412918224476, 0.008529266094860377, 66.13385596879303] and parameters: {'dropout': 0.3635622435900131, 'num_heads': 4, 'bias': True, 'loss_fn': 'MSE', 'optimizer': 'RMSprop', 'lr': 0.041784184662472634, 'weight_decay': 0.00039689164480944707}. 
[I 2024-04-21 02:58:08,986] Trial 220 finished with values: [7.610981865422376, 0.15857449690290187, -0.5536443295328843, 103.63239861993787] and parameters: {'dropout': 0.3635622435900131, 'num_heads': 4, 'bias': True, 'loss_fn': 'MAE', 'optimizer': 'Adam', 'lr': 0.002386297911470172, 'weight_decay': 0.0005023644237111914}. 
[I 2024-04-21 02:59:49,496] Trial 221 finished with values: [5.812192407006681, 0.23096143839205802, -0.05697424843494203, 70.50312260190996] and parameters: {'dropout': 0.5311365350726444, 'num_heads': 2, 'bias': False, 'loss_fn': 'MAE', 'optimizer': 'Adam', 'lr': 0.0015212116786850456, 'weight_decay': 0.00019454966924148474}. 
[I 2024-04-21 03:00:23,907] Trial 222 finished with values: [5.353926488913464, 0.23842535411104113, -0.08959653192746608, 72.67911965768806] and parameters: {'dropout': 0.5549064113533091, 'num_heads': 8, 'bias': True, 'loss_fn': 'MAE', 'optimizer': 'RMSprop', 'lr': 0.0029779843699816494, 'weight_decay': 0.0004661851350818042}. 
[I 2024-04-21 03:01:21,093] Trial 223 finished with values: [5.774342733822368, 0.3351005417053998, -0.05994486323426429, 70.70127087251332] and parameters: {'dropout': 0.32012678495573904, 'num_heads': 8, 'bias': True, 'loss_fn': 'MAE', 'optimizer': 'RMSprop', 'lr': 0.00037630797216098966, 'weight_decay': 7.011871824250725e-05}. 
[I 2024-04-21 03:03:23,551] Trial 224 finished with values: [5.70747252897749, 0.3064676719430051, -0.16057185550416087, 77.41337117540225] and parameters: {'dropout': 0.626088838661456, 'num_heads': 8, 'bias': False, 'loss_fn': 'MSE', 'optimizer': 'RMSprop', 'lr': 0.0015212116786850456, 'weight_decay': 0.00018005416692111982}. 
[I 2024-04-21 03:03:57,506] Trial 225 finished with values: [5.327364523575891, 0.20190307429321766, 0.01034257512339809, 66.01290321242887] and parameters: {'dropout': 0.626088838661456, 'num_heads': 1, 'bias': False, 'loss_fn': 'MAE', 'optimizer': 'RMSprop', 'lr': 0.0008516195332639563, 'weight_decay': 0.00018005416692111982}. 
[I 2024-04-21 03:04:36,148] Trial 226 finished with values: [5.528474564006593, 0.22299294185702762, -0.06648509264053293, 71.13752236715241] and parameters: {'dropout': 0.5700265537579589, 'num_heads': 1, 'bias': True, 'loss_fn': 'MSE', 'optimizer': 'RMSprop', 'lr': 0.0015212116786850456, 'weight_decay': 0.00018005416692111982}. 
[I 2024-04-21 03:05:56,875] Trial 227 finished with values: [6.262480436340431, 0.2573038254374322, -0.03719635992038506, 69.1838824209752] and parameters: {'dropout': 0.5674159653119129, 'num_heads': 1, 'bias': False, 'loss_fn': 'MAE', 'optimizer': 'RMSprop', 'lr': 0.0008516195332639563, 'weight_decay': 7.443665639426088e-05}. 
[I 2024-04-21 03:07:27,574] Trial 228 finished with values: [5.243324543721643, 0.2828007612178912, -0.02381763978419338, 68.29148457172275] and parameters: {'dropout': 0.5713785805880798, 'num_heads': 8, 'bias': False, 'loss_fn': 'MAE', 'optimizer': 'Adam', 'lr': 0.0008516195332639563, 'weight_decay': 0.004560977733885657}. 
[I 2024-04-21 03:08:12,697] Trial 229 finished with values: [8.03101668106511, 0.03663469610540658, -15.111416671791009, 1074.6763098378872] and parameters: {'dropout': 0.626088838661456, 'num_heads': 1, 'bias': False, 'loss_fn': 'MSE', 'optimizer': 'RMSprop', 'lr': 0.0015212116786850456, 'weight_decay': 0.00016773746443731933}. 
[I 2024-04-21 03:09:11,980] Trial 230 finished with values: [6.393176611819351, 0.29032879678959317, -0.21893707103455595, 81.30649340834151] and parameters: {'dropout': 0.5311365350726444, 'num_heads': 4, 'bias': False, 'loss_fn': 'MSE', 'optimizer': 'Adam', 'lr': 0.0003255565571680538, 'weight_decay': 0.0004661851350818042}. 
[I 2024-04-21 03:10:04,363] Trial 231 finished with values: [6.243899624260514, 0.25657593494947634, -0.2320847087198914, 82.18347741530974] and parameters: {'dropout': 0.2989380257814256, 'num_heads': 8, 'bias': True, 'loss_fn': 'MSE', 'optimizer': 'RMSprop', 'lr': 0.002386297911470172, 'weight_decay': 0.00018005416692111982}. 
[I 2024-04-21 03:10:41,383] Trial 232 finished with values: [8.273260622636016, 0.22543654360607476, -0.8309563354889173, 122.12988082808951] and parameters: {'dropout': 0.5311365350726444, 'num_heads': 4, 'bias': True, 'loss_fn': 'MSE', 'optimizer': 'RMSprop', 'lr': 0.00024986006170935027, 'weight_decay': 1.195900659167233e-05}. 
[I 2024-04-21 03:11:39,831] Trial 233 finished with values: [10.072950941807743, 0.22079219629437122, -1.407284404283807, 160.57256621359738] and parameters: {'dropout': 0.5311365350726444, 'num_heads': 4, 'bias': True, 'loss_fn': 'MSE', 'optimizer': 'Adam', 'lr': 0.00010292402149222344, 'weight_decay': 0.0004661851350818042}. 
[I 2024-04-21 03:12:24,791] Trial 234 finished with values: [9.21704483300504, 0.009130189563050034, -1.3868516110202616, 159.209642064128] and parameters: {'dropout': 0.5700265537579589, 'num_heads': 8, 'bias': False, 'loss_fn': 'MSE', 'optimizer': 'RMSprop', 'lr': 0.026274383492988353, 'weight_decay': 0.00018005416692111982}. 
[I 2024-04-21 03:13:28,731] Trial 235 finished with values: [7.131069799189595, 0.18710565646566055, -1.7036965436926197, 180.34408045472247] and parameters: {'dropout': 0.3121300419506455, 'num_heads': 2, 'bias': False, 'loss_fn': 'MSE', 'optimizer': 'RMSprop', 'lr': 0.0029779843699816494, 'weight_decay': 1.195900659167233e-05}. 
