[I 2024-04-21 03:53:49,719] Trial 278 finished with values: [10.461577489088974, 0.2655647500873525, -2.7237051232321945, 248.38149011230038] and parameters: {'dropout': 0.32012678495573904, 'num_heads': 2, 'bias': True, 'loss_fn': 'MSE', 'optimizer': 'RMSprop', 'lr': 0.0008516195332639563, 'weight_decay': 7.011871824250725e-05}. 
[I 2024-04-21 03:54:23,824] Trial 279 finished with values: [5.150190487672629, 0.4141845993661384, 0.0360850308107612, 64.29580980917164] and parameters: {'dropout': 0.2544708119430037, 'num_heads': 2, 'bias': True, 'loss_fn': 'MAE', 'optimizer': 'RMSprop', 'lr': 0.0008516195332639563, 'weight_decay': 7.736699491287808e-05}. 
[I 2024-04-21 03:55:56,285] Trial 280 finished with values: [6.051678011058267, 0.3758916326789225, -0.13694312745422166, 75.83726928540943] and parameters: {'dropout': 0.5700265537579589, 'num_heads': 8, 'bias': True, 'loss_fn': 'MAE', 'optimizer': 'RMSprop', 'lr': 0.0005918943596419596, 'weight_decay': 2.6428916322772236e-05}. 
[I 2024-04-21 03:57:14,790] Trial 281 finished with values: [14.732908129922711, 0.0800676249147029, -4.029631423441845, 335.49040708834804] and parameters: {'dropout': 0.5700265537579589, 'num_heads': 8, 'bias': True, 'loss_fn': 'MSE', 'optimizer': 'RMSprop', 'lr': 0.0015212116786850456, 'weight_decay': 0.04817546421844506}. 
[I 2024-04-21 03:58:20,706] Trial 282 finished with values: [5.397202921010705, 0.41157207041654237, 0.055211041048825016, 63.02005172263715] and parameters: {'dropout': 0.20515227118227886, 'num_heads': 2, 'bias': True, 'loss_fn': 'MAE', 'optimizer': 'RMSprop', 'lr': 0.0003139835604020809, 'weight_decay': 0.00018005416692111982}. 
[I 2024-04-21 03:59:06,976] Trial 283 finished with values: [5.286575943361751, 0.21178491373210706, -0.035111830211443706, 69.04483849076172] and parameters: {'dropout': 0.5151547260096434, 'num_heads': 2, 'bias': True, 'loss_fn': 'MAE', 'optimizer': 'RMSprop', 'lr': 0.003020980899465405, 'weight_decay': 0.00728204958032191}. 
[I 2024-04-21 03:59:40,981] Trial 284 finished with values: [5.288424286522267, 0.1932966656192388, -0.03269392034410945, 68.88355717660535] and parameters: {'dropout': 0.6171920018847595, 'num_heads': 4, 'bias': False, 'loss_fn': 'MAE', 'optimizer': 'RMSprop', 'lr': 0.0015212116786850456, 'weight_decay': 0.002914526952378704}. 
[I 2024-04-21 04:01:44,128] Trial 285 finished with values: [6.576797182942182, 0.29765848201781325, -0.2547406622786703, 83.694692540733] and parameters: {'dropout': 0.5700265537579589, 'num_heads': 8, 'bias': True, 'loss_fn': 'MSE', 'optimizer': 'RMSprop', 'lr': 0.0015212116786850456, 'weight_decay': 0.012372557046162126}. 
[I 2024-04-21 04:02:34,245] Trial 286 finished with values: [5.278464505508664, 0.25393793118204216, -0.042411231194410925, 69.53172884138725] and parameters: {'dropout': 0.5700265537579589, 'num_heads': 8, 'bias': False, 'loss_fn': 'MAE', 'optimizer': 'Adam', 'lr': 0.0004232772260006149, 'weight_decay': 0.0015978339728337685}. 
[I 2024-04-21 04:03:45,175] Trial 287 finished with values: [5.277543936250354, 0.1360927139587948, -0.018035331940017274, 67.90578855361863] and parameters: {'dropout': 0.626088838661456, 'num_heads': 8, 'bias': False, 'loss_fn': 'MSE', 'optimizer': 'Adam', 'lr': 0.041784184662472634, 'weight_decay': 1.195900659167233e-05}. 
[I 2024-04-21 04:04:47,499] Trial 288 finished with values: [9.80909210785482, 0.12262099763291233, -1.4907264082975753, 166.13837999557228] and parameters: {'dropout': 0.20076383576528645, 'num_heads': 4, 'bias': False, 'loss_fn': 'MAE', 'optimizer': 'Adam', 'lr': 0.00018846401954415756, 'weight_decay': 7.011871824250725e-05}. 
[I 2024-04-21 04:05:52,989] Trial 289 finished with values: [5.238820793827839, 0.28126133099969364, 0.014727974466691274, 65.72038487717487] and parameters: {'dropout': 0.5700265537579589, 'num_heads': 2, 'bias': False, 'loss_fn': 'MSE', 'optimizer': 'RMSprop', 'lr': 0.09628096013644202, 'weight_decay': 2.6428916322772236e-05}. 
[I 2024-04-21 04:06:33,898] Trial 290 finished with values: [5.3201388216333925, 0.18298782374641545, -0.05665254215528437, 70.48166389815243] and parameters: {'dropout': 0.5311365350726444, 'num_heads': 4, 'bias': True, 'loss_fn': 'MAE', 'optimizer': 'SGD', 'lr': 0.0029779843699816494, 'weight_decay': 1.195900659167233e-05}. 
[I 2024-04-21 04:07:44,304] Trial 291 finished with values: [6.227215113015116, 0.2239069011186153, -0.09587104802071611, 73.09764733520251] and parameters: {'dropout': 0.3121300419506455, 'num_heads': 2, 'bias': False, 'loss_fn': 'MAE', 'optimizer': 'Adam', 'lr': 0.000912532641073504, 'weight_decay': 1.195900659167233e-05}. 
[I 2024-04-21 04:09:12,077] Trial 292 finished with values: [6.994281656244334, 0.30297341731985117, -0.42288712538443174, 94.91052937022668] and parameters: {'dropout': 0.3679845624065965, 'num_heads': 8, 'bias': False, 'loss_fn': 'MSE', 'optimizer': 'Adam', 'lr': 0.0015212116786850456, 'weight_decay': 0.04817546421844506}. 
[I 2024-04-21 04:10:18,719] Trial 293 finished with values: [5.140583872606397, 0.32175751772553696, 0.05562357808772633, 62.99253435457019] and parameters: {'dropout': 0.6684625967476364, 'num_heads': 8, 'bias': False, 'loss_fn': 'MAE', 'optimizer': 'Adam', 'lr': 0.002310234514292926, 'weight_decay': 2.6428916322772236e-05}. 
[I 2024-04-21 04:11:09,492] Trial 294 finished with values: [5.244954041277334, 0.30220944728370036, 0.0850195080306253, 61.03174405544028] and parameters: {'dropout': 0.626088838661456, 'num_heads': 4, 'bias': False, 'loss_fn': 'MAE', 'optimizer': 'RMSprop', 'lr': 0.0015212116786850456, 'weight_decay': 0.00045917349837111597}. 
Training finished at Epoch 80, with validation result for [5.476810586811646, 0.43297660903809615, 0.16525414100834668, 92.56356533809291]
Training finished at Epoch 37, with validation result for [5.07948327658447, 0.1452006870086921, -0.034625094792078315, 72.08570494780088]
Training finished at Epoch 63, with validation result for [5.49172076733258, 0.47187778749602083, 0.2204243080869187, 75.73195939377301]
Training finished at Epoch 73, with validation result for [5.145826035236105, 0.4358990548636555, 0.13753203835485062, 82.88198687141293]
Training finished at Epoch 36, with validation result for [5.190726374331537, 0.11542334867163172, -0.009365502360337175, 81.8829456949192]
Training finished at Epoch 44, with validation result for [6.534960949548521, 0.25490419590691066, 0.05382412091859112, 104.82461493665959]
Training finished at Epoch 38, with validation result for [5.3988648124194185, 0.0018688310983785445, -0.06620873264104299, 94.96330996732867]
Training finished at Epoch 46, with validation result for [4.968554025502343, 0.5268456360336738, 0.2622961488303618, 71.54219218991466]
Training finished at Epoch 30, with validation result for [5.76174947595601, 0.051622093567914355, -0.06668830951676075, 91.4542086552466]
Training finished at Epoch 41, with validation result for [5.3175452508260745, 0.031048765429527628, -0.08272664878275537, 102.38341854998373]
Training finished at Epoch 66, with validation result for [6.049410543618317, 0.4765840374093864, 0.025601884883103554, 82.05670350294137]
Training finished at Epoch 56, with validation result for [5.562069534638585, 0.5448568328398385, 0.2541213576064557, 71.26673766196022]
Training finished at Epoch 70, with validation result for [5.655160674183392, 0.10539668239494776, -0.02057208383064224, 109.75605746881395]
Training finished at Epoch 80, with validation result for [5.5183716391544, 0.5013624000272514, 0.18484490235972084, 87.4684035877367]
Training finished at Epoch 46, with validation result for [5.150761976241713, 0.5529249741048781, 0.23774870916198865, 79.37383827528448]
Training finished at Epoch 32, with validation result for [5.145197734183367, 0.16300327977351003, -0.01217466530532052, 84.88823521674469]
Training finished at Epoch 55, with validation result for [5.3936387476141645, 0.058376916591128244, -0.025791375632381763, 100.56441014607633]
Training finished at Epoch 109, with validation result for [4.44281192909426, 0.6084181416660065, 0.3455161724054956, 54.16683457563787]
Training finished at Epoch 37, with validation result for [5.403088450247533, 0.06754211859007178, -0.029219184713915825, 104.25062308387459]
Training finished at Epoch 70, with validation result for [5.751495460432185, 0.02404414579103657, -0.011864698207367796, 111.50808171106854]
Training finished at Epoch 46, with validation result for [5.451264146156144, 0.4474029525038131, 0.18544730222181194, 83.2716788840553]
Training finished at Epoch 49, with validation result for [5.077924115620662, 0.39837343212107484, 0.14998565820470922, 89.51618187556744]
Training finished at Epoch 58, with validation result for [5.707268781983777, 0.3809612991983598, 0.010057695866876992, 95.0125162515307]
Training finished at Epoch 53, with validation result for [5.204884903644177, 0.11468801907988184, -0.028220024281684353, 90.67361520481832]
Training finished at Epoch 31, with validation result for [5.94263857281351, -0.13308422556769334, -0.06426499715403367, 113.69293137509949]
Training finished at Epoch 52, with validation result for [5.9393510485223215, 0.3849969131087266, 0.13636570334188214, 77.69146076629686]
Training finished at Epoch 68, with validation result for [5.377397621440125, 0.03271923695475164, -0.021203691808391323, 102.75967304620701]
Training finished at Epoch 73, with validation result for [5.49740512429122, 0.10024538886268197, -0.003993609918227836, 90.32644802050362]
Training finished at Epoch 34, with validation result for [5.250086238677937, 0.5218232040335509, 0.23297383209589528, 79.27532121307746]
Training finished at Epoch 69, with validation result for [5.527915506648395, 0.4668666054464088, 0.2176644198518085, 82.53606806738534]
Training finished at Epoch 35, with validation result for [5.390917695333353, 0.053349346163098874, -0.056539360384553206, 101.02428936202563]
Training finished at Epoch 44, with validation result for [5.591760698253953, 0.30110500817617264, -0.09299083840067035, 81.36796385352578]
Training finished at Epoch 42, with validation result for [6.259047326507921, 0.44070638460288064, 0.17965121855710564, 89.50677952525992]
Training finished at Epoch 54, with validation result for [4.608937622221654, 0.4347937919413047, 0.1853978587045102, 75.5176051981936]
Training finished at Epoch 81, with validation result for [4.571524727666085, 0.6229705254495895, 0.3740733964637869, 63.40245980862482]
Training finished at Epoch 47, with validation result for [6.004637971390775, 0.5994894560044032, 0.24439889552312144, 76.70449381068156]
Training finished at Epoch 87, with validation result for [5.034723657768837, 0.39068523561701324, 0.11006539576288443, 94.41957199163032]
Training finished at Epoch 76, with validation result for [4.629562675945967, 0.5359817819917234, 0.2620453841276589, 66.80219742700164]
Training finished at Epoch 45, with validation result for [6.451905825557918, 0.42951526382947386, -0.01929576787968923, 96.39941398376527]
Training finished at Epoch 30, with validation result for [5.347310316353081, 0.15243753003422522, -0.029748100026274704, 88.85820179681987]
Training finished at Epoch 30, with validation result for [5.1709106158042655, 0.5385788144831561, 0.2102909532333378, 73.69376022015989]
Training finished at Epoch 56, with validation result for [5.0274170917960275, 0.5578702498066104, 0.23427487170513328, 68.45825509650136]
Training finished at Epoch 34, with validation result for [7.4184173749579605, 0.36301019767018095, -0.18905205409546788, 127.07583903138213]
Training finished at Epoch 101, with validation result for [4.699369225546957, 0.3997512827672375, 0.1378349491728571, 89.88889267921677]
Training finished at Epoch 86, with validation result for [5.568693637885166, 0.44066700358589056, 0.17009091707353674, 86.34723072316388]
Training finished at Epoch 67, with validation result for [5.433412797496454, 0.4281027675382931, 0.14356340153078295, 79.16882412272152]
Training finished at Epoch 43, with validation result for [5.675882218068693, 0.020560930602972826, -0.02070684913130605, 110.44462011580595]
Training finished at Epoch 36, with validation result for [5.61299982016583, -0.009010921193651577, -0.024388060857369, 103.4613194023719]
Training finished at Epoch 137, with validation result for [11.398656573728516, 0.44832845510136593, -0.924534816570542, 184.93955261535845]
Training finished at Epoch 38, with validation result for [5.581097243384701, 0.007425941918962853, -0.03197760860679777, 107.75027049700651]
Training finished at Epoch 61, with validation result for [5.497351038198528, 0.35266419786166386, 0.12202783511777038, 92.37237622399921]
Training finished at Epoch 58, with validation result for [5.174184989469222, 0.4092839649862784, 0.16633862382488374, 87.66867944322662]
Training finished at Epoch 73, with validation result for [6.84954157083649, 0.23707115535433373, -0.30646048110890356, 112.3224397295633]
Training finished at Epoch 43, with validation result for [5.1585994559529444, 0.07619511090700076, -0.030454638926375788, 84.8077842720154]
Training finished at Epoch 56, with validation result for [4.67975599015578, 0.36746701112478936, 0.03462899090033955, 73.99791310069592]
Training finished at Epoch 86, with validation result for [5.082298845333843, 0.498581110860001, 0.15426538682863378, 60.27044511074706]
Training finished at Epoch 57, with validation result for [4.8067159508934685, 0.5324865518622445, 0.21756460386063514, 73.05464867878872]
Training finished at Epoch 43, with validation result for [88.03618472923135, 0.26588721899288226, -87.69606404421059, 7833.491625876704]
[I 2024-04-21 04:12:19,680] Trial 295 finished with values: [12.149357174224722, 0.08525732885974358, -2.574536636963399, 238.431537129697] and parameters: {'dropout': 0.36021406582955795, 'num_heads': 8, 'bias': False, 'loss_fn': 'MAE', 'optimizer': 'Adam', 'lr': 0.0015212116786850456, 'weight_decay': 0.000530330938468265}. 
[I 2024-04-21 04:13:24,381] Trial 296 finished with values: [4.962412069218309, 0.4692788258564766, 0.1587347455859458, 56.11473265361371] and parameters: {'dropout': 0.5700265537579589, 'num_heads': 4, 'bias': False, 'loss_fn': 'MAE', 'optimizer': 'RMSprop', 'lr': 0.002310234514292926, 'weight_decay': 0.00016123382618607942}. 
[I 2024-04-21 04:14:15,817] Trial 297 finished with values: [5.326895924485094, 0.28252853343361795, 0.0034676110945541794, 66.4714824375396] and parameters: {'dropout': 0.5700265537579589, 'num_heads': 1, 'bias': False, 'loss_fn': 'MSE', 'optimizer': 'RMSprop', 'lr': 0.0015212116786850456, 'weight_decay': 0.00018005416692111982}. 
[I 2024-04-21 04:15:15,680] Trial 298 finished with values: [5.130657088294329, 0.3356398242365002, 0.048262879695098904, 63.48351341293372] and parameters: {'dropout': 0.5700265537579589, 'num_heads': 2, 'bias': True, 'loss_fn': 'MSE', 'optimizer': 'RMSprop', 'lr': 0.0029779843699816494, 'weight_decay': 0.0004661851350818042}. 
[I 2024-04-21 04:16:09,871] Trial 299 finished with values: [5.115524210328677, 0.30101387013715414, 0.04615937633460632, 63.62382293848548] and parameters: {'dropout': 0.5700265537579589, 'num_heads': 2, 'bias': True, 'loss_fn': 'MSE', 'optimizer': 'RMSprop', 'lr': 0.0015212116786850456, 'weight_decay': 0.00016773746443731933}. 
[I 2024-04-21 04:16:09,955] A new study created in RDB with name: ESM3B-Attention-BioInf-Combnation
[I 2024-04-21 04:16:59,951] Trial 0 finished with values: [5.510499837085355, 0.21436165069639768, -0.12652012431746518, 75.14202598206602] and parameters: {'dropout': 0.2209284709748457, 'num_heads': 2, 'bias': False, 'loss_fn': 'MAE', 'optimizer': 'SGD', 'lr': 0.0010162881905153198, 'weight_decay': 0.03733201506541421}. 
[I 2024-04-21 04:18:08,626] Trial 1 finished with values: [5.539123848412125, 0.17494374313707844, -0.1461799834193791, 76.45339327284995] and parameters: {'dropout': 0.6795412755061707, 'num_heads': 1, 'bias': True, 'loss_fn': 'MAE', 'optimizer': 'SGD', 'lr': 0.0001430465347402703, 'weight_decay': 0.0001458934853754392}. 
[I 2024-04-21 04:19:31,241] Trial 2 finished with values: [5.315728856142868, 0.24324325316499004, -0.05771922205049518, 70.55281441439291] and parameters: {'dropout': 0.40330429094156395, 'num_heads': 4, 'bias': True, 'loss_fn': 'MAE', 'optimizer': 'Adam', 'lr': 0.002529114770389958, 'weight_decay': 0.0037267203012420346}. 
[I 2024-04-21 04:22:07,088] Trial 3 finished with values: [5.226081255997876, 0.32986907647597524, -0.023351403764649392, 68.26038533227012] and parameters: {'dropout': 0.6213902221456433, 'num_heads': 2, 'bias': True, 'loss_fn': 'MAE', 'optimizer': 'Adam', 'lr': 0.0001176103965336431, 'weight_decay': 0.021393723281926534}. 
[W 2024-04-21 05:01:34,348] Trial 4 failed with parameters: {'dropout': 0.675619715154264, 'num_heads': 1, 'bias': False, 'loss_fn': 'MSE', 'optimizer': 'SGD', 'lr': 0.05427402403255537, 'weight_decay': 0.00092683928187544} because of the following error: The value nan is not acceptable.
[W 2024-04-21 05:01:34,348] Trial 4 failed with value [nan, nan, nan, nan].
[I 2024-04-21 05:03:06,538] Trial 5 finished with values: [10.594519597992155, 0.10388639101124614, -1.774911026510512, 185.0942845591042] and parameters: {'dropout': 0.6365573126579738, 'num_heads': 2, 'bias': False, 'loss_fn': 'MSE', 'optimizer': 'Adam', 'lr': 0.0005646183896308484, 'weight_decay': 0.00024171979660503405}. 
[I 2024-04-21 05:05:33,804] Trial 6 finished with values: [5.356967936668672, 0.17314477829354394, -0.08473452907776902, 72.35481054276819] and parameters: {'dropout': 0.6391309603013053, 'num_heads': 4, 'bias': True, 'loss_fn': 'MAE', 'optimizer': 'Adam', 'lr': 0.00638788575113871, 'weight_decay': 0.03310572876438284}. 
[I 2024-04-21 05:07:05,337] Trial 7 finished with values: [5.336177249114894, 0.19977954231405365, -0.07684722914244779, 71.82870569663653] and parameters: {'dropout': 0.4764075035487058, 'num_heads': 2, 'bias': False, 'loss_fn': 'MAE', 'optimizer': 'SGD', 'lr': 0.0005162881586727135, 'weight_decay': 1.8515060707525556e-05}. 
[I 2024-04-21 05:08:44,895] Trial 8 finished with values: [6.92929698758854, 0.21848082138815744, -0.37346028073735127, 91.61362133946005] and parameters: {'dropout': 0.37061759286604334, 'num_heads': 2, 'bias': True, 'loss_fn': 'MSE', 'optimizer': 'RMSprop', 'lr': 0.0009469677419825427, 'weight_decay': 0.00016110486713333613}. 
[I 2024-04-21 05:10:23,590] Trial 9 finished with values: [5.3512194594726665, 0.030647348139501738, -0.07246900096203879, 71.53666569789524] and parameters: {'dropout': 0.40448917205749835, 'num_heads': 2, 'bias': True, 'loss_fn': 'MAE', 'optimizer': 'RMSprop', 'lr': 0.04135750773706829, 'weight_decay': 0.004558433147858236}. 
[I 2024-04-21 05:11:28,392] Trial 10 finished with values: [5.312115045752755, 0.17739359700793803, -0.0189826667876567, 67.96897842319879] and parameters: {'dropout': 0.5663635226551282, 'num_heads': 1, 'bias': False, 'loss_fn': 'MSE', 'optimizer': 'SGD', 'lr': 0.007433413186728296, 'weight_decay': 0.0001961412911287214}. 
[I 2024-04-21 05:12:45,475] Trial 11 finished with values: [5.354381632852236, 0.18124983231464079, -0.055305630870767786, 70.3918211687134] and parameters: {'dropout': 0.5054921648556425, 'num_heads': 1, 'bias': True, 'loss_fn': 'MSE', 'optimizer': 'SGD', 'lr': 0.004213421808896818, 'weight_decay': 0.028155367035976854}. 
[I 2024-04-21 05:13:56,039] Trial 12 finished with values: [5.326172628719734, 0.1946398482844196, -0.05147888381873944, 70.13656649531417] and parameters: {'dropout': 0.5519832871533943, 'num_heads': 8, 'bias': False, 'loss_fn': 'MAE', 'optimizer': 'Adam', 'lr': 0.033206590722584896, 'weight_decay': 0.0006850267097265221}. 
[I 2024-04-21 05:15:22,505] Trial 13 finished with values: [5.29713261498073, 0.12073893846269011, -0.04904217490935947, 69.97403123275923] and parameters: {'dropout': 0.5968208698337486, 'num_heads': 8, 'bias': True, 'loss_fn': 'MAE', 'optimizer': 'RMSprop', 'lr': 0.00846902563312967, 'weight_decay': 0.0001233670278662728}. 
[I 2024-04-21 05:17:41,809] Trial 14 finished with values: [18.84380109851091, 0.10436937860295781, -14.140781679582181, 1009.9322557999284] and parameters: {'dropout': 0.25880213147896197, 'num_heads': 1, 'bias': True, 'loss_fn': 'MSE', 'optimizer': 'Adam', 'lr': 0.00019611105741972358, 'weight_decay': 0.07722554434089156}. 
[I 2024-04-21 05:19:08,481] Trial 15 finished with values: [5.364571444448307, 0.03918318477297525, -0.04893510754832375, 69.96688954194421] and parameters: {'dropout': 0.47253235109455244, 'num_heads': 1, 'bias': True, 'loss_fn': 'MAE', 'optimizer': 'RMSprop', 'lr': 0.049451172069310996, 'weight_decay': 0.005519560907196492}. 
[I 2024-04-21 05:20:42,846] Trial 16 finished with values: [5.326672300268741, 0.13857508792489068, -0.06309496529944081, 70.9113914430367] and parameters: {'dropout': 0.3301841780187851, 'num_heads': 1, 'bias': False, 'loss_fn': 'MAE', 'optimizer': 'SGD', 'lr': 0.0004438407308662206, 'weight_decay': 6.594281231337641e-05}. 
[I 2024-04-21 05:22:24,113] Trial 17 finished with values: [12.21356850261445, 0.11706822973008328, -2.936787550784156, 262.59468077068493] and parameters: {'dropout': 0.28197020552685664, 'num_heads': 1, 'bias': True, 'loss_fn': 'MAE', 'optimizer': 'RMSprop', 'lr': 0.00037637109746118026, 'weight_decay': 0.0014883748552027257}. 
[I 2024-04-21 05:23:53,800] Trial 18 finished with values: [5.225784218506412, 0.23092643273561933, -0.008333604994002819, 67.2586563786031] and parameters: {'dropout': 0.5310152851853307, 'num_heads': 8, 'bias': True, 'loss_fn': 'MSE', 'optimizer': 'Adam', 'lr': 0.05944231950941618, 'weight_decay': 0.000104860869337513}. 
