nohup: ignoring input
NVIDIA A100-PCIE-40GB
===正在从训练集版本为ProThermDB_Common、训练集版本为ProThermDBTest_Common的原始数据集中进行数据清洗和生物特征提取工作===
1.预处理训练集数据...
删除数据缺失行及非法行共计0行
丢弃pH/Tm的缺失值
前一数据集采用了后一数据集中的0条数据，现已删除
获取[序列]信息.....该数据集已经经过处理，直接使用缓存文件
删除了0个非法长度的蛋白质，当前蛋白质长度被限制在(0, 5000)
不针对突变位点上下文进行截取
2.预处理测试集数据...
删除数据缺失行及非法行共计0行
丢弃pH/Tm的缺失值
获取[序列]信息.....该数据集已经经过处理，直接使用缓存文件
删除了0个非法长度的蛋白质，当前蛋白质长度被限制在(0, 5000)
不针对突变位点上下文进行截取
3.为训练集数据提取生物特征...
获取[neighbor特征].....该数据集已经经过处理，直接使用缓存文件
获取[aaindex特征].....该数据集已经经过处理，直接使用缓存文件
4.为测试集数据提取生物特征...
获取[neighbor特征].....该数据集已经经过处理，直接使用缓存文件
获取[aaindex特征].....该数据集已经经过处理，直接使用缓存文件
6.从全数据集中提取生物特征集、标签集和基本信息集...
7.数据清洗和生物特征提取工作完成==>
Acting on ESM3B...
Loading checkpoint shards:   0%|          | 0/2 [00:00<?, ?it/s]/public/home/yyang/anaconda3/envs/Pon-DT/lib/python3.11/site-packages/torch/_utils.py:776: UserWarning: TypedStorage is deprecated. It will be removed in the future and UntypedStorage will be the only storage class. This should only matter to you if you are using storages directly.  To access UntypedStorage directly, use tensor.untyped_storage() instead of tensor.storage()
  return self.fget.__get__(instance, owner)()
Loading checkpoint shards:  50%|█████     | 1/2 [00:21<00:21, 21.16s/it]Loading checkpoint shards: 100%|██████████| 2/2 [00:23<00:00, 10.08s/it]Loading checkpoint shards: 100%|██████████| 2/2 [00:23<00:00, 11.74s/it]
Some weights of EsmModel were not initialized from the model checkpoint at DeepLearning/EmbeddingModels/ESM-2/esm2_t36_3B_UR50D and are newly initialized: ['esm.pooler.dense.bias', 'esm.pooler.dense.weight']
You should probably TRAIN this model on a down-stream task to be able to use it for predictions and inference.
  0%|          | 0/4 [00:00<?, ?it/s] 25%|██▌       | 1/4 [11:10<33:30, 670.22s/it] 50%|█████     | 2/4 [12:16<10:30, 315.12s/it] 75%|███████▌  | 3/4 [22:43<07:37, 457.57s/it]100%|██████████| 4/4 [23:52<00:00, 303.98s/it]100%|██████████| 4/4 [23:52<00:00, 358.09s/it]
[I 2024-04-20 20:58:35,401] A new study created in RDB with name: ESM3B-Attention-BioInf-Subtration(MultipleRegression)
/public/home/yyang/anaconda3/envs/Pon-DT/lib/python3.11/site-packages/torch/nn/modules/lazy.py:180: UserWarning: Lazy modules are a new feature under heavy development so changes to the API or functionality can happen at any moment.
  warnings.warn('Lazy modules are a new feature under heavy development '
[I 2024-04-20 20:59:48,259] Trial 0 finished with values: [5.694856471047428, 0.24287567918289632, 0.011368314253321188, 65.94448355911979] and parameters: {'dropout': 0.618246431676777, 'num_heads': 1, 'bias': False, 'loss_fn': 'MAE', 'optimizer': 'Adam', 'lr': 0.0006704846344950074, 'weight_decay': 3.154105850837904e-05}. 
[I 2024-04-20 21:00:52,985] Trial 1 finished with values: [5.71646927216431, 0.290768252438271, 0.06836407949807877, 62.14270746969204] and parameters: {'dropout': 0.6684625967476364, 'num_heads': 8, 'bias': False, 'loss_fn': 'MAE', 'optimizer': 'Adam', 'lr': 0.002386297911470172, 'weight_decay': 2.6428916322772236e-05}. 
[I 2024-04-20 21:01:31,068] Trial 2 finished with values: [5.026845710493622, 0.4670537784469666, 0.057948842700850656, 62.83743273658495] and parameters: {'dropout': 0.5700265537579589, 'num_heads': 4, 'bias': False, 'loss_fn': 'MAE', 'optimizer': 'RMSprop', 'lr': 0.0015212116786850456, 'weight_decay': 0.00018005416692111982}. 
[I 2024-04-20 21:02:24,901] Trial 3 finished with values: [5.26685560605514, 0.2506355701057705, -0.03960045991745087, 69.34424257836915] and parameters: {'dropout': 0.3034912033003917, 'num_heads': 4, 'bias': True, 'loss_fn': 'MAE', 'optimizer': 'Adam', 'lr': 0.0006516845044855386, 'weight_decay': 0.002363434648819946}. 
[I 2024-04-20 21:03:56,042] Trial 4 finished with values: [6.063027263427366, 0.176952717087269, -0.23330137551070051, 82.2646324747117] and parameters: {'dropout': 0.36446518192449484, 'num_heads': 2, 'bias': False, 'loss_fn': 'MSE', 'optimizer': 'RMSprop', 'lr': 0.03769113029435261, 'weight_decay': 0.00013994851529444365}. 
[I 2024-04-20 21:04:57,180] Trial 5 finished with values: [8.257554711440509, 0.2203237471157971, -0.7735088146694766, 118.29797138516224] and parameters: {'dropout': 0.5900448567966543, 'num_heads': 2, 'bias': False, 'loss_fn': 'MSE', 'optimizer': 'RMSprop', 'lr': 0.0014232395981478025, 'weight_decay': 0.005445122043811764}. 
[I 2024-04-20 21:06:45,554] Trial 6 finished with values: [5.2346081200155465, 0.2782121341832308, 0.052442285159971624, 63.20473544239251] and parameters: {'dropout': 0.5311365350726444, 'num_heads': 4, 'bias': True, 'loss_fn': 'MSE', 'optimizer': 'Adam', 'lr': 0.041784184662472634, 'weight_decay': 1.195900659167233e-05}. 
[I 2024-04-20 21:07:31,400] Trial 7 finished with values: [5.244308581299645, 0.2663994645007801, -0.004768303724293155, 67.02084086615966] and parameters: {'dropout': 0.31961758477836855, 'num_heads': 1, 'bias': True, 'loss_fn': 'MAE', 'optimizer': 'RMSprop', 'lr': 0.002310234514292926, 'weight_decay': 2.0032993856203536e-05}. 
[I 2024-04-20 21:08:28,786] Trial 8 finished with values: [5.731996301086197, 0.34137177639265354, 0.07071628125701712, 61.98580906914878] and parameters: {'dropout': 0.3121300419506455, 'num_heads': 4, 'bias': True, 'loss_fn': 'MSE', 'optimizer': 'Adam', 'lr': 0.000912532641073504, 'weight_decay': 0.0004661851350818042}. 
[W 2024-04-20 21:29:48,916] Trial 9 failed with parameters: {'dropout': 0.5913396094985673, 'num_heads': 2, 'bias': True, 'loss_fn': 'MSE', 'optimizer': 'SGD', 'lr': 0.07364404889542785, 'weight_decay': 0.025766596263943207} because of the following error: The value nan is not acceptable.
[W 2024-04-20 21:29:48,916] Trial 9 failed with value [nan, nan, nan, nan].
[I 2024-04-20 21:31:43,332] Trial 10 finished with values: [5.321742784992922, 0.09408101834180589, -0.058870927443331, 70.62963636784411] and parameters: {'dropout': 0.3236943797755498, 'num_heads': 4, 'bias': False, 'loss_fn': 'MAE', 'optimizer': 'SGD', 'lr': 0.02276120970815699, 'weight_decay': 5.790794460670452e-05}. 
[I 2024-04-20 21:32:20,893] Trial 11 finished with values: [5.435472163299238, 0.2498159433657281, -0.0233317664891739, 68.25907547137004] and parameters: {'dropout': 0.2441877682802886, 'num_heads': 4, 'bias': True, 'loss_fn': 'MAE', 'optimizer': 'RMSprop', 'lr': 0.0009770232703395405, 'weight_decay': 0.00014950281068972876}. 
[I 2024-04-20 21:33:22,446] Trial 12 finished with values: [5.35484246417293, -0.06315096811916455, -0.08689322683087441, 72.49880168784387] and parameters: {'dropout': 0.3635622435900131, 'num_heads': 4, 'bias': True, 'loss_fn': 'MAE', 'optimizer': 'RMSprop', 'lr': 0.09605454481221487, 'weight_decay': 0.0005023644237111914}. 
[I 2024-04-20 21:34:36,748] Trial 13 finished with values: [5.266963349389755, 0.22842556077228182, -0.018885323452848546, 67.96248535198289] and parameters: {'dropout': 0.626088838661456, 'num_heads': 2, 'bias': False, 'loss_fn': 'MSE', 'optimizer': 'RMSprop', 'lr': 0.07754675794637712, 'weight_decay': 0.00016773746443731933}. 
[I 2024-04-20 21:35:17,300] Trial 14 finished with values: [5.400143981882463, 0.23006277230957242, -0.009242523112634515, 67.31928374549295] and parameters: {'dropout': 0.4342255747374618, 'num_heads': 8, 'bias': True, 'loss_fn': 'MSE', 'optimizer': 'RMSprop', 'lr': 0.0029779843699816494, 'weight_decay': 0.001168696876803426}. 
[I 2024-04-20 21:35:58,167] Trial 15 finished with values: [5.32659835902314, 0.25135088203356565, -0.07227005340071191, 71.52339534213364] and parameters: {'dropout': 0.2880184170750688, 'num_heads': 8, 'bias': True, 'loss_fn': 'MAE', 'optimizer': 'RMSprop', 'lr': 0.0003518112566568513, 'weight_decay': 0.09922256221763169}. 
[I 2024-04-20 21:37:36,807] Trial 16 finished with values: [5.3542181847605335, 0.139836928630328, -0.02205620264188579, 68.17399181446442] and parameters: {'dropout': 0.5458344966975266, 'num_heads': 8, 'bias': True, 'loss_fn': 'MSE', 'optimizer': 'Adam', 'lr': 0.0518227826558114, 'weight_decay': 0.05307017177396677}. 
[I 2024-04-20 21:38:16,253] Trial 17 finished with values: [5.341242062651939, 0.25447278543567897, -0.07455774354514455, 71.67599063853461] and parameters: {'dropout': 0.21991699235528095, 'num_heads': 8, 'bias': True, 'loss_fn': 'MAE', 'optimizer': 'RMSprop', 'lr': 0.0003255565571680538, 'weight_decay': 0.005489225711772834}. 
[I 2024-04-20 21:39:24,122] Trial 18 finished with values: [5.322635593412685, 0.19990303709670762, -0.0580922166040998, 70.57769418869354] and parameters: {'dropout': 0.4813333673165718, 'num_heads': 8, 'bias': False, 'loss_fn': 'MAE', 'optimizer': 'SGD', 'lr': 0.0008016683569920038, 'weight_decay': 0.003868910808916872}. 
[I 2024-04-20 21:40:20,119] Trial 19 finished with values: [5.380252481828276, 0.10920176233776398, -0.10038995252630745, 73.39907083615891] and parameters: {'dropout': 0.22674733308400608, 'num_heads': 1, 'bias': False, 'loss_fn': 'MAE', 'optimizer': 'Adam', 'lr': 0.07970048635392343, 'weight_decay': 2.526857187114771e-05}. 
[I 2024-04-20 21:41:11,583] Trial 20 finished with values: [8.042702527085263, 0.32093745536182283, -0.7007022360417536, 113.44157006146254] and parameters: {'dropout': 0.6966193868431158, 'num_heads': 8, 'bias': False, 'loss_fn': 'MSE', 'optimizer': 'RMSprop', 'lr': 0.0004232772260006149, 'weight_decay': 0.0015978339728337685}. 
[I 2024-04-20 21:42:02,707] Trial 21 finished with values: [5.363536241750479, 0.21895700921008762, -0.09140422734505904, 72.79969797058658] and parameters: {'dropout': 0.4151589281874478, 'num_heads': 1, 'bias': True, 'loss_fn': 'MAE', 'optimizer': 'RMSprop', 'lr': 0.06557042556579774, 'weight_decay': 7.736699491287808e-05}. 
[I 2024-04-20 21:43:00,133] Trial 22 finished with values: [5.365598208665731, 0.16585480277993542, -0.04977938762253031, 70.02320537146444] and parameters: {'dropout': 0.2669149557386009, 'num_heads': 2, 'bias': False, 'loss_fn': 'MAE', 'optimizer': 'SGD', 'lr': 0.012911161333108804, 'weight_decay': 3.844954637398965e-05}. 
[I 2024-04-20 21:44:19,366] Trial 23 finished with values: [6.487379555144209, 0.26326176108670174, -0.04664744175694935, 69.81429586995998] and parameters: {'dropout': 0.5796533080555868, 'num_heads': 1, 'bias': True, 'loss_fn': 'MSE', 'optimizer': 'RMSprop', 'lr': 0.007998144896696134, 'weight_decay': 0.00045917349837111597}. 
[I 2024-04-20 21:45:53,952] Trial 24 finished with values: [5.314030953416592, 0.19906005053579512, -0.03660234566902254, 69.144260018014] and parameters: {'dropout': 0.6709270573722722, 'num_heads': 4, 'bias': False, 'loss_fn': 'MAE', 'optimizer': 'SGD', 'lr': 0.0020271903886286326, 'weight_decay': 0.0002076432622487999}. 
[I 2024-04-20 21:47:07,827] Trial 25 finished with values: [5.310457955990139, 0.17779203788672346, -0.024758540549835617, 68.35424527013572] and parameters: {'dropout': 0.5111302435360718, 'num_heads': 4, 'bias': False, 'loss_fn': 'MSE', 'optimizer': 'SGD', 'lr': 0.005773271496267822, 'weight_decay': 0.021335126211440684}. 
[W 2024-04-20 22:08:23,597] Trial 26 failed with parameters: {'dropout': 0.2045542114306299, 'num_heads': 1, 'bias': False, 'loss_fn': 'MSE', 'optimizer': 'SGD', 'lr': 0.06078059465719375, 'weight_decay': 3.563072993447151e-05} because of the following error: The value nan is not acceptable.
[W 2024-04-20 22:08:23,598] Trial 26 failed with value [nan, nan, nan, nan].
[I 2024-04-20 22:09:53,209] Trial 27 finished with values: [5.3246468700503655, 0.25461584161964806, 0.013787836432475165, 65.78309469928] and parameters: {'dropout': 0.22424570365431884, 'num_heads': 4, 'bias': True, 'loss_fn': 'MSE', 'optimizer': 'Adam', 'lr': 0.034134792005353944, 'weight_decay': 8.57593926099762e-05}. 
[I 2024-04-20 22:10:51,738] Trial 28 finished with values: [5.748681963039705, 0.24012762308396518, 0.020733963346831752, 65.31976871174867] and parameters: {'dropout': 0.23484747623504593, 'num_heads': 8, 'bias': False, 'loss_fn': 'MSE', 'optimizer': 'RMSprop', 'lr': 0.030192325832367823, 'weight_decay': 0.009477483128562624}. 
[I 2024-04-20 22:11:30,948] Trial 29 finished with values: [5.562341145089882, 0.032173390731764076, -0.13654524299306448, 75.81072928503771] and parameters: {'dropout': 0.3839189566796153, 'num_heads': 1, 'bias': True, 'loss_fn': 'MSE', 'optimizer': 'Adam', 'lr': 0.030070644245821888, 'weight_decay': 2.3041012373108646e-05}. 
[I 2024-04-20 22:13:34,404] Trial 30 finished with values: [7.975731336245707, 0.17112356782954358, -1.084550001085745, 139.0452837559418] and parameters: {'dropout': 0.2984197412044785, 'num_heads': 1, 'bias': False, 'loss_fn': 'MAE', 'optimizer': 'Adam', 'lr': 0.00011410466266404346, 'weight_decay': 0.00012573034501329558}. 
[I 2024-04-20 22:16:04,267] Trial 31 finished with values: [5.107273154676641, 0.36697461611815235, 0.06272640297160725, 62.51875617657801] and parameters: {'dropout': 0.30506597731706453, 'num_heads': 2, 'bias': True, 'loss_fn': 'MAE', 'optimizer': 'Adam', 'lr': 0.0003139835604020809, 'weight_decay': 0.005696155225234225}. 
[I 2024-04-20 22:17:14,511] Trial 32 finished with values: [8.176001665039154, 0.18057683451349263, -0.8719594965811748, 124.86490573322203] and parameters: {'dropout': 0.2692261428382598, 'num_heads': 8, 'bias': False, 'loss_fn': 'MSE', 'optimizer': 'RMSprop', 'lr': 0.0025262401915415785, 'weight_decay': 0.040519253744486464}. 
[I 2024-04-20 22:19:15,409] Trial 33 finished with values: [5.274444163271163, 0.27772918000620106, -0.044389865870352097, 69.66370927832678] and parameters: {'dropout': 0.24104348656224273, 'num_heads': 2, 'bias': False, 'loss_fn': 'MAE', 'optimizer': 'Adam', 'lr': 0.0006568544474822875, 'weight_decay': 0.033819847535106105}. 
[I 2024-04-20 22:20:50,295] Trial 34 finished with values: [5.373835040834882, -0.013303355850220832, -0.09774380014132444, 73.22256511116322] and parameters: {'dropout': 0.5261639393894102, 'num_heads': 1, 'bias': False, 'loss_fn': 'MAE', 'optimizer': 'Adam', 'lr': 0.054002842887268705, 'weight_decay': 5.77711566214677e-05}. 
[I 2024-04-20 22:22:37,902] Trial 35 finished with values: [14.329145804140923, 0.07802474575387346, -4.903710363936827, 393.7939038828192] and parameters: {'dropout': 0.23173589740492467, 'num_heads': 1, 'bias': False, 'loss_fn': 'MAE', 'optimizer': 'Adam', 'lr': 0.0003244770231345193, 'weight_decay': 0.0006222389520874092}. 
[I 2024-04-20 22:23:59,935] Trial 36 finished with values: [14.107609233143794, 0.10568593944043346, -3.9148330323183016, 327.83303506072343] and parameters: {'dropout': 0.22594785591239713, 'num_heads': 2, 'bias': True, 'loss_fn': 'MSE', 'optimizer': 'RMSprop', 'lr': 0.001488238193045537, 'weight_decay': 0.038293401108527955}. 
[I 2024-04-20 22:25:46,127] Trial 37 finished with values: [5.305463900654701, 0.18007633323123606, -0.060921344441313474, 70.7664048853438] and parameters: {'dropout': 0.5844570198627566, 'num_heads': 2, 'bias': False, 'loss_fn': 'MAE', 'optimizer': 'Adam', 'lr': 0.007534521011429535, 'weight_decay': 0.001090424784471003}. 
[I 2024-04-20 22:26:28,587] Trial 38 finished with values: [5.314124644886675, 0.16431449561656336, -0.018353990598652503, 67.92704397257629] and parameters: {'dropout': 0.4472634833863586, 'num_heads': 2, 'bias': True, 'loss_fn': 'MSE', 'optimizer': 'SGD', 'lr': 0.0012780472815281188, 'weight_decay': 2.1538230304464623e-05}. 
[I 2024-04-20 22:27:04,470] Trial 39 finished with values: [5.337523092354943, 0.16676761747506702, -0.0758797133840392, 71.76416970416996] and parameters: {'dropout': 0.3058177028394996, 'num_heads': 1, 'bias': True, 'loss_fn': 'MAE', 'optimizer': 'SGD', 'lr': 0.004114074931705176, 'weight_decay': 0.07212768096873164}. 
[I 2024-04-20 22:27:49,301] Trial 40 finished with values: [5.329636222399323, 0.20056658343824352, -0.07015381676544874, 71.38223647173398] and parameters: {'dropout': 0.6327734327667937, 'num_heads': 1, 'bias': True, 'loss_fn': 'MAE', 'optimizer': 'SGD', 'lr': 0.0028078774054756833, 'weight_decay': 0.0005957933339095244}. 
[I 2024-04-20 22:28:39,005] Trial 41 finished with values: [5.284216897234759, 0.27012590866529357, 0.018810757773726983, 65.44805187333945] and parameters: {'dropout': 0.5193595144407694, 'num_heads': 1, 'bias': False, 'loss_fn': 'MAE', 'optimizer': 'RMSprop', 'lr': 0.0015594073676940246, 'weight_decay': 0.0015015021808628256}. 
[I 2024-04-20 22:29:25,146] Trial 42 finished with values: [5.378189705071586, 0.1842318281091943, -0.001653784706994843, 66.81309378391266] and parameters: {'dropout': 0.4573666223298326, 'num_heads': 2, 'bias': False, 'loss_fn': 'MSE', 'optimizer': 'SGD', 'lr': 0.0020205499559266616, 'weight_decay': 2.3330272265854954e-05}. 
[I 2024-04-20 22:29:58,020] Trial 43 finished with values: [5.3417420413127195, 0.19769370213371035, -0.07155712783222845, 71.47584122353969] and parameters: {'dropout': 0.47082117182355004, 'num_heads': 4, 'bias': True, 'loss_fn': 'MSE', 'optimizer': 'RMSprop', 'lr': 0.0038519690720093397, 'weight_decay': 0.05390662290337038}. 
[I 2024-04-20 22:31:08,001] Trial 44 finished with values: [5.257474390646023, 0.21442800263462972, -0.019655898050195963, 68.01388482116688] and parameters: {'dropout': 0.44019580455912544, 'num_heads': 4, 'bias': True, 'loss_fn': 'MSE', 'optimizer': 'RMSprop', 'lr': 0.005756458005859107, 'weight_decay': 0.08220975779411431}. 
[I 2024-04-20 22:31:43,361] Trial 45 finished with values: [5.424217649974978, -0.04402714047746899, -0.038249666809859306, 69.25414092053276] and parameters: {'dropout': 0.5250260466493789, 'num_heads': 8, 'bias': True, 'loss_fn': 'MSE', 'optimizer': 'SGD', 'lr': 0.004822807157052077, 'weight_decay': 3.378857026050369e-05}. 
[I 2024-04-20 22:32:48,547] Trial 46 finished with values: [5.310165435253662, 0.12059017387086501, -0.05573958810340285, 70.42076732328789] and parameters: {'dropout': 0.41564916544714203, 'num_heads': 1, 'bias': True, 'loss_fn': 'MSE', 'optimizer': 'SGD', 'lr': 0.0004174193608220347, 'weight_decay': 1.1619116197205573e-05}. 
[I 2024-04-20 22:34:05,027] Trial 47 finished with values: [9.415098490673845, 0.23506235786235807, -1.4350709004353188, 162.4260028018097] and parameters: {'dropout': 0.32012678495573904, 'num_heads': 8, 'bias': True, 'loss_fn': 'MSE', 'optimizer': 'Adam', 'lr': 0.0008516195332639563, 'weight_decay': 0.0005524800696843135}. 
[I 2024-04-20 22:35:16,417] Trial 48 finished with values: [6.643139695013639, 0.25434935577308077, -0.2587880446771198, 83.96466420548946] and parameters: {'dropout': 0.51906583293333, 'num_heads': 2, 'bias': True, 'loss_fn': 'MSE', 'optimizer': 'RMSprop', 'lr': 0.0009247459503078597, 'weight_decay': 2.543817568667285e-05}. 
[I 2024-04-20 22:36:57,163] Trial 49 finished with values: [5.730425229245228, 0.29017266123583835, 0.01955180479305607, 65.39862197574743] and parameters: {'dropout': 0.3696563637141852, 'num_heads': 1, 'bias': True, 'loss_fn': 'MSE', 'optimizer': 'RMSprop', 'lr': 0.026274383492988353, 'weight_decay': 1.1991207122543926e-05}. 
[I 2024-04-20 22:38:00,962] Trial 50 finished with values: [5.342268555044049, 0.2291700742763454, -0.07904053250531673, 71.97500513214737] and parameters: {'dropout': 0.5327758530434905, 'num_heads': 8, 'bias': True, 'loss_fn': 'MAE', 'optimizer': 'Adam', 'lr': 0.0004845261972377886, 'weight_decay': 0.08218855734055823}. 
[I 2024-04-20 22:39:41,969] Trial 51 finished with values: [8.05535664368912, 0.2896510607628278, -0.6154466560583904, 107.75478571741239] and parameters: {'dropout': 0.6113094297733728, 'num_heads': 1, 'bias': False, 'loss_fn': 'MSE', 'optimizer': 'RMSprop', 'lr': 0.0006528022794616931, 'weight_decay': 0.01682811038810614}. 
[I 2024-04-20 22:41:12,838] Trial 52 finished with values: [8.262872938788377, 0.16434348288482292, -0.7402445560539719, 116.07915280287119] and parameters: {'dropout': 0.2441877682802886, 'num_heads': 2, 'bias': True, 'loss_fn': 'MSE', 'optimizer': 'RMSprop', 'lr': 0.0009247459503078597, 'weight_decay': 0.00014950281068972876}. 
[I 2024-04-20 22:41:51,419] Trial 53 finished with values: [10.950621037134201, 0.024242076173419513, -1.8292449445887629, 188.7185080379498] and parameters: {'dropout': 0.640580933398803, 'num_heads': 2, 'bias': True, 'loss_fn': 'MSE', 'optimizer': 'RMSprop', 'lr': 0.0003255565571680538, 'weight_decay': 0.005445122043811764}. 
[I 2024-04-20 22:43:41,395] Trial 54 finished with values: [5.346756798140776, -0.007052475434398033, -0.08532690760769546, 72.39432383855944] and parameters: {'dropout': 0.3635622435900131, 'num_heads': 8, 'bias': True, 'loss_fn': 'MSE', 'optimizer': 'RMSprop', 'lr': 0.09605454481221487, 'weight_decay': 0.009477483128562624}. 
[I 2024-04-20 22:44:15,725] Trial 55 finished with values: [5.307561195643163, 0.2701837788808849, 0.03233087172822191, 64.54622266308483] and parameters: {'dropout': 0.22424570365431884, 'num_heads': 4, 'bias': True, 'loss_fn': 'MSE', 'optimizer': 'RMSprop', 'lr': 0.015345532811316795, 'weight_decay': 5.790794460670452e-05}. 
[I 2024-04-20 22:45:11,491] Trial 56 finished with values: [5.30672242053638, 0.1944807643475296, -0.007762547463594727, 67.22056525278929] and parameters: {'dropout': 0.3696563637141852, 'num_heads': 8, 'bias': True, 'loss_fn': 'MSE', 'optimizer': 'Adam', 'lr': 0.026274383492988353, 'weight_decay': 1.1991207122543926e-05}. 
[I 2024-04-20 22:45:49,009] Trial 57 finished with values: [5.3240259694133885, 0.18966392111208893, -0.021792336131917, 68.15639118424053] and parameters: {'dropout': 0.641640751443157, 'num_heads': 8, 'bias': False, 'loss_fn': 'MSE', 'optimizer': 'SGD', 'lr': 0.0012780472815281188, 'weight_decay': 2.1538230304464623e-05}. 
