[I 2024-04-21 08:45:36,358] Trial 111 finished with values: [5.322353720846896, 0.1754092194316522, -0.0644909211609348, 71.00450558218957] and parameters: {'dropout': 0.6106799664039466, 'num_heads': 4, 'bias': False, 'loss_fn': 'MAE', 'optimizer': 'SGD', 'lr': 0.0005776903862598507, 'weight_decay': 0.004209658587267496}. 
Training finished at Epoch 76, with validation result for [5.022634870813628, 0.22629880120028814, -0.003231980521264166, 85.22727206894311]
Training finished at Epoch 67, with validation result for [5.478670306609508, -0.13923459727626847, -0.04626449443034142, 96.1795992881411]
Training finished at Epoch 58, with validation result for [5.4850434982481735, -0.09788101183187306, -0.0696984708125099, 96.99610907905127]
Training finished at Epoch 54, with validation result for [5.183545371614009, 0.15704962902592862, 0.009105971934315837, 92.51492454128864]
Training finished at Epoch 34, with validation result for [5.604056725751865, -0.04029903750439598, -0.028697697858889093, 108.19790830078534]
Training finished at Epoch 53, with validation result for [4.929051967235955, -0.0163024782833132, -0.0398495745095373, 87.25902933038311]
Training finished at Epoch 34, with validation result for [5.632925799536739, -0.014752071915355417, -0.017212434652566833, 109.81101353742939]
Training finished at Epoch 34, with validation result for [5.5451275929690595, -0.09080595440789066, -0.03055527075007336, 103.62053684416526]
Training finished at Epoch 137, with validation result for [4.315756326169759, 0.40937868394236204, 0.14063514205479366, 56.084061634879845]
Training finished at Epoch 66, with validation result for [9.95334574584281, -0.039681314926100456, -0.58205010029696, 160.2046355478724]
Training finished at Epoch 40, with validation result for [4.8915375430099814, 0.5452793299246727, 0.29014837935690396, 72.37923315697837]
Training finished at Epoch 51, with validation result for [5.178864608452663, 0.02641642575126642, -0.04437647634626152, 95.2867189922783]
Training finished at Epoch 82, with validation result for [5.64654050470106, -0.09768379480634014, -0.03572327338336678, 112.444401611461]
Training finished at Epoch 43, with validation result for [4.841596286818687, 0.503779880277832, 0.21934654974539858, 71.86349914057028]
Training finished at Epoch 39, with validation result for [5.806153773925938, 0.08348021704063638, -0.029882033701701616, 112.77606265375282]
Training finished at Epoch 50, with validation result for [5.658940294499803, -0.14349523029343045, -0.024640240444554262, 104.11286157503605]
Training finished at Epoch 33, with validation result for [5.2198591062544795, 0.03478484298929601, -0.03566334247378733, 87.36440210836008]
Training finished at Epoch 54, with validation result for [5.181810043753365, 0.06724228903032944, -0.03323326717887709, 89.57455950529614]
Training finished at Epoch 47, with validation result for [5.150209292698184, -0.0613321599292944, -0.05116657983453399, 83.96458495880059]
Training finished at Epoch 72, with validation result for [5.037385775277861, -0.05886236407810895, -0.05275257309058845, 84.34441406111488]
Training finished at Epoch 35, with validation result for [5.668547244560105, 0.39771158329367057, 0.12515887054251829, 95.72564975563206]
Training finished at Epoch 46, with validation result for [5.35650461561594, -0.10196510140378504, -0.02342683280721891, 97.52378641384986]
Training finished at Epoch 70, with validation result for [5.5920642710087, -0.05941001967568763, -0.034061317035032124, 105.01631385478254]
Training finished at Epoch 44, with validation result for [5.469411501119795, 0.058198343786769954, -0.03224669835751759, 96.3747286413464]
Training finished at Epoch 40, with validation result for [5.406245162817389, -0.01486502915069224, -0.019809613780655155, 99.22983328649444]
Training finished at Epoch 65, with validation result for [5.331394432085858, 0.15122743699652083, -0.0415285447748428, 89.95534335208106]
Training finished at Epoch 43, with validation result for [5.248184004529079, -0.09456152921228893, -0.030626483377855562, 98.41186780480409]
Training finished at Epoch 91, with validation result for [4.765617754900037, 0.3849366931463567, 0.052436940665201215, 71.01480516948124]
Training finished at Epoch 44, with validation result for [5.376260760608576, -0.14103365351448435, -0.02300669503453623, 101.26001669578278]
Training finished at Epoch 37, with validation result for [5.687260820541947, 0.06463028670820464, -0.031140162022957885, 110.28965619374826]
Training finished at Epoch 45, with validation result for [4.981282207979145, 0.14475408565956596, -0.014275362890311394, 87.37822089868176]
Training finished at Epoch 52, with validation result for [5.310721309741869, -0.13117601301630893, -0.02995661339086997, 90.97602269239302]
Training finished at Epoch 44, with validation result for [5.863673224204611, 0.12714202355512286, -0.008772207315102865, 109.4360011148694]
Training finished at Epoch 67, with validation result for [5.149021346375897, 0.062302264190494575, -0.04271694766122636, 86.89178715569511]
Training finished at Epoch 59, with validation result for [5.586673768217705, -0.007954761128469049, -0.03680967278259173, 106.17994729717209]
Training finished at Epoch 39, with validation result for [5.326150776314118, 0.04700074076029848, -0.02300308005848528, 91.25206891464855]
Training finished at Epoch 76, with validation result for [5.81743351804937, -0.0628686598639915, -0.05374185900030404, 114.46422314586742]
Training finished at Epoch 31, with validation result for [5.284461152180345, 0.00026586853292152174, -0.07377896912313764, 85.01046096852929]
Training finished at Epoch 50, with validation result for [5.557464061779966, 0.08380759987780782, -0.02390219531819615, 104.39422421696376]
Training finished at Epoch 43, with validation result for [5.8874398955998215, -0.15503575463167632, -0.03210251062833569, 112.78011180885203]
Training finished at Epoch 117, with validation result for [5.073616318544684, 0.43600316622675117, 0.16127622375322503, 89.12806503320034]
Training finished at Epoch 49, with validation result for [5.681594514487576, 0.043768178228750634, -0.02244461782020113, 110.30058316104139]
Training finished at Epoch 34, with validation result for [5.668706044004529, 0.012605537125000926, -0.05269560733908385, 101.63349339693252]
Training finished at Epoch 138, with validation result for [4.452064941636093, 0.4556356540054269, 0.1650135058995107, 63.8939016337524]
Training finished at Epoch 80, with validation result for [5.644336796695311, -0.09644339759131046, -0.03306703143842005, 105.37565537332608]
Training finished at Epoch 72, with validation result for [5.849683653829897, 0.1394390007386012, -0.031529714894365624, 111.0576829430965]
Training finished at Epoch 35, with validation result for [5.470827010723929, -0.06575860604945351, -0.007995382110227212, 96.69471477629547]
Training finished at Epoch 67, with validation result for [4.856803437113253, 0.037151586587697495, -0.06261580371685205, 71.31037686584352]
Training finished at Epoch 36, with validation result for [5.506951913603196, 0.035601342613453595, -0.02486966125072909, 104.80550260040853]
Training finished at Epoch 39, with validation result for [5.765540884264709, -0.05435454012086486, -0.023067018826546937, 112.64299988078676]
Training finished at Epoch 69, with validation result for [5.220477697144447, 0.049129213906826084, -0.023675683464323027, 88.92920486609539]
Training finished at Epoch 55, with validation result for [5.328834395879085, -0.07046736623531566, -0.08970912984440838, 96.69622354291967]
Training finished at Epoch 88, with validation result for [5.533993980191558, 0.09188114482822352, -0.012639985521309294, 107.49016403572784]
Training finished at Epoch 49, with validation result for [5.158935543387831, 0.500798974617577, 0.2180055507334212, 70.62647905444561]
Training finished at Epoch 42, with validation result for [7.785164425546337, 0.4265841044325342, -0.09099327534449309, 98.28963456522462]
Training finished at Epoch 101, with validation result for [5.832333056211023, 0.44282445385279723, -0.050587465654212016, 96.88183090778763]
Training finished at Epoch 49, with validation result for [5.613252212168638, 0.3437773166095739, 0.10193307282674391, 97.46640820225406]
Training finished at Epoch 63, with validation result for [5.282987145883015, -0.03768873826258861, -0.029339091146621366, 92.04158079530568]
[I 2024-04-21 08:47:42,566] Trial 112 finished with values: [5.2884598042308095, 0.2061190714070104, -0.012493162052934936, 67.5361104052549] and parameters: {'dropout': 0.6213902221456433, 'num_heads': 8, 'bias': True, 'loss_fn': 'MSE', 'optimizer': 'SGD', 'lr': 0.0001176103965336431, 'weight_decay': 0.005519560907196492}. 
[I 2024-04-21 08:49:18,320] Trial 113 finished with values: [5.2306623861353625, 0.32185329991650163, -0.017779990246490573, 67.8887565523653] and parameters: {'dropout': 0.5482495747062393, 'num_heads': 4, 'bias': True, 'loss_fn': 'MAE', 'optimizer': 'RMSprop', 'lr': 0.0004925078494031119, 'weight_decay': 0.0063406834865273425}. 
[I 2024-04-21 08:51:39,684] Trial 114 finished with values: [5.346030397454079, 0.25006727035101317, -0.03149129473041423, 68.80333870277583] and parameters: {'dropout': 0.21669632530564809, 'num_heads': 8, 'bias': False, 'loss_fn': 'MSE', 'optimizer': 'RMSprop', 'lr': 0.03720693474777555, 'weight_decay': 0.0001556725605174705}. 
[I 2024-04-21 08:53:13,050] Trial 115 finished with values: [13.308689715455447, 0.04689830280061213, -3.2621132856287183, 284.2948122575822] and parameters: {'dropout': 0.6388259958261888, 'num_heads': 4, 'bias': True, 'loss_fn': 'MSE', 'optimizer': 'Adam', 'lr': 0.0005423218123817099, 'weight_decay': 0.0044688876794784635}. 
[W 2024-04-21 09:34:20,267] Trial 116 failed with parameters: {'dropout': 0.23491429552990067, 'num_heads': 2, 'bias': True, 'loss_fn': 'MSE', 'optimizer': 'SGD', 'lr': 0.03047807714922662, 'weight_decay': 0.0044688876794784635} because of the following error: The value nan is not acceptable.
[W 2024-04-21 09:34:20,267] Trial 116 failed with value [nan, nan, nan, nan].
[I 2024-04-21 09:36:15,339] Trial 117 finished with values: [5.288242997085191, 0.34885800279822876, -0.058241914487966895, 70.5876794539686] and parameters: {'dropout': 0.5310152851853307, 'num_heads': 8, 'bias': True, 'loss_fn': 'MAE', 'optimizer': 'Adam', 'lr': 0.0001176103965336431, 'weight_decay': 0.021393723281926534}. 
[I 2024-04-21 09:38:28,018] Trial 118 finished with values: [6.29448855656103, 0.2532243580174351, -0.10774573431554768, 73.8897219433998] and parameters: {'dropout': 0.20421297783875053, 'num_heads': 2, 'bias': True, 'loss_fn': 'MAE', 'optimizer': 'Adam', 'lr': 0.00041951699272833453, 'weight_decay': 8.604033281989629e-05}. 
[I 2024-04-21 09:39:16,586] Trial 119 finished with values: [5.399839848042621, 0.19476010462486743, 0.03407283834774333, 64.43002864385835] and parameters: {'dropout': 0.5519832871533943, 'num_heads': 8, 'bias': True, 'loss_fn': 'MSE', 'optimizer': 'RMSprop', 'lr': 0.033206590722584896, 'weight_decay': 0.0024022863776146748}. 
[I 2024-04-21 09:40:21,886] Trial 120 finished with values: [7.222456297303303, 0.38041542162708, -0.37332954721655254, 91.60490104995566] and parameters: {'dropout': 0.23491429552990067, 'num_heads': 4, 'bias': True, 'loss_fn': 'MSE', 'optimizer': 'Adam', 'lr': 0.002529114770389958, 'weight_decay': 0.004017571036866159}. 
[W 2024-04-21 10:21:02,468] Trial 121 failed with parameters: {'dropout': 0.22971657344274188, 'num_heads': 1, 'bias': False, 'loss_fn': 'MSE', 'optimizer': 'SGD', 'lr': 0.03047807714922662, 'weight_decay': 3.5642266538570554e-05} because of the following error: The value nan is not acceptable.
[W 2024-04-21 10:21:02,468] Trial 121 failed with value [nan, nan, nan, nan].
[I 2024-04-21 10:22:09,863] Trial 122 finished with values: [5.33268459347219, 0.17226443361093802, -0.0019302398343545857, 66.83153410993484] and parameters: {'dropout': 0.560709797427448, 'num_heads': 4, 'bias': False, 'loss_fn': 'MSE', 'optimizer': 'SGD', 'lr': 0.002529114770389958, 'weight_decay': 0.004017571036866159}. 
[I 2024-04-21 10:23:33,896] Trial 123 finished with values: [5.228614481423454, 0.2384853178241072, 0.012625730780410072, 65.86061037895264] and parameters: {'dropout': 0.560709797427448, 'num_heads': 1, 'bias': False, 'loss_fn': 'MSE', 'optimizer': 'Adam', 'lr': 0.009584155726690476, 'weight_decay': 0.0002206610224789564}. 
[I 2024-04-21 10:25:27,835] Trial 124 finished with values: [5.762368857800546, 0.3484240392402814, -0.02865289931097137, 68.61400983261085] and parameters: {'dropout': 0.5968208698337486, 'num_heads': 8, 'bias': True, 'loss_fn': 'MSE', 'optimizer': 'Adam', 'lr': 0.0011461249545361423, 'weight_decay': 0.0037267203012420346}. 
[I 2024-04-21 10:27:17,217] Trial 125 finished with values: [8.600192311738875, 0.13963992294162803, -1.0386432869770497, 135.9831782241859] and parameters: {'dropout': 0.6213902221456433, 'num_heads': 8, 'bias': True, 'loss_fn': 'MSE', 'optimizer': 'Adam', 'lr': 0.0001176103965336431, 'weight_decay': 0.021393723281926534}. 
[I 2024-04-21 10:28:39,147] Trial 126 finished with values: [6.048508985753448, 0.2159964624389518, -0.0457413214545499, 69.75385512519563] and parameters: {'dropout': 0.560709797427448, 'num_heads': 1, 'bias': True, 'loss_fn': 'MSE', 'optimizer': 'Adam', 'lr': 0.0018484782206898956, 'weight_decay': 0.006632926684142983}. 
[I 2024-04-21 10:30:52,015] Trial 127 finished with values: [5.1594703215617805, 0.325460029390638, 0.07461364075089849, 61.72584434945225] and parameters: {'dropout': 0.5968208698337486, 'num_heads': 8, 'bias': False, 'loss_fn': 'MSE', 'optimizer': 'RMSprop', 'lr': 0.002453903431924565, 'weight_decay': 0.0001233670278662728}. 
[I 2024-04-21 10:32:54,686] Trial 128 finished with values: [5.2690525773257955, 0.4278927155629033, 0.009241072933551808, 66.08637647258823] and parameters: {'dropout': 0.5729750064921451, 'num_heads': 8, 'bias': True, 'loss_fn': 'MAE', 'optimizer': 'Adam', 'lr': 0.002529114770389958, 'weight_decay': 0.000104860869337513}. 
[I 2024-04-21 10:34:26,113] Trial 129 finished with values: [5.386230629544328, 0.20378686068352647, -0.10288508713041433, 73.56550325507745] and parameters: {'dropout': 0.560709797427448, 'num_heads': 4, 'bias': False, 'loss_fn': 'MAE', 'optimizer': 'Adam', 'lr': 0.03297429445281317, 'weight_decay': 0.004209658587267496}. 
[I 2024-04-21 10:36:41,669] Trial 130 finished with values: [7.800832374389059, 0.14435904657413404, -0.6875767539029256, 112.56606389107742] and parameters: {'dropout': 0.26636388810605455, 'num_heads': 4, 'bias': True, 'loss_fn': 'MAE', 'optimizer': 'Adam', 'lr': 0.0005423218123817099, 'weight_decay': 0.0015379044637375773}. 
[I 2024-04-21 10:37:38,416] Trial 131 finished with values: [5.301720617067637, 0.1771693260841682, -0.03029243926255676, 68.72337170816128] and parameters: {'dropout': 0.6388259958261888, 'num_heads': 8, 'bias': True, 'loss_fn': 'MSE', 'optimizer': 'SGD', 'lr': 0.0005776903862598507, 'weight_decay': 0.002713277955388022}. 
[I 2024-04-21 10:39:41,767] Trial 132 finished with values: [5.447605223449971, 0.3490549569822525, 0.055521480931636225, 62.9993445188895] and parameters: {'dropout': 0.560709797427448, 'num_heads': 8, 'bias': True, 'loss_fn': 'MAE', 'optimizer': 'Adam', 'lr': 0.0018310475159348336, 'weight_decay': 0.00011407224951813356}. 
[I 2024-04-21 10:43:20,359] Trial 133 finished with values: [4.982935457761691, 0.4335621594672477, 0.13288220829632102, 57.83916880596057] and parameters: {'dropout': 0.6106799664039466, 'num_heads': 1, 'bias': True, 'loss_fn': 'MAE', 'optimizer': 'Adam', 'lr': 0.0004925078494031119, 'weight_decay': 6.726755738094533e-05}. 
[I 2024-04-21 10:44:36,950] Trial 134 finished with values: [5.266388696590413, 0.2563521142013403, -0.01392281514499083, 67.6314722434233] and parameters: {'dropout': 0.6274724636994471, 'num_heads': 2, 'bias': True, 'loss_fn': 'MAE', 'optimizer': 'Adam', 'lr': 0.0005423218123817099, 'weight_decay': 0.021393723281926534}. 
[I 2024-04-21 10:46:33,441] Trial 135 finished with values: [5.2982641711218355, 0.21300300630753705, -0.021583050120113745, 68.14243122507324] and parameters: {'dropout': 0.5519832871533943, 'num_heads': 4, 'bias': False, 'loss_fn': 'MAE', 'optimizer': 'RMSprop', 'lr': 0.033206590722584896, 'weight_decay': 0.0006850267097265221}. 
[I 2024-04-21 10:49:55,639] Trial 136 finished with values: [5.634910704574963, 0.26942438689438186, 0.019946891817700707, 65.37226857217286] and parameters: {'dropout': 0.6213902221456433, 'num_heads': 8, 'bias': True, 'loss_fn': 'MAE', 'optimizer': 'Adam', 'lr': 0.0001176103965336431, 'weight_decay': 0.0001233670278662728}. 
[I 2024-04-21 10:51:53,694] Trial 137 finished with values: [7.0644193689631205, 0.23767493699756792, -0.4358231793432472, 95.77340015406435] and parameters: {'dropout': 0.37061759286604334, 'num_heads': 2, 'bias': True, 'loss_fn': 'MSE', 'optimizer': 'RMSprop', 'lr': 0.0009469677419825427, 'weight_decay': 0.0001233670278662728}. 
[I 2024-04-21 10:53:52,664] Trial 138 finished with values: [5.396484159288696, 0.18046949603108123, -0.09306835090219434, 72.91069964101247] and parameters: {'dropout': 0.5310152851853307, 'num_heads': 1, 'bias': True, 'loss_fn': 'MAE', 'optimizer': 'RMSprop', 'lr': 0.05944231950941618, 'weight_decay': 0.005519560907196492}. 
[I 2024-04-21 10:55:03,404] Trial 139 finished with values: [5.32308085930243, 0.15935923036100502, -0.010070039004644205, 67.374481357427] and parameters: {'dropout': 0.47253235109455244, 'num_heads': 1, 'bias': False, 'loss_fn': 'MAE', 'optimizer': 'RMSprop', 'lr': 0.049451172069310996, 'weight_decay': 0.005519560907196492}. 
[I 2024-04-21 10:56:58,064] Trial 140 finished with values: [5.174599630726046, 0.32968050390249143, 0.029256969675826583, 64.75126048078681] and parameters: {'dropout': 0.40330429094156395, 'num_heads': 4, 'bias': True, 'loss_fn': 'MAE', 'optimizer': 'Adam', 'lr': 0.0005423218123817099, 'weight_decay': 0.0015379044637375773}. 
[I 2024-04-21 10:58:17,487] Trial 141 finished with values: [5.313717929499958, 0.1790010379558498, -0.04589915918175036, 69.76438334066398] and parameters: {'dropout': 0.47253235109455244, 'num_heads': 2, 'bias': True, 'loss_fn': 'MAE', 'optimizer': 'Adam', 'lr': 0.03249737160468052, 'weight_decay': 0.006380321497280199}. 
[I 2024-04-21 11:00:01,869] Trial 142 finished with values: [5.347219950371796, 0.17785516557920647, -0.08389466729945272, 72.2987894258744] and parameters: {'dropout': 0.2209284709748457, 'num_heads': 2, 'bias': False, 'loss_fn': 'MAE', 'optimizer': 'SGD', 'lr': 0.0010162881905153198, 'weight_decay': 0.03733201506541421}. 
[I 2024-04-21 11:00:49,317] Trial 143 finished with values: [5.355563744573885, 0.1356767872395881, -0.002246812572408885, 66.85265039218723] and parameters: {'dropout': 0.44029061757042265, 'num_heads': 8, 'bias': False, 'loss_fn': 'MSE', 'optimizer': 'SGD', 'lr': 0.00441869032397818, 'weight_decay': 9.219853532034945e-05}. 
[I 2024-04-21 11:02:45,679] Trial 144 finished with values: [5.3695775480671175, -0.167337258994319, -0.09328475554415538, 72.92513443261349] and parameters: {'dropout': 0.211684840929517, 'num_heads': 8, 'bias': False, 'loss_fn': 'MAE', 'optimizer': 'Adam', 'lr': 0.033206590722584896, 'weight_decay': 0.05801989614776756}. 
[I 2024-04-21 11:04:06,335] Trial 145 finished with values: [5.282615294652193, 0.259925395080382, -0.0434851798537117, 69.60336420441237] and parameters: {'dropout': 0.22971657344274188, 'num_heads': 1, 'bias': True, 'loss_fn': 'MAE', 'optimizer': 'Adam', 'lr': 0.03047807714922662, 'weight_decay': 3.5642266538570554e-05}. 
[I 2024-04-21 11:05:16,079] Trial 146 finished with values: [5.47998832655546, 0.18386932320774502, -0.1328568235002272, 75.56470144462833] and parameters: {'dropout': 0.560709797427448, 'num_heads': 8, 'bias': False, 'loss_fn': 'MAE', 'optimizer': 'SGD', 'lr': 0.00017482693978880756, 'weight_decay': 0.05801989614776756}. 
[I 2024-04-21 11:06:48,200] Trial 147 finished with values: [5.350090164595014, 0.07981232708943434, -0.0681028497859788, 71.24543126893917] and parameters: {'dropout': 0.5663635226551282, 'num_heads': 1, 'bias': False, 'loss_fn': 'MAE', 'optimizer': 'SGD', 'lr': 0.007433413186728296, 'weight_decay': 0.0001961412911287214}. 
[I 2024-04-21 11:07:57,557] Trial 148 finished with values: [5.3362885853826905, 0.09992585149106853, -0.03979310511935097, 69.35709254922543] and parameters: {'dropout': 0.44470961277411203, 'num_heads': 8, 'bias': False, 'loss_fn': 'MSE', 'optimizer': 'SGD', 'lr': 0.009584155726690476, 'weight_decay': 0.05801989614776756}. 
[I 2024-04-21 11:09:07,793] Trial 149 finished with values: [6.521573722770613, 0.203051354554687, -0.20606043717392097, 80.44758611034396] and parameters: {'dropout': 0.26590282951288446, 'num_heads': 4, 'bias': True, 'loss_fn': 'MAE', 'optimizer': 'RMSprop', 'lr': 0.0001176103965336431, 'weight_decay': 0.0001233670278662728}. 
[I 2024-04-21 11:10:32,825] Trial 150 finished with values: [7.192787610534346, 0.2348188107928169, -0.3124443344446943, 87.54368799102473] and parameters: {'dropout': 0.2246361534008745, 'num_heads': 1, 'bias': False, 'loss_fn': 'MSE', 'optimizer': 'RMSprop', 'lr': 0.00034864763407350415, 'weight_decay': 0.00016110486713333613}. 
[I 2024-04-21 11:11:31,788] Trial 151 finished with values: [5.294324073663871, 0.18308573158724092, -0.05368439369593947, 70.28368013928629] and parameters: {'dropout': 0.6594588480432766, 'num_heads': 2, 'bias': True, 'loss_fn': 'MAE', 'optimizer': 'RMSprop', 'lr': 0.0009469677419825427, 'weight_decay': 0.021393723281926534}. 
