[I 2024-04-21 03:14:22,584] Trial 236 finished with values: [11.021945749440917, 0.17432976980574008, -1.88469125367003, 192.41693109108303] and parameters: {'dropout': 0.4610069230035168, 'num_heads': 4, 'bias': True, 'loss_fn': 'MAE', 'optimizer': 'RMSprop', 'lr': 0.00018846401954415756, 'weight_decay': 8.57593926099762e-05}. 
Training finished at Epoch 106, with validation result for [5.824055818914179, 0.2974693196519721, 0.048000420139377, 96.5585196771778]
Training finished at Epoch 30, with validation result for [5.514520919955378, 0.5768991527556037, 0.3000453325930972, 67.3437045215726]
Training finished at Epoch 71, with validation result for [5.034867343333172, 0.4214250241759265, 0.09477141912040998, 76.70079274783787]
Training finished at Epoch 44, with validation result for [5.337684132812815, 0.4706348444560618, 0.2029916521604126, 75.00083749689531]
Training finished at Epoch 35, with validation result for [5.432220768524222, 0.050291119425979684, -0.033285346593182163, 105.1480548166018]
Training finished at Epoch 105, with validation result for [5.537654263714786, 0.5366904031434658, 0.22168134210641532, 83.1276309361814]
Training finished at Epoch 53, with validation result for [4.804296456110291, -0.03163015702818496, -0.040454453565285986, 70.86505154715566]
Training finished at Epoch 94, with validation result for [5.998207602171945, 0.5812108453840752, 0.17854850765378538, 90.07499028526495]
Training finished at Epoch 54, with validation result for [5.856910351134771, -0.0727358146975209, -0.06361447264139763, 110.832160464112]
Training finished at Epoch 111, with validation result for [5.542312825197954, 0.014013309457692974, -0.03988164737413702, 109.22787842300481]
Training finished at Epoch 35, with validation result for [10.90990567379638, 0.49120571834869675, -1.1074354683303613, 173.44941456621166]
Training finished at Epoch 35, with validation result for [5.046865952076512, 0.5370134956125568, 0.23716053317487895, 73.76643270714163]
Training finished at Epoch 40, with validation result for [5.733103825476765, -0.13375444095774253, -0.020964431513466275, 97.13437159840616]
Training finished at Epoch 51, with validation result for [5.861595626301035, -0.10182090988798642, -0.07301054113857974, 117.13579934460991]
Training finished at Epoch 45, with validation result for [5.574214406257378, 0.6286259836498094, 0.344520408309012, 61.064469968526645]
Training finished at Epoch 52, with validation result for [4.919911646126309, 0.49550540531789683, 0.22603233026627645, 65.08957825638753]
Training finished at Epoch 58, with validation result for [4.360688822356277, 0.5064741682691475, 0.23233635389919172, 64.30812883633051]
Training finished at Epoch 103, with validation result for [4.946894139830362, 0.5679241418808303, 0.31489292612062225, 70.77286662135957]
Training finished at Epoch 39, with validation result for [6.623161453338242, -0.08956077520006428, -0.1397190876697585, 119.66341431606206]
Training finished at Epoch 41, with validation result for [5.010924434648139, 0.3960358675557845, 0.1392464805677951, 89.63502127044295]
Training finished at Epoch 90, with validation result for [5.605399381954675, 0.14514940417171143, -0.0006804712174233174, 107.98292605100534]
Training finished at Epoch 34, with validation result for [8.428930424160058, 0.08246810804633563, -0.4019248184984501, 152.41160721352287]
Training finished at Epoch 57, with validation result for [5.214841497175112, -0.01790500559511255, -0.03485652657806426, 92.46518145028419]
Training finished at Epoch 47, with validation result for [5.111440980319845, 0.48897532879365446, 0.15726505282816294, 86.93528762945562]
Training finished at Epoch 55, with validation result for [5.546143962030233, 0.20711532825040452, 0.01159778676355272, 97.60332968959047]
Training finished at Epoch 41, with validation result for [5.2601666563861, 0.34625774453248415, 0.07464811073948863, 91.94008214735497]
Training finished at Epoch 62, with validation result for [5.171611577512261, 0.5701023006882225, 0.26393850335959135, 73.82071342012482]
Training finished at Epoch 91, with validation result for [5.289428624250918, 0.41875476879341367, 0.1726180190388904, 86.91003420915969]
Training finished at Epoch 55, with validation result for [492.6684307908415, -0.008320431129950439, -2924.9693282248504, 243002.14493456171]
Training finished at Epoch 66, with validation result for [7.032273400279194, 0.36194460778322557, -0.08841966839832027, 98.77361189630439]
Training finished at Epoch 30, with validation result for [5.405377985292813, 0.03300423042792182, -0.02503975236187328, 101.5484144008404]
Training finished at Epoch 60, with validation result for [4.702446921290142, 0.5616072081877939, 0.2674033727473729, 60.71968422159578]
Training finished at Epoch 45, with validation result for [5.246700221607756, 0.024694293695626993, -0.023096357495285158, 101.0016038895385]
Training finished at Epoch 47, with validation result for [5.178450940228763, 0.3331167997686117, 0.007415755706628446, 90.72994318137052]
Training finished at Epoch 31, with validation result for [5.333524072010625, 0.055111782965517296, -0.051206204448068116, 82.61684306747533]
Training finished at Epoch 52, with validation result for [5.4154044302251405, 0.13352954216888982, -0.01944428638768847, 87.16712573442607]
Training finished at Epoch 54, with validation result for [5.350244445930225, 0.2447467977903288, 0.023732644356507016, 87.71634205160149]
Training finished at Epoch 63, with validation result for [5.073795592589195, 0.4255806439233466, 0.11603584781196741, 87.92225667321843]
Training finished at Epoch 52, with validation result for [4.459214301692407, 0.5880074235274951, 0.33444676081456537, 55.16599478507488]
Training finished at Epoch 42, with validation result for [5.336861741430076, 0.10354800702902406, -0.003943263476215764, 94.04723726297037]
Training finished at Epoch 58, with validation result for [5.522253433829765, 0.15773918130737644, -0.026016727877032464, 94.29127940679665]
Training finished at Epoch 56, with validation result for [5.388738664517189, 0.3569008880824388, 0.07910940669831601, 98.47432897269766]
Training finished at Epoch 86, with validation result for [5.022094260036881, 0.3815863523523322, 0.11081690415759438, 89.7284490101112]
Training finished at Epoch 32, with validation result for [5.3784613012262925, 0.02042959827239082, -0.040698896515919625, 96.465908863627]
Training finished at Epoch 51, with validation result for [4.773181085482544, 0.43274427779553976, 0.15439468863852956, 75.76479686169013]
Training finished at Epoch 130, with validation result for [4.977519118100644, 0.5763171447148988, 0.28795184087573356, 70.22311591714545]
Training finished at Epoch 35, with validation result for [4.954532794807388, 0.43304749924801783, 0.10310722782527248, 80.41151443271904]
Training finished at Epoch 40, with validation result for [81.79163060358687, 0.39080065729408126, -62.67456040656352, 6841.331123485863]
Training finished at Epoch 83, with validation result for [4.895453857293723, 0.3884800421490132, 0.14652845032315076, 86.00846915684527]
Training finished at Epoch 86, with validation result for [5.449475955036284, -0.023375319090718463, -0.03775574148591532, 97.40380930093617]
Training finished at Epoch 52, with validation result for [5.479490443016661, 0.17546418625066426, -0.011506812648132803, 85.29427923380234]
Training finished at Epoch 48, with validation result for [4.650794255425551, 0.5491392643757365, 0.29122276472404074, 67.15417137901764]
Training finished at Epoch 48, with validation result for [4.9963543272859825, 0.3990152871180713, 0.13946657681789032, 62.11515499919153]
Training finished at Epoch 40, with validation result for [4.812819503907686, 0.5823739686421637, 0.3199556025280337, 71.11163926817464]
Training finished at Epoch 52, with validation result for [5.100910603581271, 0.5637393986765579, 0.31439722157879146, 76.07875932914028]
Training finished at Epoch 47, with validation result for [5.826462010543121, 0.004730619722947661, -0.05782005407352253, 114.43216483820846]
Training finished at Epoch 71, with validation result for [5.53387833435497, 0.6126981414178522, 0.27288151228331803, 64.45621825122876]
Training finished at Epoch 56, with validation result for [5.2419479718609026, 0.4132836640379372, 0.1122531003475915, 95.82219140875081]
[I 2024-04-21 03:15:39,753] Trial 237 finished with values: [5.19288494550045, 0.4195381606931478, 0.058707571367274, 62.78682342394594] and parameters: {'dropout': 0.31961758477836855, 'num_heads': 4, 'bias': True, 'loss_fn': 'MAE', 'optimizer': 'RMSprop', 'lr': 0.002310234514292926, 'weight_decay': 0.00016123382618607942}. 
[I 2024-04-21 03:16:23,497] Trial 238 finished with values: [5.261634646327647, 0.23252259876240244, -0.004645433565848567, 67.01264508479814] and parameters: {'dropout': 0.626088838661456, 'num_heads': 4, 'bias': True, 'loss_fn': 'MSE', 'optimizer': 'RMSprop', 'lr': 0.003548303408803305, 'weight_decay': 0.0004661851350818042}. 
[I 2024-04-21 03:17:35,438] Trial 239 finished with values: [5.308445638545837, 0.4073990184621207, 0.09608942631778616, 60.29334971201284] and parameters: {'dropout': 0.5700265537579589, 'num_heads': 4, 'bias': False, 'loss_fn': 'MSE', 'optimizer': 'Adam', 'lr': 0.0015212116786850456, 'weight_decay': 0.00018005416692111982}. 
[I 2024-04-21 03:18:46,393] Trial 240 finished with values: [8.672979803760942, 0.15250699301810614, -0.9714877135722728, 131.50371466850405] and parameters: {'dropout': 0.32012678495573904, 'num_heads': 4, 'bias': True, 'loss_fn': 'MAE', 'optimizer': 'RMSprop', 'lr': 0.00018846401954415756, 'weight_decay': 0.001168696876803426}. 
[I 2024-04-21 03:19:18,071] Trial 241 finished with values: [5.303834097086409, 0.20696932672668583, -0.06977582982583219, 71.35702369139882] and parameters: {'dropout': 0.2512662173869412, 'num_heads': 2, 'bias': False, 'loss_fn': 'MAE', 'optimizer': 'RMSprop', 'lr': 0.002310234514292926, 'weight_decay': 2.0032993856203536e-05}. 
[I 2024-04-21 03:20:03,129] Trial 242 finished with values: [5.250921171634474, 0.3654401922061641, 0.11852138176780358, 58.79707588354926] and parameters: {'dropout': 0.4548321579863894, 'num_heads': 2, 'bias': True, 'loss_fn': 'MSE', 'optimizer': 'RMSprop', 'lr': 0.0015212116786850456, 'weight_decay': 0.0015978339728337685}. 
[I 2024-04-21 03:20:46,766] Trial 243 finished with values: [5.407992021286777, 0.27262824371054784, -0.10100812306360729, 73.44030453058872] and parameters: {'dropout': 0.5384011995216912, 'num_heads': 4, 'bias': True, 'loss_fn': 'MAE', 'optimizer': 'Adam', 'lr': 0.0003255565571680538, 'weight_decay': 0.0004661851350818042}. 
[I 2024-04-21 03:21:36,266] Trial 244 finished with values: [106.01580664610613, 0.04903685729536035, -700.698651587099, 46805.25200655842] and parameters: {'dropout': 0.36021406582955795, 'num_heads': 1, 'bias': False, 'loss_fn': 'MSE', 'optimizer': 'RMSprop', 'lr': 0.0015212116786850456, 'weight_decay': 2.6428916322772236e-05}. 
[I 2024-04-21 03:22:07,670] Trial 245 finished with values: [6.41706194211586, 0.2810842506991946, -0.1886632194197746, 79.2871432915441] and parameters: {'dropout': 0.36021406582955795, 'num_heads': 1, 'bias': True, 'loss_fn': 'MSE', 'optimizer': 'Adam', 'lr': 0.002386297911470172, 'weight_decay': 2.2657825404556583e-05}. 
[I 2024-04-21 03:22:47,990] Trial 246 finished with values: [5.331685243782124, 0.2615857505156884, -0.06950051911834931, 71.33865970136593] and parameters: {'dropout': 0.6315905101420694, 'num_heads': 8, 'bias': True, 'loss_fn': 'MAE', 'optimizer': 'RMSprop', 'lr': 0.00010292402149222344, 'weight_decay': 0.012372557046162126}. 
[I 2024-04-21 03:24:07,897] Trial 247 finished with values: [5.3872833611840365, 0.39029450927519854, 0.14860834681176205, 56.79019162089625] and parameters: {'dropout': 0.2695403741621358, 'num_heads': 8, 'bias': False, 'loss_fn': 'MSE', 'optimizer': 'Adam', 'lr': 0.0015212116786850456, 'weight_decay': 0.04817546421844506}. 
[I 2024-04-21 03:25:06,894] Trial 248 finished with values: [11.093257950005459, 0.10696590545279817, -1.925835481965711, 195.16136557109667] and parameters: {'dropout': 0.5700265537579589, 'num_heads': 8, 'bias': True, 'loss_fn': 'MSE', 'optimizer': 'Adam', 'lr': 0.00022343489096155288, 'weight_decay': 0.0013372662274589485}. 
[I 2024-04-21 03:26:12,967] Trial 249 finished with values: [5.262063759090163, 0.23998937021636974, -0.04788469774336823, 69.89682428598297] and parameters: {'dropout': 0.44019580455912544, 'num_heads': 4, 'bias': True, 'loss_fn': 'MAE', 'optimizer': 'RMSprop', 'lr': 0.005756458005859107, 'weight_decay': 8.57593926099762e-05}. 
[I 2024-04-21 03:27:29,528] Trial 250 finished with values: [5.135223985097061, 0.37444798974105736, 0.06064164805086991, 62.65781512904475] and parameters: {'dropout': 0.626088838661456, 'num_heads': 4, 'bias': False, 'loss_fn': 'MSE', 'optimizer': 'RMSprop', 'lr': 0.0015212116786850456, 'weight_decay': 0.00045917349837111597}. 
[I 2024-04-21 03:28:14,456] Trial 251 finished with values: [5.9186714950721, 0.25297401462810887, -0.025651462362540123, 68.4138056389226] and parameters: {'dropout': 0.626088838661456, 'num_heads': 8, 'bias': False, 'loss_fn': 'MSE', 'optimizer': 'RMSprop', 'lr': 0.0008516195332639563, 'weight_decay': 0.00018005416692111982}. 
[I 2024-04-21 03:28:41,161] Trial 252 finished with values: [5.311935991403764, 0.15549578796142222, -0.05736176112300062, 70.5289707761644] and parameters: {'dropout': 0.5311365350726444, 'num_heads': 8, 'bias': False, 'loss_fn': 'MSE', 'optimizer': 'SGD', 'lr': 0.0003255565571680538, 'weight_decay': 0.003322500735489408}. 
[I 2024-04-21 03:29:35,266] Trial 253 finished with values: [5.282804505123111, 0.28689099438014215, -0.044504559053795134, 69.67135963270945] and parameters: {'dropout': 0.44019580455912544, 'num_heads': 4, 'bias': True, 'loss_fn': 'MAE', 'optimizer': 'RMSprop', 'lr': 0.005756458005859107, 'weight_decay': 8.57593926099762e-05}. 
[I 2024-04-21 03:31:21,019] Trial 254 finished with values: [5.17405316488777, 0.31657629706679596, 0.03582744435576779, 64.31299154225917] and parameters: {'dropout': 0.5700265537579589, 'num_heads': 8, 'bias': False, 'loss_fn': 'MSE', 'optimizer': 'RMSprop', 'lr': 0.026274383492988353, 'weight_decay': 1.1991207122543926e-05}. 
[I 2024-04-21 03:32:01,192] Trial 255 finished with values: [5.5000779757067875, 0.06589706367788895, -0.10703210469128632, 73.84212086232696] and parameters: {'dropout': 0.2512662173869412, 'num_heads': 2, 'bias': False, 'loss_fn': 'MAE', 'optimizer': 'RMSprop', 'lr': 0.002310234514292926, 'weight_decay': 2.0032993856203536e-05}. 
[I 2024-04-21 03:33:13,887] Trial 256 finished with values: [5.220040189288323, 0.31500094043684485, -0.013387317168400026, 67.59575303876666] and parameters: {'dropout': 0.6315905101420694, 'num_heads': 4, 'bias': True, 'loss_fn': 'MAE', 'optimizer': 'RMSprop', 'lr': 0.00010292402149222344, 'weight_decay': 0.012372557046162126}. 
[I 2024-04-21 03:34:16,966] Trial 257 finished with values: [5.847662817953923, 0.1940190778563064, -0.03518247917707007, 69.0495509732963] and parameters: {'dropout': 0.5700265537579589, 'num_heads': 4, 'bias': True, 'loss_fn': 'MAE', 'optimizer': 'Adam', 'lr': 0.0015212116786850456, 'weight_decay': 0.0005023644237111914}. 
[I 2024-04-21 03:35:16,908] Trial 258 finished with values: [6.034728294407458, 0.2585898000824762, -0.09633538505272576, 73.12861990690409] and parameters: {'dropout': 0.5311365350726444, 'num_heads': 8, 'bias': False, 'loss_fn': 'MAE', 'optimizer': 'Adam', 'lr': 0.0015212116786850456, 'weight_decay': 0.00018005416692111982}. 
[I 2024-04-21 03:36:20,261] Trial 259 finished with values: [5.115669677827604, 0.36465716943984305, 0.06668247253249693, 62.25487533209568] and parameters: {'dropout': 0.5700265537579589, 'num_heads': 4, 'bias': True, 'loss_fn': 'MAE', 'optimizer': 'RMSprop', 'lr': 0.00037630797216098966, 'weight_decay': 0.00018005416692111982}. 
[I 2024-04-21 03:37:15,090] Trial 260 finished with values: [5.237424487814258, 0.2800538884454173, 0.017236266992499027, 65.55307478827693] and parameters: {'dropout': 0.44019580455912544, 'num_heads': 4, 'bias': True, 'loss_fn': 'MAE', 'optimizer': 'RMSprop', 'lr': 0.005756458005859107, 'weight_decay': 8.57593926099762e-05}. 
[I 2024-04-21 03:37:44,340] Trial 261 finished with values: [5.2996760577798385, 0.22831760536362894, -0.044628768872856384, 69.6796447731607] and parameters: {'dropout': 0.5700265537579589, 'num_heads': 4, 'bias': True, 'loss_fn': 'MAE', 'optimizer': 'RMSprop', 'lr': 0.06224343440411302, 'weight_decay': 7.011871824250725e-05}. 
[I 2024-04-21 03:38:39,356] Trial 262 finished with values: [5.690337326422525, 0.2760380593641693, 0.05667520029879303, 62.92238822774873] and parameters: {'dropout': 0.5700265537579589, 'num_heads': 2, 'bias': True, 'loss_fn': 'MSE', 'optimizer': 'RMSprop', 'lr': 0.0015212116786850456, 'weight_decay': 0.0004661851350818042}. 
[I 2024-04-21 03:39:52,652] Trial 263 finished with values: [5.289482421499196, 0.22193851488705618, -0.05132815203145924, 70.1265122658054] and parameters: {'dropout': 0.31961758477836855, 'num_heads': 8, 'bias': True, 'loss_fn': 'MAE', 'optimizer': 'Adam', 'lr': 0.0008273635937841958, 'weight_decay': 0.0013497911017185931}. 
[I 2024-04-21 03:41:10,771] Trial 264 finished with values: [5.292910832246063, 0.22998481281696706, 0.03565095815798747, 64.32476366259046] and parameters: {'dropout': 0.44534233447383476, 'num_heads': 1, 'bias': True, 'loss_fn': 'MSE', 'optimizer': 'Adam', 'lr': 0.07754675794637712, 'weight_decay': 0.00016773746443731933}. 
[I 2024-04-21 03:41:46,112] Trial 265 finished with values: [6.437385910790336, 0.2671441465879849, -0.1400143467317061, 76.04212815456206] and parameters: {'dropout': 0.31961758477836855, 'num_heads': 1, 'bias': True, 'loss_fn': 'MSE', 'optimizer': 'RMSprop', 'lr': 0.000300125629890095, 'weight_decay': 0.00016123382618607942}. 
[I 2024-04-21 03:43:02,422] Trial 266 finished with values: [5.496079685071359, 0.3347646190397961, 0.08902691920690531, 60.7644385823922] and parameters: {'dropout': 0.31961758477836855, 'num_heads': 8, 'bias': True, 'loss_fn': 'MSE', 'optimizer': 'RMSprop', 'lr': 0.002386297911470172, 'weight_decay': 0.0015978339728337685}. 
[I 2024-04-21 03:43:47,340] Trial 267 finished with values: [5.299255076018058, 0.18578000148143098, -0.003364938664112138, 66.92723251284389] and parameters: {'dropout': 0.5311365350726444, 'num_heads': 4, 'bias': True, 'loss_fn': 'MSE', 'optimizer': 'Adam', 'lr': 0.041784184662472634, 'weight_decay': 1.195900659167233e-05}. 
[I 2024-04-21 03:44:24,582] Trial 268 finished with values: [9.224422545047807, 0.048634162860025004, -1.4759664535317492, 165.1538499542827] and parameters: {'dropout': 0.2512662173869412, 'num_heads': 4, 'bias': False, 'loss_fn': 'MSE', 'optimizer': 'RMSprop', 'lr': 0.002310234514292926, 'weight_decay': 0.00018005416692111982}. 
[I 2024-04-21 03:45:14,415] Trial 269 finished with values: [10.877402342058833, 0.15931080140727616, -2.9146785852945034, 261.1199512710529] and parameters: {'dropout': 0.2695403741621358, 'num_heads': 8, 'bias': False, 'loss_fn': 'MSE', 'optimizer': 'Adam', 'lr': 0.0015212116786850456, 'weight_decay': 0.011431037075200358}. 
[I 2024-04-21 03:46:22,659] Trial 270 finished with values: [8.373744847083913, 0.13995541269653639, -0.7779393151991523, 118.59349809500789] and parameters: {'dropout': 0.3121300419506455, 'num_heads': 4, 'bias': True, 'loss_fn': 'MAE', 'optimizer': 'Adam', 'lr': 0.0020271903886286326, 'weight_decay': 3.154105850837904e-05}. 
[I 2024-04-21 03:47:38,587] Trial 271 finished with values: [6.5041125088010645, 0.4651940018248004, -0.22505067742314888, 81.71428796094581] and parameters: {'dropout': 0.5700265537579589, 'num_heads': 8, 'bias': False, 'loss_fn': 'MSE', 'optimizer': 'RMSprop', 'lr': 0.000912532641073504, 'weight_decay': 6.705324994338547e-05}. 
[I 2024-04-21 03:48:33,372] Trial 272 finished with values: [16.397494920448658, 0.07899031208450548, -5.612733643561926, 441.087728954749] and parameters: {'dropout': 0.3635622435900131, 'num_heads': 4, 'bias': True, 'loss_fn': 'MSE', 'optimizer': 'Adam', 'lr': 0.00018846401954415756, 'weight_decay': 3.236789448258471e-05}. 
[I 2024-04-21 03:49:54,997] Trial 273 finished with values: [6.506370853455103, 0.23509680523684634, -0.15832025946492112, 77.2631834562222] and parameters: {'dropout': 0.6709270573722722, 'num_heads': 4, 'bias': False, 'loss_fn': 'MAE', 'optimizer': 'RMSprop', 'lr': 0.0008892551488809715, 'weight_decay': 0.0005161388516854719}. 
[I 2024-04-21 03:51:17,544] Trial 274 finished with values: [5.121677657604773, 0.4072287250205321, 0.0989863178209629, 60.10011899034169] and parameters: {'dropout': 0.626088838661456, 'num_heads': 2, 'bias': False, 'loss_fn': 'MAE', 'optimizer': 'Adam', 'lr': 0.0015212116786850456, 'weight_decay': 1.195900659167233e-05}. 
[I 2024-04-21 03:51:57,562] Trial 275 finished with values: [6.2577233577560625, 0.20412283813797075, -0.25990585419588585, 84.03922520985058] and parameters: {'dropout': 0.4985858701600712, 'num_heads': 4, 'bias': False, 'loss_fn': 'MSE', 'optimizer': 'RMSprop', 'lr': 0.0015212116786850456, 'weight_decay': 0.00045917349837111597}. 
[I 2024-04-21 03:52:23,906] Trial 276 finished with values: [5.375439033941089, 0.15470409694723009, -0.09057713958067892, 72.74452891595637] and parameters: {'dropout': 0.32012678495573904, 'num_heads': 4, 'bias': True, 'loss_fn': 'MAE', 'optimizer': 'RMSprop', 'lr': 0.005756458005859107, 'weight_decay': 7.011871824250725e-05}. 
[I 2024-04-21 03:52:50,121] Trial 277 finished with values: [5.640788604633778, 0.22077734883843156, 0.009376249711978812, 66.07735980544001] and parameters: {'dropout': 0.5311365350726444, 'num_heads': 4, 'bias': True, 'loss_fn': 'MSE', 'optimizer': 'RMSprop', 'lr': 0.0003255565571680538, 'weight_decay': 0.0025755038752313174}. 
