[I 2024-04-20 22:55:05,665] Trial 195 finished with values: [5.236541311811811, 0.4749580097850136, 0.18966417257488843, 54.05165383571716] and parameters: {'dropout': 0.3757170916790723, 'loss_fn': 'MSE', 'optimizer': 'Adam', 'lr': 0.0004435815774688826, 'weight_decay': 0.0003173001629768782}. 
[I 2024-04-20 22:56:00,935] Trial 196 finished with values: [4.851433827371156, 0.5024093115412469, 0.21058919228360162, 52.65589681310736] and parameters: {'dropout': 0.343986897604069, 'loss_fn': 'MSE', 'optimizer': 'RMSprop', 'lr': 0.0001491541885129046, 'weight_decay': 0.0015147055767583942}. 
[I 2024-04-20 22:57:28,447] Trial 197 finished with values: [4.7726193929046605, 0.4651650055000233, 0.1943218038924578, 53.74097687049941] and parameters: {'dropout': 0.47140953338649033, 'loss_fn': 'MAE', 'optimizer': 'Adam', 'lr': 0.06238377460053, 'weight_decay': 5.669059377844915e-05}. 
[I 2024-04-20 22:59:00,427] Trial 198 finished with values: [4.7491072746619105, 0.5121164240319962, 0.23837708071727115, 50.802367355802154] and parameters: {'dropout': 0.47140953338649033, 'loss_fn': 'MSE', 'optimizer': 'Adam', 'lr': 0.0011090204813870355, 'weight_decay': 0.0005522105098523118}. 
[I 2024-04-20 22:59:58,763] Trial 199 finished with values: [4.63484668570198, 0.4943709876376438, 0.19239118146659662, 53.86975475680083] and parameters: {'dropout': 0.4133409388264626, 'loss_fn': 'MAE', 'optimizer': 'Adam', 'lr': 0.0018470232732537505, 'weight_decay': 5.669059377844915e-05}. 
[I 2024-04-20 23:01:14,380] Trial 200 finished with values: [4.575905947994772, 0.5199537154336685, 0.21500578352225663, 52.361297891664876] and parameters: {'dropout': 0.6429336265507928, 'loss_fn': 'MAE', 'optimizer': 'Adam', 'lr': 0.00013031592875001013, 'weight_decay': 0.008799634114614038}. 
[I 2024-04-20 23:02:16,995] Trial 201 finished with values: [4.825507453706804, 0.49332861340877276, 0.16207647298447359, 55.89183014030326] and parameters: {'dropout': 0.6032520316374994, 'loss_fn': 'MAE', 'optimizer': 'Adam', 'lr': 0.00013031592875001013, 'weight_decay': 0.0010850075709354621}. 
[I 2024-04-20 23:02:43,775] Trial 202 finished with values: [5.329383684301752, 0.19483190488882077, -0.02515740993831117, 68.38085096789939] and parameters: {'dropout': 0.6682161638904962, 'loss_fn': 'MSE', 'optimizer': 'SGD', 'lr': 0.000335245518363157, 'weight_decay': 0.0051005641935645525}. 
[I 2024-04-20 23:03:33,117] Trial 203 finished with values: [4.837381690930909, 0.5143541956044958, 0.2580627056043566, 49.48928141547347] and parameters: {'dropout': 0.30637133564849045, 'loss_fn': 'MSE', 'optimizer': 'RMSprop', 'lr': 0.000335245518363157, 'weight_decay': 0.07195686042467886}. 
[I 2024-04-20 23:04:11,193] Trial 204 finished with values: [4.986644688481964, 0.431692895601308, 0.06954698604605303, 62.0638043123995] and parameters: {'dropout': 0.6032520316374994, 'loss_fn': 'MAE', 'optimizer': 'RMSprop', 'lr': 0.00013031592875001013, 'weight_decay': 3.330960312354315e-05}. 
[I 2024-04-20 23:05:00,773] Trial 205 finished with values: [4.805075716516135, 0.4960276871969728, 0.17162770114856718, 55.254736652690866] and parameters: {'dropout': 0.3757170916790723, 'loss_fn': 'MAE', 'optimizer': 'Adam', 'lr': 0.0018470232732537505, 'weight_decay': 0.0015147055767583942}. 
[I 2024-04-20 23:06:22,247] Trial 206 finished with values: [4.525965173927622, 0.5298450626009463, 0.26752550409862996, 48.85808643282675] and parameters: {'dropout': 0.47140953338649033, 'loss_fn': 'MAE', 'optimizer': 'Adam', 'lr': 0.000141601199311595, 'weight_decay': 0.0051005641935645525}. 
[I 2024-04-20 23:07:07,426] Trial 207 finished with values: [4.922531064528831, 0.4353804199293097, 0.1216656616490116, 58.58734366889241] and parameters: {'dropout': 0.39194832009245817, 'loss_fn': 'MAE', 'optimizer': 'Adam', 'lr': 0.0001491541885129046, 'weight_decay': 0.0016986021452324836}. 
[I 2024-04-20 23:07:36,411] Trial 208 finished with values: [4.959975142589225, 0.45469760454061287, 0.12591244697063364, 58.304071274472534] and parameters: {'dropout': 0.20547500706126287, 'loss_fn': 'MAE', 'optimizer': 'RMSprop', 'lr': 0.000141601199311595, 'weight_decay': 0.003425512443848347}. 
[I 2024-04-20 23:09:08,341] Trial 209 finished with values: [4.445019603030143, 0.5593543118622339, 0.3014803554533996, 46.59320339377483] and parameters: {'dropout': 0.6429336265507928, 'loss_fn': 'MAE', 'optimizer': 'Adam', 'lr': 0.000335245518363157, 'weight_decay': 0.00035756652600816603}. 
[I 2024-04-20 23:09:49,875] Trial 210 finished with values: [5.392557364337887, 0.18692720767033952, -0.10576412258811518, 73.7575429288444] and parameters: {'dropout': 0.6032520316374994, 'loss_fn': 'MAE', 'optimizer': 'RMSprop', 'lr': 0.014438792443322607, 'weight_decay': 0.027760248809972944}. 
[I 2024-04-20 23:10:37,426] Trial 211 finished with values: [5.071689103021631, 0.47911070910884346, 0.2075675145944026, 52.85745112050936] and parameters: {'dropout': 0.20547500706126287, 'loss_fn': 'MSE', 'optimizer': 'Adam', 'lr': 0.00045399421120754873, 'weight_decay': 0.005991336114926054}. 
[I 2024-04-20 23:11:23,151] Trial 212 finished with values: [5.322553762689546, 0.20431104094337402, -0.06532536798289978, 71.0601655064317] and parameters: {'dropout': 0.5425589810742064, 'loss_fn': 'MAE', 'optimizer': 'Adam', 'lr': 0.004271805895111922, 'weight_decay': 0.025100788789258092}. 
[I 2024-04-20 23:12:35,859] Trial 213 finished with values: [4.572016026347393, 0.5292398670794272, 0.21806001846242606, 52.157571925057226] and parameters: {'dropout': 0.6388664062107275, 'loss_fn': 'MAE', 'optimizer': 'Adam', 'lr': 0.0011090204813870355, 'weight_decay': 0.005991336114926054}. 
[I 2024-04-20 23:13:59,940] Trial 214 finished with values: [4.3487539291505275, 0.5601381123543384, 0.2865389482372198, 47.58983681825719] and parameters: {'dropout': 0.20547500706126287, 'loss_fn': 'MAE', 'optimizer': 'Adam', 'lr': 0.00045399421120754873, 'weight_decay': 2.015378107650812e-05}. 
[I 2024-04-20 23:15:24,151] Trial 215 finished with values: [4.4621147925483795, 0.5427708712896364, 0.2823466494184611, 47.8694748113686] and parameters: {'dropout': 0.20547500706126287, 'loss_fn': 'MAE', 'optimizer': 'Adam', 'lr': 0.00045399421120754873, 'weight_decay': 1.4907661237417258e-05}. 
[I 2024-04-20 23:16:04,271] Trial 216 finished with values: [4.748855858870413, 0.47063275193673393, 0.21322816650634768, 52.47986989150067] and parameters: {'dropout': 0.3757170916790723, 'loss_fn': 'MAE', 'optimizer': 'RMSprop', 'lr': 0.000335245518363157, 'weight_decay': 0.000445889185084419}. 
[I 2024-04-20 23:17:24,890] Trial 217 finished with values: [4.681671215822923, 0.5187107798157445, 0.24643276182340945, 50.26503101718376] and parameters: {'dropout': 0.4008478414744524, 'loss_fn': 'MAE', 'optimizer': 'Adam', 'lr': 0.006324594413501705, 'weight_decay': 0.001063154140458134}. 
[I 2024-04-20 23:18:09,136] Trial 218 finished with values: [4.720502063190899, 0.5079797846531413, 0.25742045501266275, 49.53212131651589] and parameters: {'dropout': 0.6043148734461228, 'loss_fn': 'MAE', 'optimizer': 'RMSprop', 'lr': 0.0017630080456605044, 'weight_decay': 0.00018508990731451555}. 
[I 2024-04-20 23:19:14,363] Trial 219 finished with values: [4.714146793941198, 0.5282005255809157, 0.2742882646078617, 48.40699149459556] and parameters: {'dropout': 0.28295843110109903, 'loss_fn': 'MSE', 'optimizer': 'Adam', 'lr': 0.0006875192141645101, 'weight_decay': 5.669059377844915e-05}. 
[I 2024-04-20 23:20:09,372] Trial 220 finished with values: [4.701541315628727, 0.4870416725628755, 0.18617721360403394, 54.28424369889879] and parameters: {'dropout': 0.6043148734461228, 'loss_fn': 'MAE', 'optimizer': 'RMSprop', 'lr': 0.000141601199311595, 'weight_decay': 0.003425512443848347}. 
[I 2024-04-20 23:21:41,109] Trial 221 finished with values: [4.414273308882709, 0.5470324161862931, 0.27973004520393796, 48.04400959119919] and parameters: {'dropout': 0.39194832009245817, 'loss_fn': 'MAE', 'optimizer': 'RMSprop', 'lr': 0.0001491541885129046, 'weight_decay': 1.4907661237417258e-05}. 
[I 2024-04-20 23:22:47,281] Trial 222 finished with values: [4.940979411910113, 0.47612346300133135, 0.1969404862832841, 53.56630347052844] and parameters: {'dropout': 0.6682161638904962, 'loss_fn': 'MSE', 'optimizer': 'Adam', 'lr': 0.0017630080456605044, 'weight_decay': 4.764200972975091e-05}. 
[I 2024-04-20 23:23:35,433] Trial 223 finished with values: [5.66044833946175, 0.4274808936015384, 0.074293980196106, 61.7471665976706] and parameters: {'dropout': 0.620895983541135, 'loss_fn': 'MSE', 'optimizer': 'Adam', 'lr': 0.016032538889276752, 'weight_decay': 0.0007978568032095472}. 
[I 2024-04-20 23:24:45,091] Trial 224 finished with values: [4.852166790171226, 0.459531015341456, 0.174283242654937, 55.07760464718054] and parameters: {'dropout': 0.44423573566956587, 'loss_fn': 'MSE', 'optimizer': 'RMSprop', 'lr': 0.0011090204813870355, 'weight_decay': 0.000445889185084419}. 
[I 2024-04-20 23:25:59,106] Trial 225 finished with values: [4.899782042329494, 0.4818602004457802, 0.1861055684671099, 54.28902262883002] and parameters: {'dropout': 0.6682161638904962, 'loss_fn': 'MSE', 'optimizer': 'Adam', 'lr': 0.0012768966648359554, 'weight_decay': 0.0051005641935645525}. 
[I 2024-04-20 23:27:15,192] Trial 226 finished with values: [4.689760903654246, 0.4784390677135225, 0.1964785025103034, 53.59711907330663] and parameters: {'dropout': 0.6038554864781569, 'loss_fn': 'MAE', 'optimizer': 'Adam', 'lr': 0.000141601199311595, 'weight_decay': 5.669059377844915e-05}. 
[I 2024-04-20 23:28:03,629] Trial 227 finished with values: [4.680221733542492, 0.49538147396925436, 0.20183495347830782, 53.2398288934678] and parameters: {'dropout': 0.30637133564849045, 'loss_fn': 'MAE', 'optimizer': 'RMSprop', 'lr': 0.000335245518363157, 'weight_decay': 0.012137267360228956}. 
[I 2024-04-20 23:30:02,352] Trial 228 finished with values: [4.3631977012196375, 0.5614102860442848, 0.3045080022282244, 46.39125093175713] and parameters: {'dropout': 0.21280234887289806, 'loss_fn': 'MAE', 'optimizer': 'Adam', 'lr': 0.00026496091953255184, 'weight_decay': 2.015378107650812e-05}. 
[I 2024-04-20 23:30:33,775] Trial 229 finished with values: [5.007727252839386, 0.4067461349103778, 0.10706028413656377, 59.56156297738738] and parameters: {'dropout': 0.27454880379716917, 'loss_fn': 'MAE', 'optimizer': 'Adam', 'lr': 0.001741863051229536, 'weight_decay': 0.00030768246874286195}. 
[I 2024-04-20 23:31:25,223] Trial 230 finished with values: [5.042751747480043, 0.45631271709764337, 0.16111092375203007, 55.956234960017596] and parameters: {'dropout': 0.4651931475616005, 'loss_fn': 'MSE', 'optimizer': 'RMSprop', 'lr': 0.016032538889276752, 'weight_decay': 0.0001736787544116205}. 
[I 2024-04-20 23:31:58,633] Trial 231 finished with values: [4.993567246905018, 0.4172162151532826, 0.10483139058760316, 59.710236377313315] and parameters: {'dropout': 0.20145961770575083, 'loss_fn': 'MAE', 'optimizer': 'Adam', 'lr': 0.0001929641914798421, 'weight_decay': 0.00030768246874286195}. 
[I 2024-04-20 23:33:22,275] Trial 232 finished with values: [4.640362888603047, 0.5001844062043154, 0.20222038425427258, 53.21411958854137] and parameters: {'dropout': 0.39194832009245817, 'loss_fn': 'MAE', 'optimizer': 'Adam', 'lr': 0.008712502019721046, 'weight_decay': 7.047973805145223e-05}. 
[I 2024-04-20 23:34:20,293] Trial 233 finished with values: [5.151743778733988, 0.4072041526005673, 0.15092343349424064, 56.63576889919748] and parameters: {'dropout': 0.6682161638904962, 'loss_fn': 'MSE', 'optimizer': 'Adam', 'lr': 0.027949882186859325, 'weight_decay': 0.0051005641935645525}. 
Training finished at Epoch 71, with validation result for [5.178413019627353, 0.09483357187223064, -0.027220020101991205, 79.78157655287391]
Training finished at Epoch 66, with validation result for [4.931076417196313, 0.1395076791617715, -0.02074841632249136, 69.6038950156457]
Training finished at Epoch 37, with validation result for [4.9898467684941545, 0.46983346765843637, 0.1645089632982636, 87.90423211074919]
Training finished at Epoch 64, with validation result for [4.55809634497236, 0.47252824966225726, 0.15843954419186845, 67.82008983326816]
Training finished at Epoch 84, with validation result for [5.225143828704257, 0.3877227586451868, 0.1369775661709316, 95.23021893417747]
Training finished at Epoch 75, with validation result for [5.330725321997459, -0.026761493321274858, -0.06104868691479881, 83.31531735085635]
Training finished at Epoch 71, with validation result for [4.842587303368569, 0.4886986405591392, 0.2241807797028902, 81.77672346530831]
Training finished at Epoch 30, with validation result for [4.807405537587331, 0.4349786469103874, 0.1738103154245022, 71.80667327686835]
Training finished at Epoch 41, with validation result for [5.2663526602983675, 0.5840964852545592, 0.33620437906245715, 66.89829704881375]
Training finished at Epoch 53, with validation result for [5.384733748830732, 0.010085568004777194, -0.07933533050209274, 96.8822932092964]
Training finished at Epoch 57, with validation result for [5.014262681375656, 0.451746626124352, 0.19948139133658704, 83.39588260550147]
Training finished at Epoch 51, with validation result for [6.747037765828928, 0.5909344875714374, 0.09545444951648385, 75.76272264675434]
Training finished at Epoch 48, with validation result for [5.534794368257194, 0.007158761899685665, -0.030164291861988657, 101.87334954777941]
Training finished at Epoch 97, with validation result for [4.876934599566723, 0.4315942558490939, 0.17210308370017247, 78.42896620620574]
Training finished at Epoch 108, with validation result for [4.818680526782658, 0.4438998753083609, 0.1805158589146557, 86.15225271298893]
Training finished at Epoch 34, with validation result for [4.944705720528088, 0.38700128231968806, 0.14598039614532288, 80.20410688478377]
Training finished at Epoch 41, with validation result for [5.461068307008747, 0.6005348587168738, 0.31419062239343765, 67.12242308761391]
Training finished at Epoch 42, with validation result for [4.8668695725828615, 0.5603066712980724, 0.2901833397072733, 73.65847740919973]
Training finished at Epoch 42, with validation result for [5.499277057942007, 0.4754918238919562, 0.13484865447289307, 94.90164894104267]
Training finished at Epoch 41, with validation result for [5.098073157940889, 0.5432862461726647, 0.26464399284677753, 60.20883917642927]
Training finished at Epoch 36, with validation result for [5.531353982556747, 0.5662115922715787, 0.1923312813136191, 75.5850789944685]
Training finished at Epoch 44, with validation result for [5.054099613356185, 0.47200087478656083, 0.18475970769088468, 63.202824113975446]
Training finished at Epoch 76, with validation result for [5.218277105688415, 0.41281169598310946, 0.1514131737437152, 88.2164012112455]
Training finished at Epoch 78, with validation result for [4.7483414018681875, 0.6413128262786609, 0.37069813817584796, 68.83694944028025]
Training finished at Epoch 51, with validation result for [4.966047326767957, 0.41867078129629953, 0.1641646363493774, 87.41220895953097]
Training finished at Epoch 74, with validation result for [5.3677270165140145, 0.4294061815488686, 0.1526945178193595, 93.0422740143248]
Training finished at Epoch 61, with validation result for [4.60886795635279, 0.5119057922360816, 0.24066341745702535, 66.7575275723195]
Training finished at Epoch 36, with validation result for [5.646220223527176, -0.11936678571022556, -0.03110635188858013, 104.62539277202235]
Training finished at Epoch 46, with validation result for [5.5912744384251996, 0.561348822688571, 0.3031134493791332, 75.56316762987974]
Training finished at Epoch 39, with validation result for [5.143199066660387, 0.4184100234790056, 0.1535761518936436, 89.62166140307811]
Training finished at Epoch 44, with validation result for [4.777812142572276, 0.4599629452622515, 0.20413204578213062, 79.23417407566649]
Training finished at Epoch 71, with validation result for [5.2659728962826975, 0.3836948914550741, 0.08290659622250607, 90.56994157411889]
Training finished at Epoch 37, with validation result for [4.760668487194957, 0.5077107305283884, 0.24490075259744803, 65.6943737257145]
Training finished at Epoch 36, with validation result for [5.6496744020002465, 0.45452919543905973, 0.04473846287551475, 88.54813436377792]
Training finished at Epoch 83, with validation result for [4.9133426644216085, 0.406049217503218, 0.14750355843602714, 88.06837667318128]
Training finished at Epoch 41, with validation result for [5.812210279064661, -0.13960074592476968, -0.04866741214081971, 111.26055054411563]
Training finished at Epoch 41, with validation result for [5.30373737702732, 0.5744073969496036, 0.317297399559165, 66.61538404600941]
Training finished at Epoch 42, with validation result for [5.143145300980485, 0.03419779263875615, -0.019012365121787944, 92.90209848837605]
Training finished at Epoch 76, with validation result for [4.667575868933845, 0.39549111946420973, 0.1304394487628202, 78.67245568821193]
Training finished at Epoch 85, with validation result for [5.307088171912028, 0.40913363110954254, 0.1528674615550899, 93.2188165418999]
Training finished at Epoch 80, with validation result for [4.797129935850448, 0.49581265385458934, 0.14370048634462929, 63.425957319567466]
Training finished at Epoch 41, with validation result for [5.018904526980383, 0.4257238009332164, 0.1644379105136088, 86.9660105656405]
Training finished at Epoch 78, with validation result for [4.895959932979524, 0.4235912825756987, 0.15713930306739832, 85.84052454508564]
Training finished at Epoch 49, with validation result for [5.051804500201797, 0.4555941016709764, 0.19977152454192915, 84.82275172164648]
Training finished at Epoch 60, with validation result for [4.519971616366781, 0.5828063283615529, 0.3306146679088061, 55.80883931243085]
Training finished at Epoch 57, with validation result for [4.924884394203187, 0.41648283806876024, 0.14550958246962487, 85.62856688688044]
Training finished at Epoch 94, with validation result for [4.940512428287037, 0.38006448459237974, 0.12974585354987733, 84.60132022010443]
Training finished at Epoch 55, with validation result for [4.924802788833038, 0.603514814195363, 0.3547739107403386, 62.06592053736343]
Training finished at Epoch 34, with validation result for [4.9771535278199925, 0.5874285244222129, 0.3158101359916431, 69.70156062677167]
Training finished at Epoch 67, with validation result for [4.54696599089403, 0.5064633344130245, 0.180387804117072, 58.05072105020404]
Training finished at Epoch 55, with validation result for [5.101212729994027, 0.56916716666283, 0.3144653193506374, 66.7024601649187]
Training finished at Epoch 56, with validation result for [4.475470929882377, 0.4978648573309653, 0.23813845724984206, 51.687285123940704]
Training finished at Epoch 55, with validation result for [4.934120620757885, 0.4338852068927659, 0.1722813085444862, 75.51522112427371]
Training finished at Epoch 119, with validation result for [4.514511615418306, 0.44518386169057406, 0.16689522496848663, 64.70791279657676]
Training finished at Epoch 32, with validation result for [4.988494342714554, 0.4206877456948002, 0.13295102049227203, 77.58480704389916]
Training finished at Epoch 54, with validation result for [5.316951464766263, 0.5664357837910066, 0.30930290604319155, 76.19514518713432]
Training finished at Epoch 33, with validation result for [4.5527141176241726, 0.5642922629929011, 0.25894638469590003, 60.52273350162837]
Training finished at Epoch 88, with validation result for [5.073930427327474, 0.43101743188422126, 0.1724554896752687, 90.72163171686607]
Training finished at Epoch 55, with validation result for [5.023335499546989, 0.5420233877789724, 0.24154914982839992, 79.35284067022678]
[I 2024-04-20 23:35:02,246] Trial 234 finished with values: [5.50336500318623, 0.21409090350387894, -0.13277475826371998, 75.55922746506886] and parameters: {'dropout': 0.39194832009245817, 'loss_fn': 'MAE', 'optimizer': 'SGD', 'lr': 0.000141601199311595, 'weight_decay': 7.047973805145223e-05}. 
[I 2024-04-20 23:36:16,340] Trial 235 finished with values: [4.804194003078629, 0.48815035328859074, 0.23525948733000324, 51.01031950707822] and parameters: {'dropout': 0.20145961770575083, 'loss_fn': 'MSE', 'optimizer': 'Adam', 'lr': 0.016032538889276752, 'weight_decay': 5.669059377844915e-05}. 
[I 2024-04-20 23:37:12,257] Trial 236 finished with values: [4.863593967602611, 0.46503263491298596, 0.1849703349619769, 54.36474586155087] and parameters: {'dropout': 0.39194832009245817, 'loss_fn': 'MSE', 'optimizer': 'Adam', 'lr': 0.004271805895111922, 'weight_decay': 7.047973805145223e-05}. 
[I 2024-04-20 23:38:42,728] Trial 237 finished with values: [4.577547769063003, 0.5253090258168515, 0.2603622977083042, 49.335892225264665] and parameters: {'dropout': 0.39194832009245817, 'loss_fn': 'MAE', 'optimizer': 'Adam', 'lr': 0.00013031592875001013, 'weight_decay': 0.005171761175708385}. 
[I 2024-04-20 23:39:16,699] Trial 238 finished with values: [5.411789683348215, 0.19165336135299188, 0.006004445914008283, 66.30226849825812] and parameters: {'dropout': 0.47140953338649033, 'loss_fn': 'MSE', 'optimizer': 'SGD', 'lr': 0.00045399421120754873, 'weight_decay': 0.005991336114926054}. 
[I 2024-04-20 23:40:33,664] Trial 239 finished with values: [4.514182463599954, 0.5310969043456517, 0.27415807952652316, 48.41567520166235] and parameters: {'dropout': 0.39194832009245817, 'loss_fn': 'MAE', 'optimizer': 'Adam', 'lr': 0.00028942439941062056, 'weight_decay': 5.669059377844915e-05}. 
[I 2024-04-20 23:42:25,006] Trial 240 finished with values: [4.502639155337129, 0.5511643121919692, 0.2594231577563426, 49.39853547250701] and parameters: {'dropout': 0.47140953338649033, 'loss_fn': 'MAE', 'optimizer': 'Adam', 'lr': 0.000141601199311595, 'weight_decay': 0.019071566191676756}. 
