[I 2024-04-20 23:43:21,852] Trial 241 finished with values: [4.735944637040666, 0.5007940292612578, 0.237839159828922, 50.838248175413] and parameters: {'dropout': 0.4773211130217321, 'loss_fn': 'MSE', 'optimizer': 'Adam', 'lr': 0.0001929641914798421, 'weight_decay': 5.669059377844915e-05}. 
[I 2024-04-20 23:44:14,270] Trial 242 finished with values: [4.613362430277555, 0.4916384441812577, 0.1955299356115744, 53.66039112412171] and parameters: {'dropout': 0.6045490532618478, 'loss_fn': 'MAE', 'optimizer': 'RMSprop', 'lr': 0.000335245518363157, 'weight_decay': 8.57488773372852e-05}. 
[I 2024-04-20 23:45:22,772] Trial 243 finished with values: [4.813889328768071, 0.4764276366784276, 0.13676584679787362, 57.58011931462065] and parameters: {'dropout': 0.31377357982385545, 'loss_fn': 'MAE', 'optimizer': 'Adam', 'lr': 0.0001491541885129046, 'weight_decay': 5.669059377844915e-05}. 
[I 2024-04-20 23:45:58,175] Trial 244 finished with values: [5.369635700101863, 0.18017889925016004, -0.004600947154726587, 67.00967771742651] and parameters: {'dropout': 0.4133409388264626, 'loss_fn': 'MSE', 'optimizer': 'SGD', 'lr': 0.004271805895111922, 'weight_decay': 7.821356529578963e-05}. 
[I 2024-04-20 23:46:33,193] Trial 245 finished with values: [5.137131546382943, 0.47234806658645323, 0.1386344772327528, 57.455476466563546] and parameters: {'dropout': 0.30637133564849045, 'loss_fn': 'MSE', 'optimizer': 'RMSprop', 'lr': 0.0001491541885129046, 'weight_decay': 0.000445889185084419}. 
[I 2024-04-20 23:47:53,032] Trial 246 finished with values: [4.56282828154644, 0.49978512044331896, 0.21265576142164244, 52.51805090293467] and parameters: {'dropout': 0.31377357982385545, 'loss_fn': 'MAE', 'optimizer': 'Adam', 'lr': 0.000141601199311595, 'weight_decay': 5.669059377844915e-05}. 
[I 2024-04-20 23:48:42,182] Trial 247 finished with values: [5.281150895293792, 0.44631937446954667, 0.10017215355067632, 60.021020448478914] and parameters: {'dropout': 0.4133409388264626, 'loss_fn': 'MSE', 'optimizer': 'Adam', 'lr': 0.04762774138488985, 'weight_decay': 5.669059377844915e-05}. 
[I 2024-04-20 23:50:15,406] Trial 248 finished with values: [4.638545980402872, 0.5294724651349921, 0.2392578237997619, 50.74361934219863] and parameters: {'dropout': 0.6045490532618478, 'loss_fn': 'MAE', 'optimizer': 'Adam', 'lr': 0.0012729923166016706, 'weight_decay': 0.005991336114926054}. 
[I 2024-04-20 23:51:59,352] Trial 249 finished with values: [4.809012457461241, 0.5203740264816132, 0.26135093753987426, 49.26994719835646] and parameters: {'dropout': 0.6682161638904962, 'loss_fn': 'MSE', 'optimizer': 'Adam', 'lr': 0.00621469065229145, 'weight_decay': 3.122146452942344e-05}. 
[I 2024-04-20 23:53:26,400] Trial 250 finished with values: [4.553798140342106, 0.5408017032391407, 0.2497212911487402, 50.045676963338956] and parameters: {'dropout': 0.6043148734461228, 'loss_fn': 'MAE', 'optimizer': 'RMSprop', 'lr': 0.000335245518363157, 'weight_decay': 0.003425512443848347}. 
[I 2024-04-20 23:54:07,250] Trial 251 finished with values: [4.883848839734215, 0.44767079391976544, 0.12863116105984918, 58.12272548195647] and parameters: {'dropout': 0.39194832009245817, 'loss_fn': 'MAE', 'optimizer': 'RMSprop', 'lr': 0.00044839503822010203, 'weight_decay': 1.4907661237417258e-05}. 
[I 2024-04-20 23:55:46,800] Trial 252 finished with values: [4.464074621607344, 0.514060728960453, 0.23693676418064658, 50.89844047538625] and parameters: {'dropout': 0.6429336265507928, 'loss_fn': 'MAE', 'optimizer': 'Adam', 'lr': 0.00013031592875001013, 'weight_decay': 5.669059377844915e-05}. 
[I 2024-04-20 23:56:48,691] Trial 253 finished with values: [4.724066736674667, 0.451702827611242, 0.13818829527139886, 57.48523804454965] and parameters: {'dropout': 0.6043148734461228, 'loss_fn': 'MAE', 'optimizer': 'RMSprop', 'lr': 0.0001491541885129046, 'weight_decay': 1.4907661237417258e-05}. 
[I 2024-04-20 23:57:58,836] Trial 254 finished with values: [4.609690588522317, 0.5125431129181185, 0.2148006546636395, 52.374980557150515] and parameters: {'dropout': 0.4032096615819214, 'loss_fn': 'MAE', 'optimizer': 'Adam', 'lr': 0.00045399421120754873, 'weight_decay': 1.4907661237417258e-05}. 
[I 2024-04-20 23:59:39,690] Trial 255 finished with values: [4.507614277742451, 0.5353849466891144, 0.2403941661891016, 50.66782214381656] and parameters: {'dropout': 0.39194832009245817, 'loss_fn': 'MAE', 'optimizer': 'Adam', 'lr': 0.0001929641914798421, 'weight_decay': 0.0005085180165489684}. 
[I 2024-04-21 00:00:24,058] Trial 256 finished with values: [5.080495919607159, 0.40710883728571, 0.03208344337572255, 64.56272682247877] and parameters: {'dropout': 0.21280234887289806, 'loss_fn': 'MAE', 'optimizer': 'Adam', 'lr': 0.000141601199311595, 'weight_decay': 5.669059377844915e-05}. 
[I 2024-04-21 00:01:17,798] Trial 257 finished with values: [4.814481385301014, 0.45630218007917334, 0.13294835669588523, 57.83475652370175] and parameters: {'dropout': 0.6045490532618478, 'loss_fn': 'MAE', 'optimizer': 'RMSprop', 'lr': 0.0012729923166016706, 'weight_decay': 0.005991336114926054}. 
[I 2024-04-21 00:02:35,342] Trial 258 finished with values: [4.655638573592132, 0.5190013091811173, 0.21103995325998337, 52.625829802081256] and parameters: {'dropout': 0.4133409388264626, 'loss_fn': 'MSE', 'optimizer': 'Adam', 'lr': 0.0001929641914798421, 'weight_decay': 0.0051005641935645525}. 
[I 2024-04-21 00:03:32,790] Trial 259 finished with values: [4.5497372967240155, 0.523918332856135, 0.25816881239997436, 49.48220379704387] and parameters: {'dropout': 0.31377357982385545, 'loss_fn': 'MAE', 'optimizer': 'Adam', 'lr': 0.0011090204813870355, 'weight_decay': 2.3345644331297258e-05}. 
[I 2024-04-21 00:04:24,179] Trial 260 finished with values: [5.082090641597946, 0.46931583574293156, 0.07691693840561009, 61.572207988699596] and parameters: {'dropout': 0.6032520316374994, 'loss_fn': 'MAE', 'optimizer': 'RMSprop', 'lr': 0.00013031592875001013, 'weight_decay': 0.027760248809972944}. 
[I 2024-04-21 00:06:00,835] Trial 261 finished with values: [4.522733682625194, 0.5318548801484425, 0.2612569759014619, 49.276214701015746] and parameters: {'dropout': 0.3317293527148959, 'loss_fn': 'MAE', 'optimizer': 'Adam', 'lr': 0.000141601199311595, 'weight_decay': 0.006171597869805226}. 
[I 2024-04-21 00:06:54,352] Trial 262 finished with values: [5.042902522390142, 0.45129685019368015, 0.18231017283613926, 54.54218607523308] and parameters: {'dropout': 0.4133409388264626, 'loss_fn': 'MSE', 'optimizer': 'Adam', 'lr': 0.011060229481842715, 'weight_decay': 0.003425512443848347}. 
[I 2024-04-21 00:07:35,859] Trial 263 finished with values: [4.746120778369348, 0.4942444771194323, 0.2150509957792156, 52.35828210835681] and parameters: {'dropout': 0.4133409388264626, 'loss_fn': 'MAE', 'optimizer': 'RMSprop', 'lr': 0.001474292560754528, 'weight_decay': 5.669059377844915e-05}. 
[I 2024-04-21 00:08:17,706] Trial 264 finished with values: [4.786726073809338, 0.47243552845964626, 0.1928525869357528, 53.838977728496424] and parameters: {'dropout': 0.6541832581203741, 'loss_fn': 'MSE', 'optimizer': 'Adam', 'lr': 0.0001929641914798421, 'weight_decay': 5.669059377844915e-05}. 
[I 2024-04-21 00:09:00,047] Trial 265 finished with values: [4.841418335371224, 0.4744892796150385, 0.21647884223618574, 52.26304077777423] and parameters: {'dropout': 0.39194832009245817, 'loss_fn': 'MSE', 'optimizer': 'Adam', 'lr': 0.004271805895111922, 'weight_decay': 7.047973805145223e-05}. 
[I 2024-04-21 00:09:55,616] Trial 266 finished with values: [5.1998505212206325, 0.5217562442088065, 0.23492486313434002, 51.03263987176766] and parameters: {'dropout': 0.20145961770575083, 'loss_fn': 'MSE', 'optimizer': 'Adam', 'lr': 0.004271805895111922, 'weight_decay': 7.047973805145223e-05}. 
[I 2024-04-21 00:11:22,578] Trial 267 finished with values: [4.511396900383985, 0.5329447174321558, 0.2574165225748023, 49.53238362106022] and parameters: {'dropout': 0.39194832009245817, 'loss_fn': 'MAE', 'optimizer': 'Adam', 'lr': 0.013731629104347835, 'weight_decay': 5.669059377844915e-05}. 
[I 2024-04-21 00:11:59,595] Trial 268 finished with values: [5.3458242700125105, 0.1875988715324535, -0.0751158224928179, 71.71321605677693] and parameters: {'dropout': 0.20145961770575083, 'loss_fn': 'MAE', 'optimizer': 'RMSprop', 'lr': 0.016032538889276752, 'weight_decay': 0.019071566191676756}. 
[I 2024-04-21 00:12:41,768] Trial 269 finished with values: [5.042589093520321, 0.45943745465578484, 0.1884323721234552, 54.13381835238072] and parameters: {'dropout': 0.6058998462307807, 'loss_fn': 'MSE', 'optimizer': 'Adam', 'lr': 0.0015930271303742885, 'weight_decay': 1.7247938315021415e-05}. 
[I 2024-04-21 00:14:11,190] Trial 270 finished with values: [4.40794310808864, 0.5369670043843509, 0.2685613625992497, 48.78899178934271] and parameters: {'dropout': 0.39194832009245817, 'loss_fn': 'MAE', 'optimizer': 'RMSprop', 'lr': 0.0001491541885129046, 'weight_decay': 1.4907661237417258e-05}. 
[I 2024-04-21 00:14:46,474] Trial 271 finished with values: [5.496834755597362, 0.20902387722583424, -0.13362753129588967, 75.61610979851045] and parameters: {'dropout': 0.4192473753118856, 'loss_fn': 'MAE', 'optimizer': 'SGD', 'lr': 0.000335245518363157, 'weight_decay': 0.005991336114926054}. 
[I 2024-04-21 00:15:30,688] Trial 272 finished with values: [4.771834208845935, 0.4666520604871837, 0.19099040263250533, 53.963190601642204] and parameters: {'dropout': 0.5634732513230846, 'loss_fn': 'MAE', 'optimizer': 'RMSprop', 'lr': 0.000335245518363157, 'weight_decay': 2.015378107650812e-05}. 
[I 2024-04-21 00:16:08,687] Trial 273 finished with values: [4.875322478005973, 0.49033509120550156, 0.23888830573256492, 50.76826722518517] and parameters: {'dropout': 0.30637133564849045, 'loss_fn': 'MSE', 'optimizer': 'RMSprop', 'lr': 0.0025780908544626364, 'weight_decay': 2.852096806768039e-05}. 
[I 2024-04-21 00:16:50,799] Trial 274 finished with values: [4.79950666891456, 0.4572828960222459, 0.1504107704105866, 56.66996495297443] and parameters: {'dropout': 0.30637133564849045, 'loss_fn': 'MAE', 'optimizer': 'RMSprop', 'lr': 0.0001929641914798421, 'weight_decay': 0.00035756652600816603}. 
[I 2024-04-21 00:17:42,036] Trial 275 finished with values: [4.599076436794639, 0.49829057800092025, 0.2241414603079559, 51.75192283694875] and parameters: {'dropout': 0.3586828909877259, 'loss_fn': 'MAE', 'optimizer': 'Adam', 'lr': 0.00018992574144438838, 'weight_decay': 0.0015147055767583942}. 
[I 2024-04-21 00:19:44,982] Trial 276 finished with values: [4.480016015452067, 0.5531260748235872, 0.2757239305524808, 48.311228582434985] and parameters: {'dropout': 0.3757170916790723, 'loss_fn': 'MAE', 'optimizer': 'Adam', 'lr': 0.004321273212744161, 'weight_decay': 1.4907661237417258e-05}. 
[I 2024-04-21 00:20:40,502] Trial 277 finished with values: [4.708218749624907, 0.4966775587269413, 0.18993596872296126, 54.03352427657352] and parameters: {'dropout': 0.20547500706126287, 'loss_fn': 'MAE', 'optimizer': 'Adam', 'lr': 0.00045399421120754873, 'weight_decay': 2.015378107650812e-05}. 
[I 2024-04-21 00:21:39,393] Trial 278 finished with values: [5.32421394171244, 0.2078371166302498, -0.06781774452992662, 71.22641395527077] and parameters: {'dropout': 0.6045490532618478, 'loss_fn': 'MAE', 'optimizer': 'Adam', 'lr': 0.009727102560676675, 'weight_decay': 0.005991336114926054}. 
[I 2024-04-21 00:22:41,644] Trial 279 finished with values: [4.609388111968255, 0.5055293138714944, 0.21929432637721935, 52.075240153612434] and parameters: {'dropout': 0.39194832009245817, 'loss_fn': 'MAE', 'optimizer': 'Adam', 'lr': 0.00045399421120754873, 'weight_decay': 1.4907661237417258e-05}. 
[I 2024-04-21 00:24:08,201] Trial 280 finished with values: [4.560195064532383, 0.5314860864238097, 0.2579475753365943, 49.496960924596095] and parameters: {'dropout': 0.20547500706126287, 'loss_fn': 'MAE', 'optimizer': 'RMSprop', 'lr': 0.0001395036500361573, 'weight_decay': 5.669059377844915e-05}. 
[I 2024-04-21 00:25:34,374] Trial 281 finished with values: [4.585428126798394, 0.5076861004922488, 0.22336609360997361, 51.80364195257548] and parameters: {'dropout': 0.6032520316374994, 'loss_fn': 'MAE', 'optimizer': 'Adam', 'lr': 0.00013031592875001013, 'weight_decay': 1.4907661237417258e-05}. 
[I 2024-04-21 00:26:47,077] Trial 282 finished with values: [4.592461873395766, 0.5266641996659888, 0.27457145367501357, 48.388101996057166] and parameters: {'dropout': 0.5912372289120311, 'loss_fn': 'MAE', 'optimizer': 'Adam', 'lr': 0.004271805895111922, 'weight_decay': 2.6900238709854604e-05}. 
[I 2024-04-21 00:28:16,844] Trial 283 finished with values: [4.652099366149918, 0.5391034921965863, 0.20300947373855893, 53.16148512489489] and parameters: {'dropout': 0.6043148734461228, 'loss_fn': 'MAE', 'optimizer': 'RMSprop', 'lr': 0.000141601199311595, 'weight_decay': 1.7247938315021415e-05}. 
[I 2024-04-21 00:29:09,109] Trial 284 finished with values: [4.850155237824265, 0.4858132023598867, 0.21028379795252716, 52.67626746451874] and parameters: {'dropout': 0.28295843110109903, 'loss_fn': 'MSE', 'optimizer': 'Adam', 'lr': 0.000141601199311595, 'weight_decay': 5.669059377844915e-05}. 
[I 2024-04-21 00:30:19,299] Trial 285 finished with values: [4.8356918702989935, 0.5046659494209259, 0.20623309030741954, 52.94646093247729] and parameters: {'dropout': 0.4773211130217321, 'loss_fn': 'MSE', 'optimizer': 'Adam', 'lr': 0.0001929641914798421, 'weight_decay': 3.122146452942344e-05}. 
[I 2024-04-21 00:31:02,986] Trial 286 finished with values: [4.864502552743263, 0.4556630548299333, 0.19091630765985346, 53.968132942431296] and parameters: {'dropout': 0.39194832009245817, 'loss_fn': 'MAE', 'optimizer': 'Adam', 'lr': 0.004271805895111922, 'weight_decay': 7.047973805145223e-05}. 
[I 2024-04-21 00:33:45,557] Trial 287 finished with values: [4.478499123625381, 0.5372795605159887, 0.25184924832997435, 49.90373629991947] and parameters: {'dropout': 0.39194832009245817, 'loss_fn': 'MAE', 'optimizer': 'Adam', 'lr': 0.00014322517933982416, 'weight_decay': 0.002337089366248497}. 
[I 2024-04-21 00:35:44,130] Trial 288 finished with values: [4.575424253213813, 0.5399341815859181, 0.25764553083420794, 49.51710813311561] and parameters: {'dropout': 0.47140953338649033, 'loss_fn': 'MAE', 'optimizer': 'Adam', 'lr': 0.000141601199311595, 'weight_decay': 0.0051005641935645525}. 
[I 2024-04-21 00:36:37,777] Trial 289 finished with values: [5.0100320903174715, 0.44166043895050966, 0.07397896645513802, 61.768178890480606] and parameters: {'dropout': 0.39194832009245817, 'loss_fn': 'MAE', 'optimizer': 'Adam', 'lr': 0.00013031592875001013, 'weight_decay': 7.047973805145223e-05}. 
[I 2024-04-21 00:37:26,239] Trial 290 finished with values: [5.087665415455723, 0.453775531509722, 0.19077290095817223, 53.97769856835411] and parameters: {'dropout': 0.6388664062107275, 'loss_fn': 'MSE', 'optimizer': 'Adam', 'lr': 0.0008649355346314794, 'weight_decay': 0.005991336114926054}. 
[I 2024-04-21 00:38:53,681] Trial 291 finished with values: [4.889071122451643, 0.48378882944779017, 0.23188524510729314, 51.23539084960953] and parameters: {'dropout': 0.20145961770575083, 'loss_fn': 'MSE', 'optimizer': 'Adam', 'lr': 0.016032538889276752, 'weight_decay': 2.015378107650812e-05}. 
