[I 2024-04-21 04:48:24,770] Trial 83 finished with values: [5.3431015273528635, 0.18091478527421384, -0.026935215392709155, 68.49943553710659] and parameters: {'dropout': 0.27615681943614306, 'num_heads': 8, 'bias': True, 'loss_fn': 'MAE', 'optimizer': 'Adam', 'lr': 0.0029330059977397314, 'weight_decay': 0.0129197497864599}. 
Training finished at Epoch 62, with validation result for [5.644222404775202, nan, -0.05610041532448018, 105.59457392892017]
Training finished at Epoch 30, with validation result for [5.196752255662806, 0.3554374055694173, 0.08634970997480218, 95.47110189765398]
Training finished at Epoch 63, with validation result for [5.586165674603175, nan, -0.025539827005238047, 99.91457747801356]
Training finished at Epoch 50, with validation result for [5.698901726734533, nan, -0.02743374059052628, 110.5226589770359]
Training finished at Epoch 87, with validation result for [5.439133029444116, -0.012462365691798026, -0.04187549863241791, 101.5958845450062]
Training finished at Epoch 61, with validation result for [6.785045852921452, 0.3802534068364029, -0.05407224517493936, 100.03823467146064]
Training finished at Epoch 64, with validation result for [5.150591275616596, -0.12745933615511798, -0.03595002140407977, 89.25903405346935]
Training finished at Epoch 48, with validation result for [5.258840210191079, -1.0, -0.013603384397245177, 97.52753351775192]
Training finished at Epoch 30, with validation result for [5.565106424153851, -1.0, -0.02985067306643474, 107.77753263756601]
Training finished at Epoch 110, with validation result for [5.570934066462848, nan, -0.038927668074983046, 99.69353300119887]
Training finished at Epoch 94, with validation result for [4.509968399301966, 0.31419886634681937, 0.051797108764933486, 60.22718822826979]
Training finished at Epoch 85, with validation result for [5.710736793348494, 0.13234750391989927, 0.011515603546155884, 102.84661856558527]
Training finished at Epoch 56, with validation result for [5.0321188786144555, nan, -0.011099352481326319, 80.93096923972269]
Training finished at Epoch 91, with validation result for [5.59358563130854, nan, -0.006571194391503665, 102.33116098895091]
Training finished at Epoch 35, with validation result for [5.581052827380952, nan, -0.03288318849384564, 97.70767371807966]
Training finished at Epoch 38, with validation result for [5.308063287123882, nan, -0.02260596530674941, 97.59886683416305]
Training finished at Epoch 79, with validation result for [4.737812114479312, 0.5798354253316275, 0.3276133845731505, 62.92240911031627]
Training finished at Epoch 53, with validation result for [5.019360794881166, 0.5188708834538837, 0.26536207723705973, 72.20005438829041]
Training finished at Epoch 40, with validation result for [4.738568149656364, 0.5278167895454204, 0.2576985961567011, 64.36535861951987]
Training finished at Epoch 56, with validation result for [5.695251488429514, nan, -0.02352500201684693, 104.9499000669099]
Training finished at Epoch 33, with validation result for [5.97571998396721, 0.08925756194264606, -0.06450512646397422, 117.42263653601826]
Training finished at Epoch 78, with validation result for [5.879287424993112, 0.027255478471437364, -0.02014696418557138, 110.80222359742542]
Training finished at Epoch 87, with validation result for [4.845022610624454, 0.5128154069804096, 0.24215140284098713, 71.70154183502956]
Training finished at Epoch 80, with validation result for [5.211788012722933, 0.5418897983362054, 0.29084552643308126, 71.70091125684475]
Training finished at Epoch 31, with validation result for [5.678180939392818, nan, -0.04509795713128972, 109.56229241704808]
Training finished at Epoch 34, with validation result for [5.507391995421396, -0.06576677382554322, -0.06267192279841205, 90.92894730133158]
Training finished at Epoch 50, with validation result for [5.279150738451581, -0.12892856446161544, -0.05015698807646585, 98.97051376332244]
Training finished at Epoch 60, with validation result for [4.52899493572337, 0.5873153676173677, 0.3357602956150193, 57.45589730490551]
Training finished at Epoch 97, with validation result for [5.22051790596532, -0.00545790520871486, -0.024580690791400794, 93.60635842189903]
Training finished at Epoch 35, with validation result for [5.055891943419317, -1.0, -0.021372162684500706, 84.9918936445785]
Training finished at Epoch 30, with validation result for [5.367416700996681, 1.0, -0.04329930977013441, 95.50714736379922]
Training finished at Epoch 105, with validation result for [4.433148798218687, 0.4033928872598601, 0.1331082228497501, 42.57738488239678]
Training finished at Epoch 54, with validation result for [5.482121109773573, 0.0035440749756536893, -0.04896490501721318, 103.26343699188918]
Training finished at Epoch 50, with validation result for [5.57377850533075, -1.0, -0.023576524593229342, 105.35841344705557]
Training finished at Epoch 70, with validation result for [4.96428199404762, nan, -0.03726915971095024, 73.36276975743286]
Training finished at Epoch 87, with validation result for [4.951424572549969, 0.41705714357270807, 0.15882381718132133, 75.21355463147691]
Training finished at Epoch 84, with validation result for [5.102641282139657, 0.4936610734685663, 0.22035380424689688, 75.77381320825492]
Training finished at Epoch 68, with validation result for [5.537407437113338, 0.33135274774188, 0.09156313741332545, 100.42641949942606]
Training finished at Epoch 117, with validation result for [5.23746969257044, nan, -0.014087094020683644, 83.7043975679314]
Training finished at Epoch 36, with validation result for [5.603001184603371, -0.0552853303308075, -0.04045475821274258, 105.34457975822556]
Training finished at Epoch 51, with validation result for [5.420448380390847, nan, -0.028612977445338528, 106.97349169810686]
Training finished at Epoch 45, with validation result for [5.1862681946557, nan, -0.04051873537517903, 85.04725570746477]
Training finished at Epoch 89, with validation result for [5.691609368771215, 1.0, -0.02187384464249109, 109.86270405368005]
Training finished at Epoch 42, with validation result for [5.158539438024479, 0.452902638453476, 0.16829327392908444, 80.94904998392887]
Training finished at Epoch 77, with validation result for [5.096079649945781, 0.4371576236564992, 0.17393334714586117, 88.43041559896875]
Training finished at Epoch 40, with validation result for [5.337235822337782, 0.024433290219271056, -0.021850581483284337, 104.05255050847573]
Training finished at Epoch 56, with validation result for [5.489155084093615, 0.52504318022153, 0.24550473471090706, 75.88633219403994]
Training finished at Epoch 44, with validation result for [5.963038283579025, 0.4246090481132441, 0.11853617198241606, 95.57396541669847]
Training finished at Epoch 57, with validation result for [5.472668217546772, nan, -0.058286989986783944, 84.36283274755657]
Training finished at Epoch 49, with validation result for [5.527618409601771, 0.44210215090003435, 0.1316583416325119, 89.741700402355]
Training finished at Epoch 77, with validation result for [4.927532106416037, 0.3109127130093766, 0.09609409918755174, 88.59930175396869]
Training finished at Epoch 51, with validation result for [5.3261583210444865, 0.37332409084262685, 0.051688304056434764, 90.2694597011232]
Training finished at Epoch 62, with validation result for [5.125409771290211, 0.4394143079607126, 0.16503829102568468, 75.72009578637277]
Training finished at Epoch 78, with validation result for [5.619720472886624, 0.09729247760562022, -0.013530137346245308, 101.83147003845188]
Training finished at Epoch 78, with validation result for [5.912606314396342, 0.10580884834217824, -0.024026118512981087, 105.00510049620767]
Training finished at Epoch 55, with validation result for [6.581190570617546, 0.2579862969450149, -0.140089928920901, 114.51787518506143]
Training finished at Epoch 101, with validation result for [5.005838797996881, 0.236681065593119, 0.04170681520113928, 88.95236087065679]
Training finished at Epoch 97, with validation result for [5.646197050266909, nan, -0.009152021400618882, 109.6179592503667]
Training finished at Epoch 74, with validation result for [5.313986662665954, -0.07638429534917529, -0.01436573418139897, 98.91822676667613]
Training finished at Epoch 65, with validation result for [4.808055064226832, 0.5587332769287158, 0.2946938211763649, 65.54044078951921]
Training finished at Epoch 31, with validation result for [5.564371714151503, -0.08476512115109608, -0.05237563929052835, 105.13797374773526]
[I 2024-04-21 04:48:51,935] Trial 84 finished with values: [5.74237598541074, 0.3783368085679714, -0.0722678400394301, 71.52324770477914] and parameters: {'dropout': 0.3123871851320933, 'num_heads': 2, 'bias': True, 'loss_fn': 'MSE', 'optimizer': 'RMSprop', 'lr': 0.0001387213039796065, 'weight_decay': 0.00011007350287228135}. 
[I 2024-04-21 04:49:11,173] Trial 85 finished with values: [4.951691543797106, 0.4974152604159097, 0.13599745516015604, 57.63137317432489] and parameters: {'dropout': 0.6799331143119542, 'num_heads': 2, 'bias': False, 'loss_fn': 'MAE', 'optimizer': 'Adam', 'lr': 0.002295064068704125, 'weight_decay': 1.242118945501002e-05}. 
[I 2024-04-21 04:49:30,256] Trial 86 finished with values: [5.44456385764558, 0.34217207743631056, 0.03861258827809333, 64.12721469508391] and parameters: {'dropout': 0.6656358839105669, 'num_heads': 8, 'bias': True, 'loss_fn': 'MSE', 'optimizer': 'Adam', 'lr': 0.0015605316138833955, 'weight_decay': 0.0002912764416436785}. 
[I 2024-04-21 04:49:52,510] Trial 87 finished with values: [6.19276628697839, 0.28394445839145865, -0.036177962904459626, 69.11595250709364] and parameters: {'dropout': 0.23263101391627533, 'num_heads': 8, 'bias': False, 'loss_fn': 'MSE', 'optimizer': 'RMSprop', 'lr': 0.0029330059977397314, 'weight_decay': 0.04302132200345548}. 
[I 2024-04-21 04:50:10,873] Trial 88 finished with values: [4.840552651695736, 0.5060017841540162, 0.246436425116757, 50.26478666532714] and parameters: {'dropout': 0.3693292913693079, 'num_heads': 1, 'bias': True, 'loss_fn': 'MAE', 'optimizer': 'RMSprop', 'lr': 0.0007652007103363772, 'weight_decay': 3.8599792229348496e-05}. 
[I 2024-04-21 04:50:38,155] Trial 89 finished with values: [6.698475693606341, 0.35962450341035307, -0.20979316651865165, 80.69656954113329] and parameters: {'dropout': 0.4591224360083581, 'num_heads': 4, 'bias': True, 'loss_fn': 'MSE', 'optimizer': 'RMSprop', 'lr': 0.0009964606938187815, 'weight_decay': 0.004256857040692242}. 
[I 2024-04-21 04:51:00,914] Trial 90 finished with values: [5.523778740747749, 0.10352199116478203, -0.02248441614493335, 68.20255484629784] and parameters: {'dropout': 0.5355168906744091, 'num_heads': 8, 'bias': True, 'loss_fn': 'MSE', 'optimizer': 'RMSprop', 'lr': 0.0029330059977397314, 'weight_decay': 0.04302132200345548}. 
[W 2024-04-21 04:51:30,301] Trial 91 failed with parameters: {'dropout': 0.507115799196707, 'num_heads': 2, 'bias': True, 'loss_fn': 'MAE', 'optimizer': 'RMSprop', 'lr': 0.035849503148900154, 'weight_decay': 0.00040689584172900014} because of the following error: The value nan is not acceptable.
[W 2024-04-21 04:51:30,301] Trial 91 failed with value [5.342994820751921, nan, -0.07413521673270385, 71.64780692478358].
[I 2024-04-21 04:51:53,158] Trial 92 finished with values: [5.3338184419508465, 0.2340358737446208, -0.07063647561733277, 71.4144311597878] and parameters: {'dropout': 0.5874682842915022, 'num_heads': 2, 'bias': True, 'loss_fn': 'MAE', 'optimizer': 'Adam', 'lr': 0.00010423634674715621, 'weight_decay': 0.00030304918584754363}. 
[I 2024-04-21 04:52:17,014] Trial 93 finished with values: [7.085829645340926, 0.2732227419790866, -0.6326669859854912, 108.90342962609174] and parameters: {'dropout': 0.49692633958605953, 'num_heads': 2, 'bias': True, 'loss_fn': 'MSE', 'optimizer': 'Adam', 'lr': 0.000576102341572922, 'weight_decay': 1.6370183019875382e-05}. 
[I 2024-04-21 04:52:48,741] Trial 94 finished with values: [5.272490961443004, 0.23779787280771728, 0.02953065711364533, 64.73300476735604] and parameters: {'dropout': 0.23263101391627533, 'num_heads': 8, 'bias': True, 'loss_fn': 'MSE', 'optimizer': 'RMSprop', 'lr': 0.0029330059977397314, 'weight_decay': 0.04302132200345548}. 
[W 2024-04-21 04:53:11,954] Trial 95 failed with parameters: {'dropout': 0.4934354255005909, 'num_heads': 2, 'bias': False, 'loss_fn': 'MAE', 'optimizer': 'RMSprop', 'lr': 0.04980993465337394, 'weight_decay': 9.60970719355184e-05} because of the following error: The value nan is not acceptable.
[W 2024-04-21 04:53:11,954] Trial 95 failed with value [5.344907312717446, nan, -0.07563845672152691, 71.74807721366622].
[I 2024-04-21 04:53:30,790] Trial 96 finished with values: [9.995969497414134, 0.16421689418826532, -2.581840235252588, 238.91870745232336] and parameters: {'dropout': 0.40694440742967963, 'num_heads': 4, 'bias': True, 'loss_fn': 'MSE', 'optimizer': 'Adam', 'lr': 0.000576102341572922, 'weight_decay': 1.6370183019875382e-05}. 
[W 2024-04-21 04:53:47,952] Trial 97 failed with parameters: {'dropout': 0.4244817098248359, 'num_heads': 4, 'bias': True, 'loss_fn': 'MAE', 'optimizer': 'SGD', 'lr': 0.004140832904032362, 'weight_decay': 0.08238445328093112} because of the following error: The value nan is not acceptable.
[W 2024-04-21 04:53:47,953] Trial 97 failed with value [5.397503736844406, nan, -0.10852053806982487, 73.94140350911543].
[I 2024-04-21 04:54:10,075] Trial 98 finished with values: [5.280555218250364, 0.36961465683471284, 0.10242514083595389, 59.87073992931805] and parameters: {'dropout': 0.4591224360083581, 'num_heads': 2, 'bias': True, 'loss_fn': 'MSE', 'optimizer': 'Adam', 'lr': 0.0014938197620523084, 'weight_decay': 0.0009823700199596424}. 
[I 2024-04-21 04:54:28,519] Trial 99 finished with values: [10.852829658223257, 0.1676296027089789, -2.2175178240637274, 214.61738917450847] and parameters: {'dropout': 0.3782344884327923, 'num_heads': 4, 'bias': True, 'loss_fn': 'MSE', 'optimizer': 'RMSprop', 'lr': 0.00014156502573707663, 'weight_decay': 0.008786434562845464}. 
[I 2024-04-21 04:54:51,580] Trial 100 finished with values: [5.019734223897531, 0.467667727566494, 0.20985637242654387, 52.704777936090025] and parameters: {'dropout': 0.39240749140537745, 'num_heads': 2, 'bias': False, 'loss_fn': 'MAE', 'optimizer': 'Adam', 'lr': 0.0004595462048380458, 'weight_decay': 1.2266916063951385e-05}. 
[I 2024-04-21 04:55:19,053] Trial 101 finished with values: [5.2601935200018195, 0.3753430817272095, 0.12755233345989503, 58.19468628389513] and parameters: {'dropout': 0.36462849101759043, 'num_heads': 4, 'bias': True, 'loss_fn': 'MAE', 'optimizer': 'Adam', 'lr': 0.0009964606938187815, 'weight_decay': 2.4265340760230575e-05}. 
[I 2024-04-21 04:55:37,758] Trial 102 finished with values: [5.41729143882361, 0.24842652535230358, 0.0161603041765761, 65.62484450115161] and parameters: {'dropout': 0.36462849101759043, 'num_heads': 8, 'bias': True, 'loss_fn': 'MAE', 'optimizer': 'Adam', 'lr': 0.0004253239218964941, 'weight_decay': 0.00014543044683541578}. 
[I 2024-04-21 04:56:07,598] Trial 103 finished with values: [5.9329394439197545, 0.2871342802004808, -0.06959950677304172, 71.34526245329218] and parameters: {'dropout': 0.3693292913693079, 'num_heads': 2, 'bias': False, 'loss_fn': 'MAE', 'optimizer': 'Adam', 'lr': 0.0005080531794315761, 'weight_decay': 1.242118945501002e-05}. 
[I 2024-04-21 04:56:21,748] Trial 104 finished with values: [6.000733718291362, 0.07963203689212331, -0.08412460633488195, 72.31412699916896] and parameters: {'dropout': 0.6799331143119542, 'num_heads': 4, 'bias': True, 'loss_fn': 'MSE', 'optimizer': 'RMSprop', 'lr': 0.002295064068704125, 'weight_decay': 1.242118945501002e-05}. 
[I 2024-04-21 04:56:52,108] Trial 105 finished with values: [7.080980221973737, 0.20249761142395928, -0.3575528953195488, 90.55255448182584] and parameters: {'dropout': 0.2821410560364346, 'num_heads': 2, 'bias': False, 'loss_fn': 'MSE', 'optimizer': 'Adam', 'lr': 0.0011654469827644348, 'weight_decay': 0.008703989229147282}. 
[W 2024-04-21 04:57:09,146] Trial 106 failed with parameters: {'dropout': 0.6124531667551212, 'num_heads': 8, 'bias': False, 'loss_fn': 'MAE', 'optimizer': 'RMSprop', 'lr': 0.004537554633990853, 'weight_decay': 1.3344143820661265e-05} because of the following error: The value nan is not acceptable.
[W 2024-04-21 04:57:09,146] Trial 106 failed with value [5.344238695891633, nan, -0.07515889406549547, 71.7160890504886].
[I 2024-04-21 04:57:58,039] Trial 107 finished with values: [5.906784463317538, 0.055606484700912534, -0.23016254604231756, 82.05526381775192] and parameters: {'dropout': 0.369285731780725, 'num_heads': 4, 'bias': True, 'loss_fn': 'MSE', 'optimizer': 'RMSprop', 'lr': 0.05299656470699565, 'weight_decay': 0.0002912764416436785}. 
[I 2024-04-21 04:58:14,144] Trial 108 finished with values: [5.500694581763291, 0.0364650952616721, -0.13565452645042786, 75.75131601389884] and parameters: {'dropout': 0.6799331143119542, 'num_heads': 8, 'bias': False, 'loss_fn': 'MAE', 'optimizer': 'Adam', 'lr': 0.002295064068704125, 'weight_decay': 1.242118945501002e-05}. 
[I 2024-04-21 04:58:34,766] Trial 109 finished with values: [5.268942138606786, 0.20797178714477157, -0.03442251337889002, 68.99885914052774] and parameters: {'dropout': 0.29312324544132023, 'num_heads': 4, 'bias': True, 'loss_fn': 'MAE', 'optimizer': 'RMSprop', 'lr': 0.0030062079445763094, 'weight_decay': 6.24075916043652e-05}. 
[I 2024-04-21 04:58:53,742] Trial 110 finished with values: [5.307093348547675, 0.1735900003891789, -0.011678745979893934, 67.48178658768641] and parameters: {'dropout': 0.23263101391627533, 'num_heads': 8, 'bias': True, 'loss_fn': 'MAE', 'optimizer': 'RMSprop', 'lr': 0.0001878993860460867, 'weight_decay': 0.04302132200345548}. 
[W 2024-04-21 04:59:09,601] Trial 111 failed with parameters: {'dropout': 0.6592683158653476, 'num_heads': 4, 'bias': True, 'loss_fn': 'MAE', 'optimizer': 'SGD', 'lr': 0.004140832904032362, 'weight_decay': 0.08238445328093112} because of the following error: The value nan is not acceptable.
[W 2024-04-21 04:59:09,601] Trial 111 failed with value [5.396827239880899, nan, -0.10818815599755127, 73.9192327002931].
[I 2024-04-21 04:59:34,703] Trial 112 finished with values: [5.517960574695013, 0.17880937948482947, -0.14390801515370577, 76.30184666949646] and parameters: {'dropout': 0.4934354255005909, 'num_heads': 2, 'bias': True, 'loss_fn': 'MAE', 'optimizer': 'SGD', 'lr': 0.00014156502573707663, 'weight_decay': 0.00016092681250246313}. 
[W 2024-04-21 05:00:06,314] Trial 113 failed with parameters: {'dropout': 0.4277571908944222, 'num_heads': 2, 'bias': False, 'loss_fn': 'MAE', 'optimizer': 'Adam', 'lr': 0.01717316312011277, 'weight_decay': 0.027048200471411765} because of the following error: The value nan is not acceptable.
[W 2024-04-21 05:00:06,314] Trial 113 failed with value [5.357924611303719, nan, -0.08527894462308883, 72.39112457406546].
[I 2024-04-21 05:00:24,599] Trial 114 finished with values: [8.093444738507914, 0.1869137875730602, -0.782053079679013, 118.86789762925241] and parameters: {'dropout': 0.29312324544132023, 'num_heads': 1, 'bias': True, 'loss_fn': 'MSE', 'optimizer': 'RMSprop', 'lr': 0.0001083005560110781, 'weight_decay': 6.24075916043652e-05}. 
[W 2024-04-21 05:00:45,418] Trial 115 failed with parameters: {'dropout': 0.3590963316104463, 'num_heads': 2, 'bias': True, 'loss_fn': 'MAE', 'optimizer': 'Adam', 'lr': 0.015158910997762056, 'weight_decay': 4.814482454091352e-05} because of the following error: The value nan is not acceptable.
[W 2024-04-21 05:00:45,418] Trial 115 failed with value [5.345396804971797, nan, -0.07599050997933277, 71.77156014528376].
[I 2024-04-21 05:01:44,255] Trial 116 finished with values: [5.341403398415751, 0.20184151578850243, -0.07278323129906661, 71.55762573548321] and parameters: {'dropout': 0.6124531667551212, 'num_heads': 8, 'bias': False, 'loss_fn': 'MSE', 'optimizer': 'RMSprop', 'lr': 0.022267826159890605, 'weight_decay': 0.0011245990164565015}. 
[I 2024-04-21 05:02:06,539] Trial 117 finished with values: [5.344173442373375, 0.20184151578850243, -0.07511217293306616, 71.71297262098935] and parameters: {'dropout': 0.6661280330898132, 'num_heads': 1, 'bias': True, 'loss_fn': 'MAE', 'optimizer': 'Adam', 'lr': 0.04980993465337394, 'weight_decay': 0.00029822251778626087}. 
[I 2024-04-21 05:02:36,972] Trial 118 finished with values: [5.346275668305562, 0.1748282402287621, -0.08226730377952562, 72.1902397521873] and parameters: {'dropout': 0.49692633958605953, 'num_heads': 2, 'bias': False, 'loss_fn': 'MAE', 'optimizer': 'Adam', 'lr': 0.00019068977711989097, 'weight_decay': 0.05707890586298062}. 
[W 2024-04-21 05:03:02,465] Trial 119 failed with parameters: {'dropout': 0.6862518882434415, 'num_heads': 2, 'bias': False, 'loss_fn': 'MAE', 'optimizer': 'SGD', 'lr': 0.0013019231193295388, 'weight_decay': 0.0013006916106938068} because of the following error: The value nan is not acceptable.
[W 2024-04-21 05:03:02,465] Trial 119 failed with value [5.352306892696808, nan, -0.08104760988816428, 72.10888277675787].
[I 2024-04-21 05:03:19,722] Trial 120 finished with values: [5.19750920629093, 0.2681200309592788, -0.0018492854678950899, 66.8261342284977] and parameters: {'dropout': 0.3523515642029993, 'num_heads': 4, 'bias': False, 'loss_fn': 'MAE', 'optimizer': 'Adam', 'lr': 0.002127848460471393, 'weight_decay': 0.0017662217759353337}. 
[I 2024-04-21 05:03:37,703] Trial 121 finished with values: [5.82672796326806, 0.07379474849048215, -0.22470974016170353, 81.69154649720737] and parameters: {'dropout': 0.34354910905945135, 'num_heads': 1, 'bias': True, 'loss_fn': 'MSE', 'optimizer': 'RMSprop', 'lr': 0.023737222675975948, 'weight_decay': 0.014174306093951507}. 
