[I 2024-04-21 03:33:09,896] Trial 28 finished with values: [5.347787019338385, -0.20184151578850243, -0.07772134389909868, 71.88701158246823] and parameters: {'dropout': 0.6088158616689293, 'num_heads': 4, 'bias': True, 'loss_fn': 'MAE', 'optimizer': 'Adam', 'lr': 0.09076957496661116, 'weight_decay': 0.0026666731751997775}. 
[I 2024-04-21 03:33:25,561] Trial 29 finished with values: [5.3798890240870225, -0.06246346860257571, -0.09716686033951594, 73.18408162148403] and parameters: {'dropout': 0.43587544545217394, 'num_heads': 2, 'bias': True, 'loss_fn': 'MAE', 'optimizer': 'Adam', 'lr': 0.015158910997762056, 'weight_decay': 0.02859775225320811}. 
[I 2024-04-21 03:33:55,156] Trial 30 finished with values: [5.979579654263909, 0.40197035783377855, -0.0747859925266594, 71.69121548053178] and parameters: {'dropout': 0.3693292913693079, 'num_heads': 1, 'bias': False, 'loss_fn': 'MSE', 'optimizer': 'RMSprop', 'lr': 0.0005080531794315761, 'weight_decay': 4.1451227238323664e-05}. 
[I 2024-04-21 03:34:18,144] Trial 31 finished with values: [5.0787916146477405, 0.4818633682156822, 0.19094301299187755, 53.9663516224979] and parameters: {'dropout': 0.4591224360083581, 'num_heads': 4, 'bias': True, 'loss_fn': 'MSE', 'optimizer': 'Adam', 'lr': 0.0009964606938187815, 'weight_decay': 2.4265340760230575e-05}. 
[I 2024-04-21 03:34:35,653] Trial 32 finished with values: [8.040323640463376, 0.14884626782555188, -0.8833192184488854, 125.62263078163137] and parameters: {'dropout': 0.41065410790410595, 'num_heads': 1, 'bias': True, 'loss_fn': 'MSE', 'optimizer': 'Adam', 'lr': 0.0004176565571188342, 'weight_decay': 0.02102546645501903}. 
[I 2024-04-21 03:34:53,985] Trial 33 finished with values: [5.3631625249698525, -1.0, -0.08900822419381482, 72.63987789533228] and parameters: {'dropout': 0.5910487247964707, 'num_heads': 8, 'bias': False, 'loss_fn': 'MAE', 'optimizer': 'SGD', 'lr': 0.038441643436581435, 'weight_decay': 0.035930213056032154}. 
[I 2024-04-21 03:35:05,978] Trial 34 finished with values: [5.698304405636698, -0.20184151578850243, -0.19711925094194238, 79.85118411658385] and parameters: {'dropout': 0.6263575826452481, 'num_heads': 2, 'bias': True, 'loss_fn': 'MAE', 'optimizer': 'SGD', 'lr': 0.0001438249113053528, 'weight_decay': 0.00010664808337930002}. 
[I 2024-04-21 03:35:33,242] Trial 35 finished with values: [5.5150396478699815, 0.05396445378038283, -0.14945676928993223, 76.67196400559381] and parameters: {'dropout': 0.5355168906744091, 'num_heads': 1, 'bias': True, 'loss_fn': 'MSE', 'optimizer': 'RMSprop', 'lr': 0.004181288056796252, 'weight_decay': 0.0008534996447462057}. 
[I 2024-04-21 03:36:05,083] Trial 36 finished with values: [7.095084263351353, 0.326105677430537, -0.6105265590606892, 107.42660156121762] and parameters: {'dropout': 0.49759713129295235, 'num_heads': 4, 'bias': False, 'loss_fn': 'MSE', 'optimizer': 'RMSprop', 'lr': 0.0005469219784306733, 'weight_decay': 0.00016446991547865993}. 
[I 2024-04-21 03:36:34,493] Trial 37 finished with values: [4.984589362116625, 0.4263449119485407, 0.15464093260573697, 56.38780136733149] and parameters: {'dropout': 0.4244817098248359, 'num_heads': 2, 'bias': False, 'loss_fn': 'MSE', 'optimizer': 'RMSprop', 'lr': 0.00015587385647697547, 'weight_decay': 4.221917657289298e-05}. 
[W 2024-04-21 03:42:45,835] Trial 38 failed with parameters: {'dropout': 0.22965930635143972, 'num_heads': 4, 'bias': True, 'loss_fn': 'MSE', 'optimizer': 'SGD', 'lr': 0.01645085964045575, 'weight_decay': 0.0022120569369392584} because of the following error: The value nan is not acceptable.
[W 2024-04-21 03:42:45,835] Trial 38 failed with value [nan, nan, nan, nan].
[I 2024-04-21 03:42:56,364] Trial 39 finished with values: [5.73146304244581, -0.14047869503457666, -0.20519337368255108, 80.38975056352132] and parameters: {'dropout': 0.6602935351489527, 'num_heads': 4, 'bias': False, 'loss_fn': 'MAE', 'optimizer': 'SGD', 'lr': 0.0003682154988631504, 'weight_decay': 0.0006185709740922699}. 
[I 2024-04-21 03:43:07,944] Trial 40 finished with values: [5.423223969247479, 0.18233899762296704, -0.051847523223029324, 70.16115576904059] and parameters: {'dropout': 0.21897029092123005, 'num_heads': 1, 'bias': False, 'loss_fn': 'MAE', 'optimizer': 'RMSprop', 'lr': 0.002127848460471393, 'weight_decay': 0.0017662217759353337}. 
[I 2024-04-21 03:43:22,360] Trial 41 finished with values: [5.682077533322429, -0.01703669529568176, -0.1930865848985548, 79.58219407364713] and parameters: {'dropout': 0.5874682842915022, 'num_heads': 2, 'bias': True, 'loss_fn': 'MAE', 'optimizer': 'SGD', 'lr': 0.00010423634674715621, 'weight_decay': 0.0009150299741228911}. 
[W 2024-04-21 03:49:34,828] Trial 42 failed with parameters: {'dropout': 0.3701925226301349, 'num_heads': 8, 'bias': True, 'loss_fn': 'MSE', 'optimizer': 'SGD', 'lr': 0.06937486443216109, 'weight_decay': 5.435737029047967e-05} because of the following error: The value nan is not acceptable.
[W 2024-04-21 03:49:34,828] Trial 42 failed with value [nan, nan, nan, nan].
[W 2024-04-21 03:55:41,624] Trial 43 failed with parameters: {'dropout': 0.46861384671067663, 'num_heads': 2, 'bias': False, 'loss_fn': 'MSE', 'optimizer': 'SGD', 'lr': 0.0005147885145306738, 'weight_decay': 0.000342930536632956} because of the following error: The value nan is not acceptable.
[W 2024-04-21 03:55:41,624] Trial 43 failed with value [nan, nan, nan, nan].
[W 2024-04-21 04:01:52,800] Trial 44 failed with parameters: {'dropout': 0.46840148543090865, 'num_heads': 2, 'bias': True, 'loss_fn': 'MAE', 'optimizer': 'SGD', 'lr': 0.0635153756715315, 'weight_decay': 0.005200723479780752} because of the following error: The value nan is not acceptable.
[W 2024-04-21 04:01:52,800] Trial 44 failed with value [nan, nan, nan, nan].
[I 2024-04-21 04:02:20,622] Trial 45 finished with values: [6.336939286254878, 0.3216937745900337, -0.16281217097219436, 77.56280644910319] and parameters: {'dropout': 0.49692633958605953, 'num_heads': 2, 'bias': True, 'loss_fn': 'MSE', 'optimizer': 'Adam', 'lr': 0.000576102341572922, 'weight_decay': 1.6370183019875382e-05}. 
[I 2024-04-21 04:02:57,571] Trial 46 finished with values: [5.405036300555759, -0.05906400478636964, -0.07096319629534564, 71.43622433786439] and parameters: {'dropout': 0.4277571908944222, 'num_heads': 1, 'bias': True, 'loss_fn': 'MSE', 'optimizer': 'Adam', 'lr': 0.0035578235240887562, 'weight_decay': 6.0239055358915006e-05}. 
[I 2024-04-21 04:03:13,503] Trial 47 finished with values: [5.3462402303682275, 0.14095394412929638, -0.07659903711752136, 71.81215059816738] and parameters: {'dropout': 0.39240749140537745, 'num_heads': 2, 'bias': False, 'loss_fn': 'MAE', 'optimizer': 'Adam', 'lr': 0.032186343654346194, 'weight_decay': 0.0003205913019541971}. 
[I 2024-04-21 04:03:22,869] Trial 48 finished with values: [5.36971407175305, 1.0, -0.0933854407504473, 72.93185041595359] and parameters: {'dropout': 0.5039308466375886, 'num_heads': 1, 'bias': False, 'loss_fn': 'MAE', 'optimizer': 'SGD', 'lr': 0.02612923890676587, 'weight_decay': 0.00219078254882845}. 
[W 2024-04-21 04:09:34,210] Trial 49 failed with parameters: {'dropout': 0.299722236212346, 'num_heads': 1, 'bias': True, 'loss_fn': 'MSE', 'optimizer': 'SGD', 'lr': 0.009080064106294935, 'weight_decay': 0.00139333444034772} because of the following error: The value nan is not acceptable.
[W 2024-04-21 04:09:34,211] Trial 49 failed with value [nan, nan, nan, nan].
[I 2024-04-21 04:10:21,086] Trial 50 finished with values: [6.252322497835575, 0.28618113527397465, -0.11702402713982418, 74.50860988461027] and parameters: {'dropout': 0.41583579683239735, 'num_heads': 4, 'bias': True, 'loss_fn': 'MAE', 'optimizer': 'Adam', 'lr': 0.00036501068151543, 'weight_decay': 4.567853269399096e-05}. 
[I 2024-04-21 04:10:43,298] Trial 51 finished with values: [5.330583844125533, 0.17079997418341597, -0.06328859884065641, 70.92430733887464] and parameters: {'dropout': 0.6122433820616829, 'num_heads': 2, 'bias': False, 'loss_fn': 'MAE', 'optimizer': 'Adam', 'lr': 0.0008004133642386541, 'weight_decay': 0.027048200471411765}. 
[I 2024-04-21 04:11:04,665] Trial 52 finished with values: [5.357111712113413, 0.14095394412929638, -0.08465999660965018, 72.34983901981445] and parameters: {'dropout': 0.6124531667551212, 'num_heads': 4, 'bias': False, 'loss_fn': 'MAE', 'optimizer': 'Adam', 'lr': 0.004537554633990853, 'weight_decay': 0.0011245990164565015}. 
[I 2024-04-21 04:11:33,176] Trial 53 finished with values: [5.35895981389628, 0.20184151578850243, -0.08601443788977114, 72.44018402090681] and parameters: {'dropout': 0.6661280330898132, 'num_heads': 4, 'bias': True, 'loss_fn': 'MAE', 'optimizer': 'RMSprop', 'lr': 0.04980993465337394, 'weight_decay': 0.00029822251778626087}. 
[W 2024-04-21 04:17:45,425] Trial 54 failed with parameters: {'dropout': 0.294815976407234, 'num_heads': 8, 'bias': True, 'loss_fn': 'MSE', 'optimizer': 'SGD', 'lr': 0.04818986401679037, 'weight_decay': 0.004813690067276256} because of the following error: The value nan is not acceptable.
[W 2024-04-21 04:17:45,425] Trial 54 failed with value [nan, nan, nan, nan].
[W 2024-04-21 04:24:25,183] Trial 55 failed with parameters: {'dropout': 0.434299784638721, 'num_heads': 1, 'bias': False, 'loss_fn': 'MSE', 'optimizer': 'SGD', 'lr': 0.0038908678791725647, 'weight_decay': 1.0728612640943889e-05} because of the following error: The value nan is not acceptable.
[W 2024-04-21 04:24:25,183] Trial 55 failed with value [nan, nan, nan, nan].
[I 2024-04-21 04:24:55,294] Trial 56 finished with values: [5.36736144975886, 0.3539937325218011, 0.066353024659344, 62.27685042167448] and parameters: {'dropout': 0.4934354255005909, 'num_heads': 2, 'bias': False, 'loss_fn': 'MAE', 'optimizer': 'RMSprop', 'lr': 0.0004595462048380458, 'weight_decay': 0.00016092681250246313}. 
[I 2024-04-21 04:25:21,633] Trial 57 finished with values: [5.190231104976833, 0.37824302864404125, 0.08783101385743486, 60.844208795903874] and parameters: {'dropout': 0.507115799196707, 'num_heads': 2, 'bias': True, 'loss_fn': 'MSE', 'optimizer': 'RMSprop', 'lr': 0.0014938197620523084, 'weight_decay': 0.0009823700199596424}. 
[I 2024-04-21 04:25:45,909] Trial 58 finished with values: [7.012918643798949, 0.16110203569078338, -0.47551289268227137, 98.42081444038139] and parameters: {'dropout': 0.4104952143247159, 'num_heads': 2, 'bias': True, 'loss_fn': 'MAE', 'optimizer': 'RMSprop', 'lr': 0.0001359162559976252, 'weight_decay': 0.0011396091886266457}. 
[W 2024-04-21 04:32:46,945] Trial 59 failed with parameters: {'dropout': 0.4015144329845225, 'num_heads': 8, 'bias': True, 'loss_fn': 'MSE', 'optimizer': 'SGD', 'lr': 0.014402787492111145, 'weight_decay': 0.0003807139246289713} because of the following error: The value nan is not acceptable.
[W 2024-04-21 04:32:46,945] Trial 59 failed with value [nan, nan, nan, nan].
[W 2024-04-21 04:33:26,270] Trial 60 failed with parameters: {'dropout': 0.63229652553858, 'num_heads': 8, 'bias': False, 'loss_fn': 'MSE', 'optimizer': 'RMSprop', 'lr': 0.009437270803486945, 'weight_decay': 0.004074486795723717} because of the following error: The value nan is not acceptable.
[W 2024-04-21 04:33:26,270] Trial 60 failed with value [5.339900000199804, nan, -0.07151745474846827, 71.47319491849255].
[I 2024-04-21 04:33:40,513] Trial 61 finished with values: [5.376506945456849, 0.10795174674535368, -0.0246978918710834, 68.35019983455388] and parameters: {'dropout': 0.27615681943614306, 'num_heads': 8, 'bias': True, 'loss_fn': 'MAE', 'optimizer': 'Adam', 'lr': 0.00010513278234893674, 'weight_decay': 0.0129197497864599}. 
[I 2024-04-21 04:33:57,339] Trial 62 finished with values: [5.397530764337203, -0.14047869503457666, -0.10853382803132927, 73.94228998651704] and parameters: {'dropout': 0.3577120127608717, 'num_heads': 4, 'bias': True, 'loss_fn': 'MAE', 'optimizer': 'SGD', 'lr': 0.004140832904032362, 'weight_decay': 0.08238445328093112}. 
[I 2024-04-21 04:34:11,723] Trial 63 finished with values: [5.342857527366762, 0.20184151578850243, -0.07401808940155385, 71.63999420597767] and parameters: {'dropout': 0.47590060731940703, 'num_heads': 2, 'bias': False, 'loss_fn': 'MAE', 'optimizer': 'SGD', 'lr': 0.035849503148900154, 'weight_decay': 0.00040689584172900014}. 
[I 2024-04-21 04:34:44,102] Trial 64 finished with values: [5.346609312058856, -0.14095394412929638, -0.07686609102603792, 71.82996383674092] and parameters: {'dropout': 0.3590963316104463, 'num_heads': 8, 'bias': True, 'loss_fn': 'MAE', 'optimizer': 'Adam', 'lr': 0.008458567404280862, 'weight_decay': 8.955764593347946e-05}. 
[I 2024-04-21 04:34:57,155] Trial 65 finished with values: [8.007396738166914, 0.13749731264736986, -0.8049371634460265, 120.39432967416465] and parameters: {'dropout': 0.5713805006466309, 'num_heads': 2, 'bias': True, 'loss_fn': 'MSE', 'optimizer': 'RMSprop', 'lr': 0.0001387213039796065, 'weight_decay': 0.00011007350287228135}. 
[W 2024-04-21 04:41:59,869] Trial 66 failed with parameters: {'dropout': 0.2894236711061273, 'num_heads': 8, 'bias': True, 'loss_fn': 'MSE', 'optimizer': 'SGD', 'lr': 0.0004288756861676719, 'weight_decay': 0.04046357373605561} because of the following error: The value nan is not acceptable.
[W 2024-04-21 04:41:59,869] Trial 66 failed with value [nan, nan, nan, nan].
[I 2024-04-21 04:42:25,659] Trial 67 finished with values: [5.258226532319583, 0.3585895282152764, 0.03568987600103035, 64.32216773420004] and parameters: {'dropout': 0.6036800503860398, 'num_heads': 2, 'bias': False, 'loss_fn': 'MAE', 'optimizer': 'RMSprop', 'lr': 0.0002316368618636525, 'weight_decay': 6.688801576236445e-05}. 
[I 2024-04-21 04:42:42,757] Trial 68 finished with values: [5.341378793293757, 0.17537082088068856, -0.015053295678801426, 67.7068784397354] and parameters: {'dropout': 0.36462849101759043, 'num_heads': 8, 'bias': True, 'loss_fn': 'MAE', 'optimizer': 'Adam', 'lr': 0.00019068977711989097, 'weight_decay': 0.05707890586298062}. 
[I 2024-04-21 04:43:03,156] Trial 69 finished with values: [10.120760096358444, 0.204700128672144, -2.005350492497625, 200.46523796394308] and parameters: {'dropout': 0.2821410560364346, 'num_heads': 8, 'bias': False, 'loss_fn': 'MSE', 'optimizer': 'Adam', 'lr': 0.0011654469827644348, 'weight_decay': 0.008703989229147282}. 
[I 2024-04-21 04:43:17,381] Trial 70 finished with values: [8.194312396212661, 0.2363702498912687, -1.1112034521111953, 140.82314308240484] and parameters: {'dropout': 0.29312324544132023, 'num_heads': 4, 'bias': True, 'loss_fn': 'MSE', 'optimizer': 'RMSprop', 'lr': 0.0001083005560110781, 'weight_decay': 6.24075916043652e-05}. 
[I 2024-04-21 04:43:35,888] Trial 71 finished with values: [5.3483854943766245, 0.20184151578850243, -0.07815777061602436, 71.91612245851438] and parameters: {'dropout': 0.4386695283272092, 'num_heads': 2, 'bias': True, 'loss_fn': 'MAE', 'optimizer': 'RMSprop', 'lr': 0.04980993465337394, 'weight_decay': 0.0004069483896148316}. 
[I 2024-04-21 04:43:53,295] Trial 72 finished with values: [5.6283396858861146, 0.2649664815532948, 0.02044210306587002, 65.33923660436926] and parameters: {'dropout': 0.4104952143247159, 'num_heads': 2, 'bias': True, 'loss_fn': 'MAE', 'optimizer': 'RMSprop', 'lr': 0.0001359162559976252, 'weight_decay': 0.0011396091886266457}. 
[I 2024-04-21 04:44:17,782] Trial 73 finished with values: [5.022307760711175, 0.39722884842156975, 0.1536118997789634, 56.45644071938272] and parameters: {'dropout': 0.4934354255005909, 'num_heads': 2, 'bias': False, 'loss_fn': 'MAE', 'optimizer': 'RMSprop', 'lr': 0.0020026931174657535, 'weight_decay': 0.00016092681250246313}. 
[I 2024-04-21 04:44:36,619] Trial 74 finished with values: [6.062286171761892, 0.2993998996712157, 0.009760424200808804, 66.05173429836015] and parameters: {'dropout': 0.3523515642029993, 'num_heads': 4, 'bias': True, 'loss_fn': 'MAE', 'optimizer': 'RMSprop', 'lr': 0.00028094742988670466, 'weight_decay': 0.002777272327764429}. 
[I 2024-04-21 04:44:59,465] Trial 75 finished with values: [5.046831665305269, 0.3754513249292701, 0.05821830612428769, 62.81945877666356] and parameters: {'dropout': 0.3629852321658984, 'num_heads': 4, 'bias': False, 'loss_fn': 'MAE', 'optimizer': 'Adam', 'lr': 0.0035578235240887562, 'weight_decay': 6.0239055358915006e-05}. 
[I 2024-04-21 04:45:27,842] Trial 76 finished with values: [5.3286129231096515, 0.20184576354441044, -0.010983688573673156, 67.43542432522003] and parameters: {'dropout': 0.6656358839105669, 'num_heads': 1, 'bias': False, 'loss_fn': 'MSE', 'optimizer': 'RMSprop', 'lr': 0.0015605316138833955, 'weight_decay': 0.0002912764416436785}. 
[I 2024-04-21 04:45:56,270] Trial 77 finished with values: [5.8660374161360265, 0.01631001274034992, -0.17376390056544633, 78.29331727787627] and parameters: {'dropout': 0.4277571908944222, 'num_heads': 1, 'bias': True, 'loss_fn': 'MSE', 'optimizer': 'Adam', 'lr': 0.0035578235240887562, 'weight_decay': 6.0239055358915006e-05}. 
[I 2024-04-21 04:46:16,690] Trial 78 finished with values: [8.905935468853897, 0.11028736205627822, -1.5466314320534056, 169.86740059352547] and parameters: {'dropout': 0.36462849101759043, 'num_heads': 1, 'bias': True, 'loss_fn': 'MSE', 'optimizer': 'Adam', 'lr': 0.0014938197620523084, 'weight_decay': 0.05707890586298062}. 
[I 2024-04-21 04:46:50,457] Trial 79 finished with values: [5.092466694587868, 0.33534409701378737, 0.08610738544145635, 60.95917960594187] and parameters: {'dropout': 0.3523515642029993, 'num_heads': 2, 'bias': False, 'loss_fn': 'MAE', 'optimizer': 'Adam', 'lr': 0.003922468660665162, 'weight_decay': 0.00016092681250246313}. 
[I 2024-04-21 04:47:24,512] Trial 80 finished with values: [1462.1062055330112, -0.03096478712761837, -248899.65807554126, 16602366.271439087] and parameters: {'dropout': 0.570948598139843, 'num_heads': 2, 'bias': True, 'loss_fn': 'MSE', 'optimizer': 'RMSprop', 'lr': 0.013148140534552839, 'weight_decay': 1.3344143820661265e-05}. 
[W 2024-04-21 04:47:49,656] Trial 81 failed with parameters: {'dropout': 0.6028476732390426, 'num_heads': 1, 'bias': False, 'loss_fn': 'MSE', 'optimizer': 'RMSprop', 'lr': 0.0064314222718388405, 'weight_decay': 0.004256857040692242} because of the following error: The value nan is not acceptable.
[W 2024-04-21 04:47:49,656] Trial 81 failed with value [5.496058228134228, nan, -0.14493517869039296, 76.37036133469904].
[I 2024-04-21 04:48:14,058] Trial 82 finished with values: [7.012159983031751, 0.33128803302614035, -0.2770097343134881, 85.18010159230286] and parameters: {'dropout': 0.49759713129295235, 'num_heads': 4, 'bias': False, 'loss_fn': 'MSE', 'optimizer': 'RMSprop', 'lr': 0.0005469219784306733, 'weight_decay': 0.00016446991547865993}. 
