[I 2024-04-20 21:10:49,672] Trial 103 finished with values: [5.098640745801021, 0.4589502463986223, 0.16846499792731928, 55.46569775537739] and parameters: {'dropout': 0.5299407796300326, 'loss_fn': 'MSE', 'optimizer': 'Adam', 'lr': 0.016032538889276752, 'weight_decay': 0.0273395069607594}. 
[I 2024-04-20 21:12:44,777] Trial 104 finished with values: [4.489788024310639, 0.5545145956036608, 0.274209256150417, 48.41226157848839] and parameters: {'dropout': 0.3757170916790723, 'loss_fn': 'MAE', 'optimizer': 'Adam', 'lr': 0.0011090204813870355, 'weight_decay': 0.0015147055767583942}. 
[I 2024-04-20 21:13:40,820] Trial 105 finished with values: [4.608354767790688, 0.5150298760464728, 0.2441742631506001, 50.41567916122426] and parameters: {'dropout': 0.3562044399774459, 'loss_fn': 'MAE', 'optimizer': 'RMSprop', 'lr': 0.014438792443322607, 'weight_decay': 2.015378107650812e-05}. 
[I 2024-04-20 21:14:24,231] Trial 106 finished with values: [4.842698380401615, 0.47415776695230594, 0.18978636692390227, 54.043503132724595] and parameters: {'dropout': 0.28295843110109903, 'loss_fn': 'MSE', 'optimizer': 'Adam', 'lr': 0.00012206461266414429, 'weight_decay': 0.001063154140458134}. 
[I 2024-04-20 21:15:08,357] Trial 107 finished with values: [4.787710392258893, 0.5034442017493604, 0.22099849461344867, 51.96156739169694] and parameters: {'dropout': 0.47140953338649033, 'loss_fn': 'MSE', 'optimizer': 'RMSprop', 'lr': 0.000335245518363157, 'weight_decay': 0.006374289460532649}. 
[I 2024-04-20 21:16:23,758] Trial 108 finished with values: [5.294118873946671, 0.2596964015483964, -0.06505690743120662, 71.04225844084536] and parameters: {'dropout': 0.20547500706126287, 'loss_fn': 'MAE', 'optimizer': 'Adam', 'lr': 0.00045399421120754873, 'weight_decay': 0.03925631614873473}. 
[I 2024-04-20 21:17:32,896] Trial 109 finished with values: [4.939384844391771, 0.5108659998274903, 0.2563463418663211, 49.6037676512842] and parameters: {'dropout': 0.47140953338649033, 'loss_fn': 'MSE', 'optimizer': 'Adam', 'lr': 0.015601647094364027, 'weight_decay': 0.00037248615020422644}. 
[I 2024-04-20 21:18:46,710] Trial 110 finished with values: [4.572595412041035, 0.532848254874319, 0.26940549181475437, 48.73268602251755] and parameters: {'dropout': 0.31377357982385545, 'loss_fn': 'MAE', 'optimizer': 'Adam', 'lr': 0.0001491541885129046, 'weight_decay': 1.4907661237417258e-05}. 
[I 2024-04-20 21:19:37,577] Trial 111 finished with values: [5.35283930605765, 0.2076498151701302, -0.07889949770444149, 71.96559771860635] and parameters: {'dropout': 0.343986897604069, 'loss_fn': 'MAE', 'optimizer': 'RMSprop', 'lr': 0.014438792443322607, 'weight_decay': 0.0015147055767583942}. 
[I 2024-04-20 21:20:24,177] Trial 112 finished with values: [4.641346485639962, 0.5180777104861589, 0.2550111087520528, 49.692831414282004] and parameters: {'dropout': 0.47140953338649033, 'loss_fn': 'MSE', 'optimizer': 'RMSprop', 'lr': 0.000335245518363157, 'weight_decay': 0.00037248615020422644}. 
[I 2024-04-20 21:22:22,615] Trial 113 finished with values: [4.614320667620988, 0.5186338952418856, 0.22291712386607732, 51.833589483412055] and parameters: {'dropout': 0.47140953338649033, 'loss_fn': 'MAE', 'optimizer': 'Adam', 'lr': 0.000141601199311595, 'weight_decay': 0.05801942307059556}. 
[I 2024-04-20 21:23:04,200] Trial 114 finished with values: [5.316137649013077, 0.23878983148296723, -0.06621092153128405, 71.1192343914918] and parameters: {'dropout': 0.20547500706126287, 'loss_fn': 'MAE', 'optimizer': 'RMSprop', 'lr': 0.0006275517683350238, 'weight_decay': 0.04675433717218894}. 
[I 2024-04-20 21:24:03,372] Trial 115 finished with values: [4.633914450039317, 0.47906916304614927, 0.18037068229509634, 54.67155548948595] and parameters: {'dropout': 0.6955224070594644, 'loss_fn': 'MAE', 'optimizer': 'RMSprop', 'lr': 0.0001491541885129046, 'weight_decay': 0.005991336114926054}. 
Training finished at Epoch 84, with validation result for [5.958674438913838, -0.11283432707194684, -0.03333647874906265, 115.32384181902334]
Training finished at Epoch 101, with validation result for [5.090190514698992, 0.48894192659698105, 0.2259944381607839, 78.9468374256152]
Training finished at Epoch 59, with validation result for [5.189237680633909, -0.06900987106332243, -0.030835535876554188, 87.73524335327944]
Training finished at Epoch 36, with validation result for [4.9638073889198395, 0.4484310957359857, 0.17233975383241396, 86.59920335217502]
Training finished at Epoch 83, with validation result for [4.64117742185485, 0.5616262967822088, 0.30086228173744056, 59.488661577279835]
Training finished at Epoch 39, with validation result for [4.885343059783591, -0.059135126044449614, -0.062236028393240383, 71.71225332984169]
Training finished at Epoch 50, with validation result for [5.327128808830266, -0.03487371086339661, -0.027059561300833535, 94.44388313548923]
Training finished at Epoch 57, with validation result for [5.242752420840148, 0.0561892179542062, -0.06176437144376257, 82.05786679210173]
Training finished at Epoch 59, with validation result for [5.320559475621842, 0.004914645765722888, -0.03999410529738756, 91.430958097185]
Training finished at Epoch 100, with validation result for [4.411349791937748, 0.5979120410816919, 0.3369269564142504, 58.048787837684976]
Training finished at Epoch 34, with validation result for [4.574446117361983, 0.6018631204306292, 0.34238973837555553, 66.27727483208645]
Training finished at Epoch 45, with validation result for [5.125327724720969, 0.4121378627680428, 0.15616216237785174, 89.95572280878856]
Training finished at Epoch 69, with validation result for [4.749368651628085, 0.46632559114436173, 0.18402394023837954, 75.94185350239316]
Training finished at Epoch 67, with validation result for [5.027196706320028, 0.4352268084065612, 0.12009440553801431, 87.50330790728181]
Training finished at Epoch 40, with validation result for [5.201001474733994, 0.46780869067030306, 0.2118715802043727, 85.25928633838309]
Training finished at Epoch 59, with validation result for [4.7360363104072665, 0.5367469590946805, 0.23777529533847208, 70.44948821647642]
Training finished at Epoch 118, with validation result for [4.564188905853103, 0.549262310427921, 0.25214361686293585, 64.27244968900573]
Training finished at Epoch 81, with validation result for [5.111625580632116, 0.4547514513015136, 0.1636416592461657, 81.56771889836669]
Training finished at Epoch 66, with validation result for [5.613200432673101, -0.02036618421368052, -0.036126906253478586, 107.94436163109496]
Training finished at Epoch 36, with validation result for [5.015596724410862, 0.41018636626729527, 0.16465502574351787, 82.12792888270461]
Training finished at Epoch 72, with validation result for [4.707184815125686, 0.45225865233933105, 0.18107275423942593, 69.41109775132534]
Training finished at Epoch 47, with validation result for [4.989042692602437, 0.035760793667224046, -0.06787910002743747, 72.25152459676819]
Training finished at Epoch 55, with validation result for [5.09796206502792, 0.6130647136209794, 0.36297525230828775, 68.59139507257643]
Training finished at Epoch 60, with validation result for [4.9219149524440065, 0.611957815484505, 0.32809084682833556, 72.07076812119837]
Training finished at Epoch 60, with validation result for [5.251106600922275, 0.42505682828903074, 0.16471527756102156, 89.14512794513364]
Training finished at Epoch 58, with validation result for [4.4403063532161005, 0.5484985744282473, 0.2855453438619505, 62.420923218566294]
Training finished at Epoch 84, with validation result for [5.11846860074123, -0.08102746137422982, -0.08649307605906875, 76.00698586459681]
Training finished at Epoch 54, with validation result for [4.6910008950355095, 0.595037562345722, 0.35039291047239496, 62.2091396126743]
Training finished at Epoch 64, with validation result for [5.670580625557122, -0.04210742716802099, -0.03827444735218877, 107.33730829538588]
Training finished at Epoch 68, with validation result for [4.659703632548071, 0.39137790648401727, 0.12390132287972344, 70.58787167899891]
Training finished at Epoch 41, with validation result for [5.483961113219446, -0.09867038663014674, -0.05467267358352279, 95.05702032117837]
Training finished at Epoch 69, with validation result for [5.9731049323280745, -0.04605734440277379, -0.0753064088564237, 113.97195898672707]
Training finished at Epoch 63, with validation result for [4.867233367161293, 0.41022338934933494, 0.15027609239570616, 84.36933242363618]
Training finished at Epoch 60, with validation result for [5.078398543157208, 0.3832888926844321, 0.1373668470470617, 76.0084214124967]
Training finished at Epoch 54, with validation result for [4.814984509284765, 0.6025512644846427, 0.314179619930659, 60.455683228757344]
Training finished at Epoch 51, with validation result for [4.909736905362076, 0.568191402379141, 0.30469883930006136, 71.83844486194391]
Training finished at Epoch 84, with validation result for [5.630963487939773, 0.08696458686411533, -0.032791124817579176, 104.66948374118765]
Training finished at Epoch 37, with validation result for [5.227390399570705, 0.5384694546470762, 0.27932379105372895, 64.16197198595026]
Training finished at Epoch 54, with validation result for [7.453323134270751, 0.37922019345163305, 0.014779712979926085, 105.58849758925408]
Training finished at Epoch 88, with validation result for [5.247276360143032, 0.03631764129345417, -0.0460868604674356, 81.5179098635365]
Training finished at Epoch 38, with validation result for [5.614571747472245, 0.5200159449499184, 0.19402592902849192, 77.16946068754696]
Training finished at Epoch 34, with validation result for [4.723805339727838, 0.4853304024877155, 0.2203649178360365, 67.86048977109469]
Training finished at Epoch 65, with validation result for [4.833146561912822, 0.573939181124707, 0.2861373855885082, 59.791495552280594]
Training finished at Epoch 79, with validation result for [5.081813171283403, 0.4401249047300271, 0.14939016704486408, 89.39278774691526]
Training finished at Epoch 48, with validation result for [5.311108567337377, 0.5262259331399717, 0.21655522829937468, 74.31361632623904]
Training finished at Epoch 66, with validation result for [5.688071525397356, 0.6542838936163525, 0.40632389880137787, 63.42267668021706]
Training finished at Epoch 119, with validation result for [4.83773817837573, 0.4268697342608976, 0.16836428585004226, 89.7538121841899]
Training finished at Epoch 66, with validation result for [4.757345188871615, 0.4393502274250186, 0.1731417294681724, 76.01317940473554]
Training finished at Epoch 38, with validation result for [4.682336731976022, 0.6122429828010784, 0.35143178083088644, 66.82804606219251]
Training finished at Epoch 55, with validation result for [4.844726788518989, 0.46947459221822735, 0.21117777534562598, 66.1917249400973]
Training finished at Epoch 78, with validation result for [5.729593339419918, 0.01579811631239853, -0.04401865867974242, 111.46217210793759]
Training finished at Epoch 65, with validation result for [4.900083832165348, 0.5297504856317454, 0.18038918681704097, 75.6081758654657]
Training finished at Epoch 73, with validation result for [5.116075194907132, 0.430657403637528, 0.15994387446000857, 92.16683260386498]
Training finished at Epoch 64, with validation result for [5.41488487889642, 0.16536640812979042, -0.021529719211909937, 92.88631095730948]
Training finished at Epoch 58, with validation result for [6.132482618970272, 0.5857293550884722, 0.19764762839273065, 68.90865694008933]
Training finished at Epoch 115, with validation result for [4.701993616511531, 0.45666309778995007, 0.16510844161766558, 69.60375446662023]
Training finished at Epoch 49, with validation result for [5.22803182805136, -0.046975273629413596, -0.03182316783852768, 97.25752434241325]
Training finished at Epoch 60, with validation result for [4.990246567847731, 0.3814511944020132, 0.1332750994137476, 85.58669148793003]
[I 2024-04-20 21:25:26,021] Trial 116 finished with values: [4.630855142827157, 0.4945975799695396, 0.22117407495792196, 51.94985569430108] and parameters: {'dropout': 0.620895983541135, 'loss_fn': 'MAE', 'optimizer': 'Adam', 'lr': 0.0003092558937466653, 'weight_decay': 0.0007978568032095472}. 
[I 2024-04-20 21:26:15,390] Trial 117 finished with values: [5.518135349662924, 0.21764784721072175, -0.1407634115988683, 76.09209286490814] and parameters: {'dropout': 0.343986897604069, 'loss_fn': 'MAE', 'optimizer': 'SGD', 'lr': 0.0001491541885129046, 'weight_decay': 0.005928553328474211}. 
[I 2024-04-20 21:27:00,592] Trial 118 finished with values: [5.094353814980942, 0.48861337971004976, 0.17576129849795197, 54.979014210879136] and parameters: {'dropout': 0.20145961770575083, 'loss_fn': 'MSE', 'optimizer': 'RMSprop', 'lr': 0.0023419731461315086, 'weight_decay': 0.0008246459167351}. 
[I 2024-04-20 21:28:26,085] Trial 119 finished with values: [4.836175161665419, 0.5057684171166994, 0.2123987199718681, 52.53519628265801] and parameters: {'dropout': 0.5617665243506511, 'loss_fn': 'MSE', 'optimizer': 'Adam', 'lr': 0.004271805895111922, 'weight_decay': 7.047973805145223e-05}. 
[I 2024-04-20 21:28:56,312] Trial 120 finished with values: [4.905193243630852, 0.44867871686259186, 0.15719731100586587, 56.217283816853765] and parameters: {'dropout': 0.45902369848893865, 'loss_fn': 'MAE', 'optimizer': 'Adam', 'lr': 0.006324594413501705, 'weight_decay': 1.809829017769436e-05}. 
[I 2024-04-20 21:30:04,459] Trial 121 finished with values: [5.203852174135416, 0.46433989223356364, 0.16417934946138357, 55.75156242963028] and parameters: {'dropout': 0.5250684878848557, 'loss_fn': 'MSE', 'optimizer': 'RMSprop', 'lr': 0.014438792443322607, 'weight_decay': 2.015378107650812e-05}. 
[I 2024-04-20 21:31:05,213] Trial 122 finished with values: [4.9446439865199965, 0.47218000651906733, 0.17360527186875707, 55.122827184559604] and parameters: {'dropout': 0.28295843110109903, 'loss_fn': 'MSE', 'optimizer': 'Adam', 'lr': 0.0008016721638355649, 'weight_decay': 0.001585478962444657}. 
[I 2024-04-20 21:32:47,687] Trial 123 finished with values: [4.62466975509395, 0.5328881157387725, 0.25388890577661394, 49.76768547442467] and parameters: {'dropout': 0.3757170916790723, 'loss_fn': 'MSE', 'optimizer': 'Adam', 'lr': 0.0012729923166016706, 'weight_decay': 0.0003173001629768782}. 
[I 2024-04-20 21:33:32,979] Trial 124 finished with values: [5.108845729136568, 0.4791507124090251, 0.1122278549078255, 59.21687163208756] and parameters: {'dropout': 0.4133409388264626, 'loss_fn': 'MSE', 'optimizer': 'RMSprop', 'lr': 0.0001929641914798421, 'weight_decay': 5.669059377844915e-05}. 
[I 2024-04-20 21:35:10,691] Trial 125 finished with values: [5.092104760195002, 0.480004359909457, 0.18762358198614204, 54.18776690438626] and parameters: {'dropout': 0.6682161638904962, 'loss_fn': 'MSE', 'optimizer': 'Adam', 'lr': 0.0012768966648359554, 'weight_decay': 0.0051005641935645525}. 
[I 2024-04-20 21:35:57,859] Trial 126 finished with values: [4.8554952321657225, 0.4604967479753149, 0.15755262033866435, 56.19358369597666] and parameters: {'dropout': 0.5359315389247657, 'loss_fn': 'MSE', 'optimizer': 'RMSprop', 'lr': 0.00019711337282298693, 'weight_decay': 0.00037248615020422644}. 
[I 2024-04-20 21:38:08,721] Trial 127 finished with values: [5.34083762891968, 0.2010782886092233, -0.07471765023215515, 71.6866568593776] and parameters: {'dropout': 0.6682161638904962, 'loss_fn': 'MAE', 'optimizer': 'Adam', 'lr': 0.03013995500819378, 'weight_decay': 0.0025754511319173957}. 
[I 2024-04-20 21:39:13,980] Trial 128 finished with values: [4.961615223670787, 0.47479063720382864, 0.21419843292341123, 52.41515042245019] and parameters: {'dropout': 0.6286018739175663, 'loss_fn': 'MSE', 'optimizer': 'Adam', 'lr': 0.0008016721638355649, 'weight_decay': 0.0018853361751123058}. 
[I 2024-04-20 21:41:28,998] Trial 129 finished with values: [4.486084227402272, 0.5516458420712571, 0.2703871000007261, 48.66721002593099] and parameters: {'dropout': 0.6032520316374994, 'loss_fn': 'MAE', 'optimizer': 'Adam', 'lr': 0.00013031592875001013, 'weight_decay': 0.027760248809972944}. 
[I 2024-04-20 21:42:28,001] Trial 130 finished with values: [5.318378917429649, 0.19986560109948595, -0.05483992758117062, 70.36075746383014] and parameters: {'dropout': 0.5851132204843101, 'loss_fn': 'MAE', 'optimizer': 'SGD', 'lr': 0.0017630080456605044, 'weight_decay': 1.7247938315021415e-05}. 
[I 2024-04-20 21:43:16,564] Trial 131 finished with values: [5.054738722180914, 0.4475346648188676, 0.1952771293111787, 53.6772540076004] and parameters: {'dropout': 0.6435909446026579, 'loss_fn': 'MSE', 'optimizer': 'Adam', 'lr': 0.004271805895111922, 'weight_decay': 0.0007978568032095472}. 
[I 2024-04-20 21:44:12,910] Trial 132 finished with values: [4.728596191284554, 0.46241622692504597, 0.14914999012220476, 56.754062505376936] and parameters: {'dropout': 0.31377357982385545, 'loss_fn': 'MAE', 'optimizer': 'RMSprop', 'lr': 0.0001491541885129046, 'weight_decay': 5.669059377844915e-05}. 
[I 2024-04-20 21:44:47,504] Trial 133 finished with values: [5.348827241975616, 0.1959646043221815, -0.05885338382390959, 70.62846615962685] and parameters: {'dropout': 0.45902369848893865, 'loss_fn': 'MAE', 'optimizer': 'SGD', 'lr': 0.0017630080456605044, 'weight_decay': 0.0008187484524651352}. 
[I 2024-04-20 21:46:07,810] Trial 134 finished with values: [5.099229848100318, 0.44339813344832313, 0.16247980544798246, 55.86492674301974] and parameters: {'dropout': 0.5653625430188676, 'loss_fn': 'MSE', 'optimizer': 'Adam', 'lr': 0.004271805895111922, 'weight_decay': 0.007411856748029663}. 
[I 2024-04-20 21:47:06,997] Trial 135 finished with values: [4.693789558758347, 0.5057485433672609, 0.22557888810309346, 51.65604240445758] and parameters: {'dropout': 0.5250684878848557, 'loss_fn': 'MSE', 'optimizer': 'RMSprop', 'lr': 0.006849816115273617, 'weight_decay': 1.4907661237417258e-05}. 
[I 2024-04-20 21:48:36,325] Trial 136 finished with values: [4.6973630484622975, 0.550054072590291, 0.21010507710748783, 52.68818864203842] and parameters: {'dropout': 0.4773211130217321, 'loss_fn': 'MAE', 'optimizer': 'Adam', 'lr': 0.0001929641914798421, 'weight_decay': 0.00030768246874286195}. 
[I 2024-04-20 21:49:13,163] Trial 137 finished with values: [4.942534241386628, 0.4822402061519839, 0.14115154504536098, 57.28758104162542] and parameters: {'dropout': 0.30637133564849045, 'loss_fn': 'MAE', 'optimizer': 'Adam', 'lr': 0.0017630080456605044, 'weight_decay': 0.00035756652600816603}. 
[I 2024-04-20 21:50:31,081] Trial 138 finished with values: [4.5609477502203095, 0.5292775507139106, 0.24895606334941467, 50.09671978622146] and parameters: {'dropout': 0.20547500706126287, 'loss_fn': 'MAE', 'optimizer': 'Adam', 'lr': 0.00045399421120754873, 'weight_decay': 0.005991336114926054}. 
[I 2024-04-20 21:51:16,428] Trial 139 finished with values: [4.7735854932111, 0.49691114411955845, 0.23082102674010285, 51.3063771750837] and parameters: {'dropout': 0.4133409388264626, 'loss_fn': 'MSE', 'optimizer': 'RMSprop', 'lr': 0.00010804580448118604, 'weight_decay': 5.669059377844915e-05}. 
[I 2024-04-20 21:52:00,939] Trial 140 finished with values: [4.558468917135174, 0.5234086161590273, 0.2611355441156953, 49.28431453891847] and parameters: {'dropout': 0.30637133564849045, 'loss_fn': 'MAE', 'optimizer': 'RMSprop', 'lr': 0.000335245518363157, 'weight_decay': 0.000445889185084419}. 
[I 2024-04-20 21:52:51,177] Trial 141 finished with values: [4.940431998614702, 0.45272471173882084, 0.1087582772885437, 59.44830211076882] and parameters: {'dropout': 0.39194832009245817, 'loss_fn': 'MAE', 'optimizer': 'Adam', 'lr': 0.004271805895111922, 'weight_decay': 0.003425512443848347}. 
[I 2024-04-20 21:53:40,375] Trial 142 finished with values: [5.264649684057883, 0.4644457041966365, 0.1032748513541134, 59.81406187408005] and parameters: {'dropout': 0.3878037786365096, 'loss_fn': 'MSE', 'optimizer': 'Adam', 'lr': 0.0022180942829478196, 'weight_decay': 0.019071566191676756}. 
[I 2024-04-20 21:54:27,538] Trial 143 finished with values: [5.236336256261369, 0.4169297906034426, 0.14189353050298004, 57.23808854758897] and parameters: {'dropout': 0.48376583850520444, 'loss_fn': 'MSE', 'optimizer': 'Adam', 'lr': 0.0012768966648359554, 'weight_decay': 0.014833918258703328}. 
[I 2024-04-20 21:55:04,222] Trial 144 finished with values: [5.084250570753174, 0.4402624140919165, 0.11810459777118587, 58.82487653550986] and parameters: {'dropout': 0.4133409388264626, 'loss_fn': 'MSE', 'optimizer': 'Adam', 'lr': 0.013022507981495917, 'weight_decay': 5.669059377844915e-05}. 
[I 2024-04-20 21:56:07,424] Trial 145 finished with values: [4.61755810044507, 0.5251953031741379, 0.24453976208092998, 50.39129936584697] and parameters: {'dropout': 0.4133409388264626, 'loss_fn': 'MAE', 'optimizer': 'Adam', 'lr': 0.0018470232732537505, 'weight_decay': 5.669059377844915e-05}. 
[I 2024-04-20 21:56:55,009] Trial 146 finished with values: [4.911690465117554, 0.40884115402219556, 0.07077920729459086, 61.98161172739851] and parameters: {'dropout': 0.4514832749907628, 'loss_fn': 'MAE', 'optimizer': 'Adam', 'lr': 0.006324594413501705, 'weight_decay': 0.00037248615020422644}. 
[I 2024-04-20 21:58:08,340] Trial 147 finished with values: [4.739936496803444, 0.48538272239215563, 0.17930862235454148, 54.74239784189935] and parameters: {'dropout': 0.48376583850520444, 'loss_fn': 'MAE', 'optimizer': 'Adam', 'lr': 0.000141601199311595, 'weight_decay': 0.019071566191676756}. 
[I 2024-04-20 21:58:46,994] Trial 148 finished with values: [5.3039082435460365, 0.19020141602172505, -0.031141843966110194, 68.78002936471435] and parameters: {'dropout': 0.6091546659103715, 'loss_fn': 'MSE', 'optimizer': 'SGD', 'lr': 0.0017630080456605044, 'weight_decay': 0.002206487896835645}. 
