[I 2024-04-21 02:51:03,494] Trial 289 finished with values: [5.460221837985566, 0.22121656170335985, 0.005723430654795081, 66.32101299776002] and parameters: {'dropout': 0.2864316147243036, 'num_heads': 8, 'bias': True, 'loss_fn': 'MSE', 'optimizer': 'Adam', 'lr': 0.00012653702848240087, 'weight_decay': 0.003006198705678768}. 
[I 2024-04-21 02:51:12,292] Trial 290 finished with values: [5.378047937570013, 0.2804880069957132, -0.08769025379933626, 72.55196560376491] and parameters: {'dropout': 0.5356496528379955, 'num_heads': 8, 'bias': False, 'loss_fn': 'MAE', 'optimizer': 'RMSprop', 'lr': 0.0018555700204824078, 'weight_decay': 0.0012646218294935334}. 
[I 2024-04-21 02:51:28,425] Trial 291 finished with values: [5.381921989557914, 1.0, -0.10045877030704231, 73.40366117356736] and parameters: {'dropout': 0.3186712596423216, 'num_heads': 8, 'bias': False, 'loss_fn': 'MAE', 'optimizer': 'RMSprop', 'lr': 0.006768417365176362, 'weight_decay': 2.778206105443145e-05}. 
[I 2024-04-21 02:51:38,670] Trial 292 finished with values: [5.3158228769878715, 0.1904242328209162, -0.027872697509730537, 68.56196820214674] and parameters: {'dropout': 0.5356496528379955, 'num_heads': 2, 'bias': False, 'loss_fn': 'MAE', 'optimizer': 'Adam', 'lr': 0.0008974100862471255, 'weight_decay': 3.267852176114278e-05}. 
[I 2024-04-21 02:51:47,536] Trial 293 finished with values: [5.335445457683063, 0.2496716459076239, -0.04480559902382142, 69.69143983612621] and parameters: {'dropout': 0.6843836269030925, 'num_heads': 2, 'bias': True, 'loss_fn': 'MSE', 'optimizer': 'Adam', 'lr': 0.003732613088530846, 'weight_decay': 9.862400533423962e-05}. 
[I 2024-04-21 02:51:59,549] Trial 294 finished with values: [5.501520618102481, 0.22336740316546552, 0.0263399946332874, 64.9458308304007] and parameters: {'dropout': 0.3186712596423216, 'num_heads': 8, 'bias': True, 'loss_fn': 'MSE', 'optimizer': 'Adam', 'lr': 0.0005639970556310195, 'weight_decay': 0.003006198705678768}. 
[I 2024-04-21 02:52:13,720] Trial 295 finished with values: [5.333229046488792, 0.21827965225546184, 0.015153269812572479, 65.692016494542] and parameters: {'dropout': 0.601322534865889, 'num_heads': 4, 'bias': True, 'loss_fn': 'MSE', 'optimizer': 'Adam', 'lr': 0.0009181384288823589, 'weight_decay': 1.251476968558302e-05}. 
[I 2024-04-21 02:52:27,301] Trial 296 finished with values: [5.300382524566137, 0.15220317096311756, -0.04069101007842835, 69.41698530773722] and parameters: {'dropout': 0.2864316147243036, 'num_heads': 8, 'bias': True, 'loss_fn': 'MAE', 'optimizer': 'Adam', 'lr': 0.00019290042098284114, 'weight_decay': 9.862400533423962e-05}. 
[I 2024-04-21 02:52:38,940] Trial 297 finished with values: [5.488637002215192, 0.1679720220978451, -0.0880456106416525, 72.575668893659] and parameters: {'dropout': 0.3186712596423216, 'num_heads': 8, 'bias': False, 'loss_fn': 'MSE', 'optimizer': 'Adam', 'lr': 0.0003551505691591176, 'weight_decay': 0.0012646218294935334}. 
[I 2024-04-21 02:52:50,768] Trial 298 finished with values: [5.608109205301535, 0.10124618898138912, -0.04025984612400224, 69.38822547258945] and parameters: {'dropout': 0.4458780520491319, 'num_heads': 2, 'bias': False, 'loss_fn': 'MSE', 'optimizer': 'RMSprop', 'lr': 0.0008974375358981978, 'weight_decay': 9.862400533423962e-05}. 
[I 2024-04-21 02:52:59,898] Trial 299 finished with values: [5.415828957619925, 0.12999287784346775, -0.0837939456984289, 72.29207101490445] and parameters: {'dropout': 0.35678171751055654, 'num_heads': 4, 'bias': False, 'loss_fn': 'MSE', 'optimizer': 'Adam', 'lr': 0.0009181384288823589, 'weight_decay': 1.251476968558302e-05}. 
[I 2024-04-21 02:52:59,965] A new study created in RDB with name: ProtBert-Attention-BioInf-Combnation
[W 2024-04-21 02:59:06,992] Trial 0 failed with parameters: {'dropout': 0.6029638156543532, 'num_heads': 4, 'bias': True, 'loss_fn': 'MSE', 'optimizer': 'SGD', 'lr': 0.000113854110802553, 'weight_decay': 0.0005083123841052844} because of the following error: The value nan is not acceptable.
[W 2024-04-21 02:59:06,992] Trial 0 failed with value [nan, nan, nan, nan].
[I 2024-04-21 02:59:28,800] Trial 1 finished with values: [5.219877985652909, 0.3268322939343102, 0.011305149804898496, 65.94869680353688] and parameters: {'dropout': 0.6656358839105669, 'num_heads': 1, 'bias': False, 'loss_fn': 'MSE', 'optimizer': 'Adam', 'lr': 0.0015605316138833955, 'weight_decay': 0.0002912764416436785}. 
[W 2024-04-21 02:59:55,628] Trial 2 failed with parameters: {'dropout': 0.20706975370463726, 'num_heads': 2, 'bias': False, 'loss_fn': 'MAE', 'optimizer': 'SGD', 'lr': 0.000914177519971445, 'weight_decay': 0.0027676960555680216} because of the following error: The value nan is not acceptable.
[W 2024-04-21 02:59:55,628] Trial 2 failed with value [5.352239927367192, nan, -0.08099782011496326, 72.10556166038299].
[I 2024-04-21 03:00:08,968] Trial 3 finished with values: [5.477561629519692, 0.15219627855206705, 0.003169931613111854, 66.49133848701979] and parameters: {'dropout': 0.6862518882434415, 'num_heads': 4, 'bias': True, 'loss_fn': 'MSE', 'optimizer': 'RMSprop', 'lr': 0.0013019231193295388, 'weight_decay': 0.002777272327764429}. 
[I 2024-04-21 03:00:26,623] Trial 4 finished with values: [5.428428656375327, 0.03193271914999479, -0.06950773763051177, 71.33914119620721] and parameters: {'dropout': 0.4861198793360585, 'num_heads': 8, 'bias': True, 'loss_fn': 'MAE', 'optimizer': 'RMSprop', 'lr': 0.0007652007103363772, 'weight_decay': 0.026999193588245634}. 
[I 2024-04-21 03:01:22,125] Trial 5 finished with values: [5.329798272366482, 0.0811983373385846, -0.05948847119489575, 70.67082825392183] and parameters: {'dropout': 0.6028476732390426, 'num_heads': 8, 'bias': False, 'loss_fn': 'MSE', 'optimizer': 'RMSprop', 'lr': 0.0064314222718388405, 'weight_decay': 0.004256857040692242}. 
[I 2024-04-21 03:01:48,989] Trial 6 finished with values: [5.3793128226901965, -0.047450655197539424, -0.08517941141778262, 72.38448543239568] and parameters: {'dropout': 0.3523515642029993, 'num_heads': 4, 'bias': False, 'loss_fn': 'MAE', 'optimizer': 'Adam', 'lr': 0.003922468660665162, 'weight_decay': 0.00111611328035739}. 
[W 2024-04-21 03:02:04,331] Trial 7 failed with parameters: {'dropout': 0.6192437920961658, 'num_heads': 2, 'bias': True, 'loss_fn': 'MAE', 'optimizer': 'Adam', 'lr': 0.010353307628230772, 'weight_decay': 0.0021412745051992326} because of the following error: The value nan is not acceptable.
[W 2024-04-21 03:02:04,331] Trial 7 failed with value [5.398438894164427, nan, -0.10898084673190844, 73.97210737733707].
[W 2024-04-21 03:02:18,636] Trial 8 failed with parameters: {'dropout': 0.4322926548385697, 'num_heads': 4, 'bias': False, 'loss_fn': 'MAE', 'optimizer': 'SGD', 'lr': 0.009558735600604636, 'weight_decay': 0.020142046703394666} because of the following error: The value nan is not acceptable.
[W 2024-04-21 03:02:18,636] Trial 8 failed with value [5.355594428142804, nan, -0.08351075506914563, 72.27318141216755].
[W 2024-04-21 03:08:24,987] Trial 9 failed with parameters: {'dropout': 0.5141676161171354, 'num_heads': 8, 'bias': False, 'loss_fn': 'MSE', 'optimizer': 'SGD', 'lr': 0.00022286028400340406, 'weight_decay': 0.08051522352859475} because of the following error: The value nan is not acceptable.
[W 2024-04-21 03:08:24,987] Trial 9 failed with value [nan, nan, nan, nan].
[I 2024-04-21 03:08:55,508] Trial 10 finished with values: [4.713906811107378, 0.5273136388877079, 0.2250249750323231, 51.69298994712207] and parameters: {'dropout': 0.570948598139843, 'num_heads': 8, 'bias': False, 'loss_fn': 'MAE', 'optimizer': 'RMSprop', 'lr': 0.0016801200246028194, 'weight_decay': 1.3344143820661265e-05}. 
Training finished at Epoch 77, with validation result for [5.123037634688997, 0.11506372683366534, -0.025904012085852912, 88.38910674084144]
Training finished at Epoch 59, with validation result for [6.125585823051613, -0.021101934846804303, -0.12652088125105787, 112.05238292519367]
Training finished at Epoch 80, with validation result for [5.835693032434386, 0.12439020634896673, -0.03804462431669031, 107.40109949532139]
Training finished at Epoch 68, with validation result for [5.277689198800141, -0.011332020370939203, -0.039742454546586536, 98.09965853749645]
Training finished at Epoch 47, with validation result for [5.705036679602851, 0.03607834937868747, -0.029617205454428586, 106.1491738972539]
Training finished at Epoch 32, with validation result for [5.545487058327191, 0.03143428283987318, -0.044963351574313304, 99.24849844562563]
Training finished at Epoch 33, with validation result for [5.464591909809056, 0.1425611364009866, 0.009612163318979183, 92.85086835475461]
Training finished at Epoch 35, with validation result for [5.182198134230979, -0.002712462965665845, -0.0479237863011559, 90.24841030088074]
Training finished at Epoch 45, with validation result for [5.86957728447582, 0.10752293735201988, -0.024293653839865925, 106.29858320175204]
Training finished at Epoch 52, with validation result for [5.421502100182669, 0.12444179190240838, -0.05617715790766398, 99.88931290603175]
Training finished at Epoch 45, with validation result for [5.6241097271232094, -0.07836985583192713, -0.05811644461519605, 109.45272024234374]
Training finished at Epoch 49, with validation result for [4.9663529344457285, 0.07249266712924166, -0.06810142633237137, 73.16324218932338]
Training finished at Epoch 40, with validation result for [5.46556929865551, 0.07088534366948832, -0.026040317627572085, 94.81348216944497]
Training finished at Epoch 70, with validation result for [5.453446774346692, 0.0030295382016654352, -0.06878914933839342, 98.24627100710693]
Training finished at Epoch 41, with validation result for [5.082106659089804, 0.03623773012170977, -0.02789732863684624, 90.70927656827583]
Training finished at Epoch 49, with validation result for [5.231362674667708, -0.07510944793108303, -0.10964139902265568, 91.24202190211031]
Training finished at Epoch 77, with validation result for [5.432159755645125, 0.05222947409021601, -0.03976670770162749, 91.82193780482213]
Training finished at Epoch 32, with validation result for [5.287091691914854, 0.08463946973572804, -0.0485378819126252, 91.2540216021855]
Training finished at Epoch 33, with validation result for [5.171452498671384, 0.1485733423590649, 0.0022391429073381763, 79.70898596685413]
Training finished at Epoch 129, with validation result for [5.409320461643379, 0.11478343104714499, -0.08150964133310423, 76.76329409933692]
Training finished at Epoch 60, with validation result for [5.38859141492524, -0.02375507244830444, -0.03788313767225748, 105.44480345824691]
Training finished at Epoch 41, with validation result for [5.804764667300755, 0.02653275149320412, -0.03035973095846245, 112.70581329981655]
Training finished at Epoch 32, with validation result for [5.839632038208254, nan, -0.06329493760704352, 114.45762739076736]
Training finished at Epoch 71, with validation result for [5.69641431216667, -0.03973080646504587, -0.0679572657117502, 108.73127706672203]
Training finished at Epoch 55, with validation result for [5.859239728832759, -0.0335130721095137, -0.13913047730228367, 98.26500693803276]
Training finished at Epoch 111, with validation result for [4.917515654560943, 0.1386739174728014, -0.02239955991730347, 70.16573060797083]
Training finished at Epoch 64, with validation result for [5.352355737339219, 0.08667423012734751, -0.01937022831858415, 86.1286648684558]
Training finished at Epoch 40, with validation result for [5.229859491424771, 0.010811906124005859, -0.12059165997890542, 71.83165472643385]
Training finished at Epoch 89, with validation result for [6.44848455143634, 0.021068301324903373, -0.12075832725821378, 122.11759727760206]
Training finished at Epoch 47, with validation result for [5.396290457028119, 0.07478481856662783, -0.02895010021643274, 92.58433329929291]
Training finished at Epoch 66, with validation result for [5.065116045051176, 0.09738167481434223, -0.03512568391521054, 88.53301949288618]
Training finished at Epoch 68, with validation result for [5.3337101269407015, 0.09334161901787674, -0.04161412523309638, 90.95413908563297]
Training finished at Epoch 75, with validation result for [5.698839727760951, 0.07850040675287379, -0.0352498938014707, 112.11883307782796]
Training finished at Epoch 55, with validation result for [5.744563589047439, 0.029962499834002714, -0.06517917767255677, 94.30402013273658]
Training finished at Epoch 115, with validation result for [5.207227578196024, nan, -0.026602024579547523, 80.8280027183922]
Training finished at Epoch 49, with validation result for [5.663517263322878, nan, -0.02659684424135511, 109.09010074205973]
Training finished at Epoch 74, with validation result for [5.266851168544161, 0.0970829261345473, -0.017026295288802284, 94.87806135797507]
Training finished at Epoch 72, with validation result for [5.978896801071239, 0.04893147460085012, -0.06502243998294577, 111.59641117154364]
Training finished at Epoch 36, with validation result for [5.316763895693223, 0.12811180152700793, -0.02230750200519993, 99.46306641099768]
Training finished at Epoch 54, with validation result for [5.5487878357825435, 0.08638244252086802, -0.03730973763506573, 104.08020733427725]
Training finished at Epoch 37, with validation result for [5.557845378060603, 0.020798748417054667, -0.025897275920467422, 100.11000683777793]
Training finished at Epoch 60, with validation result for [5.234165234239965, 1.0, -0.030752344554615618, 88.31269590260642]
Training finished at Epoch 39, with validation result for [5.364167081988906, 0.09482985036948262, -0.021172074609873137, 86.75372316401064]
Training finished at Epoch 34, with validation result for [5.7956292268548255, 0.08561791295875507, -0.026052561241410865, 111.3561708268707]
Training finished at Epoch 45, with validation result for [5.875031723196564, 0.0316033890172818, -0.07515725316884869, 110.26462438810104]
Training finished at Epoch 50, with validation result for [6.106661913569812, 0.01816062886036423, -0.09309894816295161, 118.3037756730294]
Training finished at Epoch 53, with validation result for [5.399293879760246, 0.10435232812130331, -0.0007472994126151988, 95.71311167262581]
Training finished at Epoch 46, with validation result for [5.848922212827406, 0.024624632046544092, -0.08750866604444973, 106.33919580107734]
Training finished at Epoch 54, with validation result for [5.9480337640829255, 0.05276341250832432, -0.03615433345419383, 106.05252930286291]
Training finished at Epoch 39, with validation result for [5.802596405328058, 0.09062282613197584, -0.01247508602276759, 108.33234290005781]
Training finished at Epoch 51, with validation result for [5.4959353695785715, 0.1572500342312896, 0.012583239188735162, 98.86922915198438]
Training finished at Epoch 83, with validation result for [5.392021509690861, nan, -0.02351317778590567, 91.25861044119152]
Training finished at Epoch 32, with validation result for [5.8633723074932504, 0.3651816812530773, 0.11610112376968607, 86.24185659025949]
Training finished at Epoch 51, with validation result for [5.6528300541618846, 0.0027825741670516034, -0.023399249108421616, 108.17452332847377]
Training finished at Epoch 149, with validation result for [5.3942977196636575, nan, -0.009399727765320165, 97.4421802116451]
Training finished at Epoch 72, with validation result for [5.072703467640079, 1.0, -0.014306562920069377, 90.2114460811804]
Training finished at Epoch 35, with validation result for [5.445695977406565, nan, -0.014066049669265057, 95.9316723220923]
Training finished at Epoch 46, with validation result for [5.29726018221507, nan, -0.03315000647255073, 84.98042456493883]
Training finished at Epoch 78, with validation result for [4.624794588314445, 0.4529390818040023, 0.14462590424070776, 61.4439259590712]
[I 2024-04-21 03:09:19,802] Trial 11 finished with values: [5.674015875206627, -0.14095394412929638, -0.191129506112649, 79.45165147453592] and parameters: {'dropout': 0.2958809828762871, 'num_heads': 8, 'bias': False, 'loss_fn': 'MSE', 'optimizer': 'Adam', 'lr': 0.018786758697540894, 'weight_decay': 0.008248275308008141}. 
[I 2024-04-21 03:09:29,929] Trial 12 finished with values: [5.593365571936448, 0.014628701769124453, -0.09176041694573689, 72.8234568077799] and parameters: {'dropout': 0.3782344884327923, 'num_heads': 4, 'bias': True, 'loss_fn': 'MAE', 'optimizer': 'RMSprop', 'lr': 0.00014156502573707663, 'weight_decay': 0.0017236552962088222}. 
[W 2024-04-21 03:15:21,314] Trial 13 failed with parameters: {'dropout': 0.5658756376084073, 'num_heads': 4, 'bias': False, 'loss_fn': 'MSE', 'optimizer': 'SGD', 'lr': 0.035413219807112914, 'weight_decay': 0.0004436821243510801} because of the following error: The value nan is not acceptable.
[W 2024-04-21 03:15:21,315] Trial 13 failed with value [nan, nan, nan, nan].
[I 2024-04-21 03:15:41,755] Trial 14 finished with values: [5.351584912992858, 0.20184151578850243, -0.08051161330878931, 72.07313031390854] and parameters: {'dropout': 0.6565193056511684, 'num_heads': 2, 'bias': False, 'loss_fn': 'MAE', 'optimizer': 'SGD', 'lr': 0.0013679974569032359, 'weight_decay': 0.0004069483896148316}. 
[I 2024-04-21 03:15:56,790] Trial 15 finished with values: [5.406018356702338, 0.20184151578850243, -0.11264591498758825, 74.21657762527089] and parameters: {'dropout': 0.6999299213489002, 'num_heads': 4, 'bias': False, 'loss_fn': 'MAE', 'optimizer': 'SGD', 'lr': 0.0007604246609633804, 'weight_decay': 2.270826559971053e-05}. 
[I 2024-04-21 03:16:33,811] Trial 16 finished with values: [5.92776906449333, 0.03874623982730946, -0.1541715127121932, 76.98645050706573] and parameters: {'dropout': 0.44155446791625563, 'num_heads': 1, 'bias': True, 'loss_fn': 'MSE', 'optimizer': 'RMSprop', 'lr': 0.030423586312621993, 'weight_decay': 0.0008601767344678037}. 
[W 2024-04-21 03:22:42,282] Trial 17 failed with parameters: {'dropout': 0.5559938550721297, 'num_heads': 4, 'bias': True, 'loss_fn': 'MSE', 'optimizer': 'SGD', 'lr': 0.00016564203673551206, 'weight_decay': 0.0026474372300691333} because of the following error: The value nan is not acceptable.
[W 2024-04-21 03:22:42,282] Trial 17 failed with value [nan, nan, nan, nan].
[I 2024-04-21 03:23:04,645] Trial 18 finished with values: [5.653038686624672, 0.20168810020972985, -0.03614619705759381, 69.11383363674324] and parameters: {'dropout': 0.3846016956416972, 'num_heads': 1, 'bias': True, 'loss_fn': 'MSE', 'optimizer': 'Adam', 'lr': 0.0026892156602810664, 'weight_decay': 0.0275805786785111}. 
[I 2024-04-21 03:23:28,016] Trial 19 finished with values: [4.978333912790134, 0.459689899041037, 0.10375225912271668, 59.782217447888236] and parameters: {'dropout': 0.6291352684393432, 'num_heads': 2, 'bias': False, 'loss_fn': 'MAE', 'optimizer': 'RMSprop', 'lr': 0.0020026931174657535, 'weight_decay': 0.00030304918584754363}. 
[I 2024-04-21 03:23:49,753] Trial 20 finished with values: [5.331696339156124, -0.14095394412929638, -0.06253133557876378, 70.87379577279421] and parameters: {'dropout': 0.36479312893741833, 'num_heads': 1, 'bias': True, 'loss_fn': 'MSE', 'optimizer': 'SGD', 'lr': 0.016018515854870137, 'weight_decay': 0.0001844817451184779}. 
[W 2024-04-21 03:24:02,561] Trial 21 failed with parameters: {'dropout': 0.6303734194928629, 'num_heads': 8, 'bias': False, 'loss_fn': 'MAE', 'optimizer': 'Adam', 'lr': 0.02391018299734313, 'weight_decay': 0.019245203152368953} because of the following error: The value nan is not acceptable.
[W 2024-04-21 03:24:02,561] Trial 21 failed with value [5.619041668066473, nan, -0.17729027492532157, 78.52853625714909].
[W 2024-04-21 03:30:07,524] Trial 22 failed with parameters: {'dropout': 0.6024660005906111, 'num_heads': 2, 'bias': False, 'loss_fn': 'MSE', 'optimizer': 'SGD', 'lr': 0.006859015424019953, 'weight_decay': 6.600026684900442e-05} because of the following error: The value nan is not acceptable.
[W 2024-04-21 03:30:07,524] Trial 22 failed with value [nan, nan, nan, nan].
[I 2024-04-21 03:30:55,800] Trial 23 finished with values: [5.374852466687147, 0.08675264910860321, -0.08038529753892543, 72.06470470068054] and parameters: {'dropout': 0.6102760018376332, 'num_heads': 4, 'bias': True, 'loss_fn': 'MSE', 'optimizer': 'RMSprop', 'lr': 0.023737222675975948, 'weight_decay': 0.014174306093951507}. 
[I 2024-04-21 03:31:32,187] Trial 24 finished with values: [4.755750161041391, 0.5270189916473458, 0.2518723713159111, 49.902193932435274] and parameters: {'dropout': 0.6799331143119542, 'num_heads': 8, 'bias': False, 'loss_fn': 'MAE', 'optimizer': 'Adam', 'lr': 0.002295064068704125, 'weight_decay': 1.242118945501002e-05}. 
[I 2024-04-21 03:32:03,391] Trial 25 finished with values: [5.3582336084486, 0.18719015304099115, 0.0032283819679121972, 66.4874396857607] and parameters: {'dropout': 0.23263101391627533, 'num_heads': 8, 'bias': True, 'loss_fn': 'MSE', 'optimizer': 'RMSprop', 'lr': 0.0029330059977397314, 'weight_decay': 0.04302132200345548}. 
[W 2024-04-21 03:32:20,702] Trial 26 failed with parameters: {'dropout': 0.21344668135369138, 'num_heads': 1, 'bias': True, 'loss_fn': 'MAE', 'optimizer': 'SGD', 'lr': 0.09289775036875099, 'weight_decay': 0.00040585767281044904} because of the following error: The value nan is not acceptable.
[W 2024-04-21 03:32:20,702] Trial 26 failed with value [5.359958973836882, nan, -0.08672244281705055, 72.4874099190445].
[W 2024-04-21 03:32:54,503] Trial 27 failed with parameters: {'dropout': 0.6758885754308296, 'num_heads': 2, 'bias': False, 'loss_fn': 'MSE', 'optimizer': 'SGD', 'lr': 0.0429938070176369, 'weight_decay': 9.42067351043578e-05} because of the following error: The value nan is not acceptable.
[W 2024-04-21 03:32:54,504] Trial 27 failed with value [5.337371244581167, nan, -0.06941343000185873, 71.33285061503642].
