[I 2024-04-21 06:44:53,683] Trial 286 finished with values: [4.824063950688601, 0.49284145020743764, 0.20409717291772245, 53.08893256394451] and parameters: {'dropout': 0.3523515642029993, 'num_heads': 8, 'bias': True, 'loss_fn': 'MAE', 'optimizer': 'RMSprop', 'lr': 0.0020026931174657535, 'weight_decay': 0.00016092681250246313}. 
[I 2024-04-21 06:45:21,106] Trial 287 finished with values: [5.344852978187516, -0.14095394412929638, -0.07559942857228252, 71.74547392754532] and parameters: {'dropout': 0.3629852321658984, 'num_heads': 4, 'bias': False, 'loss_fn': 'MAE', 'optimizer': 'RMSprop', 'lr': 0.0035578235240887562, 'weight_decay': 6.0239055358915006e-05}. 
[I 2024-04-21 06:45:42,333] Trial 288 finished with values: [5.2559335963345415, 0.33802701848827305, -0.025038236834683758, 68.37290179037842] and parameters: {'dropout': 0.3435061141662442, 'num_heads': 4, 'bias': False, 'loss_fn': 'MAE', 'optimizer': 'RMSprop', 'lr': 0.0020026931174657535, 'weight_decay': 0.00029822251778626087}. 
[I 2024-04-21 06:45:56,067] Trial 289 finished with values: [5.3481438675073765, 0.14095394412929638, -0.07798142166925559, 71.90435949320735] and parameters: {'dropout': 0.6122433820616829, 'num_heads': 8, 'bias': False, 'loss_fn': 'MAE', 'optimizer': 'Adam', 'lr': 0.05495783855879237, 'weight_decay': 0.00017414884463387825}. 
[I 2024-04-21 06:46:24,788] Trial 290 finished with values: [5.143285982564161, 0.3983508562825196, 0.15282098276949085, 56.509197084042825] and parameters: {'dropout': 0.6799331143119542, 'num_heads': 2, 'bias': False, 'loss_fn': 'MAE', 'optimizer': 'Adam', 'lr': 0.0020026931174657535, 'weight_decay': 6.0239055358915006e-05}. 
[I 2024-04-21 06:46:52,717] Trial 291 finished with values: [4.973181864582195, 0.42339024625713156, 0.1631368201477752, 55.82110203489716] and parameters: {'dropout': 0.3629852321658984, 'num_heads': 2, 'bias': False, 'loss_fn': 'MAE', 'optimizer': 'Adam', 'lr': 0.0020026931174657535, 'weight_decay': 6.0239055358915006e-05}. 
[I 2024-04-21 06:47:10,291] Trial 292 finished with values: [4.9604414835498805, 0.3835477954003467, 0.13297947036038016, 57.8326811557297] and parameters: {'dropout': 0.319616569696689, 'num_heads': 4, 'bias': True, 'loss_fn': 'MAE', 'optimizer': 'Adam', 'lr': 0.0009964606938187815, 'weight_decay': 2.4265340760230575e-05}. 
[I 2024-04-21 06:47:24,992] Trial 293 finished with values: [5.538718596716845, 0.2365282888330726, -0.008691807639909177, 67.28254949151297] and parameters: {'dropout': 0.3344998495842664, 'num_heads': 8, 'bias': False, 'loss_fn': 'MAE', 'optimizer': 'Adam', 'lr': 0.0020026931174657535, 'weight_decay': 1.242118945501002e-05}. 
[I 2024-04-21 06:48:14,607] Trial 294 finished with values: [4.85861507004298, 0.47449859345233697, 0.22365093591568375, 51.78464217842637] and parameters: {'dropout': 0.3523515642029993, 'num_heads': 2, 'bias': False, 'loss_fn': 'MAE', 'optimizer': 'Adam', 'lr': 0.0020026931174657535, 'weight_decay': 0.00016092681250246313}. 
[I 2024-04-21 06:48:32,735] Trial 295 finished with values: [4.87557500210645, 0.49912807264106535, 0.20544794369308994, 52.9988323957296] and parameters: {'dropout': 0.5323331816379571, 'num_heads': 4, 'bias': False, 'loss_fn': 'MAE', 'optimizer': 'RMSprop', 'lr': 0.002295064068704125, 'weight_decay': 6.24075916043652e-05}. 
[I 2024-04-21 06:49:02,623] Trial 296 finished with values: [4.938051932623112, 0.46909357722673845, 0.2188047584488474, 52.10789569628727] and parameters: {'dropout': 0.3523515642029993, 'num_heads': 2, 'bias': False, 'loss_fn': 'MAE', 'optimizer': 'Adam', 'lr': 0.002295064068704125, 'weight_decay': 1.242118945501002e-05}. 
[I 2024-04-21 06:49:23,059] Trial 297 finished with values: [5.42277571425396, 0.2299968044317037, 0.0018842822044613516, 66.57709487892373] and parameters: {'dropout': 0.6799331143119542, 'num_heads': 8, 'bias': False, 'loss_fn': 'MAE', 'optimizer': 'Adam', 'lr': 0.0020026931174657535, 'weight_decay': 1.242118945501002e-05}. 
[I 2024-04-21 06:49:49,233] Trial 298 finished with values: [5.105300866130356, 0.3690505846509833, 0.09863270683112302, 60.1237058270191] and parameters: {'dropout': 0.570948598139843, 'num_heads': 4, 'bias': False, 'loss_fn': 'MAE', 'optimizer': 'RMSprop', 'lr': 0.0016801200246028194, 'weight_decay': 0.00029822251778626087}. 
[I 2024-04-21 06:50:08,605] Trial 299 finished with values: [5.2947721764133355, 0.3662490881505825, 0.048778382912460394, 63.44912791433796] and parameters: {'dropout': 0.5323331816379571, 'num_heads': 2, 'bias': True, 'loss_fn': 'MSE', 'optimizer': 'RMSprop', 'lr': 0.0009964606938187815, 'weight_decay': 0.00016092681250246313}. 
[I 2024-04-21 06:50:08,671] A new study created in RDB with name: ProtBert-Conv-BioInf-Subtration
[I 2024-04-21 06:50:43,813] Trial 0 finished with values: [5.065035121087368, 0.3228634868262337, 0.06551352733206306, 62.332847228670396] and parameters: {'dropout': 0.6478480572591838, 'loss_fn': 'MSE', 'optimizer': 'Adam', 'lr': 0.0061795694835023035, 'weight_decay': 1.8719811898003524e-05}. 
