[I 2024-04-21 06:21:07,969] Trial 245 finished with values: [5.3420313585884465, 0.2813038983752325, -0.06482125646267067, 71.02653986572345] and parameters: {'dropout': 0.4934354255005909, 'num_heads': 8, 'bias': False, 'loss_fn': 'MAE', 'optimizer': 'RMSprop', 'lr': 0.0020026931174657535, 'weight_decay': 0.0023780790525675605}. 
[W 2024-04-21 06:21:16,969] Trial 246 failed with parameters: {'dropout': 0.5039308466375886, 'num_heads': 2, 'bias': False, 'loss_fn': 'MAE', 'optimizer': 'SGD', 'lr': 0.02612923890676587, 'weight_decay': 0.00219078254882845} because of the following error: The value nan is not acceptable.
[W 2024-04-21 06:21:16,969] Trial 246 failed with value [5.372445169528208, nan, -0.09513761190369174, 73.0487251059658].
[I 2024-04-21 06:21:33,356] Trial 247 finished with values: [5.368503531717234, -0.14095394412929638, -0.09261158978025197, 72.88023240358662] and parameters: {'dropout': 0.5039308466375886, 'num_heads': 1, 'bias': False, 'loss_fn': 'MAE', 'optimizer': 'SGD', 'lr': 0.0020026931174657535, 'weight_decay': 0.00030304918584754363}. 
[I 2024-04-21 06:21:44,787] Trial 248 finished with values: [5.4302168537100215, 0.14095394412929638, -0.12250101986718365, 74.87394053511434] and parameters: {'dropout': 0.27224164382440813, 'num_heads': 2, 'bias': False, 'loss_fn': 'MAE', 'optimizer': 'SGD', 'lr': 0.0020026931174657535, 'weight_decay': 9.133735498525707e-05}. 
[I 2024-04-21 06:22:17,537] Trial 249 finished with values: [4.851374615002425, 0.5182637350509163, 0.20368758715895374, 53.11625307341692] and parameters: {'dropout': 0.4934354255005909, 'num_heads': 2, 'bias': False, 'loss_fn': 'MAE', 'optimizer': 'RMSprop', 'lr': 0.0016801200246028194, 'weight_decay': 0.00016092681250246313}. 
[I 2024-04-21 06:22:35,380] Trial 250 finished with values: [5.266985196096574, 0.19937326282763598, -0.04678248636457871, 69.82330372094832] and parameters: {'dropout': 0.4244817098248359, 'num_heads': 2, 'bias': False, 'loss_fn': 'MAE', 'optimizer': 'RMSprop', 'lr': 0.003922468660665162, 'weight_decay': 4.221917657289298e-05}. 
[I 2024-04-21 06:23:02,478] Trial 251 finished with values: [5.074982236317148, 0.4137536076989214, 0.06778557481782155, 62.181295341116865] and parameters: {'dropout': 0.4244817098248359, 'num_heads': 2, 'bias': False, 'loss_fn': 'MAE', 'optimizer': 'Adam', 'lr': 0.002548313290740233, 'weight_decay': 4.221917657289298e-05}. 
[I 2024-04-21 06:23:22,658] Trial 252 finished with values: [7.248013902578112, 0.20578389714159648, -0.5008999864902197, 100.11420421775603] and parameters: {'dropout': 0.6799331143119542, 'num_heads': 2, 'bias': False, 'loss_fn': 'MSE', 'optimizer': 'RMSprop', 'lr': 0.00015587385647697547, 'weight_decay': 1.242118945501002e-05}. 
[I 2024-04-21 06:23:37,975] Trial 253 finished with values: [5.264456363475439, 0.26982401929730765, -0.0350121636645071, 69.03819045483428] and parameters: {'dropout': 0.4732573146798835, 'num_heads': 2, 'bias': False, 'loss_fn': 'MAE', 'optimizer': 'RMSprop', 'lr': 0.0014938197620523084, 'weight_decay': 0.0009823700199596424}. 
[I 2024-04-21 06:24:04,047] Trial 254 finished with values: [7.3197151563392335, 0.25783588809118235, -0.6205649828424096, 108.096192351779] and parameters: {'dropout': 0.3756121486579195, 'num_heads': 2, 'bias': True, 'loss_fn': 'MAE', 'optimizer': 'RMSprop', 'lr': 0.00018565247131226996, 'weight_decay': 0.00029822251778626087}. 
[I 2024-04-21 06:24:26,350] Trial 255 finished with values: [5.286161665604399, 0.23491998461664626, -0.0456420266073434, 69.74723188267416] and parameters: {'dropout': 0.3629852321658984, 'num_heads': 2, 'bias': False, 'loss_fn': 'MAE', 'optimizer': 'Adam', 'lr': 0.00012771325632440322, 'weight_decay': 1.242118945501002e-05}. 
[I 2024-04-21 06:24:42,974] Trial 256 finished with values: [5.336808636533353, 0.30293816637556026, -0.028147106197319083, 68.5802720249435] and parameters: {'dropout': 0.4244817098248359, 'num_heads': 2, 'bias': False, 'loss_fn': 'MSE', 'optimizer': 'Adam', 'lr': 0.003922468660665162, 'weight_decay': 4.221917657289298e-05}. 
[I 2024-04-21 06:25:13,884] Trial 257 finished with values: [5.119641729470004, 0.4012161317631442, 0.04917193782045426, 63.422876707205944] and parameters: {'dropout': 0.4934354255005909, 'num_heads': 1, 'bias': False, 'loss_fn': 'MAE', 'optimizer': 'RMSprop', 'lr': 0.0020026931174657535, 'weight_decay': 3.8599792229348496e-05}. 
[I 2024-04-21 06:26:11,795] Trial 258 finished with values: [5.4634137329459085, 0.3809364252267143, 0.043773668547836264, 63.7829562842903] and parameters: {'dropout': 0.4642349498866044, 'num_heads': 8, 'bias': False, 'loss_fn': 'MAE', 'optimizer': 'Adam', 'lr': 0.0009964606938187815, 'weight_decay': 2.4265340760230575e-05}. 
[I 2024-04-21 06:26:49,627] Trial 259 finished with values: [5.0513582632279, 0.38465911940463177, 0.12072615074596516, 58.650011659604] and parameters: {'dropout': 0.3523515642029993, 'num_heads': 2, 'bias': False, 'loss_fn': 'MAE', 'optimizer': 'Adam', 'lr': 0.0020026931174657535, 'weight_decay': 0.00016092681250246313}. 
[I 2024-04-21 06:27:11,418] Trial 260 finished with values: [10.103310416763895, 0.12894318623444845, -2.218326421498294, 214.67132487270476] and parameters: {'dropout': 0.4244817098248359, 'num_heads': 2, 'bias': True, 'loss_fn': 'MSE', 'optimizer': 'RMSprop', 'lr': 0.00015587385647697547, 'weight_decay': 0.0009823700199596424}. 
[I 2024-04-21 06:27:48,044] Trial 261 finished with values: [5.008314180977653, 0.3727454513126445, 0.07965273015648855, 61.38972306864494] and parameters: {'dropout': 0.3523515642029993, 'num_heads': 2, 'bias': False, 'loss_fn': 'MSE', 'optimizer': 'RMSprop', 'lr': 0.0020026931174657535, 'weight_decay': 0.00016092681250246313}. 
[I 2024-04-21 06:28:18,421] Trial 262 finished with values: [4.754172895176701, 0.5076452319714655, 0.25239571438809105, 49.867285493714654] and parameters: {'dropout': 0.39240749140537745, 'num_heads': 4, 'bias': False, 'loss_fn': 'MAE', 'optimizer': 'Adam', 'lr': 0.0020026931174657535, 'weight_decay': 1.2266916063951385e-05}. 
[I 2024-04-21 06:28:57,094] Trial 263 finished with values: [6.831294624744647, 0.20908951216525778, -0.3389527524450957, 89.31187321127231] and parameters: {'dropout': 0.3693292913693079, 'num_heads': 4, 'bias': True, 'loss_fn': 'MAE', 'optimizer': 'RMSprop', 'lr': 0.00014472525549227846, 'weight_decay': 2.4265340760230575e-05}. 
[I 2024-04-21 06:29:19,066] Trial 264 finished with values: [5.29087469517762, 0.23724948087543896, -0.04905401964228151, 69.97482130939414] and parameters: {'dropout': 0.5899385839843799, 'num_heads': 1, 'bias': False, 'loss_fn': 'MAE', 'optimizer': 'Adam', 'lr': 0.0001681408702102997, 'weight_decay': 1.3344143820661265e-05}. 
Training finished at Epoch 63, with validation result for [5.043285370409503, 0.24285123597610656, 0.03155375199206556, 85.64587394307347]
Training finished at Epoch 58, with validation result for [4.741792835918839, 0.6307105736217309, 0.34944170861204393, 67.68469659311876]
Training finished at Epoch 46, with validation result for [6.128341321159564, -0.10503161958702179, -0.07915908100755886, 118.38058123621182]
Training finished at Epoch 50, with validation result for [4.649814896577905, 0.37840164947800337, 0.1329420784484503, 68.0688663845054]
Training finished at Epoch 60, with validation result for [5.428339210941964, 0.3458139441824448, 0.07653425494744948, 99.2949784706242]
Training finished at Epoch 55, with validation result for [5.510584937236874, 0.5195396319551618, 0.2633814074522096, 82.74347860124662]
Training finished at Epoch 41, with validation result for [5.880222369124231, 0.4291937379080066, 0.16120884966857152, 87.65175445533782]
Training finished at Epoch 41, with validation result for [5.540025157722624, 0.36895024588662556, 0.05187764233343939, 86.07690333802243]
Training finished at Epoch 110, with validation result for [5.009818376610052, 0.5995147526417965, 0.27374941937863273, 67.45013717138177]
Training finished at Epoch 49, with validation result for [5.187276134866434, 0.46432540999239985, 0.1614629235165922, 85.19148646300589]
Training finished at Epoch 61, with validation result for [5.427882531660856, 0.3629950391358465, 0.11298766103502311, 98.4208342281346]
Training finished at Epoch 70, with validation result for [4.9407131680012, 0.36175581575233673, 0.1220387731321314, 87.40784286876159]
Training finished at Epoch 54, with validation result for [5.272055244537244, 0.3783563031225393, 0.13978283490846877, 79.28943891563861]
Training finished at Epoch 39, with validation result for [4.769081052772405, 0.3274057138671262, 0.10146093597047912, 75.82464209372993]
Training finished at Epoch 60, with validation result for [5.0478939310622986, 0.3773401290344501, 0.1333254143735947, 73.40824849041334]
Training finished at Epoch 61, with validation result for [4.8143860206906135, 0.3493970908526225, 0.10239590719458924, 77.16410289273811]
Training finished at Epoch 35, with validation result for [5.0590394161944685, 0.41744771659244406, 0.12130437350604373, 90.3931087191429]
Training finished at Epoch 92, with validation result for [5.252500535438786, nan, -0.01588695236697668, 96.61652920993699]
Training finished at Epoch 37, with validation result for [5.355601038526777, 1.0, -0.03347102146530445, 91.64605905639235]
Training finished at Epoch 47, with validation result for [5.04929986385496, 0.2857989792614416, 0.04827938662975639, 82.49626297848017]
Training finished at Epoch 375, with validation result for [5.309897273639358, nan, -0.014925376447300742, 89.57890131250156]
Training finished at Epoch 83, with validation result for [5.433839166697703, 0.11288268014911428, -0.06904474906834124, 93.99671201691365]
Training finished at Epoch 35, with validation result for [4.66937456315538, 0.4473684091468461, 0.1915256353831215, 57.85493932298368]
Training finished at Epoch 72, with validation result for [4.959767698442837, 0.3869012762884226, 0.14483437150157674, 87.85466605394824]
Training finished at Epoch 48, with validation result for [4.821160532864273, 0.36253048479106076, 0.1220772385994805, 75.26200175948897]
Training finished at Epoch 37, with validation result for [5.269346520322589, 0.028649956456667576, -0.04227475780017276, 85.34514942749843]
Training finished at Epoch 68, with validation result for [5.502607314405939, 0.3576731800637073, 0.09968566903285714, 95.86905706276194]
Training finished at Epoch 71, with validation result for [5.308863239434763, 0.36654558814369365, 0.036625240497726974, 89.56248073269512]
Training finished at Epoch 93, with validation result for [5.108076279272373, 0.2975740576468057, 0.019117014016305167, 96.11416616834379]
Training finished at Epoch 82, with validation result for [5.0142637142423006, 0.05447565666056925, -0.05687826704604837, 83.6295714580612]
Training finished at Epoch 79, with validation result for [5.479279760166037, 0.3466692137490406, 0.11709426745094287, 98.31737565967802]
Training finished at Epoch 83, with validation result for [5.902871005448148, 0.3974564002720152, 0.019481305464270182, 104.90929778490094]
Training finished at Epoch 44, with validation result for [5.1215863618546384, 0.4560563051589317, 0.15490753442348315, 80.02902911298308]
Training finished at Epoch 48, with validation result for [5.29043629009467, 0.375517447248526, 0.017034189636083608, 84.12040364064494]
Training finished at Epoch 43, with validation result for [5.6272965596681095, 0.16370607841170753, -0.002122450091570416, 108.75174700787899]
Training finished at Epoch 92, with validation result for [4.71174976088417, 0.46266115519353707, 0.19457114561061273, 70.54298708832262]
Training finished at Epoch 79, with validation result for [5.6320063864785395, 0.25440524131369585, -0.01967850651928349, 97.30401159295145]
Training finished at Epoch 59, with validation result for [5.553236060446744, 0.5119678259503584, 0.2584504132579303, 78.39069195043753]
Training finished at Epoch 55, with validation result for [5.157010502289879, 0.399209781177805, 0.046806453462753805, 83.50705511189808]
Training finished at Epoch 34, with validation result for [5.325147123634438, 0.07928996906011315, -0.06308775161266311, 93.37545467723773]
Training finished at Epoch 30, with validation result for [5.378438735904996, nan, -0.033041432885292155, 90.00432956848819]
Training finished at Epoch 42, with validation result for [5.4608219016511255, nan, -0.044031746119026716, 95.20180675343757]
Training finished at Epoch 35, with validation result for [5.383597067790892, nan, -0.02930629547775676, 94.43955488209151]
Training finished at Epoch 87, with validation result for [5.284526207280366, 0.38115021913571245, 0.08584115344201793, 96.1392613834215]
Training finished at Epoch 45, with validation result for [5.738349290789514, nan, -0.03490680970282689, 110.83683270021123]
Training finished at Epoch 54, with validation result for [5.009791246188029, 0.41513955527081625, 0.10896879733494413, 76.67479082034532]
Training finished at Epoch 48, with validation result for [4.645074764136615, 0.5255357508494873, 0.2592817532402637, 69.27532425244289]
Training finished at Epoch 41, with validation result for [5.344421251947199, -0.027240508217569993, -0.05901313888543047, 90.40676940469012]
Training finished at Epoch 66, with validation result for [5.1128589647655, 0.45799398535121566, 0.20685212909853035, 74.15757434270886]
Training finished at Epoch 51, with validation result for [5.181442516075982, 0.374958609520045, 0.12342171858763995, 89.21097351926824]
Training finished at Epoch 35, with validation result for [5.398695037810768, 0.25171752770181793, 0.03327385789910697, 94.09747704837427]
Training finished at Epoch 88, with validation result for [5.12722017805378, 0.32745341760924496, 0.039796419389933724, 81.03976964719335]
Training finished at Epoch 125, with validation result for [5.111863722998323, 0.496254504438084, 0.22944960368156886, 78.63921325371786]
Training finished at Epoch 82, with validation result for [5.114375707821746, 0.2963171217584118, 0.07709022835959523, 90.45000462938178]
Training finished at Epoch 47, with validation result for [5.606180902555124, 0.35323527192911763, 0.04206199197462457, 72.96224438652835]
Training finished at Epoch 95, with validation result for [5.119353235929667, 0.5632252009020321, 0.1695547348243901, 84.05489501489382]
Training finished at Epoch 64, with validation result for [4.886994340055664, 0.4728139640301993, 0.16525906213943253, 67.30171465491699]
Training finished at Epoch 79, with validation result for [5.29353487288332, 0.29454984781410604, 0.026717424812600532, 104.62038116959303]
Training finished at Epoch 54, with validation result for [5.607543826160679, -0.00615990509582762, -0.051488284100639214, 100.6824852757366]
[I 2024-04-21 06:29:47,257] Trial 265 finished with values: [5.348195339694031, -0.14095394412929638, -0.07801897143311165, 71.90686416691037] and parameters: {'dropout': 0.3629852321658984, 'num_heads': 4, 'bias': False, 'loss_fn': 'MAE', 'optimizer': 'SGD', 'lr': 0.0009416363973736015, 'weight_decay': 1.5622104214829834e-05}. 
[I 2024-04-21 06:30:10,814] Trial 266 finished with values: [5.06262506019621, 0.4138397442209013, 0.16404239063642867, 55.76069796423911] and parameters: {'dropout': 0.4244817098248359, 'num_heads': 8, 'bias': False, 'loss_fn': 'MAE', 'optimizer': 'Adam', 'lr': 0.0009166092518830877, 'weight_decay': 1.3344143820661265e-05}. 
[I 2024-04-21 06:31:07,978] Trial 267 finished with values: [4.913269981749624, 0.47714085946532026, 0.2242899724282036, 51.7420166654056] and parameters: {'dropout': 0.3629852321658984, 'num_heads': 4, 'bias': False, 'loss_fn': 'MAE', 'optimizer': 'Adam', 'lr': 0.0020026931174657535, 'weight_decay': 6.0239055358915006e-05}. 
[I 2024-04-21 06:31:34,944] Trial 268 finished with values: [5.079593224311841, 0.3317437984354623, 0.05073766270767899, 63.31843850178294] and parameters: {'dropout': 0.6433769190190421, 'num_heads': 4, 'bias': False, 'loss_fn': 'MAE', 'optimizer': 'RMSprop', 'lr': 0.002295064068704125, 'weight_decay': 6.24075916043652e-05}. 
[I 2024-04-21 06:31:53,204] Trial 269 finished with values: [5.332704260664315, 0.18438698187422348, -0.03856795613630393, 69.2753717040059] and parameters: {'dropout': 0.4934354255005909, 'num_heads': 1, 'bias': False, 'loss_fn': 'MAE', 'optimizer': 'RMSprop', 'lr': 0.0016801200246028194, 'weight_decay': 0.08177173682887226}. 
[I 2024-04-21 06:32:18,384] Trial 270 finished with values: [4.920466181214711, 0.44725937853179015, 0.11538763273356112, 59.006105661419404] and parameters: {'dropout': 0.5323331816379571, 'num_heads': 2, 'bias': False, 'loss_fn': 'MAE', 'optimizer': 'RMSprop', 'lr': 0.0020026931174657535, 'weight_decay': 0.00016092681250246313}. 
[I 2024-04-21 06:32:41,753] Trial 271 finished with values: [6.365567895960484, 0.43133791502975255, -0.14887785947606602, 76.63334911063028] and parameters: {'dropout': 0.319616569696689, 'num_heads': 4, 'bias': True, 'loss_fn': 'MSE', 'optimizer': 'Adam', 'lr': 0.0009964606938187815, 'weight_decay': 2.4265340760230575e-05}. 
[I 2024-04-21 06:33:02,928] Trial 272 finished with values: [5.293423689093889, 0.28528838044873034, 0.04845839160895449, 63.470472224415545] and parameters: {'dropout': 0.319616569696689, 'num_heads': 4, 'bias': False, 'loss_fn': 'MAE', 'optimizer': 'Adam', 'lr': 0.002295064068704125, 'weight_decay': 1.242118945501002e-05}. 
[I 2024-04-21 06:33:38,817] Trial 273 finished with values: [5.262191556468178, 0.32268572414249685, 0.07809817389111251, 61.49341629592239] and parameters: {'dropout': 0.4934354255005909, 'num_heads': 4, 'bias': False, 'loss_fn': 'MAE', 'optimizer': 'Adam', 'lr': 0.0020026931174657535, 'weight_decay': 4.221917657289298e-05}. 
[I 2024-04-21 06:34:01,499] Trial 274 finished with values: [5.350817363556525, 0.21668715715636838, -0.06006469916911117, 70.70926426272045] and parameters: {'dropout': 0.4244817098248359, 'num_heads': 2, 'bias': False, 'loss_fn': 'MAE', 'optimizer': 'Adam', 'lr': 0.00015587385647697547, 'weight_decay': 0.00030304918584754363}. 
[I 2024-04-21 06:34:24,217] Trial 275 finished with values: [4.8734291151854325, 0.43223569044709426, 0.15210333698974443, 56.557066053858435] and parameters: {'dropout': 0.6661280330898132, 'num_heads': 2, 'bias': False, 'loss_fn': 'MAE', 'optimizer': 'RMSprop', 'lr': 0.00015587385647697547, 'weight_decay': 4.221917657289298e-05}. 
[I 2024-04-21 06:34:48,090] Trial 276 finished with values: [6.028295416270473, 0.349945860860338, -0.14081162869809583, 76.09530907955423] and parameters: {'dropout': 0.4591224360083581, 'num_heads': 4, 'bias': False, 'loss_fn': 'MSE', 'optimizer': 'RMSprop', 'lr': 0.00046399779725227766, 'weight_decay': 0.00019430496650347164}. 
[I 2024-04-21 06:35:05,814] Trial 277 finished with values: [4.955364308753621, 0.44419975791115707, 0.10039246646401834, 60.00632496430497] and parameters: {'dropout': 0.3523515642029993, 'num_heads': 4, 'bias': False, 'loss_fn': 'MAE', 'optimizer': 'RMSprop', 'lr': 0.0020026931174657535, 'weight_decay': 6.24075916043652e-05}. 
[I 2024-04-21 06:35:25,701] Trial 278 finished with values: [9.506844232037574, 0.13051851201408138, -1.5428613888558314, 169.61592822495393] and parameters: {'dropout': 0.3693292913693079, 'num_heads': 4, 'bias': True, 'loss_fn': 'MSE', 'optimizer': 'RMSprop', 'lr': 0.0009964606938187815, 'weight_decay': 3.8599792229348496e-05}. 
[I 2024-04-21 06:35:59,419] Trial 279 finished with values: [5.337862849676272, 0.21576214656347792, -0.03375638867103148, 68.95442676952547] and parameters: {'dropout': 0.3523515642029993, 'num_heads': 2, 'bias': True, 'loss_fn': 'MAE', 'optimizer': 'RMSprop', 'lr': 0.0020026931174657535, 'weight_decay': 2.4265340760230575e-05}. 
[W 2024-04-21 06:36:16,476] Trial 280 failed with parameters: {'dropout': 0.6122433820616829, 'num_heads': 2, 'bias': False, 'loss_fn': 'MAE', 'optimizer': 'Adam', 'lr': 0.009263118536854284, 'weight_decay': 1.3344143820661265e-05} because of the following error: The value nan is not acceptable.
[W 2024-04-21 06:36:16,476] Trial 280 failed with value [5.399277440275806, nan, -0.10939442926403098, 73.99969448271018].
[I 2024-04-21 06:36:34,450] Trial 281 finished with values: [5.311606208592789, 0.21991856830221038, 0.013194219306990496, 65.82269061284043] and parameters: {'dropout': 0.4591224360083581, 'num_heads': 4, 'bias': False, 'loss_fn': 'MAE', 'optimizer': 'Adam', 'lr': 0.0009964606938187815, 'weight_decay': 1.242118945501002e-05}. 
[I 2024-04-21 06:36:46,985] Trial 282 finished with values: [5.408024714684987, 0.2528470442250162, -0.09024362893007565, 72.72228282782002] and parameters: {'dropout': 0.4934354255005909, 'num_heads': 2, 'bias': True, 'loss_fn': 'MAE', 'optimizer': 'Adam', 'lr': 0.0020026931174657535, 'weight_decay': 0.004521224869946979}. 
[I 2024-04-21 06:37:10,158] Trial 283 finished with values: [4.792723314681305, 0.505789650034876, 0.19987411901175245, 53.37062200692568] and parameters: {'dropout': 0.6799331143119542, 'num_heads': 2, 'bias': False, 'loss_fn': 'MAE', 'optimizer': 'Adam', 'lr': 0.0020026931174657535, 'weight_decay': 4.567853269399096e-05}. 
[W 2024-04-21 06:44:02,544] Trial 284 failed with parameters: {'dropout': 0.4244817098248359, 'num_heads': 8, 'bias': False, 'loss_fn': 'MSE', 'optimizer': 'SGD', 'lr': 0.002127848460471393, 'weight_decay': 4.221917657289298e-05} because of the following error: The value nan is not acceptable.
[W 2024-04-21 06:44:02,544] Trial 284 failed with value [nan, nan, nan, nan].
[I 2024-04-21 06:44:21,683] Trial 285 finished with values: [5.514345165817154, 0.14913659324895884, -0.09814426165272616, 73.24927700795494] and parameters: {'dropout': 0.4934354255005909, 'num_heads': 2, 'bias': False, 'loss_fn': 'MSE', 'optimizer': 'RMSprop', 'lr': 0.0020026931174657535, 'weight_decay': 0.00016092681250246313}. 
