[I 2024-04-21 02:21:16,895] Trial 195 finished with values: [6.233758063016419, -0.04212469749451641, -0.8811438754405962, 125.4775293517321] and parameters: {'dropout': 0.4692721577950015, 'num_heads': 1, 'bias': True, 'loss_fn': 'MSE', 'optimizer': 'RMSprop', 'lr': 0.013618270161348199, 'weight_decay': 0.018793626984551694}. 
[I 2024-04-21 02:21:29,073] Trial 196 finished with values: [5.458159831026869, 0.22568554011021533, 0.029132778482208743, 64.75954437886918] and parameters: {'dropout': 0.4175623535922639, 'num_heads': 4, 'bias': False, 'loss_fn': 'MSE', 'optimizer': 'RMSprop', 'lr': 0.0003464779303760371, 'weight_decay': 0.0037168330157469373}. 
[I 2024-04-21 02:21:40,200] Trial 197 finished with values: [5.313828591894337, 0.2034632517467566, -0.009460328481809999, 67.33381196949564] and parameters: {'dropout': 0.5356496528379955, 'num_heads': 2, 'bias': False, 'loss_fn': 'MSE', 'optimizer': 'Adam', 'lr': 0.0008974100862471255, 'weight_decay': 0.0012646218294935334}. 
[I 2024-04-21 02:21:52,863] Trial 198 finished with values: [5.421830583706028, 0.17453924770452522, -0.10036896521644612, 73.39767092420986] and parameters: {'dropout': 0.564828765402576, 'num_heads': 1, 'bias': False, 'loss_fn': 'MAE', 'optimizer': 'Adam', 'lr': 0.001259987046706076, 'weight_decay': 0.0005311105933556758}. 
[I 2024-04-21 02:22:12,010] Trial 199 finished with values: [5.311901190200098, 0.2571076632051054, -0.059056407479515904, 70.64200840221554] and parameters: {'dropout': 0.6586733276831351, 'num_heads': 4, 'bias': False, 'loss_fn': 'MAE', 'optimizer': 'Adam', 'lr': 0.0004399465845986358, 'weight_decay': 0.005004304918035022}. 
[I 2024-04-21 02:22:22,558] Trial 200 finished with values: [5.327381464882797, 0.2124874727645325, -0.05778941374382485, 70.55749639559329] and parameters: {'dropout': 0.6843836269030925, 'num_heads': 8, 'bias': True, 'loss_fn': 'MSE', 'optimizer': 'Adam', 'lr': 0.0009181384288823589, 'weight_decay': 0.003006198705678768}. 
[I 2024-04-21 02:22:30,513] Trial 201 finished with values: [5.556174540604347, 0.04702176393948085, -0.1515798312011598, 76.81357814088646] and parameters: {'dropout': 0.250127375517484, 'num_heads': 1, 'bias': True, 'loss_fn': 'MAE', 'optimizer': 'RMSprop', 'lr': 0.00012653702848240087, 'weight_decay': 0.00014714370666574225}. 
[I 2024-04-21 02:22:48,254] Trial 202 finished with values: [5.3803093963073, 0.1891678905968663, -0.07093486461130927, 71.43433453572769] and parameters: {'dropout': 0.5010784230012597, 'num_heads': 2, 'bias': True, 'loss_fn': 'MAE', 'optimizer': 'RMSprop', 'lr': 0.0009181384288823589, 'weight_decay': 0.0002587068960219466}. 
[I 2024-04-21 02:23:09,309] Trial 203 finished with values: [5.364327230870709, 0.1930481549808774, -0.025990010955350806, 68.43638777181845] and parameters: {'dropout': 0.5308643758909863, 'num_heads': 8, 'bias': True, 'loss_fn': 'MSE', 'optimizer': 'Adam', 'lr': 0.00012653702848240087, 'weight_decay': 0.00014714370666574225}. 
[I 2024-04-21 02:23:21,461] Trial 204 finished with values: [5.358704747707273, 0.20407344008284228, -0.024938069789743667, 68.36622036984188] and parameters: {'dropout': 0.47947213988756854, 'num_heads': 8, 'bias': False, 'loss_fn': 'MSE', 'optimizer': 'RMSprop', 'lr': 0.00019290042098284114, 'weight_decay': 0.0008862509658684476}. 
[I 2024-04-21 02:23:38,573] Trial 205 finished with values: [5.216601197401631, 0.26281692131689594, -0.02098854223479729, 68.10277589535416] and parameters: {'dropout': 0.4175623535922639, 'num_heads': 1, 'bias': False, 'loss_fn': 'MAE', 'optimizer': 'RMSprop', 'lr': 0.001259987046706076, 'weight_decay': 0.0037168330157469373}. 
[I 2024-04-21 02:23:53,909] Trial 206 finished with values: [5.35041924288857, 0.18488916084723245, -0.00726701245585204, 67.18751168932154] and parameters: {'dropout': 0.5356496528379955, 'num_heads': 4, 'bias': False, 'loss_fn': 'MSE', 'optimizer': 'Adam', 'lr': 0.0025897766497561176, 'weight_decay': 0.0002587068960219466}. 
[I 2024-04-21 02:24:05,746] Trial 207 finished with values: [5.349363176694721, 0.17927739381704952, -0.07200447647464947, 71.50568062239837] and parameters: {'dropout': 0.48449624536526786, 'num_heads': 1, 'bias': False, 'loss_fn': 'MAE', 'optimizer': 'RMSprop', 'lr': 0.001259987046706076, 'weight_decay': 0.06851951865397855}. 
[I 2024-04-21 02:24:25,607] Trial 208 finished with values: [5.241491971975678, 0.1987738056740479, -0.035684810304354775, 69.08305785684257] and parameters: {'dropout': 0.4622029983473447, 'num_heads': 1, 'bias': True, 'loss_fn': 'MAE', 'optimizer': 'RMSprop', 'lr': 0.001259987046706076, 'weight_decay': 0.003006198705678768}. 
[I 2024-04-21 02:24:36,069] Trial 209 finished with values: [5.5463782626683145, 0.04559162845536568, -0.1269415172114794, 75.17013406030372] and parameters: {'dropout': 0.5010784230012597, 'num_heads': 8, 'bias': True, 'loss_fn': 'MSE', 'optimizer': 'RMSprop', 'lr': 0.00037518143649159464, 'weight_decay': 6.336536341307612e-05}. 
[I 2024-04-21 02:24:52,852] Trial 210 finished with values: [6.541807883482704, 0.1274246256646044, -0.2196480690609124, 81.35391895451366] and parameters: {'dropout': 0.250127375517484, 'num_heads': 8, 'bias': True, 'loss_fn': 'MSE', 'optimizer': 'RMSprop', 'lr': 0.002296408255281905, 'weight_decay': 0.00014714370666574225}. 
[I 2024-04-21 02:25:10,702] Trial 211 finished with values: [5.491509285553254, 0.12305761578452284, -0.13372117501501846, 75.62235609506915] and parameters: {'dropout': 0.6843836269030925, 'num_heads': 8, 'bias': False, 'loss_fn': 'MSE', 'optimizer': 'Adam', 'lr': 0.00019290042098284114, 'weight_decay': 9.862400533423962e-05}. 
[I 2024-04-21 02:25:22,375] Trial 212 finished with values: [5.354067710626378, 0.21974647484792698, -0.002308466987929414, 66.85676291320922] and parameters: {'dropout': 0.3300927418933808, 'num_heads': 2, 'bias': False, 'loss_fn': 'MSE', 'optimizer': 'Adam', 'lr': 0.00019290042098284114, 'weight_decay': 1.7259304738591127e-05}. 
[I 2024-04-21 02:25:49,848] Trial 213 finished with values: [5.297967264837226, 0.19851488777369938, -0.019140647807486477, 67.97951619668412] and parameters: {'dropout': 0.29718655227845536, 'num_heads': 2, 'bias': False, 'loss_fn': 'MAE', 'optimizer': 'RMSprop', 'lr': 0.0001170951834227463, 'weight_decay': 0.0015190414835792026}. 
[I 2024-04-21 02:26:01,834] Trial 214 finished with values: [5.393393064498286, 0.12957627508209035, -0.09252632870076494, 72.87454525241037] and parameters: {'dropout': 0.3936067762435769, 'num_heads': 2, 'bias': False, 'loss_fn': 'MAE', 'optimizer': 'RMSprop', 'lr': 0.0001170951834227463, 'weight_decay': 0.008818160881482772}. 
[I 2024-04-21 02:26:18,634] Trial 215 finished with values: [5.410245968193295, 0.1882014892237992, -0.01569055806133912, 67.7493856133512] and parameters: {'dropout': 0.3186712596423216, 'num_heads': 8, 'bias': False, 'loss_fn': 'MSE', 'optimizer': 'RMSprop', 'lr': 0.00012653702848240087, 'weight_decay': 0.02076297142943548}. 
[I 2024-04-21 02:26:33,388] Trial 216 finished with values: [5.3304136931293105, 0.21082102409773498, -0.058755884358215216, 70.62196267404653] and parameters: {'dropout': 0.564828765402576, 'num_heads': 4, 'bias': True, 'loss_fn': 'MAE', 'optimizer': 'Adam', 'lr': 0.001259987046706076, 'weight_decay': 0.08706296017842331}. 
[I 2024-04-21 02:26:51,434] Trial 217 finished with values: [5.373468073208995, 0.18708210640532066, -0.06004610961651258, 70.70802428785076] and parameters: {'dropout': 0.6743237762582717, 'num_heads': 2, 'bias': False, 'loss_fn': 'MSE', 'optimizer': 'RMSprop', 'lr': 0.00012653702848240087, 'weight_decay': 0.00014714370666574225}. 
[I 2024-04-21 02:26:59,759] Trial 218 finished with values: [5.860388854784753, 0.022850593966131743, -0.2021319588171231, 80.1855456759262] and parameters: {'dropout': 0.250127375517484, 'num_heads': 8, 'bias': True, 'loss_fn': 'MSE', 'optimizer': 'RMSprop', 'lr': 0.00012653702848240087, 'weight_decay': 0.003006198705678768}. 
[W 2024-04-21 02:30:17,143] Trial 219 failed with parameters: {'dropout': 0.35401135963479047, 'num_heads': 2, 'bias': False, 'loss_fn': 'MSE', 'optimizer': 'SGD', 'lr': 0.005872983613013404, 'weight_decay': 0.00014714370666574225} because of the following error: The value nan is not acceptable.
[W 2024-04-21 02:30:17,143] Trial 219 failed with value [nan, nan, nan, nan].
[I 2024-04-21 02:30:37,731] Trial 220 finished with values: [5.335352052658543, 0.20611481333133091, -0.01095951852857735, 67.43381211597728] and parameters: {'dropout': 0.601322534865889, 'num_heads': 1, 'bias': True, 'loss_fn': 'MSE', 'optimizer': 'RMSprop', 'lr': 0.00019290042098284114, 'weight_decay': 0.02076297142943548}. 
[I 2024-04-21 02:30:51,043] Trial 221 finished with values: [5.503854559589762, 0.1952374768034623, -0.0648159795603962, 71.02618788166275] and parameters: {'dropout': 0.2864316147243036, 'num_heads': 1, 'bias': False, 'loss_fn': 'MSE', 'optimizer': 'RMSprop', 'lr': 0.0005763062233516245, 'weight_decay': 0.01693527897253239}. 
[I 2024-04-21 02:31:01,811] Trial 222 finished with values: [5.511431225940975, 0.0629805878838974, -0.1419132300952166, 76.16878895711476] and parameters: {'dropout': 0.5010784230012597, 'num_heads': 8, 'bias': True, 'loss_fn': 'MAE', 'optimizer': 'Adam', 'lr': 0.00012123567350640214, 'weight_decay': 0.009441847196587201}. 
[I 2024-04-21 02:31:15,148] Trial 223 finished with values: [5.2628101052034335, 0.2859597156366846, -0.021073560244024847, 68.10844683306793] and parameters: {'dropout': 0.601322534865889, 'num_heads': 1, 'bias': False, 'loss_fn': 'MAE', 'optimizer': 'RMSprop', 'lr': 0.0009181384288823589, 'weight_decay': 1.251476968558302e-05}. 
[I 2024-04-21 02:31:32,400] Trial 224 finished with values: [5.2952109448561036, 0.21800309757269964, -0.020224920451571204, 68.05184019821301] and parameters: {'dropout': 0.2864316147243036, 'num_heads': 1, 'bias': True, 'loss_fn': 'MAE', 'optimizer': 'Adam', 'lr': 0.0004886778990874548, 'weight_decay': 9.187573219720651e-05}. 
[I 2024-04-21 02:31:45,424] Trial 225 finished with values: [5.3695135324811, -0.14047869503457666, -0.09325742398798709, 72.92331134178768] and parameters: {'dropout': 0.553678472298213, 'num_heads': 2, 'bias': False, 'loss_fn': 'MAE', 'optimizer': 'SGD', 'lr': 0.001259987046706076, 'weight_decay': 0.0008862509658684476}. 
[I 2024-04-21 02:31:56,230] Trial 226 finished with values: [5.320105432977917, 0.23415365751215617, -0.05826699900241872, 70.58935266086122] and parameters: {'dropout': 0.601322534865889, 'num_heads': 8, 'bias': False, 'loss_fn': 'MAE', 'optimizer': 'RMSprop', 'lr': 0.0003464779303760371, 'weight_decay': 0.0002587068960219466}. 
[I 2024-04-21 02:32:18,059] Trial 227 finished with values: [5.3311555736365515, 0.19236252325857964, -0.024490834552532537, 68.33638853542617] and parameters: {'dropout': 0.564828765402576, 'num_heads': 2, 'bias': True, 'loss_fn': 'MSE', 'optimizer': 'Adam', 'lr': 0.0001170951834227463, 'weight_decay': 0.0008862509658684476}. 
[I 2024-04-21 02:32:42,936] Trial 228 finished with values: [5.358756084111574, -1.0, -0.08587043110498338, 72.43057836777153] and parameters: {'dropout': 0.5308643758909863, 'num_heads': 2, 'bias': True, 'loss_fn': 'MAE', 'optimizer': 'RMSprop', 'lr': 0.002296408255281905, 'weight_decay': 0.00013665991125097322}. 
[I 2024-04-21 02:33:05,090] Trial 229 finished with values: [5.395986523743692, 0.19799518128077953, -0.03350290351003249, 68.93751860415612] and parameters: {'dropout': 0.553678472298213, 'num_heads': 8, 'bias': False, 'loss_fn': 'MSE', 'optimizer': 'RMSprop', 'lr': 0.00012653702848240087, 'weight_decay': 0.02076297142943548}. 
[I 2024-04-21 02:33:24,765] Trial 230 finished with values: [5.251388441191436, 0.26921634434087743, -0.023622748391637582, 68.2784847737014] and parameters: {'dropout': 0.26012060126618136, 'num_heads': 1, 'bias': False, 'loss_fn': 'MAE', 'optimizer': 'Adam', 'lr': 0.00010447899875809218, 'weight_decay': 0.0037168330157469373}. 
[I 2024-04-21 02:33:37,881] Trial 231 finished with values: [5.59379763554155, 0.16588724069487704, -0.12682684643019893, 75.16248520020761] and parameters: {'dropout': 0.4175623535922639, 'num_heads': 8, 'bias': False, 'loss_fn': 'MSE', 'optimizer': 'RMSprop', 'lr': 0.0003464779303760371, 'weight_decay': 2.8049146073131596e-05}. 
[I 2024-04-21 02:33:55,017] Trial 232 finished with values: [5.1901207961039635, 0.2806232359686801, 0.016679230091116493, 65.59023069913296] and parameters: {'dropout': 0.264360828881129, 'num_heads': 1, 'bias': True, 'loss_fn': 'MAE', 'optimizer': 'RMSprop', 'lr': 0.0011218242088903074, 'weight_decay': 6.016476080954159e-05}. 
[I 2024-04-21 02:34:03,677] Trial 233 finished with values: [5.60477936262892, -0.06888548007501273, -0.17546233327889227, 78.40660746446736] and parameters: {'dropout': 0.35678171751055654, 'num_heads': 4, 'bias': False, 'loss_fn': 'MAE', 'optimizer': 'RMSprop', 'lr': 0.003732613088530846, 'weight_decay': 0.08706296017842331}. 
[I 2024-04-21 02:34:25,624] Trial 234 finished with values: [5.295669369692378, 0.14760571873699116, -0.044665739213578526, 69.68211079772887] and parameters: {'dropout': 0.553678472298213, 'num_heads': 2, 'bias': True, 'loss_fn': 'MAE', 'optimizer': 'RMSprop', 'lr': 0.0014245419603048832, 'weight_decay': 0.0027296084983015347}. 
[I 2024-04-21 02:34:35,607] Trial 235 finished with values: [5.286632412473949, 0.26961926607099435, -0.02601225359030024, 68.43787141744288] and parameters: {'dropout': 0.4622029983473447, 'num_heads': 1, 'bias': False, 'loss_fn': 'MAE', 'optimizer': 'RMSprop', 'lr': 0.001259987046706076, 'weight_decay': 0.003006198705678768}. 
[I 2024-04-21 02:34:46,266] Trial 236 finished with values: [5.911666806647577, 0.050429550529445026, -0.2406248352098268, 82.75312760863021] and parameters: {'dropout': 0.5010784230012597, 'num_heads': 1, 'bias': False, 'loss_fn': 'MSE', 'optimizer': 'Adam', 'lr': 0.00012653702848240087, 'weight_decay': 6.336536341307612e-05}. 
[I 2024-04-21 02:34:56,982] Trial 237 finished with values: [5.394562326940108, 0.1481071294185148, -0.09650169066186498, 73.13971295365324] and parameters: {'dropout': 0.27365393415702083, 'num_heads': 2, 'bias': False, 'loss_fn': 'MAE', 'optimizer': 'RMSprop', 'lr': 0.0001170951834227463, 'weight_decay': 0.008818160881482772}. 
[I 2024-04-21 02:35:06,169] Trial 238 finished with values: [5.371748853262883, 0.24154484125051343, -0.08651416007917301, 72.47351688103889] and parameters: {'dropout': 0.5356496528379955, 'num_heads': 2, 'bias': True, 'loss_fn': 'MAE', 'optimizer': 'Adam', 'lr': 0.0014245419603048832, 'weight_decay': 0.016453122909363}. 
[I 2024-04-21 02:35:16,438] Trial 239 finished with values: [5.451874751999348, 0.2106677901092807, -0.0879514340527181, 72.56938705320196] and parameters: {'dropout': 0.6352229583985685, 'num_heads': 8, 'bias': False, 'loss_fn': 'MAE', 'optimizer': 'RMSprop', 'lr': 0.00012653702848240087, 'weight_decay': 0.02076297142943548}. 
[I 2024-04-21 02:35:31,546] Trial 240 finished with values: [5.29928218126777, 0.27252126361255946, 0.06752991573179079, 62.19834851333313] and parameters: {'dropout': 0.250127375517484, 'num_heads': 2, 'bias': False, 'loss_fn': 'MSE', 'optimizer': 'Adam', 'lr': 0.0008974100862471255, 'weight_decay': 0.0012646218294935334}. 
[I 2024-04-21 02:35:48,066] Trial 241 finished with values: [5.351035525594345, 0.18304225429172288, -0.04518491816234205, 69.71674147783409] and parameters: {'dropout': 0.6248103281053354, 'num_heads': 2, 'bias': True, 'loss_fn': 'MSE', 'optimizer': 'RMSprop', 'lr': 0.00012653702848240087, 'weight_decay': 0.0021941429038526616}. 
[I 2024-04-21 02:36:06,452] Trial 242 finished with values: [5.352325135702973, 0.17799565531353603, -0.04954282926753795, 70.00742627114177] and parameters: {'dropout': 0.553678472298213, 'num_heads': 2, 'bias': False, 'loss_fn': 'MSE', 'optimizer': 'Adam', 'lr': 0.0002743881097041735, 'weight_decay': 0.0037168330157469373}. 
[I 2024-04-21 02:36:27,517] Trial 243 finished with values: [5.393808724531749, 0.20739347856291634, -0.022725693958374205, 68.21864874762734] and parameters: {'dropout': 0.553678472298213, 'num_heads': 8, 'bias': True, 'loss_fn': 'MSE', 'optimizer': 'RMSprop', 'lr': 0.00019290042098284114, 'weight_decay': 0.02076297142943548}. 
[I 2024-04-21 02:36:36,886] Trial 244 finished with values: [5.349739741080558, 0.18359301300378242, -0.06864076845189282, 71.2813119403074] and parameters: {'dropout': 0.37661264521482396, 'num_heads': 8, 'bias': False, 'loss_fn': 'MAE', 'optimizer': 'RMSprop', 'lr': 0.0011218242088903074, 'weight_decay': 0.0008862509658684476}. 
[I 2024-04-21 02:36:50,905] Trial 245 finished with values: [5.273404540512103, 0.224505383669556, -0.015329871625048952, 67.72532682471346] and parameters: {'dropout': 0.3186712596423216, 'num_heads': 8, 'bias': False, 'loss_fn': 'MAE', 'optimizer': 'Adam', 'lr': 0.00012653702848240087, 'weight_decay': 0.0009259466988382586}. 
[I 2024-04-21 02:36:58,235] Trial 246 finished with values: [5.346343469800908, 0.15543037419773575, -0.04735172406517263, 69.86127345905123] and parameters: {'dropout': 0.5308643758909863, 'num_heads': 1, 'bias': False, 'loss_fn': 'MAE', 'optimizer': 'RMSprop', 'lr': 0.001259987046706076, 'weight_decay': 0.003006198705678768}. 
[I 2024-04-21 02:37:07,604] Trial 247 finished with values: [5.3610071291768735, 0.23238449876977477, -0.07878013723327837, 71.95763604314955] and parameters: {'dropout': 0.5356496528379955, 'num_heads': 2, 'bias': True, 'loss_fn': 'MSE', 'optimizer': 'Adam', 'lr': 0.0014245419603048832, 'weight_decay': 0.016453122909363}. 
