[I 2024-04-21 05:04:01,988] Trial 122 finished with values: [5.0371375535106075, 0.4425250111119215, 0.08703019541161172, 60.89762561391183] and parameters: {'dropout': 0.6661280330898132, 'num_heads': 4, 'bias': True, 'loss_fn': 'MAE', 'optimizer': 'RMSprop', 'lr': 0.00018565247131226996, 'weight_decay': 0.00029822251778626087}. 
[I 2024-04-21 05:04:20,146] Trial 123 finished with values: [5.3683117831833815, 0.35977451486377293, 0.02574503780733728, 64.98551610570888] and parameters: {'dropout': 0.41583579683239735, 'num_heads': 8, 'bias': True, 'loss_fn': 'MAE', 'optimizer': 'RMSprop', 'lr': 0.0001083005560110781, 'weight_decay': 4.567853269399096e-05}. 
[I 2024-04-21 05:04:42,849] Trial 124 finished with values: [5.344919477744714, -0.20184151578850243, -0.07564719616357762, 71.7486601587619] and parameters: {'dropout': 0.6493701617463983, 'num_heads': 1, 'bias': False, 'loss_fn': 'MAE', 'optimizer': 'SGD', 'lr': 0.02612923890676587, 'weight_decay': 0.00219078254882845}. 
[I 2024-04-21 05:04:59,112] Trial 125 finished with values: [5.480915560360311, -0.20184151578850243, -0.14033888435899033, 76.06377571708236] and parameters: {'dropout': 0.3590963316104463, 'num_heads': 8, 'bias': False, 'loss_fn': 'MAE', 'optimizer': 'Adam', 'lr': 0.008458567404280862, 'weight_decay': 1.242118945501002e-05}. 
[I 2024-04-21 05:05:18,284] Trial 126 finished with values: [7.619693846421336, 0.24340264321442892, -0.6359577657904787, 109.1229337931899] and parameters: {'dropout': 0.6036800503860398, 'num_heads': 4, 'bias': True, 'loss_fn': 'MSE', 'optimizer': 'RMSprop', 'lr': 0.0002316368618636525, 'weight_decay': 6.24075916043652e-05}. 
[I 2024-04-21 05:05:46,605] Trial 127 finished with values: [4.891978252955697, 0.4793176505051323, 0.2219069298755697, 51.90097223267953] and parameters: {'dropout': 0.6122433820616829, 'num_heads': 2, 'bias': False, 'loss_fn': 'MAE', 'optimizer': 'Adam', 'lr': 0.0020108387978155272, 'weight_decay': 9.133735498525707e-05}. 
[I 2024-04-21 05:06:14,011] Trial 128 finished with values: [12.022020989277122, 0.07784835693950082, -4.288217000683717, 352.73878440914274] and parameters: {'dropout': 0.507115799196707, 'num_heads': 2, 'bias': True, 'loss_fn': 'MSE', 'optimizer': 'Adam', 'lr': 0.0014938197620523084, 'weight_decay': 0.0009823700199596424}. 
[I 2024-04-21 05:06:27,987] Trial 129 finished with values: [5.298594310581497, 0.24150957543248538, -0.04805602731793868, 69.90825244520177] and parameters: {'dropout': 0.43792912899809555, 'num_heads': 8, 'bias': True, 'loss_fn': 'MAE', 'optimizer': 'RMSprop', 'lr': 0.003922468660665162, 'weight_decay': 0.04302132200345548}. 
[I 2024-04-21 05:07:05,466] Trial 130 finished with values: [6.105302847687261, 0.40064068885759785, -0.10698191369614385, 73.83877298333248] and parameters: {'dropout': 0.4244817098248359, 'num_heads': 2, 'bias': False, 'loss_fn': 'MSE', 'optimizer': 'Adam', 'lr': 0.00015587385647697547, 'weight_decay': 1.2266916063951385e-05}. 
[I 2024-04-21 05:07:18,353] Trial 131 finished with values: [5.358259881423464, 0.2021509517908137, 0.02106448923791926, 65.29772171537486] and parameters: {'dropout': 0.23263101391627533, 'num_heads': 8, 'bias': True, 'loss_fn': 'MAE', 'optimizer': 'RMSprop', 'lr': 0.0001083005560110781, 'weight_decay': 0.04302132200345548}. 
[W 2024-04-21 05:13:44,981] Trial 132 failed with parameters: {'dropout': 0.23263101391627533, 'num_heads': 8, 'bias': True, 'loss_fn': 'MSE', 'optimizer': 'SGD', 'lr': 0.0029330059977397314, 'weight_decay': 0.04302132200345548} because of the following error: The value nan is not acceptable.
[W 2024-04-21 05:13:44,981] Trial 132 failed with value [nan, nan, nan, nan].
[I 2024-04-21 05:14:41,188] Trial 133 finished with values: [8.370684581297093, 0.1919840280755982, -0.8868941315686782, 125.86108743121308] and parameters: {'dropout': 0.3629852321658984, 'num_heads': 4, 'bias': True, 'loss_fn': 'MAE', 'optimizer': 'Adam', 'lr': 0.0001359162559976252, 'weight_decay': 0.0011396091886266457}. 
[I 2024-04-21 05:15:27,775] Trial 134 finished with values: [5.554459514559458, 0.271245420540403, -0.027324419943687284, 68.52539656332408] and parameters: {'dropout': 0.4591224360083581, 'num_heads': 2, 'bias': True, 'loss_fn': 'MSE', 'optimizer': 'Adam', 'lr': 0.0014938197620523084, 'weight_decay': 0.0009823700199596424}. 
[I 2024-04-21 05:15:59,542] Trial 135 finished with values: [5.324046260609635, 0.2208828262335292, -0.0006378493531695728, 66.7453280697409] and parameters: {'dropout': 0.570948598139843, 'num_heads': 8, 'bias': True, 'loss_fn': 'MSE', 'optimizer': 'RMSprop', 'lr': 0.0029330059977397314, 'weight_decay': 0.04302132200345548}. 
[W 2024-04-21 05:22:26,347] Trial 136 failed with parameters: {'dropout': 0.3693292913693079, 'num_heads': 1, 'bias': True, 'loss_fn': 'MSE', 'optimizer': 'SGD', 'lr': 0.0005080531794315761, 'weight_decay': 0.0129197497864599} because of the following error: The value nan is not acceptable.
[W 2024-04-21 05:22:26,347] Trial 136 failed with value [nan, nan, nan, nan].
[I 2024-04-21 05:22:50,771] Trial 137 finished with values: [5.916923862051646, 0.1407945468358929, -0.13769738302944678, 75.88758023042253] and parameters: {'dropout': 0.5634662740865948, 'num_heads': 4, 'bias': True, 'loss_fn': 'MAE', 'optimizer': 'RMSprop', 'lr': 0.00018565247131226996, 'weight_decay': 0.00029822251778626087}. 
[I 2024-04-21 05:23:08,017] Trial 138 finished with values: [5.906690022982989, 0.22857292061948106, -0.026325037953612407, 68.45873500456167] and parameters: {'dropout': 0.36462849101759043, 'num_heads': 8, 'bias': False, 'loss_fn': 'MAE', 'optimizer': 'RMSprop', 'lr': 0.0004253239218964941, 'weight_decay': 0.003061438489570887}. 
[I 2024-04-21 05:23:46,325] Trial 139 finished with values: [5.090811529512947, 0.38949272938879753, 0.1235971345735436, 58.45850905196377] and parameters: {'dropout': 0.6656358839105669, 'num_heads': 4, 'bias': True, 'loss_fn': 'MSE', 'optimizer': 'RMSprop', 'lr': 0.0015605316138833955, 'weight_decay': 0.00029822251778626087}. 
[I 2024-04-21 05:24:06,912] Trial 140 finished with values: [5.628065262513828, 0.2644324084987688, -0.05678023857065018, 70.49018160427602] and parameters: {'dropout': 0.3600997882362048, 'num_heads': 2, 'bias': False, 'loss_fn': 'MSE', 'optimizer': 'Adam', 'lr': 0.003922468660665162, 'weight_decay': 4.221917657289298e-05}. 
[I 2024-04-21 05:24:48,812] Trial 141 finished with values: [4.932859813873169, 0.4104299548759852, 0.14071738666052658, 57.31654061361117] and parameters: {'dropout': 0.4244817098248359, 'num_heads': 2, 'bias': False, 'loss_fn': 'MAE', 'optimizer': 'Adam', 'lr': 0.003922468660665162, 'weight_decay': 4.221917657289298e-05}. 
[I 2024-04-21 05:25:19,695] Trial 142 finished with values: [5.359386097145466, 0.2701791962437537, 0.03963289799035774, 64.05915719903591] and parameters: {'dropout': 0.41583579683239735, 'num_heads': 4, 'bias': False, 'loss_fn': 'MAE', 'optimizer': 'Adam', 'lr': 0.00036501068151543, 'weight_decay': 4.567853269399096e-05}. 
[I 2024-04-21 05:25:41,997] Trial 143 finished with values: [5.09371007300693, 0.3668774524164269, 0.1242848117575307, 58.41263907085026] and parameters: {'dropout': 0.6656358839105669, 'num_heads': 8, 'bias': True, 'loss_fn': 'MAE', 'optimizer': 'RMSprop', 'lr': 0.0015605316138833955, 'weight_decay': 0.0002912764416436785}. 
[I 2024-04-21 05:26:00,381] Trial 144 finished with values: [5.3585097033081315, -0.14095394412929638, -0.08569643754826384, 72.41897251353288] and parameters: {'dropout': 0.6122433820616829, 'num_heads': 2, 'bias': False, 'loss_fn': 'MAE', 'optimizer': 'SGD', 'lr': 0.0020108387978155272, 'weight_decay': 7.729156960431118e-05}. 
[I 2024-04-21 05:26:38,100] Trial 145 finished with values: [10.107637956504934, 0.154939706520984, -3.1872313998941957, 279.2999821768868] and parameters: {'dropout': 0.6307014314065329, 'num_heads': 4, 'bias': True, 'loss_fn': 'MSE', 'optimizer': 'Adam', 'lr': 0.0009964606938187815, 'weight_decay': 2.4265340760230575e-05}. 
Training finished at Epoch 80, with validation result for [5.0882884533718595, 0.5826731644509318, 0.27681052857998334, 65.74425774375318]
Training finished at Epoch 51, with validation result for [5.100645703567069, 0.4467576793468017, 0.09759274166641818, 89.50701578426754]
Training finished at Epoch 50, with validation result for [4.858868981725824, 0.5052763863399661, 0.2517056472200708, 75.45211433895315]
Training finished at Epoch 74, with validation result for [6.025553058659463, 0.25897787478051987, 0.02228651368294665, 78.94016905877798]
Training finished at Epoch 55, with validation result for [5.524211247219452, 0.3137576327718989, 0.07936069539800517, 97.20040406411597]
Training finished at Epoch 87, with validation result for [6.570647153043055, 0.5612569389890133, 0.05490929853295656, 88.82779695878826]
Training finished at Epoch 63, with validation result for [5.610702426715878, 0.029624560739067902, -0.057229022655772344, 110.09508436200004]
Training finished at Epoch 76, with validation result for [5.687549490191224, nan, -0.021357703587331356, 107.61036987583373]
Training finished at Epoch 65, with validation result for [5.410459221548425, 0.05985044883840237, -0.017577042766930173, 100.5242897066991]
Training finished at Epoch 60, with validation result for [5.217141398517276, 0.5451296250984722, 0.2612717207260228, 71.68230265155984]
Training finished at Epoch 86, with validation result for [5.022429497282265, 0.06340592641449341, -0.07123225920275855, 89.07137876830514]
Training finished at Epoch 69, with validation result for [5.694759824826964, nan, -0.02339367803847403, 104.92106501270239]
Training finished at Epoch 54, with validation result for [4.811408244418906, 0.6011175709263201, 0.34528008311860725, 59.45024177469486]
Training finished at Epoch 56, with validation result for [5.318963376322798, nan, -0.061133890895255005, 84.68318493629195]
Training finished at Epoch 56, with validation result for [4.8093162900409, 0.26514916043009756, 0.046328805377729765, 69.78537047581604]
Training finished at Epoch 48, with validation result for [5.587723632151898, 0.4797157349350764, 0.2275945997648826, 82.08856141699096]
Training finished at Epoch 62, with validation result for [4.8020668968961155, 0.47486415959553907, 0.17403804610421525, 73.25946684647435]
Training finished at Epoch 82, with validation result for [4.853296711435513, 0.45298127986187586, 0.16781067438904795, 87.76818957124927]
Training finished at Epoch 47, with validation result for [5.451320317579783, 0.3785539875115379, 0.05278194995191665, 83.97717602438583]
Training finished at Epoch 83, with validation result for [4.705472603316062, 0.5261181717892026, 0.2678020151436614, 63.085481118158135]
Training finished at Epoch 38, with validation result for [5.324053506639353, -0.026081070893289475, -0.07329512752444667, 87.6870125866722]
Training finished at Epoch 86, with validation result for [5.437840078407276, 0.4742478269863061, 0.20014290077459607, 76.8709578787813]
Training finished at Epoch 49, with validation result for [5.255877823468199, nan, -0.01585270086669266, 86.64309788531953]
Training finished at Epoch 98, with validation result for [5.562708331705152, nan, -0.005783300971044625, 98.562048684096]
Training finished at Epoch 43, with validation result for [5.256159987817052, 0.32729229349276595, 0.10293271581591934, 89.04325167316723]
Training finished at Epoch 46, with validation result for [6.0572428322068985, 1.0, -0.04430693064407909, 116.47608297951194]
Training finished at Epoch 47, with validation result for [6.005898842507709, -0.037600139081626925, -0.06857920883386304, 117.81959899151964]
Training finished at Epoch 49, with validation result for [5.190036768166487, nan, -0.06891351080131547, 89.4261614607613]
Training finished at Epoch 81, with validation result for [5.509700448800099, -0.04190552570300436, -0.09077513516977387, 98.88113370603823]
Training finished at Epoch 86, with validation result for [5.7839048420395685, nan, -0.03331669403847637, 109.90771144471232]
Training finished at Epoch 57, with validation result for [4.450582988444105, 0.4662216035061201, 0.17547298889664353, 55.00539296781009]
Training finished at Epoch 52, with validation result for [5.644405054568302, nan, -0.03906953942323588, 97.82965743945549]
Training finished at Epoch 168, with validation result for [5.065262705499438, nan, -0.04343043965276827, 76.51559774343247]
Training finished at Epoch 51, with validation result for [5.5138322667215816, 1.0, -0.018372669550898113, 105.25923383156386]
Training finished at Epoch 69, with validation result for [5.605604897185446, 0.04238831325842756, -0.02679853480605887, 102.38239488881727]
Training finished at Epoch 64, with validation result for [5.559573745463435, nan, -0.038974865131351955, 108.11573734745575]
Training finished at Epoch 50, with validation result for [4.9169043405782435, 0.04931673191542611, -0.02891136507149583, 77.6050412460059]
Training finished at Epoch 42, with validation result for [5.498197464521856, 0.042411081870475605, -0.10563548526601818, 97.1230798914142]
Training finished at Epoch 51, with validation result for [5.077753984244546, 0.4929680901997631, 0.19312410337380315, 87.83780567482408]
Training finished at Epoch 43, with validation result for [5.374204959168087, 0.41460287081654124, 0.14064256904630978, 93.58624807672861]
Training finished at Epoch 59, with validation result for [5.028334628802483, nan, -0.006939855113485605, 96.80501110641295]
Training finished at Epoch 33, with validation result for [5.263031994047619, -1.0, -0.021798100697177913, 95.97989319518176]
Training finished at Epoch 41, with validation result for [5.1802773537405615, 0.4931681919578844, 0.21960916982524303, 78.0115084685644]
Training finished at Epoch 71, with validation result for [5.319590870074657, 0.13629468029035574, -0.0017181899431240044, 99.47135842427963]
Training finished at Epoch 67, with validation result for [5.897422425836342, 0.26264342403133245, 0.03328082961319634, 107.2579739293044]
Training finished at Epoch 34, with validation result for [5.108235232145579, 0.06747864941092126, -0.02104194222398381, 84.72460910328704]
Training finished at Epoch 82, with validation result for [4.964581022111375, 0.4548605014126266, 0.1036699374126574, 66.01036926146179]
Training finished at Epoch 37, with validation result for [5.516643423253456, -0.015749006199969565, -0.02833634698564058, 97.75557894449004]
Training finished at Epoch 130, with validation result for [5.0123378425362795, 0.4955648913809069, 0.23036123768810757, 79.9397681724741]
Training finished at Epoch 108, with validation result for [5.360923362241512, 0.5356729024961431, 0.2746124090089965, 77.83590252715744]
Training finished at Epoch 88, with validation result for [5.769909447958152, 0.025976081123209357, -0.05221111787743382, 100.2818052063895]
Training finished at Epoch 57, with validation result for [4.643518743538644, 0.414013787084132, 0.09319133295580972, 59.7332923087738]
Training finished at Epoch 50, with validation result for [5.1136270189696535, 0.3040411886209041, 0.08852135923193294, 73.7965163668695]
Training finished at Epoch 89, with validation result for [4.598781296236183, 0.551984757285183, 0.16460286166575533, 58.41990564073493]
Training finished at Epoch 50, with validation result for [5.151505116066731, 0.27844811298985933, 0.0751676336126037, 72.97294925130201]
Training finished at Epoch 89, with validation result for [5.012749467158666, 0.2826737983125786, 0.07453279984641825, 83.94692673431868]
Training finished at Epoch 68, with validation result for [4.798476627451233, 0.4687404959227179, 0.2089250748522522, 76.50356792620362]
Training finished at Epoch 57, with validation result for [5.284992164294648, 0.31700041907825927, 0.07358796870869477, 95.09616659669905]
Training finished at Epoch 46, with validation result for [5.559852815151223, nan, -0.018154142405979456, 103.02347587056711]
Training finished at Epoch 77, with validation result for [4.794730852379325, 0.578849202451357, 0.29681930817373803, 64.41806330740671]
[I 2024-04-21 05:27:26,522] Trial 146 finished with values: [6.748991036289144, 0.31674261726171665, -0.2797974507666374, 85.36605003444019] and parameters: {'dropout': 0.36462849101759043, 'num_heads': 2, 'bias': True, 'loss_fn': 'MAE', 'optimizer': 'Adam', 'lr': 0.0004595462048380458, 'weight_decay': 0.00014543044683541578}. 
[I 2024-04-21 05:27:56,931] Trial 147 finished with values: [9.596769560383308, 0.181274227211763, -2.215226605433681, 214.46455851830174] and parameters: {'dropout': 0.49692633958605953, 'num_heads': 2, 'bias': False, 'loss_fn': 'MSE', 'optimizer': 'Adam', 'lr': 0.000576102341572922, 'weight_decay': 7.334965650222417e-05}. 
[I 2024-04-21 05:28:31,190] Trial 148 finished with values: [5.476627307861203, 0.2135989553129556, -0.10723874983978621, 73.85590466856571] and parameters: {'dropout': 0.39240749140537745, 'num_heads': 8, 'bias': True, 'loss_fn': 'MSE', 'optimizer': 'Adam', 'lr': 0.0029330059977397314, 'weight_decay': 1.2266916063951385e-05}. 
[I 2024-04-21 05:28:53,041] Trial 149 finished with values: [6.609319701318105, 0.25392984833852333, -0.2603411732983629, 84.0682622049319] and parameters: {'dropout': 0.4244817098248359, 'num_heads': 8, 'bias': False, 'loss_fn': 'MAE', 'optimizer': 'RMSprop', 'lr': 0.0005375674941668259, 'weight_decay': 4.221917657289298e-05}. 
[I 2024-04-21 05:29:19,158] Trial 150 finished with values: [5.032159192520843, 0.45270526943791906, 0.20289070356150585, 53.169407426092505] and parameters: {'dropout': 0.3344998495842664, 'num_heads': 2, 'bias': False, 'loss_fn': 'MAE', 'optimizer': 'Adam', 'lr': 0.0020026931174657535, 'weight_decay': 0.00019430496650347164}. 
[I 2024-04-21 05:29:46,234] Trial 151 finished with values: [8.758554736220685, 0.1962749614180245, -1.1330587742813938, 142.2809538670586] and parameters: {'dropout': 0.3693292913693079, 'num_heads': 2, 'bias': False, 'loss_fn': 'MSE', 'optimizer': 'RMSprop', 'lr': 0.00015587385647697547, 'weight_decay': 4.221917657289298e-05}. 
[I 2024-04-21 05:29:59,266] Trial 152 finished with values: [5.3846845587329755, 0.16898670023863824, -0.010608289052590703, 67.41038413289863] and parameters: {'dropout': 0.5874682842915022, 'num_heads': 2, 'bias': False, 'loss_fn': 'MAE', 'optimizer': 'Adam', 'lr': 0.00010423634674715621, 'weight_decay': 0.00030304918584754363}. 
[I 2024-04-21 05:30:21,871] Trial 153 finished with values: [6.034221702589293, 0.33426626296774953, -0.08861011661867235, 72.6133230126371] and parameters: {'dropout': 0.4934354255005909, 'num_heads': 2, 'bias': True, 'loss_fn': 'MSE', 'optimizer': 'Adam', 'lr': 0.0001387213039796065, 'weight_decay': 0.00016092681250246313}. 
[I 2024-04-21 05:30:38,671] Trial 154 finished with values: [8.498153281408987, 0.07642871391794424, -1.0322669770585526, 135.55786061536315] and parameters: {'dropout': 0.6028476732390426, 'num_heads': 8, 'bias': False, 'loss_fn': 'MSE', 'optimizer': 'RMSprop', 'lr': 0.0004595462048380458, 'weight_decay': 0.004256857040692242}. 
[I 2024-04-21 05:31:01,793] Trial 155 finished with values: [7.750433080221938, 0.1675320837561238, -0.7847866361890992, 119.05023345252835] and parameters: {'dropout': 0.4934354255005909, 'num_heads': 1, 'bias': False, 'loss_fn': 'MSE', 'optimizer': 'RMSprop', 'lr': 0.0005080531794315761, 'weight_decay': 4.1451227238323664e-05}. 
[I 2024-04-21 05:31:15,799] Trial 156 finished with values: [5.290326625840172, 0.24550997155648663, -0.005666467425646138, 67.08075088350098] and parameters: {'dropout': 0.6122433820616829, 'num_heads': 2, 'bias': False, 'loss_fn': 'MAE', 'optimizer': 'RMSprop', 'lr': 0.0020108387978155272, 'weight_decay': 9.133735498525707e-05}. 
[I 2024-04-21 05:31:43,251] Trial 157 finished with values: [8.592966469614161, 0.21699908434357576, -1.169391300879144, 144.7044344589001] and parameters: {'dropout': 0.6124531667551212, 'num_heads': 8, 'bias': False, 'loss_fn': 'MSE', 'optimizer': 'RMSprop', 'lr': 0.0005323870899281988, 'weight_decay': 0.0011245990164565015}. 
[I 2024-04-21 05:32:13,878] Trial 158 finished with values: [5.287827394809211, 0.17587941177195615, -0.012537767262399857, 67.53908569680647] and parameters: {'dropout': 0.6656358839105669, 'num_heads': 8, 'bias': False, 'loss_fn': 'MSE', 'optimizer': 'Adam', 'lr': 0.0015605316138833955, 'weight_decay': 0.05707890586298062}. 
[I 2024-04-21 05:32:38,405] Trial 159 finished with values: [10.658942776377334, 0.1183596595594706, -2.8938243162160773, 259.7289135122934] and parameters: {'dropout': 0.4591224360083581, 'num_heads': 1, 'bias': True, 'loss_fn': 'MSE', 'optimizer': 'Adam', 'lr': 0.0001878993860460867, 'weight_decay': 0.04302132200345548}. 
[I 2024-04-21 05:33:03,844] Trial 160 finished with values: [5.460683910475435, 0.26640838463186095, 0.03699163676309791, 64.23533667020553] and parameters: {'dropout': 0.4244817098248359, 'num_heads': 1, 'bias': True, 'loss_fn': 'MSE', 'optimizer': 'Adam', 'lr': 0.0014938197620523084, 'weight_decay': 4.221917657289298e-05}. 
[W 2024-04-21 05:33:45,071] Trial 161 failed with parameters: {'dropout': 0.6291352684393432, 'num_heads': 2, 'bias': True, 'loss_fn': 'MAE', 'optimizer': 'RMSprop', 'lr': 0.044184831725991816, 'weight_decay': 0.005978117771253267} because of the following error: The value nan is not acceptable.
[W 2024-04-21 05:33:45,071] Trial 161 failed with value [5.349440708903196, nan, -0.07893024256988124, 71.9676484866555].
[I 2024-04-21 05:34:23,966] Trial 162 finished with values: [9.292054937040037, 0.19616361373704855, -2.184064329215145, 212.3859480090645] and parameters: {'dropout': 0.3123871851320933, 'num_heads': 2, 'bias': True, 'loss_fn': 'MSE', 'optimizer': 'Adam', 'lr': 0.0001387213039796065, 'weight_decay': 0.00011007350287228135}. 
