[I 2024-04-21 02:11:23,079] Trial 154 finished with values: [5.279012255032356, 0.20473100758942434, -0.03085924188898015, 68.76117902004327] and parameters: {'dropout': 0.2864316147243036, 'num_heads': 2, 'bias': True, 'loss_fn': 'MAE', 'optimizer': 'Adam', 'lr': 0.00019290042098284114, 'weight_decay': 9.187573219720651e-05}. 
[I 2024-04-21 02:11:34,857] Trial 155 finished with values: [5.30721006805029, 0.26515674595813987, -0.03343709070179535, 68.93312870677235] and parameters: {'dropout': 0.564828765402576, 'num_heads': 1, 'bias': True, 'loss_fn': 'MAE', 'optimizer': 'Adam', 'lr': 0.001259987046706076, 'weight_decay': 0.0008862509658684476}. 
[I 2024-04-21 02:11:52,759] Trial 156 finished with values: [5.433640452382033, 0.1494332883651781, -0.05353270775681662, 70.27356226519542] and parameters: {'dropout': 0.35678171751055654, 'num_heads': 8, 'bias': True, 'loss_fn': 'MSE', 'optimizer': 'RMSprop', 'lr': 0.00012653702848240087, 'weight_decay': 0.009624118486563455}. 
[I 2024-04-21 02:12:01,355] Trial 157 finished with values: [5.676170908466261, -0.062232523663720826, -0.19402833169231504, 79.64501120448901] and parameters: {'dropout': 0.264360828881129, 'num_heads': 8, 'bias': True, 'loss_fn': 'MSE', 'optimizer': 'Adam', 'lr': 0.0019215873558326476, 'weight_decay': 6.016476080954159e-05}. 
[I 2024-04-21 02:12:23,137] Trial 158 finished with values: [5.417852757125854, 0.21250025807466322, -0.060276186613188454, 70.72337106354423] and parameters: {'dropout': 0.35678171751055654, 'num_heads': 4, 'bias': False, 'loss_fn': 'MSE', 'optimizer': 'RMSprop', 'lr': 0.004165706095073904, 'weight_decay': 6.336536341307612e-05}. 
[I 2024-04-21 02:12:32,160] Trial 159 finished with values: [5.408674977116103, 0.12348601638565303, -0.07337591273459654, 71.59715923592083] and parameters: {'dropout': 0.6586733276831351, 'num_heads': 4, 'bias': True, 'loss_fn': 'MAE', 'optimizer': 'RMSprop', 'lr': 0.0004399465845986358, 'weight_decay': 0.0002587068960219466}. 
[I 2024-04-21 02:12:46,167] Trial 160 finished with values: [5.750915522433665, 0.06863090334234642, -0.09910757204525544, 73.31353249081911] and parameters: {'dropout': 0.4175623535922639, 'num_heads': 1, 'bias': True, 'loss_fn': 'MSE', 'optimizer': 'RMSprop', 'lr': 0.0009181384288823589, 'weight_decay': 0.0037168330157469373}. 
[I 2024-04-21 02:13:04,708] Trial 161 finished with values: [5.37183733276007, -0.14047869503457666, -0.09474623743998811, 73.02261934053337] and parameters: {'dropout': 0.6586733276831351, 'num_heads': 2, 'bias': True, 'loss_fn': 'MAE', 'optimizer': 'RMSprop', 'lr': 0.026148238597773737, 'weight_decay': 0.026150240107081776}. 
[I 2024-04-21 02:13:20,402] Trial 162 finished with values: [5.333295056196062, 0.1970631915480509, 0.006917611376658472, 66.24135782170721] and parameters: {'dropout': 0.4622029983473447, 'num_heads': 8, 'bias': True, 'loss_fn': 'MSE', 'optimizer': 'Adam', 'lr': 0.0008974100862471255, 'weight_decay': 0.003006198705678768}. 
[W 2024-04-21 02:13:30,782] Trial 163 failed with parameters: {'dropout': 0.2864316147243036, 'num_heads': 4, 'bias': True, 'loss_fn': 'MAE', 'optimizer': 'Adam', 'lr': 0.004378149122665535, 'weight_decay': 0.006466426730421486} because of the following error: The value nan is not acceptable.
[W 2024-04-21 02:13:30,782] Trial 163 failed with value [5.449547389901188, nan, -0.1297779529641716, 75.35933221524516].
[I 2024-04-21 02:13:41,432] Trial 164 finished with values: [5.545894254638777, 0.2565808633775494, 0.056769065753121906, 62.91612714083537] and parameters: {'dropout': 0.5308643758909863, 'num_heads': 1, 'bias': True, 'loss_fn': 'MSE', 'optimizer': 'RMSprop', 'lr': 0.0011218242088903074, 'weight_decay': 0.003006198705678768}. 
[I 2024-04-21 02:13:52,904] Trial 165 finished with values: [5.259842702827314, 0.23278642590656407, -0.03155647981938947, 68.80768672953869] and parameters: {'dropout': 0.21552314443762993, 'num_heads': 1, 'bias': True, 'loss_fn': 'MAE', 'optimizer': 'Adam', 'lr': 0.0008974375358981978, 'weight_decay': 0.0007384679430791242}. 
[I 2024-04-21 02:14:01,701] Trial 166 finished with values: [5.423034117401322, 0.20437439364685286, -0.003356692537475947, 66.92668247325864] and parameters: {'dropout': 0.6634253081505919, 'num_heads': 4, 'bias': True, 'loss_fn': 'MSE', 'optimizer': 'RMSprop', 'lr': 0.0014663604034180699, 'weight_decay': 0.0037168330157469373}. 
[I 2024-04-21 02:14:13,263] Trial 167 finished with values: [5.401250889960826, -0.07605054592886873, -0.11004074958965471, 74.04280584632667] and parameters: {'dropout': 0.21394355875372933, 'num_heads': 8, 'bias': False, 'loss_fn': 'MAE', 'optimizer': 'Adam', 'lr': 0.009409960538819545, 'weight_decay': 0.0002587068960219466}. 
[I 2024-04-21 02:14:28,289] Trial 168 finished with values: [5.443964425324864, 0.20711842260962832, 0.02702402594026232, 64.90020403942579] and parameters: {'dropout': 0.553678472298213, 'num_heads': 2, 'bias': False, 'loss_fn': 'MSE', 'optimizer': 'RMSprop', 'lr': 0.0002743881097041735, 'weight_decay': 0.0027296084983015347}. 
[I 2024-04-21 02:14:46,197] Trial 169 finished with values: [5.259622926265009, 0.2437582879097577, -0.02388781731871692, 68.29616560849136] and parameters: {'dropout': 0.4622029983473447, 'num_heads': 1, 'bias': True, 'loss_fn': 'MAE', 'optimizer': 'RMSprop', 'lr': 0.001259987046706076, 'weight_decay': 0.003006198705678768}. 
[I 2024-04-21 02:14:57,616] Trial 170 finished with values: [5.348927694624521, -0.14095394412929638, -0.07855421495385984, 71.94256639865449] and parameters: {'dropout': 0.601322534865889, 'num_heads': 1, 'bias': False, 'loss_fn': 'MAE', 'optimizer': 'RMSprop', 'lr': 0.028092200747004564, 'weight_decay': 0.0026374045128561207}. 
[I 2024-04-21 02:15:12,350] Trial 171 finished with values: [5.216592239629519, 0.3048703097081714, -0.01593085937817018, 67.76541437964046] and parameters: {'dropout': 0.5010784230012597, 'num_heads': 2, 'bias': False, 'loss_fn': 'MAE', 'optimizer': 'RMSprop', 'lr': 0.0009181384288823589, 'weight_decay': 0.0002587068960219466}. 
[I 2024-04-21 02:15:29,804] Trial 172 finished with values: [5.340737307755472, 0.20893153797156236, -0.005686342661110899, 67.0820766169943] and parameters: {'dropout': 0.553678472298213, 'num_heads': 8, 'bias': False, 'loss_fn': 'MSE', 'optimizer': 'RMSprop', 'lr': 0.00012653702848240087, 'weight_decay': 0.02076297142943548}. 
[I 2024-04-21 02:15:50,696] Trial 173 finished with values: [5.375401816106504, 0.25496665770160454, 0.03068344729258332, 64.65611045565423] and parameters: {'dropout': 0.250127375517484, 'num_heads': 8, 'bias': True, 'loss_fn': 'MSE', 'optimizer': 'RMSprop', 'lr': 0.00012653702848240087, 'weight_decay': 0.00014714370666574225}. 
[I 2024-04-21 02:16:04,006] Trial 174 finished with values: [5.35327732749287, 0.15572004346711685, -0.07326462014216406, 71.58973571041813] and parameters: {'dropout': 0.264360828881129, 'num_heads': 1, 'bias': True, 'loss_fn': 'MAE', 'optimizer': 'Adam', 'lr': 0.00010447899875809218, 'weight_decay': 0.016611844451172173}. 
[I 2024-04-21 02:16:24,414] Trial 175 finished with values: [5.346678835844425, 0.23151574640507475, -0.0713989329477902, 71.46528918469006] and parameters: {'dropout': 0.41818337874955647, 'num_heads': 4, 'bias': False, 'loss_fn': 'MAE', 'optimizer': 'Adam', 'lr': 0.00012123567350640214, 'weight_decay': 0.005004304918035022}. 
[I 2024-04-21 02:16:33,405] Trial 176 finished with values: [5.34246025870393, 0.19255891870679245, -0.061341366747139636, 70.79442154153675] and parameters: {'dropout': 0.6586733276831351, 'num_heads': 4, 'bias': True, 'loss_fn': 'MSE', 'optimizer': 'Adam', 'lr': 0.0008974100862471255, 'weight_decay': 0.0012646218294935334}. 
[I 2024-04-21 02:16:42,305] Trial 177 finished with values: [5.359557857849682, 0.15269037978630604, -0.0454193955180513, 69.73238176971577] and parameters: {'dropout': 0.6374826674935149, 'num_heads': 8, 'bias': True, 'loss_fn': 'MSE', 'optimizer': 'RMSprop', 'lr': 0.00012653702848240087, 'weight_decay': 0.00014714370666574225}. 
[I 2024-04-21 02:16:56,964] Trial 178 finished with values: [5.39786322852823, 0.25610901954611065, 0.0010506589598530125, 66.63269986826519] and parameters: {'dropout': 0.37661264521482396, 'num_heads': 8, 'bias': False, 'loss_fn': 'MSE', 'optimizer': 'RMSprop', 'lr': 0.001259987046706076, 'weight_decay': 0.0008862509658684476}. 
[I 2024-04-21 02:17:11,861] Trial 179 finished with values: [5.367016070379098, 0.15103969797297329, -0.03487407388259256, 69.02897948225022] and parameters: {'dropout': 0.28060307774751625, 'num_heads': 2, 'bias': True, 'loss_fn': 'MSE', 'optimizer': 'Adam', 'lr': 0.0009181384288823589, 'weight_decay': 0.06365096467069543}. 
[I 2024-04-21 02:17:22,273] Trial 180 finished with values: [5.435851570297634, 0.06618060764719459, -0.11402520372662783, 74.30858002099238] and parameters: {'dropout': 0.5092029418473762, 'num_heads': 8, 'bias': True, 'loss_fn': 'MAE', 'optimizer': 'RMSprop', 'lr': 0.0014245419603048832, 'weight_decay': 9.862400533423962e-05}. 
[I 2024-04-21 02:17:38,884] Trial 181 finished with values: [5.6403498058710415, -0.03151555712864982, -0.09808161429393514, 73.2450982548547] and parameters: {'dropout': 0.4622029983473447, 'num_heads': 1, 'bias': True, 'loss_fn': 'MAE', 'optimizer': 'RMSprop', 'lr': 0.0011218242088903074, 'weight_decay': 0.003006198705678768}. 
[I 2024-04-21 02:17:57,393] Trial 182 finished with values: [5.407131470819083, 0.19155187906127194, -0.05207383624506878, 70.17625147715542] and parameters: {'dropout': 0.5010784230012597, 'num_heads': 8, 'bias': True, 'loss_fn': 'MSE', 'optimizer': 'Adam', 'lr': 0.00010447899875809218, 'weight_decay': 0.0002587068960219466}. 
[I 2024-04-21 02:18:13,451] Trial 183 finished with values: [5.412909370846319, 0.21955901970255268, -0.10062048322063144, 73.41444787474761] and parameters: {'dropout': 0.4622029983473447, 'num_heads': 2, 'bias': True, 'loss_fn': 'MAE', 'optimizer': 'RMSprop', 'lr': 0.0008974100862471255, 'weight_decay': 0.0034875138541967964}. 
[I 2024-04-21 02:18:27,238] Trial 184 finished with values: [5.301150512637127, 0.26774610285387207, -0.03301280902401271, 68.90482793862142] and parameters: {'dropout': 0.564828765402576, 'num_heads': 4, 'bias': False, 'loss_fn': 'MAE', 'optimizer': 'RMSprop', 'lr': 0.001259987046706076, 'weight_decay': 0.016611844451172173}. 
[I 2024-04-21 02:18:38,862] Trial 185 finished with values: [5.369121482910611, 0.036103024921601355, -0.06719176454767695, 71.18465934913894] and parameters: {'dropout': 0.41818337874955647, 'num_heads': 8, 'bias': True, 'loss_fn': 'MAE', 'optimizer': 'RMSprop', 'lr': 0.09866561863201809, 'weight_decay': 0.005004304918035022}. 
[I 2024-04-21 02:19:00,252] Trial 186 finished with values: [5.401847377850847, 0.22408855480089737, -0.03891874882340862, 69.29877055205108] and parameters: {'dropout': 0.5010784230012597, 'num_heads': 4, 'bias': True, 'loss_fn': 'MSE', 'optimizer': 'Adam', 'lr': 0.0004399465845986358, 'weight_decay': 0.007003630296290256}. 
[I 2024-04-21 02:19:28,541] Trial 187 finished with values: [5.298434870969321, 0.19101529738545248, -0.04435888280035316, 69.66164262137089] and parameters: {'dropout': 0.41818337874955647, 'num_heads': 1, 'bias': False, 'loss_fn': 'MAE', 'optimizer': 'Adam', 'lr': 0.00012123567350640214, 'weight_decay': 0.003848211063905239}. 
[I 2024-04-21 02:19:42,243] Trial 188 finished with values: [5.177729976048672, 0.29459124370371104, 0.030487559973010336, 64.66917668477804] and parameters: {'dropout': 0.2864316147243036, 'num_heads': 2, 'bias': True, 'loss_fn': 'MAE', 'optimizer': 'RMSprop', 'lr': 0.00019290042098284114, 'weight_decay': 9.187573219720651e-05}. 
[I 2024-04-21 02:19:51,779] Trial 189 finished with values: [5.71051011463665, 0.14372370297301115, -0.19930327628714473, 79.99686468250727] and parameters: {'dropout': 0.4520295257103348, 'num_heads': 8, 'bias': True, 'loss_fn': 'MAE', 'optimizer': 'SGD', 'lr': 0.00012653702848240087, 'weight_decay': 0.0002587068960219466}. 
Training finished at Epoch 35, with validation result for [5.352941135330817, 0.10273580828889473, -0.032648297713180785, 89.99273827253988]
Training finished at Epoch 40, with validation result for [4.953691262674653, 0.1538108769089714, 0.012413814008135349, 74.83057625982558]
Training finished at Epoch 42, with validation result for [5.3690317733560535, -0.0030376636915007893, -0.018670247446714194, 102.59236732885897]
Training finished at Epoch 59, with validation result for [5.13536040128466, nan, -0.03742109918408776, 88.09119675672325]
Training finished at Epoch 62, with validation result for [5.62613863571952, -0.020859204084813926, -0.054828485078207256, 111.88340966342105]
Training finished at Epoch 47, with validation result for [5.936889837358128, 0.13946579389072852, -0.006186650419217399, 97.6198432618588]
Training finished at Epoch 116, with validation result for [5.9071526860828385, 0.06306107249249139, -0.028984868095977223, 113.01177827988896]
Training finished at Epoch 36, with validation result for [5.162429420593899, 0.07704447843891518, -0.029105416114063587, 87.59963138209194]
Training finished at Epoch 54, with validation result for [5.365028668318641, 0.02731233911439085, -0.036659557317260116, 102.98594361255523]
Training finished at Epoch 43, with validation result for [5.957423609699778, 0.07095850559517904, -0.032877799846686706, 112.31816399380011]
Training finished at Epoch 35, with validation result for [5.3654557231117375, 0.036969767358548, -0.11650290277458786, 80.45548968752031]
Training finished at Epoch 36, with validation result for [5.754249129141382, -1.0, -0.065668152929377, 111.94415090016462]
Training finished at Epoch 41, with validation result for [4.982392275612302, 0.05219688981619503, -0.07083695801318601, 72.09890991367224]
Training finished at Epoch 42, with validation result for [5.8019936804098835, 1.0, -0.06364272788736258, 114.75785468928336]
Training finished at Epoch 59, with validation result for [6.089570210926207, -0.02622975976049794, -0.08058501823640563, 117.20111634643065]
Training finished at Epoch 52, with validation result for [5.4119819100218685, 0.05519800848025828, -0.02351120524170347, 103.57300615090486]
Training finished at Epoch 57, with validation result for [5.511574113061901, 0.0061184596325101525, -0.0686709728150503, 98.62268919931567]
Training finished at Epoch 32, with validation result for [5.565107729377703, 0.10172294233925168, -0.02866941162610326, 92.88105825554669]
Training finished at Epoch 68, with validation result for [5.658504661542451, 0.0024320853527618398, -0.11481051892348071, 97.02043038464963]
Training finished at Epoch 49, with validation result for [5.403343441683975, 0.062092348164303805, -0.02886144211832331, 99.3903891944665]
Training finished at Epoch 49, with validation result for [5.4125132271582, 0.05901732573595957, -0.062304472796303356, 83.38531484102913]
Training finished at Epoch 36, with validation result for [5.326820449014018, -0.029782899164435352, -0.09253314921197386, 96.10956277453154]
Training finished at Epoch 69, with validation result for [5.809699729273457, -0.01110548198006462, -0.05595404983918195, 112.74756958404578]
Training finished at Epoch 47, with validation result for [5.681512582867577, 0.047939198940775835, -0.026503395577070155, 109.09093059522945]
Training finished at Epoch 72, with validation result for [5.243306256654447, 0.06684633829660132, -0.058578842408633314, 81.77128915751821]
Training finished at Epoch 31, with validation result for [5.466240884837519, -0.0007365065292383616, -0.07289592692220404, 92.66630352302393]
Training finished at Epoch 77, with validation result for [5.105949850070728, nan, -0.027254549845234344, 88.89287147111342]
Training finished at Epoch 32, with validation result for [5.451663049048772, 0.02144180444770984, -0.030215846120275947, 104.35807184125701]
Training finished at Epoch 63, with validation result for [5.587738854380532, 0.0893240535369585, -0.018581434937263053, 106.11521260852203]
Training finished at Epoch 71, with validation result for [39.84734578299968, 0.04349989984102579, -59.9833487864877, 5473.947091902422]
Training finished at Epoch 56, with validation result for [5.879750570074319, 0.014216422198708693, -0.08887362349751116, 99.85092955535409]
Training finished at Epoch 37, with validation result for [5.134854560175378, -1.0, -0.019751604585493743, 97.00729904918258]
Training finished at Epoch 41, with validation result for [4.930106196410583, 0.2056576111308249, 0.02440552505369964, 82.80190644053052]
Training finished at Epoch 42, with validation result for [5.201931416931267, 0.039498470405431876, -0.028922806761570774, 87.29021057926708]
Training finished at Epoch 33, with validation result for [5.6230894676516145, 0.030017057150085867, -0.02881844360564667, 107.57977790014316]
Training finished at Epoch 39, with validation result for [5.444222361810518, nan, -0.019225945298394942, 104.78051658723098]
Training finished at Epoch 52, with validation result for [5.434222058356155, 0.05021868651707924, -0.028637861268717257, 95.21488623610468]
Training finished at Epoch 67, with validation result for [5.77196727915202, 0.018213041717183548, -0.0471967214696174, 102.10586602472328]
Training finished at Epoch 46, with validation result for [5.626209025292373, 1.0, -0.02325400269631195, 103.77434245598869]
Training finished at Epoch 58, with validation result for [5.385719684666014, 0.03444353034024624, -0.022317868431233068, 105.02210430027549]
Training finished at Epoch 65, with validation result for [5.884375912786877, -0.007010102764141696, -0.06437154951075796, 114.7370223499211]
Training finished at Epoch 77, with validation result for [5.985734750651372, 0.06559248383516696, -0.055267121957241816, 111.42775851605741]
Training finished at Epoch 53, with validation result for [5.517925705279854, -0.05763737285201156, -0.047061701772368014, 101.5372417259461]
Training finished at Epoch 75, with validation result for [5.678161089595638, 0.010422610149985021, -0.04369077846402214, 113.27160711276673]
Training finished at Epoch 35, with validation result for [5.118892750430919, 0.15355702427841408, 0.013936867160301403, 81.80059434285613]
Training finished at Epoch 34, with validation result for [5.849328782290013, 0.024081683912112548, -0.03794977889178708, 114.21781688937718]
Training finished at Epoch 54, with validation result for [5.657630650796871, 0.021229918638154044, -0.11015509350907227, 99.3422582280258]
Training finished at Epoch 60, with validation result for [5.959978469366871, 0.04036183479021867, -0.12045580238953524, 99.19981262168521]
Training finished at Epoch 34, with validation result for [5.835393379132644, 0.11196145559631089, -0.022222204430318193, 111.81032135701348]
Training finished at Epoch 65, with validation result for [5.4961136940105355, 0.1133257054511452, -0.027612995597534606, 93.28080874668153]
Training finished at Epoch 74, with validation result for [5.641441939316766, 0.04164930853729295, -0.039163921953188296, 109.51825575821863]
Training finished at Epoch 58, with validation result for [5.308532119199265, 0.12241076139779974, -0.020153677891656674, 95.30140818775412]
Training finished at Epoch 53, with validation result for [5.69681842644314, 0.17434074462133442, -0.05485448562065742, 101.1619111623816]
Training finished at Epoch 43, with validation result for [5.814906839846585, nan, -0.03446682417927138, 111.36507055594522]
Training finished at Epoch 82, with validation result for [5.359799362814442, 0.07107800200826127, -0.05013137198564377, 82.29993198657748]
Training finished at Epoch 109, with validation result for [5.138727385350135, 0.07859065135179048, -0.03197167395905831, 87.78425047190437]
Training finished at Epoch 48, with validation result for [5.320121296188929, 0.05580780294772944, -0.044011296384772525, 88.73482216015692]
Training finished at Epoch 35, with validation result for [5.572729367702725, 0.0004544334740226761, -0.1279644189258533, 98.14669542264168]
[I 2024-04-21 02:20:11,092] Trial 190 finished with values: [5.4062380203153895, 0.13132750469051063, -0.10842456144389234, 73.93500160118337] and parameters: {'dropout': 0.250127375517484, 'num_heads': 2, 'bias': True, 'loss_fn': 'MAE', 'optimizer': 'RMSprop', 'lr': 0.0024788499077993517, 'weight_decay': 0.02231635450933497}. 
[I 2024-04-21 02:20:23,039] Trial 191 finished with values: [5.328398315218213, 0.21631435621366027, -0.04880172268699634, 69.9579924006512] and parameters: {'dropout': 0.5356496528379955, 'num_heads': 2, 'bias': True, 'loss_fn': 'MSE', 'optimizer': 'Adam', 'lr': 0.0008974100862471255, 'weight_decay': 0.08706296017842331}. 
[I 2024-04-21 02:20:30,307] Trial 192 finished with values: [5.523114446957657, -0.013801026623666966, -0.11199150600307362, 74.17292672560579] and parameters: {'dropout': 0.6843836269030925, 'num_heads': 8, 'bias': False, 'loss_fn': 'MAE', 'optimizer': 'RMSprop', 'lr': 0.0011330344250983853, 'weight_decay': 9.862400533423962e-05}. 
[I 2024-04-21 02:20:41,242] Trial 193 finished with values: [5.291818762701449, 0.24120797403157013, 0.0285951522484007, 64.79540554420248] and parameters: {'dropout': 0.2864316147243036, 'num_heads': 2, 'bias': False, 'loss_fn': 'MSE', 'optimizer': 'Adam', 'lr': 0.00019290042098284114, 'weight_decay': 0.0012646218294935334}. 
[I 2024-04-21 02:20:52,051] Trial 194 finished with values: [5.378814393432703, 0.213828082944159, -0.006655845652176806, 67.14674516340709] and parameters: {'dropout': 0.23559293142944182, 'num_heads': 2, 'bias': True, 'loss_fn': 'MSE', 'optimizer': 'Adam', 'lr': 0.0014245419603048832, 'weight_decay': 0.016453122909363}. 
