[I 2024-04-21 06:00:15,264] Trial 205 finished with values: [4.858429726359521, 0.5013404006309934, 0.24431162211980872, 50.406516935880624] and parameters: {'dropout': 0.319616569696689, 'num_heads': 4, 'bias': True, 'loss_fn': 'MAE', 'optimizer': 'Adam', 'lr': 0.0009964606938187815, 'weight_decay': 2.4265340760230575e-05}. 
Training finished at Epoch 103, with validation result for [5.033907107045988, 0.5156781655125912, 0.26220464306168734, 72.4960878776016]
Training finished at Epoch 67, with validation result for [5.352161675057144, 0.5762630045599395, 0.3067205984614271, 71.94478320456734]
Training finished at Epoch 95, with validation result for [4.950624326324895, 0.5029341181681914, 0.19525371631707433, 71.82547784962149]
Training finished at Epoch 52, with validation result for [5.079236869435991, 0.5121763726697024, 0.23164390764202747, 83.9563524318396]
Training finished at Epoch 66, with validation result for [5.471945714386313, 0.37643243579880814, 0.10079953801207475, 99.71337786679995]
Training finished at Epoch 67, with validation result for [5.165832376097072, 0.47702631721289407, 0.19706428979609547, 79.80856350698711]
Training finished at Epoch 32, with validation result for [5.081296772409529, 0.04572012758954896, -0.037147110732725475, 81.65417194544182]
Training finished at Epoch 49, with validation result for [5.221904985809486, 0.5517426335523334, 0.2778794597266856, 62.89506482596767]
Training finished at Epoch 39, with validation result for [5.6120845010533005, 0.4821982338411499, 0.17836963749433576, 76.73605511145445]
Training finished at Epoch 56, with validation result for [5.355714421620128, 0.44997940906001305, 0.100968692712185, 81.76772008914553]
Training finished at Epoch 36, with validation result for [5.863295927694328, 0.07976144882770493, -0.032113066488187236, 112.94181881425477]
Training finished at Epoch 64, with validation result for [5.091770294760862, 0.505969319921636, 0.19925397046340332, 71.0005810036075]
Training finished at Epoch 75, with validation result for [5.782435586966309, 0.06017962891861391, -0.026960815617411704, 109.1408585787658]
Training finished at Epoch 54, with validation result for [5.553554256032314, 0.32298616901505034, 0.038752692343031026, 77.61535742129841]
Training finished at Epoch 57, with validation result for [5.949421092819475, 0.21236109813808104, 0.018434802265144712, 102.21371182380709]
Training finished at Epoch 101, with validation result for [5.377988385729552, nan, -0.03725324172017763, 95.33842396073794]
Training finished at Epoch 85, with validation result for [5.3543481290643316, 0.5304053254476024, 0.2134346993873617, 74.89709932066721]
Training finished at Epoch 58, with validation result for [5.681916012332216, 0.09522177939383401, -0.03006038222998919, 108.18657667399141]
Training finished at Epoch 86, with validation result for [5.591761135360222, 0.1210687758713277, -0.013007324920505825, 108.02552685003901]
Training finished at Epoch 38, with validation result for [5.654568067291515, 0.13645557841687916, -0.04199995581532279, 111.2858938533494]
Training finished at Epoch 88, with validation result for [4.677629402564467, 0.35917263181836473, 0.030404444702745725, 66.92887613336765]
Training finished at Epoch 37, with validation result for [4.820738278373614, 0.34614628615059423, 0.09244045940970869, 74.43989241566072]
Training finished at Epoch 58, with validation result for [4.734824620611309, 0.4109220597465537, 0.15348070616228549, 68.20018302372564]
Training finished at Epoch 47, with validation result for [5.602404760284699, 1.0, -0.04447649838075396, 98.88042932556733]
Training finished at Epoch 89, with validation result for [6.021676465278776, 0.01711546153898937, -0.050564434464478225, 116.7878235851576]
Training finished at Epoch 39, with validation result for [5.64951678408552, -1.0, -0.06837268968861676, 99.61131344434926]
Training finished at Epoch 98, with validation result for [5.500948232848394, 0.45152997054409444, 0.1753549992573752, 90.19132394588264]
Training finished at Epoch 101, with validation result for [5.202902109775477, 0.31193642821240686, 0.08934803514950695, 86.54192898463494]
Training finished at Epoch 46, with validation result for [4.938445315951431, 0.1304739507562617, -0.01623507073420205, 69.8981560765853]
Training finished at Epoch 39, with validation result for [5.124776728259769, 0.3455282936522751, 0.11646699158323737, 88.7884249790538]
Training finished at Epoch 74, with validation result for [4.6276810229288605, 0.5196388554205082, 0.2591637899689524, 51.50219624097213]
Training finished at Epoch 65, with validation result for [5.268865540234709, 0.43588682141358237, 0.14042711145557507, 89.56101750907568]
Training finished at Epoch 64, with validation result for [5.141325980607597, 0.37662337458541145, 0.11500258328412305, 85.62970385461858]
Training finished at Epoch 44, with validation result for [5.282095348400896, 0.3862885057146396, 0.12312447505852375, 78.90282651932098]
Training finished at Epoch 58, with validation result for [4.534394898956731, 0.5630223417992573, 0.31247262809862875, 52.136572366604526]
Training finished at Epoch 98, with validation result for [5.03920416658471, 0.4323813563194565, 0.15886030404859908, 84.89934566362757]
Training finished at Epoch 38, with validation result for [5.605227115225698, -0.09537319974486462, -0.03726224776851095, 110.82829001905536]
Training finished at Epoch 43, with validation result for [4.685149096826868, 0.35810405589819244, 0.03423465161543471, 64.39037788648032]
Training finished at Epoch 46, with validation result for [4.912470852175828, 0.519945436897161, 0.26239815442873904, 65.72156363242765]
Training finished at Epoch 129, with validation result for [5.068571360658058, 0.49200509814401316, 0.1829640596919957, 68.16941774633972]
Training finished at Epoch 84, with validation result for [5.092720660608874, 0.46542690911144746, 0.16497995529908138, 86.4485469231754]
Training finished at Epoch 64, with validation result for [4.6565976187043345, 0.4315155739069321, 0.1539530601780974, 62.46164495066275]
Training finished at Epoch 35, with validation result for [5.367604542158753, 0.3439860274564767, 0.11497899966828484, 92.82240196509001]
Training finished at Epoch 75, with validation result for [5.500806663816415, 0.20703495787348092, -0.08740933353373781, 108.64097584969083]
Training finished at Epoch 69, with validation result for [5.2727280098973495, 0.21046327585734262, -0.015528429293683255, 88.08877185630882]
Training finished at Epoch 93, with validation result for [5.375956342552782, 0.4508647568713314, 0.16441510193573117, 90.06345727936389]
Training finished at Epoch 38, with validation result for [4.564737236812534, 0.39346439259609123, 0.12843050045257465, 73.37891398293608]
Training finished at Epoch 92, with validation result for [5.287066986466513, 0.4402807451593714, 0.15171625191709215, 85.80969941679739]
Training finished at Epoch 45, with validation result for [4.9590105584084965, 0.26995777586862135, 0.060178270757875074, 93.6215253411941]
Training finished at Epoch 41, with validation result for [5.586313053365877, -0.11266558594601571, -0.03604190456643486, 110.18072793464368]
Training finished at Epoch 90, with validation result for [5.667395690312426, 0.06447115829014552, -0.01828419163447559, 102.64251509059623]
Training finished at Epoch 41, with validation result for [4.939924663343248, 1.0, -0.02317496312456835, 81.5892897320192]
Training finished at Epoch 93, with validation result for [5.813055952257959, 0.4895384140428105, 0.14015108059400072, 93.87351691583645]
Training finished at Epoch 66, with validation result for [5.036209454055016, 0.3391144595984165, 0.062362213721604776, 87.45826807415828]
Training finished at Epoch 111, with validation result for [5.417541057846731, 0.02470055542691707, -0.03612628095389159, 102.77916272002842]
Training finished at Epoch 53, with validation result for [5.4963053181119745, 0.4253708859769868, 0.17716726243130254, 82.10481576744225]
Training finished at Epoch 67, with validation result for [5.761744092800698, 1.0, -0.04204749388771756, 110.36263121118948]
Training finished at Epoch 50, with validation result for [5.534001338090591, -0.0692306939580189, -0.04322112140378698, 101.35825561114954]
Training finished at Epoch 113, with validation result for [5.202398667898499, 0.3182900661400916, 0.08439253116344869, 90.98713038688726]
[I 2024-04-21 06:00:40,729] Trial 206 finished with values: [5.14887664786214, 0.3212231291758762, 0.017363629926727353, 65.54457932627288] and parameters: {'dropout': 0.6799331143119542, 'num_heads': 4, 'bias': False, 'loss_fn': 'MSE', 'optimizer': 'Adam', 'lr': 0.002295064068704125, 'weight_decay': 1.242118945501002e-05}. 
[I 2024-04-21 06:01:07,782] Trial 207 finished with values: [6.403733237637892, 0.36736786591330955, -0.2596852872981068, 84.02451278420817] and parameters: {'dropout': 0.35656579395859456, 'num_heads': 2, 'bias': False, 'loss_fn': 'MSE', 'optimizer': 'Adam', 'lr': 0.0004595462048380458, 'weight_decay': 1.2266916063951385e-05}. 
[I 2024-04-21 06:01:29,424] Trial 208 finished with values: [5.326593949211278, 0.2487488090883224, -0.05040972781399855, 70.06525081568013] and parameters: {'dropout': 0.3344998495842664, 'num_heads': 1, 'bias': False, 'loss_fn': 'MAE', 'optimizer': 'Adam', 'lr': 0.0020026931174657535, 'weight_decay': 0.0017662217759353337}. 
[I 2024-04-21 06:01:52,722] Trial 209 finished with values: [4.934331243465408, 0.44839980491585973, 0.16810366903243334, 55.489799397790605] and parameters: {'dropout': 0.6656358839105669, 'num_heads': 4, 'bias': True, 'loss_fn': 'MAE', 'optimizer': 'RMSprop', 'lr': 0.00018565247131226996, 'weight_decay': 0.00029822251778626087}. 
[I 2024-04-21 06:02:17,932] Trial 210 finished with values: [5.613199599341101, 0.12538253582388223, -0.07492588709675485, 71.70054683750797] and parameters: {'dropout': 0.4244817098248359, 'num_heads': 2, 'bias': False, 'loss_fn': 'MAE', 'optimizer': 'Adam', 'lr': 0.00015587385647697547, 'weight_decay': 9.133735498525707e-05}. 
[I 2024-04-21 06:02:43,057] Trial 211 finished with values: [10.36280324264529, 0.17711874886858883, -2.355727299456774, 223.83634564654156] and parameters: {'dropout': 0.3123871851320933, 'num_heads': 2, 'bias': True, 'loss_fn': 'MSE', 'optimizer': 'RMSprop', 'lr': 0.0001387213039796065, 'weight_decay': 0.00011007350287228135}. 
[I 2024-04-21 06:03:02,119] Trial 212 finished with values: [11.015544166163469, 0.1835318614750248, -2.06595943699863, 204.50802316070065] and parameters: {'dropout': 0.3123871851320933, 'num_heads': 2, 'bias': True, 'loss_fn': 'MSE', 'optimizer': 'RMSprop', 'lr': 0.0001387213039796065, 'weight_decay': 0.00011007350287228135}. 
[I 2024-04-21 06:03:23,950] Trial 213 finished with values: [9.338783353002615, 0.19313733361112914, -1.3624073650729716, 157.57914286182023] and parameters: {'dropout': 0.4934354255005909, 'num_heads': 8, 'bias': True, 'loss_fn': 'MSE', 'optimizer': 'Adam', 'lr': 0.0001387213039796065, 'weight_decay': 0.00016092681250246313}. 
[I 2024-04-21 06:04:07,395] Trial 214 finished with values: [7.589473063005363, 0.306532130751156, -0.9912646156412199, 132.8228890507726] and parameters: {'dropout': 0.3123871851320933, 'num_heads': 4, 'bias': True, 'loss_fn': 'MSE', 'optimizer': 'RMSprop', 'lr': 0.000449814705092089, 'weight_decay': 0.00011007350287228135}. 
[I 2024-04-21 06:04:30,506] Trial 215 finished with values: [5.240347773993967, 0.32197268476460394, 0.03925800690689185, 64.08416347715394] and parameters: {'dropout': 0.41583579683239735, 'num_heads': 4, 'bias': False, 'loss_fn': 'MAE', 'optimizer': 'Adam', 'lr': 0.00036501068151543, 'weight_decay': 4.567853269399096e-05}. 
[I 2024-04-21 06:04:58,258] Trial 216 finished with values: [4.934779069737833, 0.4336585085320758, 0.18200500358062766, 54.56254171347832] and parameters: {'dropout': 0.4244817098248359, 'num_heads': 4, 'bias': False, 'loss_fn': 'MAE', 'optimizer': 'Adam', 'lr': 0.002127848460471393, 'weight_decay': 4.221917657289298e-05}. 
[I 2024-04-21 06:05:30,011] Trial 217 finished with values: [5.27814780879533, 0.32269251329518733, 0.09086279643841066, 60.64198046411114] and parameters: {'dropout': 0.5886563451029113, 'num_heads': 2, 'bias': False, 'loss_fn': 'MAE', 'optimizer': 'Adam', 'lr': 0.0020108387978155272, 'weight_decay': 9.133735498525707e-05}. 
[I 2024-04-21 06:05:56,642] Trial 218 finished with values: [4.9158831099013245, 0.446419095983618, 0.19504277740682363, 53.69288593152778] and parameters: {'dropout': 0.3629852321658984, 'num_heads': 2, 'bias': False, 'loss_fn': 'MAE', 'optimizer': 'Adam', 'lr': 0.0020026931174657535, 'weight_decay': 6.0239055358915006e-05}. 
[I 2024-04-21 06:06:11,776] Trial 219 finished with values: [5.1198636575353484, 0.353100987375142, 0.06356234092122715, 62.46299678997337] and parameters: {'dropout': 0.4244817098248359, 'num_heads': 2, 'bias': False, 'loss_fn': 'MAE', 'optimizer': 'Adam', 'lr': 0.003922468660665162, 'weight_decay': 4.221917657289298e-05}. 
[I 2024-04-21 06:06:36,099] Trial 220 finished with values: [5.138793079878289, 0.3489089598935907, 0.11406300545578374, 59.09446198562054] and parameters: {'dropout': 0.6799331143119542, 'num_heads': 2, 'bias': True, 'loss_fn': 'MAE', 'optimizer': 'Adam', 'lr': 0.002295064068704125, 'weight_decay': 1.242118945501002e-05}. 
[I 2024-04-21 06:06:55,022] Trial 221 finished with values: [5.117618692603732, 0.4174243743102872, 0.16868214785972457, 55.451213250830534] and parameters: {'dropout': 0.4934354255005909, 'num_heads': 8, 'bias': False, 'loss_fn': 'MAE', 'optimizer': 'RMSprop', 'lr': 0.0016801200246028194, 'weight_decay': 1.3344143820661265e-05}. 
[I 2024-04-21 06:07:09,308] Trial 222 finished with values: [5.583492419301948, 0.03651956393072659, -0.13800362460008841, 75.90800739506983] and parameters: {'dropout': 0.6661280330898132, 'num_heads': 8, 'bias': False, 'loss_fn': 'MAE', 'optimizer': 'RMSprop', 'lr': 0.0001083005560110781, 'weight_decay': 4.567853269399096e-05}. 
[W 2024-04-21 06:07:47,052] Trial 223 failed with parameters: {'dropout': 0.6799331143119542, 'num_heads': 2, 'bias': False, 'loss_fn': 'MAE', 'optimizer': 'RMSprop', 'lr': 0.002295064068704125, 'weight_decay': 0.00010982601770689331} because of the following error: The value nan is not acceptable.
[W 2024-04-21 06:07:47,052] Trial 223 failed with value [5.3677216150350855, nan, -0.09207959414404732, 72.84474681477633].
[I 2024-04-21 06:08:01,914] Trial 224 finished with values: [5.405188512932225, -0.20184151578850243, -0.11231038993844988, 74.19419717114872] and parameters: {'dropout': 0.4934354255005909, 'num_heads': 2, 'bias': False, 'loss_fn': 'MAE', 'optimizer': 'SGD', 'lr': 0.0020026931174657535, 'weight_decay': 0.00016092681250246313}. 
[I 2024-04-21 06:08:22,703] Trial 225 finished with values: [5.093666946238094, 0.3597911896470923, 0.03582619823361477, 64.31307466207316] and parameters: {'dropout': 0.6799331143119542, 'num_heads': 2, 'bias': False, 'loss_fn': 'MAE', 'optimizer': 'Adam', 'lr': 0.002295064068704125, 'weight_decay': 1.242118945501002e-05}. 
[I 2024-04-21 06:12:52,835] Trial 226 finished with values: [1.646271623512754e+58, 0.06002955510101008, -8.30928820484639e+115, 5.54252637572133e+117] and parameters: {'dropout': 0.23263101391627533, 'num_heads': 2, 'bias': False, 'loss_fn': 'MSE', 'optimizer': 'SGD', 'lr': 0.0001083005560110781, 'weight_decay': 2.4265340760230575e-05}. 
[I 2024-04-21 06:13:27,465] Trial 227 finished with values: [5.131295987636297, 0.2864247897609447, 0.052167512104895675, 63.22306356951425] and parameters: {'dropout': 0.49759713129295235, 'num_heads': 1, 'bias': True, 'loss_fn': 'MSE', 'optimizer': 'Adam', 'lr': 0.0029330059977397314, 'weight_decay': 4.221917657289298e-05}. 
[I 2024-04-21 06:13:43,967] Trial 228 finished with values: [5.436716369137945, 0.22990005702553953, -0.0458639881699241, 69.76203733633844] and parameters: {'dropout': 0.39240749140537745, 'num_heads': 2, 'bias': False, 'loss_fn': 'MAE', 'optimizer': 'Adam', 'lr': 0.0004595462048380458, 'weight_decay': 1.2266916063951385e-05}. 
[I 2024-04-21 06:14:11,720] Trial 229 finished with values: [5.2702324797409545, 0.42789761617549565, 0.1636247388480725, 55.788556500322635] and parameters: {'dropout': 0.3756121486579195, 'num_heads': 2, 'bias': False, 'loss_fn': 'MAE', 'optimizer': 'Adam', 'lr': 0.0020026931174657535, 'weight_decay': 4.567853269399096e-05}. 
[I 2024-04-21 06:14:34,424] Trial 230 finished with values: [4.9818832877176025, 0.41460317975425215, 0.161907288022209, 55.90311524791549] and parameters: {'dropout': 0.4934354255005909, 'num_heads': 4, 'bias': False, 'loss_fn': 'MAE', 'optimizer': 'RMSprop', 'lr': 0.0020026931174657535, 'weight_decay': 0.00010072384768737433}. 
[I 2024-04-21 06:14:51,816] Trial 231 finished with values: [5.267800927078344, 0.24140137653457938, 0.001778596532062915, 66.58414440726314] and parameters: {'dropout': 0.3693292913693079, 'num_heads': 2, 'bias': False, 'loss_fn': 'MAE', 'optimizer': 'Adam', 'lr': 0.00036501068151543, 'weight_decay': 0.0006565078408853733}. 
[I 2024-04-21 06:15:20,385] Trial 232 finished with values: [5.378898814782283, 0.32512116079943, 0.09959551873698513, 60.05948359460229] and parameters: {'dropout': 0.4934354255005909, 'num_heads': 4, 'bias': False, 'loss_fn': 'MSE', 'optimizer': 'RMSprop', 'lr': 0.0020026931174657535, 'weight_decay': 0.00016092681250246313}. 
[I 2024-04-21 06:15:49,076] Trial 233 finished with values: [5.051122267575844, 0.42861172714376566, 0.15956386161267466, 56.05942830824273] and parameters: {'dropout': 0.4591224360083581, 'num_heads': 4, 'bias': False, 'loss_fn': 'MSE', 'optimizer': 'RMSprop', 'lr': 0.00028094742988670466, 'weight_decay': 1.3344143820661265e-05}. 
[I 2024-04-21 06:16:27,227] Trial 234 finished with values: [5.224801700618592, 0.3813228080195371, -0.01565185305532979, 67.74680388178297] and parameters: {'dropout': 0.6291352684393432, 'num_heads': 2, 'bias': False, 'loss_fn': 'MAE', 'optimizer': 'RMSprop', 'lr': 0.0020026931174657535, 'weight_decay': 0.00016092681250246313}. 
[I 2024-04-21 06:17:02,200] Trial 235 finished with values: [5.200814953679066, 0.2505172043166706, 0.01790024878244123, 65.50878535586072] and parameters: {'dropout': 0.22804036445183024, 'num_heads': 2, 'bias': False, 'loss_fn': 'MAE', 'optimizer': 'Adam', 'lr': 0.0004595462048380458, 'weight_decay': 0.008697054954754082}. 
[I 2024-04-21 06:17:35,031] Trial 236 finished with values: [5.09086766787637, 0.32872621592085327, 0.025095375647964824, 65.02885037893255] and parameters: {'dropout': 0.4934354255005909, 'num_heads': 4, 'bias': False, 'loss_fn': 'MAE', 'optimizer': 'RMSprop', 'lr': 0.0020026931174657535, 'weight_decay': 0.00010072384768737433}. 
[I 2024-04-21 06:18:07,894] Trial 237 finished with values: [4.875957658494022, 0.49300197182198885, 0.19715478051138768, 53.55200944940234] and parameters: {'dropout': 0.570948598139843, 'num_heads': 8, 'bias': True, 'loss_fn': 'MSE', 'optimizer': 'RMSprop', 'lr': 0.0009964606938187815, 'weight_decay': 2.4265340760230575e-05}. 
[I 2024-04-21 06:18:28,289] Trial 238 finished with values: [5.470227771222463, 0.2512538069454398, 0.02257341706888938, 65.19707203159889] and parameters: {'dropout': 0.3629852321658984, 'num_heads': 2, 'bias': False, 'loss_fn': 'MAE', 'optimizer': 'Adam', 'lr': 0.0009964606938187815, 'weight_decay': 2.4265340760230575e-05}. 
[I 2024-04-21 06:18:47,061] Trial 239 finished with values: [8.183577717121215, 0.1441030688057621, -1.0211625946779668, 134.817167421034] and parameters: {'dropout': 0.5323331816379571, 'num_heads': 2, 'bias': False, 'loss_fn': 'MSE', 'optimizer': 'RMSprop', 'lr': 0.00015587385647697547, 'weight_decay': 4.221917657289298e-05}. 
[I 2024-04-21 06:19:06,291] Trial 240 finished with values: [5.369955350820603, 0.2545212903624901, -0.08440474328956116, 72.33281291331524] and parameters: {'dropout': 0.3756121486579195, 'num_heads': 1, 'bias': True, 'loss_fn': 'MAE', 'optimizer': 'Adam', 'lr': 0.0020026931174657535, 'weight_decay': 0.00219078254882845}. 
[I 2024-04-21 06:19:40,162] Trial 241 finished with values: [5.015597086693035, 0.39527221046701483, 0.09903582630740226, 60.09681663657627] and parameters: {'dropout': 0.6656358839105669, 'num_heads': 4, 'bias': True, 'loss_fn': 'MAE', 'optimizer': 'RMSprop', 'lr': 0.00018565247131226996, 'weight_decay': 2.4265340760230575e-05}. 
[I 2024-04-21 06:20:12,139] Trial 242 finished with values: [4.973351806255301, 0.44184558344186353, 0.19428518443387754, 53.74341949025265] and parameters: {'dropout': 0.570948598139843, 'num_heads': 8, 'bias': False, 'loss_fn': 'MAE', 'optimizer': 'RMSprop', 'lr': 0.0016801200246028194, 'weight_decay': 1.3344143820661265e-05}. 
[I 2024-04-21 06:20:34,518] Trial 243 finished with values: [9.69726865217544, 0.16662630886189755, -2.049430316394573, 203.4054848366354] and parameters: {'dropout': 0.3693292913693079, 'num_heads': 1, 'bias': True, 'loss_fn': 'MSE', 'optimizer': 'RMSprop', 'lr': 0.0005080531794315761, 'weight_decay': 0.016071689952446948}. 
[I 2024-04-21 06:20:55,571] Trial 244 finished with values: [5.139373584692141, 0.37798911258962326, 0.09896980810396427, 60.1012202343913] and parameters: {'dropout': 0.4134283379388878, 'num_heads': 8, 'bias': False, 'loss_fn': 'MAE', 'optimizer': 'RMSprop', 'lr': 0.0016801200246028194, 'weight_decay': 1.3344143820661265e-05}. 
