[I 2024-04-21 01:51:38,522] Trial 72 finished with values: [5.360530984151449, 0.14047869503457666, -0.08712907565686034, 72.51453346060808] and parameters: {'dropout': 0.4506553387317926, 'num_heads': 1, 'bias': False, 'loss_fn': 'MAE', 'optimizer': 'SGD', 'lr': 0.003272727316932724, 'weight_decay': 0.020849567060606675}. 
Training finished at Epoch 94, with validation result for [5.609724866034884, -0.036754137094478445, -0.08327989351279785, 96.63797816337308]
Training finished at Epoch 68, with validation result for [5.809349159982173, nan, -0.030151400927180827, 111.3388529439381]
Training finished at Epoch 40, with validation result for [5.700390956750319, -0.06320088006642649, -0.04062090949940167, 110.15759391759245]
Training finished at Epoch 57, with validation result for [5.657796409925846, nan, -0.02899614369494219, 108.18850166799173]
Training finished at Epoch 44, with validation result for [5.754675128398077, 0.03547808875574629, -0.02672041685028237, 110.60891075914547]
Training finished at Epoch 39, with validation result for [5.566605712631572, nan, -0.018588410486169105, 105.73301753529931]
Training finished at Epoch 106, with validation result for [5.596210494357202, 0.1249674037446726, -0.0033066239687353782, 107.28812743127405]
Training finished at Epoch 54, with validation result for [5.731643559440893, -0.00949288019585273, -0.03257393420119459, 113.12284869450805]
Training finished at Epoch 42, with validation result for [5.366837444144825, 0.06057780311014511, -0.039992897766617075, 85.68871552369701]
Training finished at Epoch 118, with validation result for [5.319884194725597, 0.029405008151990243, -0.019130765138806405, 96.4311442343343]
Training finished at Epoch 33, with validation result for [5.099563118463596, 0.027433509620911883, -0.04551294153637997, 78.19428701979923]
Training finished at Epoch 137, with validation result for [5.268537652800554, nan, -0.0030374054150468233, 85.4019932375851]
Training finished at Epoch 90, with validation result for [5.541629390321926, 0.06722271667637891, -0.0255193531736706, 100.09092375982658]
Training finished at Epoch 39, with validation result for [5.826369780088001, nan, -0.11982242833770296, 97.85801030569456]
Training finished at Epoch 98, with validation result for [5.734894551308078, 0.05009656868424066, -0.03252555772664589, 106.59758958176774]
Training finished at Epoch 54, with validation result for [5.138025852947892, 0.04804816474674287, -0.06176639104013826, 87.96142896619911]
Training finished at Epoch 32, with validation result for [5.667159575396092, nan, -0.017008805307454855, 108.85607963382363]
Training finished at Epoch 30, with validation result for [5.692006543698235, 1.0, -0.022785847311297847, 110.00368030333122]
Training finished at Epoch 56, with validation result for [5.487280582394675, nan, -0.030043907041316764, 94.05160333024116]
Training finished at Epoch 67, with validation result for [5.380337464986842, 0.06932485150786119, -0.08028245906103026, 88.47998449179318]
Training finished at Epoch 75, with validation result for [5.601444674832789, nan, -0.02328046204677303, 109.28651390012503]
Training finished at Epoch 51, with validation result for [5.391777957776313, nan, -0.04093067831911479, 95.18779910518617]
Training finished at Epoch 46, with validation result for [5.834647581110907, 1.0, -0.035721050459961656, 112.80916661097179]
Training finished at Epoch 75, with validation result for [5.766890607573817, nan, -0.025872996860675457, 113.06428562515548]
Training finished at Epoch 85, with validation result for [5.880815912635588, 0.07720200348740637, -0.05734056382017649, 109.25992000273062]
Training finished at Epoch 89, with validation result for [5.642348708479166, nan, -0.030110077178868933, 110.02819924479216]
Training finished at Epoch 35, with validation result for [5.693793166060804, -1.0, -0.2066395531414975, 90.36717887429045]
Training finished at Epoch 34, with validation result for [5.849777005329957, nan, -0.06109076582205675, 112.12627440306274]
Training finished at Epoch 65, with validation result for [5.893421925811759, 0.12358045238888302, -0.024053720427466674, 112.37663475821773]
Training finished at Epoch 89, with validation result for [5.797698297050225, 0.026769425403901842, -0.1360249432390117, 101.5972175275648]
Training finished at Epoch 53, with validation result for [5.72388241150455, 0.06167138128910679, -0.0711201026558339, 91.80883169404501]
Training finished at Epoch 61, with validation result for [5.2960588336397665, nan, -0.05456325771930848, 86.14993627954122]
Training finished at Epoch 84, with validation result for [5.574589511729047, nan, -0.019360194360491967, 106.20438263910516]
Training finished at Epoch 47, with validation result for [5.260044636254123, 0.07808288226132695, -0.039093038466622154, 89.9831424644925]
Training finished at Epoch 70, with validation result for [6.410068104078101, 0.08222050353124136, -0.18725515025403738, 107.20256507056455]
Training finished at Epoch 84, with validation result for [5.741204117063492, -1.0, -0.021231296696543778, 111.60237512485692]
Training finished at Epoch 38, with validation result for [5.7988026808099775, 0.007795885539320967, -0.0648970209379991, 111.25895239524824]
Training finished at Epoch 42, with validation result for [5.523628472222222, nan, -0.04182440613562077, 96.73940149906878]
Training finished at Epoch 69, with validation result for [5.9139761220988305, 0.09174000787126207, -0.012251309325883142, 112.704420369734]
Training finished at Epoch 107, with validation result for [5.24837352224007, nan, -0.03298746910567418, 88.40235563915883]
Training finished at Epoch 60, with validation result for [5.753218365554979, -0.011728254947616317, -0.0664903080809165, 103.80567591231636]
Training finished at Epoch 72, with validation result for [5.301764830668547, nan, -0.0443811778974994, 104.08755930872958]
Training finished at Epoch 90, with validation result for [5.864921557625498, nan, -0.03625507402729822, 115.00096531239227]
Training finished at Epoch 57, with validation result for [5.558213946721252, nan, -0.04801323188724438, 104.17250222105406]
Training finished at Epoch 51, with validation result for [5.622810412151087, nan, -0.05068552649171454, 100.98999907417578]
Training finished at Epoch 80, with validation result for [5.016949539652853, nan, -0.09066982705181581, 74.68891596258196]
Training finished at Epoch 42, with validation result for [40.55235374573815, 0.100383141797284, -52.91556810544936, 5593.46969013704]
Training finished at Epoch 63, with validation result for [4.939756072386685, 0.0792244506400108, -0.026302461094113383, 75.21543910240045]
Training finished at Epoch 42, with validation result for [5.5114750556141106, 0.011415236527685018, -0.03623646641436418, 107.5780864190544]
Training finished at Epoch 75, with validation result for [5.927436154991493, 0.08238177373528846, -0.10798911368245578, 92.98007618919502]
Training finished at Epoch 45, with validation result for [5.36737779840271, nan, -0.01694934984234253, 101.18863644385335]
Training finished at Epoch 63, with validation result for [5.384646577380952, nan, -0.03149520665452732, 87.9512182095362]
Training finished at Epoch 68, with validation result for [6.215167556709272, 0.018186352537670203, -0.1126333140141762, 110.12923661181424]
Training finished at Epoch 35, with validation result for [5.19203373015873, nan, -0.042197234748299506, 86.12037182000154]
Training finished at Epoch 37, with validation result for [4.9861246604245295, 0.10588268117864508, -0.049297374220185874, 75.20346765995407]
Training finished at Epoch 114, with validation result for [5.853045942736613, nan, -0.0007218901963561564, 108.82104466526617]
Training finished at Epoch 49, with validation result for [5.363836368784686, nan, -0.015252762863704472, 99.2245786813124]
Training finished at Epoch 41, with validation result for [5.70240902586731, nan, -0.050420419766818325, 98.6549274438684]
Training finished at Epoch 31, with validation result for [5.44184155035492, -1.0, -0.05923715714439681, 92.60551990531833]
Training finished at Epoch 97, with validation result for [5.713000900370319, 0.039059038363005255, -0.036777242148718914, 95.84645976051127]
Training finished at Epoch 46, with validation result for [5.612457287885178, nan, -0.02975280228763033, 108.46271669821165]
[I 2024-04-21 01:51:48,672] Trial 73 finished with values: [6.03348568384518, 0.2109933304923765, -0.044471595027776756, 69.66916084047656] and parameters: {'dropout': 0.2769863592074008, 'num_heads': 4, 'bias': True, 'loss_fn': 'MSE', 'optimizer': 'RMSprop', 'lr': 0.00023451389247525884, 'weight_decay': 1.251476968558302e-05}. 
[I 2024-04-21 01:52:02,369] Trial 74 finished with values: [5.319737748821848, 0.19884597630922882, -0.006929763297099267, 67.16501623229206] and parameters: {'dropout': 0.250127375517484, 'num_heads': 8, 'bias': True, 'loss_fn': 'MSE', 'optimizer': 'RMSprop', 'lr': 0.0001729280367416899, 'weight_decay': 6.030930289007694e-05}. 
[I 2024-04-21 01:52:18,451] Trial 75 finished with values: [5.350407219329785, 0.20140157387367932, -0.04578346192910865, 69.75666601207269] and parameters: {'dropout': 0.6398739387450053, 'num_heads': 4, 'bias': False, 'loss_fn': 'MSE', 'optimizer': 'RMSprop', 'lr': 0.00037518143649159464, 'weight_decay': 6.336536341307612e-05}. 
[I 2024-04-21 01:52:37,754] Trial 76 finished with values: [5.979329844371268, 0.04248703944183428, -0.18126773270156415, 78.79384375509198] and parameters: {'dropout': 0.22631263190352624, 'num_heads': 2, 'bias': True, 'loss_fn': 'MSE', 'optimizer': 'RMSprop', 'lr': 0.006374051909215136, 'weight_decay': 0.04963236909795054}. 
[W 2024-04-21 01:52:49,229] Trial 77 failed with parameters: {'dropout': 0.264360828881129, 'num_heads': 8, 'bias': True, 'loss_fn': 'MAE', 'optimizer': 'Adam', 'lr': 0.09493517251666506, 'weight_decay': 0.009624118486563455} because of the following error: The value nan is not acceptable.
[W 2024-04-21 01:52:49,229] Trial 77 failed with value [5.3531576719631175, nan, -0.08168150946123376, 72.15116564162766].
[I 2024-04-21 01:53:04,540] Trial 78 finished with values: [5.318745644784894, 0.2232486891905843, 0.01981418682570002, 65.38112036429055] and parameters: {'dropout': 0.48449624536526786, 'num_heads': 8, 'bias': False, 'loss_fn': 'MAE', 'optimizer': 'RMSprop', 'lr': 0.0011218242088903074, 'weight_decay': 0.06851951865397855}. 
[I 2024-04-21 01:53:22,705] Trial 79 finished with values: [5.256565733609968, 0.25191536273220644, -0.0390770091312056, 69.30932695482073] and parameters: {'dropout': 0.4622029983473447, 'num_heads': 1, 'bias': True, 'loss_fn': 'MAE', 'optimizer': 'RMSprop', 'lr': 0.0011218242088903074, 'weight_decay': 0.003006198705678768}. 
[I 2024-04-21 01:53:40,185] Trial 80 finished with values: [5.3858588963990055, 0.20619152562173793, -0.001159392307165552, 66.78011643557119] and parameters: {'dropout': 0.5308643758909863, 'num_heads': 1, 'bias': True, 'loss_fn': 'MSE', 'optimizer': 'Adam', 'lr': 0.00019290042098284114, 'weight_decay': 9.862400533423962e-05}. 
[I 2024-04-21 01:53:51,386] Trial 81 finished with values: [5.430780299335833, 0.14095394412929638, -0.12272188514571747, 74.88867286358312] and parameters: {'dropout': 0.22519233998110277, 'num_heads': 2, 'bias': True, 'loss_fn': 'MAE', 'optimizer': 'SGD', 'lr': 0.0014629914289036854, 'weight_decay': 0.018724359742011323}. 
[I 2024-04-21 01:54:09,189] Trial 82 finished with values: [5.421816839735567, 0.22021472677298426, -0.06731100317143857, 71.19261289703512] and parameters: {'dropout': 0.28060307774751625, 'num_heads': 2, 'bias': False, 'loss_fn': 'MSE', 'optimizer': 'RMSprop', 'lr': 0.0009181384288823589, 'weight_decay': 0.0003785062296578804}. 
[I 2024-04-21 01:54:32,280] Trial 83 finished with values: [5.345226637801239, -0.14095394412929638, -0.0758680294371663, 71.76339035241179] and parameters: {'dropout': 0.5010784230012597, 'num_heads': 2, 'bias': False, 'loss_fn': 'MAE', 'optimizer': 'RMSprop', 'lr': 0.009018696835276395, 'weight_decay': 0.0027296084983015347}. 
[I 2024-04-21 01:54:42,017] Trial 84 finished with values: [5.3039567771540845, 0.24724231428568094, -0.04842213090668657, 69.93267257297755] and parameters: {'dropout': 0.601322534865889, 'num_heads': 1, 'bias': False, 'loss_fn': 'MAE', 'optimizer': 'RMSprop', 'lr': 0.0009181384288823589, 'weight_decay': 0.0036512883175910866}. 
[I 2024-04-21 01:54:52,595] Trial 85 finished with values: [5.320624519522909, 0.21834500337796917, 0.0010420736224477922, 66.63327253415233] and parameters: {'dropout': 0.21394355875372933, 'num_heads': 1, 'bias': False, 'loss_fn': 'MAE', 'optimizer': 'RMSprop', 'lr': 0.005872983613013404, 'weight_decay': 0.0002587068960219466}. 
[W 2024-04-21 01:55:02,969] Trial 86 failed with parameters: {'dropout': 0.601322534865889, 'num_heads': 1, 'bias': True, 'loss_fn': 'MAE', 'optimizer': 'SGD', 'lr': 0.0016843039792363457, 'weight_decay': 0.0035829163620928256} because of the following error: The value nan is not acceptable.
[W 2024-04-21 01:55:02,969] Trial 86 failed with value [5.403233097446518, nan, -0.11135597669424269, 74.1305351528272].
[I 2024-04-21 01:55:29,890] Trial 87 finished with values: [5.398781401544181, 0.14047869503457666, -0.10914968147686843, 73.98336912448086] and parameters: {'dropout': 0.6628261506342109, 'num_heads': 1, 'bias': False, 'loss_fn': 'MAE', 'optimizer': 'RMSprop', 'lr': 0.004378149122665535, 'weight_decay': 0.06851951865397855}. 
[I 2024-04-21 01:55:48,861] Trial 88 finished with values: [5.397311775707829, 0.18593146032314345, -0.09319107271418425, 72.91888552725281] and parameters: {'dropout': 0.6843836269030925, 'num_heads': 8, 'bias': False, 'loss_fn': 'MAE', 'optimizer': 'Adam', 'lr': 0.00010447899875809218, 'weight_decay': 6.016476080954159e-05}. 
[I 2024-04-21 01:56:08,423] Trial 89 finished with values: [5.310602648601062, 0.19073512578185167, -0.00205878939458648, 66.8401087231942] and parameters: {'dropout': 0.22519233998110277, 'num_heads': 2, 'bias': False, 'loss_fn': 'MAE', 'optimizer': 'Adam', 'lr': 0.0001170951834227463, 'weight_decay': 1.7259304738591127e-05}. 
[I 2024-04-21 01:56:22,216] Trial 90 finished with values: [5.389868045742163, 0.06708245737228606, -0.10595449467907381, 73.77024127687768] and parameters: {'dropout': 0.5010784230012597, 'num_heads': 2, 'bias': True, 'loss_fn': 'MAE', 'optimizer': 'RMSprop', 'lr': 0.002296408255281905, 'weight_decay': 0.007003630296290256}. 
[I 2024-04-21 01:56:33,680] Trial 91 finished with values: [5.279326373458627, 0.22440893363368153, -0.007068286754574826, 67.1742561322424] and parameters: {'dropout': 0.3186712596423216, 'num_heads': 8, 'bias': True, 'loss_fn': 'MAE', 'optimizer': 'RMSprop', 'lr': 0.00012653702848240087, 'weight_decay': 0.02076297142943548}. 
[I 2024-04-21 01:56:50,258] Trial 92 finished with values: [5.365779296257378, 0.21210471403584538, 0.01576915955224667, 65.65093493565843] and parameters: {'dropout': 0.2864316147243036, 'num_heads': 8, 'bias': False, 'loss_fn': 'MSE', 'optimizer': 'Adam', 'lr': 0.00019290042098284114, 'weight_decay': 9.862400533423962e-05}. 
[I 2024-04-21 01:57:06,040] Trial 93 finished with values: [5.286184947667461, 0.2405660935313668, -0.04193565617705519, 69.50000666480189] and parameters: {'dropout': 0.5010784230012597, 'num_heads': 1, 'bias': True, 'loss_fn': 'MAE', 'optimizer': 'RMSprop', 'lr': 0.0005763062233516245, 'weight_decay': 0.0002587068960219466}. 
[I 2024-04-21 01:57:16,647] Trial 94 finished with values: [5.407618512652604, 0.1580113466020006, -0.10236340730362614, 73.53070575945118] and parameters: {'dropout': 0.5010784230012597, 'num_heads': 1, 'bias': True, 'loss_fn': 'MAE', 'optimizer': 'RMSprop', 'lr': 0.002296408255281905, 'weight_decay': 1.7259304738591127e-05}. 
[I 2024-04-21 01:57:28,869] Trial 95 finished with values: [5.344601511107451, 0.14095394412929638, -0.07541893252887677, 71.73343433935645] and parameters: {'dropout': 0.21394355875372933, 'num_heads': 4, 'bias': True, 'loss_fn': 'MAE', 'optimizer': 'SGD', 'lr': 0.005872983613013404, 'weight_decay': 8.944419014093568e-05}. 
[I 2024-04-21 01:57:37,329] Trial 96 finished with values: [5.371605573370826, -0.025206003580683183, -0.09812495949571431, 73.2479895003886] and parameters: {'dropout': 0.33906823649636453, 'num_heads': 8, 'bias': True, 'loss_fn': 'MAE', 'optimizer': 'RMSprop', 'lr': 0.06266263176737731, 'weight_decay': 1.7259304738591127e-05}. 
[I 2024-04-21 01:57:53,751] Trial 97 finished with values: [5.572202317746419, -0.19863680846115128, -0.1653818153399258, 77.73420887652253] and parameters: {'dropout': 0.40230299146194626, 'num_heads': 4, 'bias': True, 'loss_fn': 'MSE', 'optimizer': 'Adam', 'lr': 0.0046679055443659585, 'weight_decay': 2.3118123270818593e-05}. 
[I 2024-04-21 01:58:12,704] Trial 98 finished with values: [5.216231726020913, 0.2433511235743196, 0.03614546563776111, 64.29177863809656] and parameters: {'dropout': 0.5356496528379955, 'num_heads': 2, 'bias': False, 'loss_fn': 'MSE', 'optimizer': 'Adam', 'lr': 0.0008974100862471255, 'weight_decay': 0.0012646218294935334}. 
[I 2024-04-21 01:58:25,307] Trial 99 finished with values: [5.32829588923581, 0.17923000989256369, -0.031218588105448752, 68.78514841229074] and parameters: {'dropout': 0.5356496528379955, 'num_heads': 1, 'bias': True, 'loss_fn': 'MSE', 'optimizer': 'Adam', 'lr': 0.0008974100862471255, 'weight_decay': 0.0013540661555891953}. 
[I 2024-04-21 01:58:42,031] Trial 100 finished with values: [5.332612607882103, 0.21817506073937037, -0.06350775547434462, 70.9389256959792] and parameters: {'dropout': 0.6586733276831351, 'num_heads': 4, 'bias': False, 'loss_fn': 'MAE', 'optimizer': 'Adam', 'lr': 0.0004399465845986358, 'weight_decay': 6.016476080954159e-05}. 
[I 2024-04-21 01:58:55,302] Trial 101 finished with values: [5.3392028481243345, 0.24898452265312027, -0.06402359328436735, 70.97333351283622] and parameters: {'dropout': 0.564828765402576, 'num_heads': 1, 'bias': True, 'loss_fn': 'MAE', 'optimizer': 'RMSprop', 'lr': 0.001259987046706076, 'weight_decay': 0.016611844451172173}. 
[I 2024-04-21 01:59:12,677] Trial 102 finished with values: [5.278287187659231, 0.1756557431459563, -0.023698662189463038, 68.28354843518908] and parameters: {'dropout': 0.6634253081505919, 'num_heads': 8, 'bias': True, 'loss_fn': 'MSE', 'optimizer': 'RMSprop', 'lr': 0.0014663604034180699, 'weight_decay': 0.0037168330157469373}. 
[I 2024-04-21 01:59:21,116] Trial 103 finished with values: [5.348554103810333, 0.14095394412929638, -0.07828094650562423, 71.92433863299443] and parameters: {'dropout': 0.22519233998110277, 'num_heads': 1, 'bias': True, 'loss_fn': 'MAE', 'optimizer': 'Adam', 'lr': 0.06266263176737731, 'weight_decay': 0.009624118486563455}. 
[I 2024-04-21 01:59:47,810] Trial 104 finished with values: [5.374641199989339, 0.17219358020728387, -0.03874746049177613, 69.28734514385098] and parameters: {'dropout': 0.5898435917863725, 'num_heads': 8, 'bias': False, 'loss_fn': 'MSE', 'optimizer': 'Adam', 'lr': 0.00019290042098284114, 'weight_decay': 0.009624118486563455}. 
[I 2024-04-21 02:00:08,516] Trial 105 finished with values: [5.398753249398882, 0.17821979487369083, -0.05847414734764533, 70.6031700317214] and parameters: {'dropout': 0.33379122370013237, 'num_heads': 4, 'bias': True, 'loss_fn': 'MSE', 'optimizer': 'RMSprop', 'lr': 0.0001729280367416899, 'weight_decay': 0.0007384679430791242}. 
[I 2024-04-21 02:00:15,917] Trial 106 finished with values: [5.343905536081425, 0.20042860109174115, -0.02605675749861036, 68.44083995192562] and parameters: {'dropout': 0.35678171751055654, 'num_heads': 8, 'bias': True, 'loss_fn': 'MSE', 'optimizer': 'Adam', 'lr': 0.002159091901219909, 'weight_decay': 0.009624118486563455}. 
[I 2024-04-21 02:00:34,360] Trial 107 finished with values: [5.364501093280466, 0.2048017198183164, -0.016909645735101453, 67.83070215238041] and parameters: {'dropout': 0.5010784230012597, 'num_heads': 1, 'bias': True, 'loss_fn': 'MSE', 'optimizer': 'RMSprop', 'lr': 0.0001729280367416899, 'weight_decay': 0.0007384679430791242}. 
[I 2024-04-21 02:00:46,660] Trial 108 finished with values: [5.574352943681003, 0.20184151578850243, -0.16591978690599585, 77.77009307647833] and parameters: {'dropout': 0.5010784230012597, 'num_heads': 2, 'bias': True, 'loss_fn': 'MAE', 'optimizer': 'SGD', 'lr': 0.00022777207533889764, 'weight_decay': 2.8932369498372485e-05}. 
[I 2024-04-21 02:00:59,646] Trial 109 finished with values: [5.348148325600608, 0.16504721697250385, -0.03983449671390127, 69.35985348372273] and parameters: {'dropout': 0.2864316147243036, 'num_heads': 4, 'bias': True, 'loss_fn': 'MSE', 'optimizer': 'Adam', 'lr': 0.0010565422235765504, 'weight_decay': 1.7259304738591127e-05}. 
[I 2024-04-21 02:01:07,102] Trial 110 finished with values: [5.644966554530663, -0.053560008807548645, -0.1788985533091243, 78.63581289916674] and parameters: {'dropout': 0.46530050433809567, 'num_heads': 1, 'bias': False, 'loss_fn': 'MSE', 'optimizer': 'Adam', 'lr': 0.0005763062233516245, 'weight_decay': 0.0002587068960219466}. 
[I 2024-04-21 02:01:18,696] Trial 111 finished with values: [5.284504497168786, 0.23735134360336319, -0.023981899492182324, 68.302441151174] and parameters: {'dropout': 0.564828765402576, 'num_heads': 1, 'bias': False, 'loss_fn': 'MAE', 'optimizer': 'RMSprop', 'lr': 0.001259987046706076, 'weight_decay': 0.0037168330157469373}. 
[I 2024-04-21 02:01:42,364] Trial 112 finished with values: [5.382847639269527, 0.186575270169669, -0.03303369524760269, 68.906221107835] and parameters: {'dropout': 0.250127375517484, 'num_heads': 1, 'bias': True, 'loss_fn': 'MSE', 'optimizer': 'RMSprop', 'lr': 0.0024402095972575633, 'weight_decay': 0.0027296084983015347}. 
