[I 2024-04-21 02:37:24,769] Trial 248 finished with values: [5.337094176785104, 0.17513155480493112, -0.03323876272916215, 68.91989967930016] and parameters: {'dropout': 0.553678472298213, 'num_heads': 2, 'bias': True, 'loss_fn': 'MSE', 'optimizer': 'RMSprop', 'lr': 0.0002743881097041735, 'weight_decay': 0.0027296084983015347}. 
Training finished at Epoch 66, with validation result for [5.836257064388548, -0.11714033226685262, -0.05474549386483751, 112.7822563829597]
Training finished at Epoch 39, with validation result for [5.913795612670214, 0.0782299432786277, -0.02541066187956198, 110.69981044713877]
Training finished at Epoch 30, with validation result for [5.218821098411849, -0.01223462282670948, -0.11229721292391637, 89.5694547253114]
Training finished at Epoch 44, with validation result for [5.568678775762787, 0.1140114365484996, -0.04361219427181218, 90.5524414833381]
Training finished at Epoch 39, with validation result for [5.7111395234521884, 0.033085625623072726, -0.042466800315787756, 103.86119855867376]
Training finished at Epoch 90, with validation result for [5.908301343087209, nan, -0.13827483859273992, 105.37606721725432]
Training finished at Epoch 48, with validation result for [5.627392480787738, 0.07359722736147262, -0.034302644323604525, 100.95726766944034]
Training finished at Epoch 44, with validation result for [5.739628546938042, 0.08568087807455158, -0.025379758758186544, 95.04798783497263]
Training finished at Epoch 44, with validation result for [5.393933181840059, 0.09086596494319381, -0.009673760674133058, 100.6125192814885]
Training finished at Epoch 68, with validation result for [5.666564698844884, 0.028694193220483718, -0.04341132589275132, 108.5768275826369]
Training finished at Epoch 41, with validation result for [5.332224852232455, 0.06743856219022018, -0.03022951923349626, 93.2160416002796]
Training finished at Epoch 32, with validation result for [5.414351168985803, -0.008286519584328274, -0.034897581902374464, 99.74539484634944]
Training finished at Epoch 71, with validation result for [5.351001967826825, -0.03352133089222877, -0.04494356000971966, 95.35723777758729]
Training finished at Epoch 84, with validation result for [5.578698766899239, 0.0195438913887483, -0.04573537407602268, 107.81247126283188]
Training finished at Epoch 45, with validation result for [4.9251059421522045, 0.11225187847748125, -0.011878741785242397, 74.49344758239407]
Training finished at Epoch 70, with validation result for [5.251908023451025, 0.14665730119882456, -0.04348265043279276, 86.04158004239731]
Training finished at Epoch 64, with validation result for [5.7093225469827855, 0.07693187860087891, -0.04005908047396933, 98.28620944989932]
Training finished at Epoch 55, with validation result for [5.37239100023811, 0.037429493310736604, -0.01682326722256855, 102.95377936370136]
Training finished at Epoch 76, with validation result for [5.153793595513776, -0.02082592715101979, -0.023299964854362143, 97.81108275649747]
Training finished at Epoch 39, with validation result for [6.067617561310745, 0.09317333466859733, -0.08361771663571926, 114.16179667321023]
Training finished at Epoch 68, with validation result for [8.88325518189724, 0.22461086044437392, -0.9090466873629561, 207.07285103120694]
Training finished at Epoch 62, with validation result for [5.577128242797099, 0.10333662621773994, -0.021385087011086545, 98.63900222658435]
Training finished at Epoch 43, with validation result for [5.684175292978796, 0.09711391570970782, -0.0371975072299644, 103.54208042172864]
Training finished at Epoch 115, with validation result for [5.2981143335843806, 0.08061148606125544, -0.021772045544879326, 96.65794707525178]
Training finished at Epoch 42, with validation result for [5.44068964052434, 0.008678518017591584, -0.06474556428603129, 96.44620076032156]
Training finished at Epoch 71, with validation result for [6.027065419976618, 0.08631745015004343, -0.03892583751898315, 109.80609935014922]
Training finished at Epoch 54, with validation result for [5.411054440954928, -0.007422812119687069, -0.03235966091254805, 103.45352901739824]
Training finished at Epoch 68, with validation result for [5.671656035349199, 0.06800449049941862, -0.04401155913057786, 109.93206700764995]
Training finished at Epoch 30, with validation result for [6.527502512835819, 0.1927866711687178, -0.06961890234549672, 115.00867359439633]
Training finished at Epoch 86, with validation result for [5.454711469584229, 0.02201705563419083, -0.05303775691415469, 96.01297703533687]
Training finished at Epoch 57, with validation result for [5.921127562499218, 0.0705786601000762, -0.06830816735259382, 108.83147792879778]
Training finished at Epoch 41, with validation result for [5.083367062190168, 0.02843974748486231, -0.023774510489934952, 89.70553801444179]
Training finished at Epoch 53, with validation result for [4.893798059203654, 0.09583073280597655, -0.06665900164449168, 75.10342703150799]
Training finished at Epoch 65, with validation result for [5.651800157529176, 2.3453174462594084e-05, -0.05135251006522945, 104.18597477070136]
Training finished at Epoch 50, with validation result for [5.6798586365680785, nan, -0.024588959018466028, 109.29248104629114]
Training finished at Epoch 47, with validation result for [5.748429167622295, -0.016098897568271098, -0.03984319695122274, 105.3799760072285]
Training finished at Epoch 87, with validation result for [5.479458454052716, 0.03288820079508535, -0.04874235606490651, 100.97699712117766]
Training finished at Epoch 100, with validation result for [5.392152614049692, nan, -0.013021811297305064, 100.89456283998469]
Training finished at Epoch 81, with validation result for [5.495287740103687, 0.016631868312915573, -0.08451131415924662, 90.75951905276754]
Training finished at Epoch 70, with validation result for [5.179390523771306, 0.20728064166738294, -0.006818646912306825, 76.51607076698758]
Training finished at Epoch 49, with validation result for [5.990773890344486, 0.039922335131909174, -0.06745766864426961, 114.49158358288015]
Training finished at Epoch 64, with validation result for [5.734522174156851, 0.11488595619966317, -0.003421896322054918, 106.0664544267258]
Training finished at Epoch 31, with validation result for [6.354580875042008, -0.15191855976121582, -0.19536447673127055, 121.71232492518055]
Training finished at Epoch 81, with validation result for [5.402110911945321, 0.09261990026555661, -0.016832779778333196, 106.39325499877468]
Training finished at Epoch 37, with validation result for [5.558799440990145, -0.08631616124147873, -0.049911051532096185, 106.24682364869857]
Training finished at Epoch 41, with validation result for [5.065981089863393, 0.09637145613813093, -0.041352054528597026, 83.55072627919162]
Training finished at Epoch 38, with validation result for [5.46805251215621, 0.01887067486958833, -0.029196012311227815, 108.5907169820819]
Training finished at Epoch 36, with validation result for [5.800163722127981, -0.020020998428448174, -0.041827480888670276, 109.90726755865053]
Training finished at Epoch 37, with validation result for [5.243526323573981, 0.12857530219642468, -0.034461338182118606, 91.0975727196087]
Training finished at Epoch 58, with validation result for [5.662496638486566, 0.07424442966862083, -0.05835317038075494, 94.44791704677488]
Training finished at Epoch 68, with validation result for [5.476950884979384, 0.028413380304619942, -0.07402533759006968, 95.44209072630667]
Training finished at Epoch 63, with validation result for [5.644827579407167, -0.01704802256006191, -0.08564104750409474, 101.20027625594203]
Training finished at Epoch 92, with validation result for [5.533071790105136, 0.03071173357847518, -0.11688338955975763, 89.82346500662213]
Training finished at Epoch 35, with validation result for [5.242482703170126, 0.046984322350178596, -0.024453282660265474, 97.33021582561264]
Training finished at Epoch 50, with validation result for [4.980841076162602, 0.10495861008905662, -0.02800580062065028, 67.5325577811672]
Training finished at Epoch 32, with validation result for [5.652051950868681, -0.010209569286686584, -0.042048814486214336, 112.16121092343985]
Training finished at Epoch 36, with validation result for [5.476298872624021, 0.15607566752536553, -0.0002821850545071669, 100.83707708641815]
Training finished at Epoch 67, with validation result for [5.407955303056667, 0.03878249353111422, -0.07741732544198165, 89.76920183669948]
[I 2024-04-21 02:37:42,484] Trial 249 finished with values: [5.329986733276271, 0.1864844064922235, -0.052490352991796385, 70.20403430280493] and parameters: {'dropout': 0.27365393415702083, 'num_heads': 8, 'bias': True, 'loss_fn': 'MAE', 'optimizer': 'RMSprop', 'lr': 0.0014245419603048832, 'weight_decay': 0.0001004548037454834}. 
[I 2024-04-21 02:37:56,927] Trial 250 finished with values: [5.520886329088456, 0.22382060825474137, -0.058947984471752424, 70.63477628599271] and parameters: {'dropout': 0.2864316147243036, 'num_heads': 8, 'bias': False, 'loss_fn': 'MSE', 'optimizer': 'Adam', 'lr': 0.00019290042098284114, 'weight_decay': 9.862400533423962e-05}. 
[I 2024-04-21 02:38:18,430] Trial 251 finished with values: [5.189162165252098, 0.25815824031878076, 0.010402890474298432, 66.00888001074198] and parameters: {'dropout': 0.4458780520491319, 'num_heads': 8, 'bias': True, 'loss_fn': 'MSE', 'optimizer': 'Adam', 'lr': 0.0008974375358981978, 'weight_decay': 9.862400533423962e-05}. 
[I 2024-04-21 02:38:35,301] Trial 252 finished with values: [5.306460253715374, 0.22580774375197593, -0.0490376750767032, 69.97373108140368] and parameters: {'dropout': 0.553678472298213, 'num_heads': 1, 'bias': False, 'loss_fn': 'MAE', 'optimizer': 'RMSprop', 'lr': 0.0002743881097041735, 'weight_decay': 0.0027296084983015347}. 
[I 2024-04-21 02:38:47,988] Trial 253 finished with values: [5.373045460046127, 0.23895187184333408, -0.08574575894407355, 72.42226238783286] and parameters: {'dropout': 0.4622029983473447, 'num_heads': 1, 'bias': True, 'loss_fn': 'MAE', 'optimizer': 'RMSprop', 'lr': 0.001259987046706076, 'weight_decay': 0.003006198705678768}. 
[I 2024-04-21 02:38:56,932] Trial 254 finished with values: [5.409020854834663, 0.08309530809912585, -0.07553124780222431, 71.74092608052102] and parameters: {'dropout': 0.27365393415702083, 'num_heads': 2, 'bias': True, 'loss_fn': 'MAE', 'optimizer': 'RMSprop', 'lr': 0.0014245419603048832, 'weight_decay': 0.0001004548037454834}. 
[I 2024-04-21 02:39:06,306] Trial 255 finished with values: [5.432432850201436, 0.20991333533353929, 0.025270546068530186, 65.01716602460165] and parameters: {'dropout': 0.5308643758909863, 'num_heads': 2, 'bias': True, 'loss_fn': 'MSE', 'optimizer': 'Adam', 'lr': 0.00019290042098284114, 'weight_decay': 9.862400533423962e-05}. 
[I 2024-04-21 02:39:15,647] Trial 256 finished with values: [5.427280337104835, 0.2338807448722397, -0.10151332368825994, 73.47400281759164] and parameters: {'dropout': 0.4622029983473447, 'num_heads': 1, 'bias': True, 'loss_fn': 'MAE', 'optimizer': 'RMSprop', 'lr': 0.00037518143649159464, 'weight_decay': 0.003006198705678768}. 
[I 2024-04-21 02:39:27,756] Trial 257 finished with values: [5.451636601783751, 0.14619837023955692, 0.00220502396155009, 66.5557005115046] and parameters: {'dropout': 0.26012060126618136, 'num_heads': 1, 'bias': False, 'loss_fn': 'MSE', 'optimizer': 'RMSprop', 'lr': 0.0003464779303760371, 'weight_decay': 0.0037168330157469373}. 
[I 2024-04-21 02:39:41,281] Trial 258 finished with values: [5.316892526270725, 0.1919219792069992, -0.042690846239278324, 69.55037994269726] and parameters: {'dropout': 0.4622029983473447, 'num_heads': 2, 'bias': False, 'loss_fn': 'MAE', 'optimizer': 'RMSprop', 'lr': 0.001259987046706076, 'weight_decay': 0.06851951865397855}. 
[I 2024-04-21 02:39:53,980] Trial 259 finished with values: [5.370963472546237, 0.2589870170876995, -0.0798577250636685, 72.02951414900957] and parameters: {'dropout': 0.4175623535922639, 'num_heads': 1, 'bias': True, 'loss_fn': 'MAE', 'optimizer': 'RMSprop', 'lr': 0.001259987046706076, 'weight_decay': 0.0037168330157469373}. 
[I 2024-04-21 02:40:08,840] Trial 260 finished with values: [5.284674364397886, 0.19098995353988765, -0.01629432132224884, 67.78965830236842] and parameters: {'dropout': 0.2769863592074008, 'num_heads': 1, 'bias': True, 'loss_fn': 'MAE', 'optimizer': 'Adam', 'lr': 0.00019290042098284114, 'weight_decay': 9.862400533423962e-05}. 
[I 2024-04-21 02:40:20,974] Trial 261 finished with values: [5.25549693654704, 0.23431491831458903, -0.02083584394172444, 68.09259049443871] and parameters: {'dropout': 0.2864316147243036, 'num_heads': 1, 'bias': False, 'loss_fn': 'MAE', 'optimizer': 'Adam', 'lr': 0.0019461384509752825, 'weight_decay': 1.251476968558302e-05}. 
[I 2024-04-21 02:40:39,178] Trial 262 finished with values: [5.3122923428401245, 0.21584975274226517, -0.05770954430626363, 70.55216888193166] and parameters: {'dropout': 0.27365393415702083, 'num_heads': 1, 'bias': True, 'loss_fn': 'MAE', 'optimizer': 'RMSprop', 'lr': 0.0014245419603048832, 'weight_decay': 0.034085050263008385}. 
[I 2024-04-21 02:40:50,309] Trial 263 finished with values: [5.32674104303238, 0.15068022331150072, -0.06275636783597638, 70.88880605033232] and parameters: {'dropout': 0.264360828881129, 'num_heads': 1, 'bias': True, 'loss_fn': 'MAE', 'optimizer': 'Adam', 'lr': 0.0005763062233516245, 'weight_decay': 6.016476080954159e-05}. 
[I 2024-04-21 02:41:04,528] Trial 264 finished with values: [5.299012341449037, 0.2304444262861893, 0.027944762450416105, 64.83878835294568] and parameters: {'dropout': 0.3186712596423216, 'num_heads': 1, 'bias': True, 'loss_fn': 'MAE', 'optimizer': 'RMSprop', 'lr': 0.00012653702848240087, 'weight_decay': 0.02076297142943548}. 
[I 2024-04-21 02:41:23,367] Trial 265 finished with values: [5.286206874030597, 0.24776924933920635, -0.011962991817053181, 67.50074657572395] and parameters: {'dropout': 0.2384816827737528, 'num_heads': 2, 'bias': False, 'loss_fn': 'MAE', 'optimizer': 'RMSprop', 'lr': 0.0009181384288823589, 'weight_decay': 1.251476968558302e-05}. 
[I 2024-04-21 02:41:32,135] Trial 266 finished with values: [5.482946050565759, 0.17139579173974087, -0.12954613426418438, 75.34386926309584] and parameters: {'dropout': 0.564828765402576, 'num_heads': 8, 'bias': True, 'loss_fn': 'MAE', 'optimizer': 'Adam', 'lr': 0.0009181384288823589, 'weight_decay': 9.862400533423962e-05}. 
[I 2024-04-21 02:41:40,427] Trial 267 finished with values: [5.472620059981983, 0.18168489132259533, -0.010741081934790842, 67.41924178753713] and parameters: {'dropout': 0.5356496528379955, 'num_heads': 2, 'bias': False, 'loss_fn': 'MSE', 'optimizer': 'Adam', 'lr': 0.0008974100862471255, 'weight_decay': 9.187573219720651e-05}. 
[I 2024-04-21 02:42:13,691] Trial 268 finished with values: [5.331837396470288, 0.25609144302893766, 0.025987493720920907, 64.96934362182267] and parameters: {'dropout': 0.3186712596423216, 'num_heads': 8, 'bias': True, 'loss_fn': 'MSE', 'optimizer': 'Adam', 'lr': 0.00012653702848240087, 'weight_decay': 0.003006198705678768}. 
[I 2024-04-21 02:42:29,640] Trial 269 finished with values: [5.3441087059754535, 0.24038737121105155, -0.061333037653015676, 70.79386596778929] and parameters: {'dropout': 0.553678472298213, 'num_heads': 2, 'bias': False, 'loss_fn': 'MAE', 'optimizer': 'RMSprop', 'lr': 0.0001170951834227463, 'weight_decay': 0.0027296084983015347}. 
[I 2024-04-21 02:42:40,345] Trial 270 finished with values: [5.335801724811967, 0.18694387204899846, -0.05535310396504345, 70.39498775615957] and parameters: {'dropout': 0.5308643758909863, 'num_heads': 1, 'bias': False, 'loss_fn': 'MAE', 'optimizer': 'Adam', 'lr': 0.0008974375358981978, 'weight_decay': 0.007003630296290256}. 
[W 2024-04-21 02:42:50,453] Trial 271 failed with parameters: {'dropout': 0.3390437259975235, 'num_heads': 1, 'bias': True, 'loss_fn': 'MSE', 'optimizer': 'Adam', 'lr': 0.004378149122665535, 'weight_decay': 0.0001004548037454834} because of the following error: The value nan is not acceptable.
[W 2024-04-21 02:42:50,454] Trial 271 failed with value [5.755264282140008, nan, -0.2110007392143236, 80.77711799909216].
[I 2024-04-21 02:43:11,565] Trial 272 finished with values: [5.259091088952459, 0.2743206079528332, -0.01785332872169265, 67.8936484326701] and parameters: {'dropout': 0.264360828881129, 'num_heads': 8, 'bias': True, 'loss_fn': 'MAE', 'optimizer': 'Adam', 'lr': 0.00010447899875809218, 'weight_decay': 6.016476080954159e-05}. 
[I 2024-04-21 02:43:25,282] Trial 273 finished with values: [6.455333393578148, 0.009997435966101977, -0.35331619288457095, 90.26995464399313] and parameters: {'dropout': 0.4175623535922639, 'num_heads': 1, 'bias': False, 'loss_fn': 'MSE', 'optimizer': 'RMSprop', 'lr': 0.005603610188597056, 'weight_decay': 0.02076297142943548}. 
[I 2024-04-21 02:43:54,264] Trial 274 finished with values: [5.302798421993552, 0.21449442091456838, -0.061856563103886764, 70.82878657167593] and parameters: {'dropout': 0.27365393415702083, 'num_heads': 2, 'bias': True, 'loss_fn': 'MAE', 'optimizer': 'RMSprop', 'lr': 0.0019461384509752825, 'weight_decay': 1.251476968558302e-05}. 
[I 2024-04-21 02:44:12,574] Trial 275 finished with values: [5.4379154080848675, 0.21943618513224397, -0.0036211382760269473, 66.94432173964022] and parameters: {'dropout': 0.4735985967725911, 'num_heads': 2, 'bias': True, 'loss_fn': 'MSE', 'optimizer': 'RMSprop', 'lr': 0.0011218242088903074, 'weight_decay': 0.003006198705678768}. 
[I 2024-04-21 02:44:23,330] Trial 276 finished with values: [5.4318607839358375, 0.10793140709936837, -0.03757342557214671, 69.20903374884763] and parameters: {'dropout': 0.601322534865889, 'num_heads': 1, 'bias': False, 'loss_fn': 'MSE', 'optimizer': 'RMSprop', 'lr': 0.0003464779303760371, 'weight_decay': 0.0002587068960219466}. 
[I 2024-04-21 02:44:44,631] Trial 277 finished with values: [5.350858706636817, 0.2605403764331249, 0.05714683072456739, 62.890929166394685] and parameters: {'dropout': 0.37661264521482396, 'num_heads': 1, 'bias': False, 'loss_fn': 'MSE', 'optimizer': 'RMSprop', 'lr': 0.0002978321756687764, 'weight_decay': 0.0008862509658684476}. 
[I 2024-04-21 02:44:57,141] Trial 278 finished with values: [5.323833727254648, 0.16485069045533207, -0.04402622280374002, 69.63945327422199] and parameters: {'dropout': 0.5356496528379955, 'num_heads': 2, 'bias': False, 'loss_fn': 'MSE', 'optimizer': 'Adam', 'lr': 0.0008974100862471255, 'weight_decay': 0.009624118486563455}. 
[I 2024-04-21 02:45:14,095] Trial 279 finished with values: [5.296321975472104, 0.20209632692199303, -0.05062583184490932, 70.07966555568788] and parameters: {'dropout': 0.5010784230012597, 'num_heads': 1, 'bias': True, 'loss_fn': 'MAE', 'optimizer': 'RMSprop', 'lr': 0.0014245419603048832, 'weight_decay': 0.007003630296290256}. 
[I 2024-04-21 02:45:32,440] Trial 280 finished with values: [5.317101614177042, 0.20452099957779907, -0.04536711690199402, 69.72889464059905] and parameters: {'dropout': 0.6843836269030925, 'num_heads': 8, 'bias': True, 'loss_fn': 'MSE', 'optimizer': 'Adam', 'lr': 0.0001729280367416899, 'weight_decay': 6.030930289007694e-05}. 
[I 2024-04-21 02:45:50,476] Trial 281 finished with values: [5.320881632459209, 0.23785813899918173, -0.05250241897947805, 70.20483913774777] and parameters: {'dropout': 0.4622029983473447, 'num_heads': 1, 'bias': False, 'loss_fn': 'MAE', 'optimizer': 'RMSprop', 'lr': 0.0009181384288823589, 'weight_decay': 0.003006198705678768}. 
[I 2024-04-21 02:46:04,325] Trial 282 finished with values: [5.34300204574989, 0.20646805079368183, 0.00664108870975566, 66.25980265280478] and parameters: {'dropout': 0.250127375517484, 'num_heads': 2, 'bias': False, 'loss_fn': 'MSE', 'optimizer': 'Adam', 'lr': 0.0008974100862471255, 'weight_decay': 1.251476968558302e-05}. 
[W 2024-04-21 02:49:20,930] Trial 283 failed with parameters: {'dropout': 0.564828765402576, 'num_heads': 1, 'bias': True, 'loss_fn': 'MAE', 'optimizer': 'SGD', 'lr': 0.012036225587839105, 'weight_decay': 0.016611844451172173} because of the following error: The value nan is not acceptable.
[W 2024-04-21 02:49:20,930] Trial 283 failed with value [nan, nan, nan, nan].
[I 2024-04-21 02:49:49,690] Trial 284 finished with values: [5.3045969415738705, 0.22797179302292755, -0.05012361709065849, 70.04616643454669] and parameters: {'dropout': 0.3186712596423216, 'num_heads': 8, 'bias': False, 'loss_fn': 'MSE', 'optimizer': 'RMSprop', 'lr': 0.007654076189585567, 'weight_decay': 0.0011237205961388546}. 
[I 2024-04-21 02:50:02,655] Trial 285 finished with values: [5.357359464912992, 0.14095394412929638, -0.0848483987613311, 72.36240596741804] and parameters: {'dropout': 0.250127375517484, 'num_heads': 4, 'bias': False, 'loss_fn': 'MAE', 'optimizer': 'Adam', 'lr': 0.007524657083137373, 'weight_decay': 9.862400533423962e-05}. 
[I 2024-04-21 02:50:20,851] Trial 286 finished with values: [5.256168488368224, 0.2886555084343665, -0.04500242593675763, 69.70456873874105] and parameters: {'dropout': 0.4622029983473447, 'num_heads': 1, 'bias': True, 'loss_fn': 'MAE', 'optimizer': 'RMSprop', 'lr': 0.0014245419603048832, 'weight_decay': 0.0001004548037454834}. 
[I 2024-04-21 02:50:38,965] Trial 287 finished with values: [5.452960795274632, 0.2553945586288386, 0.017005205121554234, 65.56848725782382] and parameters: {'dropout': 0.26012060126618136, 'num_heads': 8, 'bias': False, 'loss_fn': 'MSE', 'optimizer': 'Adam', 'lr': 0.00019290042098284114, 'weight_decay': 9.862400533423962e-05}. 
[I 2024-04-21 02:50:48,578] Trial 288 finished with values: [5.309240090693574, 0.25764920557226995, -0.025563255288691522, 68.40792198172744] and parameters: {'dropout': 0.5983800146560976, 'num_heads': 8, 'bias': True, 'loss_fn': 'MAE', 'optimizer': 'Adam', 'lr': 0.002707576747024776, 'weight_decay': 1.814361779009586e-05}. 
