[I 2024-04-21 02:01:52,884] Trial 113 finished with values: [5.304507065492267, 0.22492020842777843, -0.04631659459249815, 69.79222744375912] and parameters: {'dropout': 0.372748256545408, 'num_heads': 2, 'bias': False, 'loss_fn': 'MAE', 'optimizer': 'Adam', 'lr': 0.0009399903820514661, 'weight_decay': 9.862400533423962e-05}. 
[I 2024-04-21 02:02:01,185] Trial 114 finished with values: [5.4985393084737355, 0.24377833904716323, -0.04911944351028419, 69.97918526338235] and parameters: {'dropout': 0.3597095463109935, 'num_heads': 4, 'bias': True, 'loss_fn': 'MSE', 'optimizer': 'Adam', 'lr': 0.0008974100862471255, 'weight_decay': 0.0004656758942910911}. 
[I 2024-04-21 02:02:14,797] Trial 115 finished with values: [5.336127624082046, 0.18744505938644518, -0.011962244222894158, 67.50069670911394] and parameters: {'dropout': 0.553678472298213, 'num_heads': 2, 'bias': False, 'loss_fn': 'MSE', 'optimizer': 'RMSprop', 'lr': 0.0002743881097041735, 'weight_decay': 0.006515187092911549}. 
[W 2024-04-21 02:02:24,481] Trial 116 failed with parameters: {'dropout': 0.5836627085463613, 'num_heads': 2, 'bias': True, 'loss_fn': 'MAE', 'optimizer': 'Adam', 'lr': 0.027778190725525887, 'weight_decay': 0.0010044386872116438} because of the following error: The value nan is not acceptable.
[W 2024-04-21 02:02:24,481] Trial 116 failed with value [5.343964355221514, nan, -0.07496256561451986, 71.70299339667312].
[I 2024-04-21 02:02:38,845] Trial 117 finished with values: [5.267092943573511, 0.27007373456908446, -0.03245307181896684, 68.8674919099995] and parameters: {'dropout': 0.6843836269030925, 'num_heads': 8, 'bias': False, 'loss_fn': 'MAE', 'optimizer': 'Adam', 'lr': 0.0009181384288823589, 'weight_decay': 9.862400533423962e-05}. 
[I 2024-04-21 02:02:48,781] Trial 118 finished with values: [5.312120125107381, 0.21852420043089082, -0.02505761209832391, 68.37419417436024] and parameters: {'dropout': 0.6374826674935149, 'num_heads': 1, 'bias': False, 'loss_fn': 'MSE', 'optimizer': 'Adam', 'lr': 0.0012257722818794833, 'weight_decay': 0.00247339413356821}. 
[I 2024-04-21 02:03:06,775] Trial 119 finished with values: [5.344941086621871, 0.20184151578850243, -0.07566272137938501, 71.74969573384341] and parameters: {'dropout': 0.30284491979918227, 'num_heads': 1, 'bias': False, 'loss_fn': 'MAE', 'optimizer': 'SGD', 'lr': 0.002010796380027487, 'weight_decay': 0.00041971857123823306}. 
[I 2024-04-21 02:03:26,638] Trial 120 finished with values: [5.319327871867487, 0.22673950325816591, -0.06350826210234883, 70.93895948947639] and parameters: {'dropout': 0.553678472298213, 'num_heads': 2, 'bias': False, 'loss_fn': 'MAE', 'optimizer': 'RMSprop', 'lr': 0.0008967339544398752, 'weight_decay': 0.009158463724496873}. 
[I 2024-04-21 02:03:53,257] Trial 121 finished with values: [5.750563004535978, -0.1398253709665931, -0.21000142402128796, 80.71046089587809] and parameters: {'dropout': 0.4175623535922639, 'num_heads': 8, 'bias': False, 'loss_fn': 'MSE', 'optimizer': 'RMSprop', 'lr': 0.006796980793649618, 'weight_decay': 0.0037168330157469373}. 
[I 2024-04-21 02:04:07,027] Trial 122 finished with values: [5.320090983385625, 0.21312292441303896, -0.06403185362672392, 70.97388450064955] and parameters: {'dropout': 0.5460956051080166, 'num_heads': 1, 'bias': False, 'loss_fn': 'MAE', 'optimizer': 'Adam', 'lr': 0.003732613088530846, 'weight_decay': 0.08706296017842331}. 
[I 2024-04-21 02:04:20,129] Trial 123 finished with values: [5.822291280383045, 0.013125573816041985, -0.16270247500001855, 77.555489422613] and parameters: {'dropout': 0.4587848860442391, 'num_heads': 2, 'bias': True, 'loss_fn': 'MSE', 'optimizer': 'RMSprop', 'lr': 0.0004507856770314032, 'weight_decay': 0.013371783342168934}. 
[I 2024-04-21 02:04:30,554] Trial 124 finished with values: [5.342963516113702, 0.18479539098669448, -0.05825033774680155, 70.58824130876421] and parameters: {'dropout': 0.6586733276831351, 'num_heads': 8, 'bias': True, 'loss_fn': 'MSE', 'optimizer': 'Adam', 'lr': 0.0003464779303760371, 'weight_decay': 0.0037168330157469373}. 
[I 2024-04-21 02:04:45,371] Trial 125 finished with values: [5.536938069528511, 0.23668174204354317, -0.01808838194719442, 67.90932713666886] and parameters: {'dropout': 0.5308643758909863, 'num_heads': 2, 'bias': True, 'loss_fn': 'MSE', 'optimizer': 'Adam', 'lr': 0.007654076189585567, 'weight_decay': 0.009624118486563455}. 
[I 2024-04-21 02:04:58,058] Trial 126 finished with values: [5.187224622949787, 0.2832649623001441, 0.011560256574423944, 65.93168047236792] and parameters: {'dropout': 0.27365393415702083, 'num_heads': 2, 'bias': True, 'loss_fn': 'MAE', 'optimizer': 'RMSprop', 'lr': 0.0014245419603048832, 'weight_decay': 0.0001004548037454834}. 
[I 2024-04-21 02:05:15,770] Trial 127 finished with values: [5.225141258183094, 0.27330598334056494, -0.00381096367673317, 66.9569836219129] and parameters: {'dropout': 0.3186712596423216, 'num_heads': 8, 'bias': True, 'loss_fn': 'MAE', 'optimizer': 'Adam', 'lr': 0.00012653702848240087, 'weight_decay': 2.8049146073131596e-05}. 
[I 2024-04-21 02:05:28,448] Trial 128 finished with values: [5.4736797303133855, 0.18750570164220806, 0.013087082490054747, 65.8298369365572] and parameters: {'dropout': 0.5010784230012597, 'num_heads': 1, 'bias': False, 'loss_fn': 'MSE', 'optimizer': 'RMSprop', 'lr': 0.00037518143649159464, 'weight_decay': 6.336536341307612e-05}. 
[I 2024-04-21 02:05:40,177] Trial 129 finished with values: [5.343464178370111, -0.20184151578850243, -0.07453633311999841, 71.67456250361904] and parameters: {'dropout': 0.2456843607562728, 'num_heads': 4, 'bias': False, 'loss_fn': 'MAE', 'optimizer': 'Adam', 'lr': 0.047344979731837045, 'weight_decay': 0.0009885700957659859}. 
[I 2024-04-21 02:05:53,010] Trial 130 finished with values: [5.2690077803990425, 0.24954662005695905, -0.02823042648238583, 68.58582971973311] and parameters: {'dropout': 0.564828765402576, 'num_heads': 1, 'bias': False, 'loss_fn': 'MAE', 'optimizer': 'Adam', 'lr': 0.001259987046706076, 'weight_decay': 0.0037168330157469373}. 
[I 2024-04-21 02:06:06,867] Trial 131 finished with values: [5.376763203087941, 0.05248993883873718, -0.08810578070705022, 72.57968240439872] and parameters: {'dropout': 0.6539016853443866, 'num_heads': 1, 'bias': False, 'loss_fn': 'MAE', 'optimizer': 'RMSprop', 'lr': 0.006431027510457778, 'weight_decay': 0.0002587068960219466}. 
Training finished at Epoch 41, with validation result for [7.142768592052415, -0.07801892554282153, -0.23543747954149663, 135.51790024259603]
Training finished at Epoch 55, with validation result for [6.080156847427499, -0.01951812024098217, -0.11107051495632336, 112.39981473534864]
Training finished at Epoch 63, with validation result for [5.97393018131817, 0.0005114934540855781, -0.12474484516957363, 104.90535562020307]
Training finished at Epoch 75, with validation result for [5.82692258938345, -0.01503841585760374, -0.07612829734146986, 113.61755386679981]
Training finished at Epoch 47, with validation result for [5.465621122672164, nan, -0.039795267004665735, 97.03178660317558]
Training finished at Epoch 61, with validation result for [5.555839503460667, -0.050323672185101954, -0.04259261059557051, 109.84044571917913]
Training finished at Epoch 70, with validation result for [4.932267043761212, 0.09880715242406828, -0.07162289806303912, 78.7144678565955]
Training finished at Epoch 70, with validation result for [5.511529168836655, 0.05339202254787306, -0.04091862522779266, 101.54092828700153]
Training finished at Epoch 38, with validation result for [5.354696180555557, nan, -0.019663086250562456, 99.66023173862258]
Training finished at Epoch 73, with validation result for [5.915849311063815, 0.09261770044025361, -0.05712473408042795, 96.49592924212784]
Training finished at Epoch 86, with validation result for [5.7767220664083245, 0.08064418865230147, -0.02612254722975793, 112.52098252647643]
Training finished at Epoch 39, with validation result for [5.3015108574513325, 0.0038282474177814317, -0.04551698857728059, 86.83565965796055]
Training finished at Epoch 39, with validation result for [5.1846782184377, nan, -0.013051817041820124, 92.91325931027053]
Training finished at Epoch 39, with validation result for [5.339443314667059, nan, -0.012589575887297144, 96.75833297137915]
Training finished at Epoch 115, with validation result for [5.391662146675426, 0.1312420380496798, -0.014819157254469806, 85.32800641486881]
Training finished at Epoch 69, with validation result for [5.32696050649431, 0.09600335669838678, -0.01869842111011777, 93.41910256181116]
Training finished at Epoch 68, with validation result for [5.474360798760781, 0.09755357663676695, -0.07853148380676656, 88.48061046114304]
Training finished at Epoch 58, with validation result for [5.598591638238694, -0.03910425595065053, -0.021978041984830998, 110.36902607716816]
Training finished at Epoch 43, with validation result for [5.323434461947621, 0.0816767148491769, -0.045341705845728164, 94.79425497301452]
Training finished at Epoch 60, with validation result for [5.74923124807988, -0.020220876699204714, -0.10246038258175871, 111.88059526042451]
Training finished at Epoch 62, with validation result for [5.375050127316044, 0.12880498754194783, -0.003970935768806472, 105.88514112075798]
Training finished at Epoch 38, with validation result for [5.783270787970758, -0.017614231423373133, -0.04980362032470964, 112.5546402091132]
Training finished at Epoch 46, with validation result for [5.6108569181248855, nan, -0.024362638417787075, 105.08961499586844]
Training finished at Epoch 33, with validation result for [36.243805702469096, 0.05232190368271419, -53.633955321302295, 5692.433734228929]
Training finished at Epoch 56, with validation result for [5.292203071863143, nan, -0.09366020886963944, 83.58577012208856]
Training finished at Epoch 77, with validation result for [5.239176231279753, 0.11350147009919526, -0.033723345184350606, 81.00664535014482]
Training finished at Epoch 45, with validation result for [5.179311512774742, 0.06527183835582256, -0.09249740541156037, 77.84832473086513]
Training finished at Epoch 63, with validation result for [5.1014719881241595, 0.08193864661664836, -0.010010302606249688, 84.50755174090503]
Training finished at Epoch 47, with validation result for [5.160743073634362, 0.07804641959286358, -0.02167779177173701, 88.81595170722947]
Training finished at Epoch 73, with validation result for [5.624515617289927, 0.05838483335560399, -0.0423213583356461, 110.18919049186889]
Training finished at Epoch 33, with validation result for [5.286503003067568, -1.0, -0.030798700115902466, 98.42981030521884]
Training finished at Epoch 100, with validation result for [5.940752727664111, 0.03521974648551913, -0.03718203006392384, 113.89940125381555]
Training finished at Epoch 78, with validation result for [6.17109375091849, 0.06627182651519332, -0.06918685536339853, 114.04608453722665]
Training finished at Epoch 31, with validation result for [5.8676798072835625, 0.0658600608783807, -0.01486898957691496, 111.13112245430818]
Training finished at Epoch 71, with validation result for [5.662635719374074, 0.04314527023925539, -0.07430587543426093, 96.27502605052399]
Training finished at Epoch 50, with validation result for [5.332864993491434, nan, -0.03255055686716335, 101.76953562855209]
Training finished at Epoch 46, with validation result for [5.7445615447525675, 0.07167037074073161, -0.04571148319896712, 101.60366412642003]
Training finished at Epoch 30, with validation result for [5.5942180931049, 0.0191374391674081, -0.05466018592993027, 102.77640380255285]
Training finished at Epoch 41, with validation result for [5.022866540840407, 0.11699356043693014, -0.033755036439800934, 82.77392083074595]
Training finished at Epoch 95, with validation result for [5.624908072950837, -0.004221145051798728, -0.03722620811745214, 109.8221804660722]
Training finished at Epoch 36, with validation result for [5.297788108595906, 0.054282043644162406, -0.023202942362114287, 100.22243281471951]
Training finished at Epoch 34, with validation result for [5.17269425933556, 0.043963884289054254, -0.0884579203607474, 82.67340395417911]
Training finished at Epoch 55, with validation result for [5.2346391997096875, 0.05349068922380844, -0.052237377637176285, 89.10670333704498]
Training finished at Epoch 35, with validation result for [5.333600300902688, -1.0, -0.012704460970721199, 101.79695689057331]
Training finished at Epoch 51, with validation result for [5.474982181908345, 0.0010975609823663526, -0.03553799924865175, 104.15401167918577]
Training finished at Epoch 37, with validation result for [5.9160305907393, 0.04188586951197051, -0.03728361015439008, 111.87447340955593]
Training finished at Epoch 72, with validation result for [5.457728978722845, nan, -0.013509812155810375, 96.66923365309573]
Training finished at Epoch 80, with validation result for [5.580750293549847, 0.029892955060401658, -0.03717372399080543, 109.32098123956972]
Training finished at Epoch 102, with validation result for [5.705544344562283, nan, -0.07542452127387023, 100.36325123085781]
Training finished at Epoch 52, with validation result for [5.598785619514376, 0.1623964517148044, -0.09939829491938545, 100.22728680196258]
Training finished at Epoch 46, with validation result for [5.659683845048388, 0.07737058045271232, -0.047717817336742296, 92.85551304115506]
Training finished at Epoch 36, with validation result for [5.409291327814198, 0.0868946817036236, -0.014778920725272648, 94.53657092853605]
Training finished at Epoch 54, with validation result for [5.218483313738884, 0.1404221378590656, -0.0038760021996870897, 85.97563234782791]
Training finished at Epoch 49, with validation result for [5.073932116636781, 0.033121492321577545, -0.05830945458550052, 73.85783699688407]
Training finished at Epoch 63, with validation result for [5.5242351726233965, -0.0013244512911686503, -0.04254507276900088, 108.14894579612674]
Training finished at Epoch 46, with validation result for [5.539558948056711, 0.07796472879065303, -0.017836560331943696, 95.5194059285401]
Training finished at Epoch 40, with validation result for [5.213586212683427, nan, -0.043547731988641036, 89.6511787650802]
Training finished at Epoch 49, with validation result for [5.123066612298764, 0.1007807296447307, -0.04790893682712749, 80.80873422063127]
Training finished at Epoch 52, with validation result for [5.055737847222222, nan, -0.040165079836948614, 83.28479529452865]
[I 2024-04-21 02:06:17,026] Trial 132 finished with values: [5.346418112430592, 0.21433207944803057, -0.018488075434732965, 67.93598780413248] and parameters: {'dropout': 0.2769863592074008, 'num_heads': 1, 'bias': True, 'loss_fn': 'MAE', 'optimizer': 'RMSprop', 'lr': 0.0019461384509752825, 'weight_decay': 1.251476968558302e-05}. 
[I 2024-04-21 02:06:27,016] Trial 133 finished with values: [5.646797821400581, 0.15918014101133493, 0.00797017069355388, 66.1711491873202] and parameters: {'dropout': 0.4520295257103348, 'num_heads': 4, 'bias': True, 'loss_fn': 'MSE', 'optimizer': 'RMSprop', 'lr': 0.00029371086990681664, 'weight_decay': 0.0005832301624195837}. 
[I 2024-04-21 02:06:38,775] Trial 134 finished with values: [5.351881272963675, 0.24919314427726638, -0.0626340400379799, 70.88064644592139] and parameters: {'dropout': 0.553678472298213, 'num_heads': 2, 'bias': False, 'loss_fn': 'MAE', 'optimizer': 'RMSprop', 'lr': 0.001259987046706076, 'weight_decay': 0.016611844451172173}. 
[W 2024-04-21 02:06:53,858] Trial 135 failed with parameters: {'dropout': 0.21394355875372933, 'num_heads': 1, 'bias': False, 'loss_fn': 'MAE', 'optimizer': 'RMSprop', 'lr': 0.005872983613013404, 'weight_decay': 0.0002587068960219466} because of the following error: The value nan is not acceptable.
[W 2024-04-21 02:06:53,859] Trial 135 failed with value [5.365514190080788, nan, -0.09058598954742636, 72.74511923335676].
[I 2024-04-21 02:07:09,291] Trial 136 finished with values: [5.228422951951162, 0.26305998771491845, 0.0024496540484250096, 66.53938300421187] and parameters: {'dropout': 0.22519233998110277, 'num_heads': 1, 'bias': False, 'loss_fn': 'MAE', 'optimizer': 'RMSprop', 'lr': 0.0001170951834227463, 'weight_decay': 0.008818160881482772}. 
[I 2024-04-21 02:07:22,571] Trial 137 finished with values: [5.371012530417604, 0.20189058347183814, -0.0029680248747323557, 66.90075725897988] and parameters: {'dropout': 0.3186712596423216, 'num_heads': 1, 'bias': True, 'loss_fn': 'MSE', 'optimizer': 'Adam', 'lr': 0.00019290042098284114, 'weight_decay': 0.02076297142943548}. 
[I 2024-04-21 02:07:52,777] Trial 138 finished with values: [5.227716993970457, 0.18132093647606495, -0.026345292566944956, 68.4600860436141] and parameters: {'dropout': 0.35678171751055654, 'num_heads': 4, 'bias': True, 'loss_fn': 'MSE', 'optimizer': 'Adam', 'lr': 0.003732613088530846, 'weight_decay': 0.08706296017842331}. 
[I 2024-04-21 02:08:02,173] Trial 139 finished with values: [5.293098356550233, 0.21021669908347881, -0.06383243178638942, 70.96058250915883] and parameters: {'dropout': 0.4520295257103348, 'num_heads': 2, 'bias': False, 'loss_fn': 'MAE', 'optimizer': 'RMSprop', 'lr': 0.0005763062233516245, 'weight_decay': 0.0002587068960219466}. 
[I 2024-04-21 02:08:19,157] Trial 140 finished with values: [5.31498664494532, 0.24617202449694456, -0.04646840001428143, 69.80235328767581] and parameters: {'dropout': 0.564828765402576, 'num_heads': 8, 'bias': True, 'loss_fn': 'MAE', 'optimizer': 'RMSprop', 'lr': 0.0001729280367416899, 'weight_decay': 0.0037168330157469373}. 
[I 2024-04-21 02:08:31,368] Trial 141 finished with values: [5.456063674892808, 0.19153360619325238, -0.07662638065901262, 71.81397448844756] and parameters: {'dropout': 0.5010784230012597, 'num_heads': 2, 'bias': True, 'loss_fn': 'MSE', 'optimizer': 'RMSprop', 'lr': 0.0001729280367416899, 'weight_decay': 0.0007384679430791242}. 
[I 2024-04-21 02:08:41,630] Trial 142 finished with values: [5.554000380273239, 0.12186964628597668, -0.03881115880530861, 69.29159399855598] and parameters: {'dropout': 0.2864316147243036, 'num_heads': 2, 'bias': True, 'loss_fn': 'MSE', 'optimizer': 'Adam', 'lr': 0.0003759394711991868, 'weight_decay': 1.7389381795975686e-05}. 
[W 2024-04-21 02:08:52,056] Trial 143 failed with parameters: {'dropout': 0.3186712596423216, 'num_heads': 2, 'bias': True, 'loss_fn': 'MSE', 'optimizer': 'Adam', 'lr': 0.007654076189585567, 'weight_decay': 0.009624118486563455} because of the following error: The value nan is not acceptable.
[W 2024-04-21 02:08:52,056] Trial 143 failed with value [5.733192943608188, nan, -0.2056170819888552, 80.41801308619965].
[I 2024-04-21 02:09:04,855] Trial 144 finished with values: [5.387136608519252, 0.15239452652783872, -0.09962927316282255, 73.34833140659957] and parameters: {'dropout': 0.6586733276831351, 'num_heads': 4, 'bias': False, 'loss_fn': 'MAE', 'optimizer': 'Adam', 'lr': 0.0004399465845986358, 'weight_decay': 0.0012646218294935334}. 
[I 2024-04-21 02:09:15,209] Trial 145 finished with values: [5.670854040923899, 0.16891826435579899, -0.18725657159472564, 79.19331596867981] and parameters: {'dropout': 0.40378969562903, 'num_heads': 2, 'bias': False, 'loss_fn': 'MAE', 'optimizer': 'SGD', 'lr': 0.00016000695601954069, 'weight_decay': 9.862400533423962e-05}. 
[I 2024-04-21 02:09:32,212] Trial 146 finished with values: [5.356972246035089, 0.16968592515350048, -0.04814489216965323, 69.91417997801035] and parameters: {'dropout': 0.5308643758909863, 'num_heads': 8, 'bias': True, 'loss_fn': 'MSE', 'optimizer': 'Adam', 'lr': 0.0008974375358981978, 'weight_decay': 0.009624118486563455}. 
[I 2024-04-21 02:09:45,719] Trial 147 finished with values: [5.29477388521129, 0.22591819321360776, -0.04384376101288723, 69.62728256521021] and parameters: {'dropout': 0.48449624536526786, 'num_heads': 8, 'bias': False, 'loss_fn': 'MAE', 'optimizer': 'RMSprop', 'lr': 0.0011218242088903074, 'weight_decay': 0.0006484479831168184}. 
[I 2024-04-21 02:10:00,236] Trial 148 finished with values: [5.273633182470317, 0.24447183111506818, -0.028213570336377503, 68.58470536790489] and parameters: {'dropout': 0.601322534865889, 'num_heads': 1, 'bias': False, 'loss_fn': 'MAE', 'optimizer': 'RMSprop', 'lr': 0.00037518143649159464, 'weight_decay': 0.0002587068960219466}. 
[I 2024-04-21 02:10:09,710] Trial 149 finished with values: [5.470698016736325, 0.1519121160011368, -0.0024398263290468236, 66.86552494666975] and parameters: {'dropout': 0.264360828881129, 'num_heads': 8, 'bias': True, 'loss_fn': 'MSE', 'optimizer': 'Adam', 'lr': 0.00010447899875809218, 'weight_decay': 6.016476080954159e-05}. 
[I 2024-04-21 02:10:26,617] Trial 150 finished with values: [5.332770410317041, 0.20426358628233776, -0.00926441143380119, 67.32074375740247] and parameters: {'dropout': 0.5308643758909863, 'num_heads': 1, 'bias': True, 'loss_fn': 'MSE', 'optimizer': 'RMSprop', 'lr': 0.0002743881097041735, 'weight_decay': 0.009624118486563455}. 
[I 2024-04-21 02:10:38,837] Trial 151 finished with values: [5.69883998640534, 0.0592924161400139, -0.10416674976523677, 73.65099371807688] and parameters: {'dropout': 0.35678171751055654, 'num_heads': 1, 'bias': True, 'loss_fn': 'MSE', 'optimizer': 'RMSprop', 'lr': 0.002159091901219909, 'weight_decay': 0.02220182326451775}. 
[I 2024-04-21 02:10:53,187] Trial 152 finished with values: [5.371558424534195, 0.21944738294972577, -0.04403450319744495, 69.64000559951604] and parameters: {'dropout': 0.5460956051080166, 'num_heads': 8, 'bias': False, 'loss_fn': 'MSE', 'optimizer': 'RMSprop', 'lr': 0.0001729280367416899, 'weight_decay': 0.020506895866600754}. 
[I 2024-04-21 02:11:02,966] Trial 153 finished with values: [5.254854739678077, 0.2739352667196418, -0.017458363244695185, 67.8673031366617] and parameters: {'dropout': 0.41818337874955647, 'num_heads': 8, 'bias': False, 'loss_fn': 'MAE', 'optimizer': 'Adam', 'lr': 0.00012123567350640214, 'weight_decay': 0.005004304918035022}. 
