[I 2024-04-21 11:17:16,843] Trial 91 finished with values: [5.101224871161577, 0.46565204881825617, 0.13752306744550657, 57.52961059102988] and parameters: {'dropout': 0.2696212995142171, 'loss_fn': 'MSE', 'optimizer': 'Adam', 'lr': 0.00012766258629869277, 'weight_decay': 0.001406578545372081}. 
[I 2024-04-21 11:18:09,790] Trial 92 finished with values: [22703.09831964148, 0.14437324208238958, -20531534.510394946, 1369510532.0098445] and parameters: {'dropout': 0.5521466099486719, 'loss_fn': 'MAE', 'optimizer': 'RMSprop', 'lr': 0.06121929974728496, 'weight_decay': 0.00047297180971722245}. 
[I 2024-04-21 11:19:29,595] Trial 93 finished with values: [5.280070193339119, 0.3861193600358043, 0.08270349977224056, 61.186228248815574] and parameters: {'dropout': 0.6358191835117813, 'loss_fn': 'MSE', 'optimizer': 'RMSprop', 'lr': 0.0015061998031711391, 'weight_decay': 0.013935085121758844}. 
[W 2024-04-21 11:28:10,988] Trial 94 failed with parameters: {'dropout': 0.4511144839152419, 'loss_fn': 'MSE', 'optimizer': 'SGD', 'lr': 0.006498585198448538, 'weight_decay': 2.516267314798212e-05} because of the following error: The value nan is not acceptable.
[W 2024-04-21 11:28:10,988] Trial 94 failed with value [nan, nan, nan, nan].
[I 2024-04-21 11:28:48,516] Trial 95 finished with values: [5.228626753569888, 0.42870286156636844, 0.11091409372691552, 59.304503157400944] and parameters: {'dropout': 0.3079122831174717, 'loss_fn': 'MAE', 'optimizer': 'Adam', 'lr': 0.0015061998031711391, 'weight_decay': 1.2909172926831569e-05}. 
[W 2024-04-21 11:37:04,250] Trial 96 failed with parameters: {'dropout': 0.231073724859225, 'loss_fn': 'MAE', 'optimizer': 'SGD', 'lr': 0.00012766258629869277, 'weight_decay': 0.020419710163149404} because of the following error: The value nan is not acceptable.
[W 2024-04-21 11:37:04,250] Trial 96 failed with value [nan, nan, nan, nan].
[I 2024-04-21 11:37:26,687] Trial 97 finished with values: [6.341074386443405, 0.4548601080622605, -0.12037974172296217, 74.73244538204298] and parameters: {'dropout': 0.3993086482668754, 'loss_fn': 'MSE', 'optimizer': 'Adam', 'lr': 0.00012682575873919637, 'weight_decay': 0.00039469093440288574}. 
[I 2024-04-21 11:37:53,167] Trial 98 finished with values: [8.132820247505697, 0.07876753665231247, -1.219426311553729, 148.0419088554632] and parameters: {'dropout': 0.6358191835117813, 'loss_fn': 'MAE', 'optimizer': 'RMSprop', 'lr': 0.008507065300455929, 'weight_decay': 1.2909172926831569e-05}. 
[I 2024-04-21 11:38:33,696] Trial 99 finished with values: [4649.370899010642, -0.028507231091456392, -556312.6471536901, 37107667.78705153] and parameters: {'dropout': 0.239690648623066, 'loss_fn': 'MSE', 'optimizer': 'RMSprop', 'lr': 0.016900135161593385, 'weight_decay': 0.00022267909194999115}. 
[I 2024-04-21 11:38:59,019] Trial 100 finished with values: [5.3821445933542655, 0.3999072137181283, 0.09340877719403651, 60.47215646544535] and parameters: {'dropout': 0.6435592774902543, 'loss_fn': 'MSE', 'optimizer': 'Adam', 'lr': 0.0015099449601812742, 'weight_decay': 0.020094511371138685}. 
[I 2024-04-21 11:40:59,983] Trial 101 finished with values: [192.16189448944039, -0.0921981717048302, -935.7328188120241, 62482.68476523991] and parameters: {'dropout': 0.2843204694661713, 'loss_fn': 'MSE', 'optimizer': 'Adam', 'lr': 0.09137956523349422, 'weight_decay': 0.00013790951296805272}. 
[I 2024-04-21 11:41:38,720] Trial 102 finished with values: [5.496952764418289, 0.39284356524847047, 0.02491991180205888, 65.04055430554989] and parameters: {'dropout': 0.21166136886255332, 'loss_fn': 'MSE', 'optimizer': 'Adam', 'lr': 0.0008225727128965903, 'weight_decay': 0.0020574428445053043}. 
                                                                                                                                                                                                                                            0.0008225727128965903, 'weight_decay': 0.001406578545372081}. 
                                                                                                                                                                                                                                                                                                            