[I 2024-04-21 00:40:07,929] Trial 292 finished with values: [4.703350680274022, 0.49033935165155357, 0.19245733176039959, 53.86534234819102] and parameters: {'dropout': 0.3757170916790723, 'loss_fn': 'MAE', 'optimizer': 'Adam', 'lr': 0.000141601199311595, 'weight_decay': 0.0015147055767583942}. 
Training finished at Epoch 58, with validation result for [5.494420744381146, -0.05343715736740974, -0.05227566420435048, 104.11152785456694]
Training finished at Epoch 72, with validation result for [10.745082095805651, 0.6835846745624955, -0.7142718559545147, 147.80933916483446]
Training finished at Epoch 49, with validation result for [4.798328177787613, 0.5928687488743762, 0.34762152826854786, 69.79878936080584]
Training finished at Epoch 82, with validation result for [4.816485489386681, 0.34641841208165736, 0.09488826221871816, 84.45277142863003]
Training finished at Epoch 38, with validation result for [5.0974764687103535, 0.0027550346256269595, -0.006520860151280949, 90.2682107586557]
Training finished at Epoch 72, with validation result for [5.083160276994772, 0.43278950248132503, 0.1212036985442907, 78.04180137908189]
Training finished at Epoch 118, with validation result for [5.092503183730563, 0.38191020876117887, 0.09409110558220468, 86.1671335792916]
Training finished at Epoch 55, with validation result for [4.860070988200938, 0.5953990563182072, 0.33132430527173595, 63.21932648655338]
Training finished at Epoch 51, with validation result for [5.144725110482843, 0.4733008453094218, 0.18075617489350648, 87.25692952950794]
Training finished at Epoch 57, with validation result for [4.788952782901103, 0.43135655027588315, 0.1414699379348997, 75.73282214721372]
Training finished at Epoch 43, with validation result for [5.739738868873732, -0.0531293165839165, -0.024688338031790158, 110.28231968533237]
Training finished at Epoch 35, with validation result for [5.107201692340059, 0.4769227411090258, 0.04750303460035965, 71.76047368888402]
Training finished at Epoch 74, with validation result for [4.972117847140388, 0.46878368860240155, 0.19482848385376983, 75.35199792021882]
Training finished at Epoch 46, with validation result for [4.949035922957411, 0.5760384292385983, 0.29695654624511303, 73.6381319820568]
Training finished at Epoch 73, with validation result for [5.16619435122689, 0.3615792572424518, 0.12062453936979678, 91.62902132200436]
Training finished at Epoch 86, with validation result for [4.91726779978024, 0.5512598082851671, 0.27042691808082253, 71.64960442168122]
Training finished at Epoch 85, with validation result for [4.51634054624846, 0.4365844905927153, 0.18219145969038242, 68.17987334314456]
Training finished at Epoch 36, with validation result for [4.833543179222496, 0.4324315337157343, 0.18280726912476886, 71.96994000730494]
Training finished at Epoch 75, with validation result for [4.180979824741809, 0.436220298938815, 0.19026648567293813, 57.86146455847254]
Training finished at Epoch 53, with validation result for [5.046212050339484, 0.41034653634760937, 0.1551784170759858, 90.02041699578085]
Training finished at Epoch 50, with validation result for [4.453876686513386, 0.454634182576064, 0.13333628732392866, 63.596994511857154]
Training finished at Epoch 76, with validation result for [4.950379533864642, 0.4046939432947536, 0.1590539990929456, 87.8909816410445]
Training finished at Epoch 41, with validation result for [5.190012742860587, 0.4322536952451735, 0.16530745879206277, 83.8634532282101]
Training finished at Epoch 55, with validation result for [4.761764104164243, 0.44499215660116315, 0.14246509224614312, 86.56572433135597]
Training finished at Epoch 78, with validation result for [6.682764176736042, 0.5622971276709748, 0.020403159139240623, 93.10735413877505]
Training finished at Epoch 52, with validation result for [4.980504195862383, 0.46236537596125626, 0.09825026500321399, 65.20603549467872]
Training finished at Epoch 48, with validation result for [4.663968692630994, 0.49194566900676867, 0.18661276098621704, 67.95404878379583]
Training finished at Epoch 92, with validation result for [4.602778029308111, 0.43675917179778473, 0.17764110247037046, 68.08150735448451]
Training finished at Epoch 52, with validation result for [5.207040944943422, 0.6049497605962911, 0.2989419390199598, 76.70417205418563]
Training finished at Epoch 43, with validation result for [5.2786615887799755, 0.44501441888376614, 0.1368427531456159, 91.94560097290741]
Training finished at Epoch 37, with validation result for [5.4218857932991495, 0.6437733781398851, 0.22325913887614757, 61.36663214768189]
Training finished at Epoch 35, with validation result for [5.065194992576564, 0.6005648184321397, 0.3286192119251168, 73.80671901867471]
Training finished at Epoch 59, with validation result for [4.7807543055514055, 0.5822081377128784, 0.3252585813328914, 66.30291161447478]
Training finished at Epoch 89, with validation result for [5.0465321058084145, 0.4579536740578036, 0.19911275762809666, 87.03951888163732]
Training finished at Epoch 46, with validation result for [5.075175505691708, 0.0232780003086674, -0.061186855239164784, 76.09559651982339]
Training finished at Epoch 40, with validation result for [4.758789560932827, 0.5192121235653151, 0.23691720509442526, 62.27262427209755]
Training finished at Epoch 101, with validation result for [4.686995373611467, 0.4240773400436649, 0.1751203397297324, 69.75566798500866]
Training finished at Epoch 44, with validation result for [5.530219462077313, 0.17351205591709826, -0.026018466538034746, 104.94701107614803]
Training finished at Epoch 51, with validation result for [4.544625398678718, 0.45745348127526614, 0.20324094585922703, 58.00577309786359]
Training finished at Epoch 41, with validation result for [5.767723943283722, 0.5944855328863836, 0.31040076144480244, 75.45448086364482]
Training finished at Epoch 41, with validation result for [4.655034322489378, 0.4386299435216197, 0.1670544795226898, 67.6583885693418]
Training finished at Epoch 51, with validation result for [4.784988002438317, 0.41108801198325545, 0.15030210306240943, 80.309646084386]
Training finished at Epoch 126, with validation result for [4.579770224251248, 0.45154231865612854, 0.2029047865298902, 68.37581106489749]
Training finished at Epoch 49, with validation result for [4.933369014875207, 0.41695656515093704, 0.14915772619913137, 90.41355665142795]
Training finished at Epoch 53, with validation result for [5.636215374358653, -0.014913032341481414, -0.05654248397548711, 108.8036625647422]
Training finished at Epoch 49, with validation result for [5.333097025516699, 0.41796933764890803, 0.12517105784630356, 94.02996300703553]
Training finished at Epoch 79, with validation result for [4.861454471170396, 0.4199371632294349, 0.17444771739089837, 86.66903872167705]
Training finished at Epoch 63, with validation result for [4.822069810850674, 0.4472615644358417, 0.15041155071876322, 71.20948706986151]
Training finished at Epoch 62, with validation result for [5.317873418548129, 0.4036623122583837, 0.16101141683259823, 88.57023437462311]
Training finished at Epoch 86, with validation result for [4.9380006810438255, 0.41238665531755836, 0.1560268702475227, 88.99023713989664]
Training finished at Epoch 36, with validation result for [5.297190788112574, 0.5122483935531803, 0.1435584850149112, 76.49561403829978]
Training finished at Epoch 51, with validation result for [4.766890673994783, 0.5986076886453422, 0.3399921302705958, 71.49331176394016]
Training finished at Epoch 35, with validation result for [4.564100761012073, 0.48762568477851964, 0.22364004822217676, 62.117004991923615]
Training finished at Epoch 132, with validation result for [4.823300827953707, 0.4112310619406862, 0.16118036434189575, 83.1321113361645]
Training finished at Epoch 90, with validation result for [5.709040056239952, 0.3614444880216197, 0.1284064643061592, 93.83247824063183]
Training finished at Epoch 38, with validation result for [4.604673600891954, 0.5162931269410994, 0.2463642614990933, 62.885619132987934]
Training finished at Epoch 35, with validation result for [4.958283155915779, 0.5758845859951993, 0.32820909296320866, 58.46930266014115]
Training finished at Epoch 75, with validation result for [4.772734108215886, 0.5965245027691314, 0.3397485117884764, 58.968595525716715]
Training finished at Epoch 62, with validation result for [4.833232640414345, 0.39666114855544193, 0.11458354665540393, 70.00606503721257]
[I 2024-04-21 00:40:40,714] Trial 293 finished with values: [4.808190819568935, 0.4383221960066972, 0.15308915676139234, 56.49130913279173] and parameters: {'dropout': 0.20547500706126287, 'loss_fn': 'MAE', 'optimizer': 'RMSprop', 'lr': 0.0011090204813870355, 'weight_decay': 5.669059377844915e-05}. 
[I 2024-04-21 00:42:12,967] Trial 294 finished with values: [4.962884413435843, 0.5102665527865419, 0.2204663800732154, 51.99706091173668] and parameters: {'dropout': 0.4133409388264626, 'loss_fn': 'MSE', 'optimizer': 'Adam', 'lr': 0.004271805895111922, 'weight_decay': 5.669059377844915e-05}. 
[I 2024-04-21 00:43:47,840] Trial 295 finished with values: [4.8235904251575175, 0.5144603235512502, 0.2645559083357011, 49.05616673086797] and parameters: {'dropout': 0.4651931475616005, 'loss_fn': 'MSE', 'optimizer': 'Adam', 'lr': 0.007530349214979006, 'weight_decay': 5.669059377844915e-05}. 
[I 2024-04-21 00:45:41,471] Trial 296 finished with values: [4.748136761154703, 0.4760694701942034, 0.19444494480182928, 53.7327630292979] and parameters: {'dropout': 0.3757170916790723, 'loss_fn': 'MAE', 'optimizer': 'Adam', 'lr': 0.0012729923166016706, 'weight_decay': 0.005991336114926054}. 
[I 2024-04-21 00:46:46,439] Trial 297 finished with values: [4.550743212279208, 0.5036449543955039, 0.2238265443753299, 51.772928605670266] and parameters: {'dropout': 0.4008478414744524, 'loss_fn': 'MAE', 'optimizer': 'Adam', 'lr': 0.0009437874575479735, 'weight_decay': 3.122146452942344e-05}. 
[I 2024-04-21 00:48:27,638] Trial 298 finished with values: [4.606764759137817, 0.5075284111979149, 0.21266058970445167, 52.517728843040246] and parameters: {'dropout': 0.6915230798735348, 'loss_fn': 'MAE', 'optimizer': 'Adam', 'lr': 0.000141601199311595, 'weight_decay': 2.015378107650812e-05}. 
[I 2024-04-21 00:50:07,844] Trial 299 finished with values: [4.574190503022384, 0.5303764363130592, 0.2377951003437454, 50.84118706563647] and parameters: {'dropout': 0.498419904495987, 'loss_fn': 'MAE', 'optimizer': 'Adam', 'lr': 0.0019840959411180892, 'weight_decay': 5.669059377844915e-05}. 
/public/home/yyang/anaconda3/envs/Pon-DT/lib/python3.11/site-packages/torch/_utils.py:776: UserWarning: TypedStorage is deprecated. It will be removed in the future and UntypedStorage will be the only storage class. This should only matter to you if you are using storages directly.  To access UntypedStorage directly, use tensor.untyped_storage() instead of tensor.storage()
  return self.fget.__get__(instance, owner)()
Training finished at Epoch 32, with validation result for [5.23567247239241, 0.4446573583190856, 0.15219505577291692, 90.96088814821955]
Training finished at Epoch 67, with validation result for [4.841016631777599, 0.5231060378831194, 0.25295896088793, 73.11957586418846]
Training finished at Epoch 79, with validation result for [4.744298059360253, 0.5042281096934517, 0.2381032912912664, 63.12945680738802]
Training finished at Epoch 85, with validation result for [4.736580748119283, 0.46780388768792514, 0.1846872046798863, 73.93256489275406]
Training finished at Epoch 49, with validation result for [4.785333757503834, 0.4083153701003283, 0.1511587709600033, 69.76351707272023]
Training finished at Epoch 77, with validation result for [4.6092172207938376, 0.4818485997299035, 0.22854117083890924, 67.55573845904273]
Training finished at Epoch 73, with validation result for [4.526098065183994, 0.42002053220370494, 0.1416570918826099, 64.93451106326891]
Acting on ProtBert...
  0%|          | 0/4 [00:00<?, ?it/s] 25%|██▌       | 1/4 [01:54<05:43, 114.55s/it] 50%|█████     | 2/4 [02:06<01:48, 54.07s/it]  75%|███████▌  | 3/4 [04:00<01:21, 81.46s/it]100%|██████████| 4/4 [04:12<00:00, 54.20s/it]100%|██████████| 4/4 [04:12<00:00, 63.18s/it]
[I 2024-04-21 00:54:25,503] A new study created in RDB with name: ProtBert-Attention-BioInf-Subtration
/public/home/yyang/anaconda3/envs/Pon-DT/lib/python3.11/site-packages/torchmetrics/utilities/prints.py:43: UserWarning: The variance of predictions or target is close to zero. This can cause instability in Pearson correlationcoefficient, leading to wrong results. Consider re-scaling the input if possible or computing using alarger dtype (currently using torch.float64).
  warnings.warn(*args, **kwargs)  # noqa: B028
[I 2024-04-21 00:54:49,229] Trial 0 finished with values: [5.377651142735367, -0.14095394412929638, -0.09816936153828082, 73.25095124014288] and parameters: {'dropout': 0.3862140601736346, 'num_heads': 2, 'bias': True, 'loss_fn': 'MSE', 'optimizer': 'Adam', 'lr': 0.001818152831022012, 'weight_decay': 0.00014472075468255718}. 
[W 2024-04-21 00:58:06,921] Trial 1 failed with parameters: {'dropout': 0.31315188430115454, 'num_heads': 1, 'bias': False, 'loss_fn': 'MSE', 'optimizer': 'SGD', 'lr': 0.002154705438043164, 'weight_decay': 0.07213446734443639} because of the following error: The value nan is not acceptable.
[W 2024-04-21 00:58:06,922] Trial 1 failed with value [nan, nan, nan, nan].
[I 2024-04-21 00:58:26,921] Trial 2 finished with values: [5.403869548120534, 0.05879312745189048, -0.1115316598352929, 74.14225370704071] and parameters: {'dropout': 0.5137814290753476, 'num_heads': 2, 'bias': True, 'loss_fn': 'MAE', 'optimizer': 'Adam', 'lr': 0.006374051909215136, 'weight_decay': 0.04963236909795054}. 
[I 2024-04-21 00:58:37,659] Trial 3 finished with values: [5.269841911341304, 0.23315190731960406, -0.02275827344372372, 68.22082188992793] and parameters: {'dropout': 0.5010784230012597, 'num_heads': 1, 'bias': True, 'loss_fn': 'MAE', 'optimizer': 'RMSprop', 'lr': 0.002296408255281905, 'weight_decay': 0.007003630296290256}. 
[I 2024-04-21 00:58:52,821] Trial 4 finished with values: [5.363527314030253, -1.0, -0.08925205802249536, 72.65614228998844] and parameters: {'dropout': 0.3736390961591862, 'num_heads': 2, 'bias': False, 'loss_fn': 'MAE', 'optimizer': 'SGD', 'lr': 0.0014629914289036854, 'weight_decay': 0.018724359742011323}. 
[I 2024-04-21 00:59:04,919] Trial 5 finished with values: [5.37845344302245, 0.19541157019316963, -0.06629706046907291, 71.12498009825876] and parameters: {'dropout': 0.4710099644887663, 'num_heads': 4, 'bias': False, 'loss_fn': 'MSE', 'optimizer': 'Adam', 'lr': 0.0001170951834227463, 'weight_decay': 0.00247339413356821}. 
[I 2024-04-21 00:59:13,425] Trial 6 finished with values: [5.345595893294318, -0.20184151578850243, -0.07613393237984822, 71.78112681836247] and parameters: {'dropout': 0.547925199982604, 'num_heads': 4, 'bias': False, 'loss_fn': 'MAE', 'optimizer': 'SGD', 'lr': 0.01700747473352709, 'weight_decay': 0.0023261183748204263}. 
[I 2024-04-21 00:59:42,131] Trial 7 finished with values: [5.396995425715394, 0.14445016729690593, -0.08580731999132274, 72.42636868093143] and parameters: {'dropout': 0.3456547539932546, 'num_heads': 1, 'bias': True, 'loss_fn': 'MAE', 'optimizer': 'Adam', 'lr': 0.0016683526545743096, 'weight_decay': 3.2735957434199316e-05}. 
[I 2024-04-21 00:59:57,361] Trial 8 finished with values: [5.302585142905815, 0.24711239460530987, -0.050899120306228784, 70.09789465627631] and parameters: {'dropout': 0.41818337874955647, 'num_heads': 8, 'bias': False, 'loss_fn': 'MAE', 'optimizer': 'Adam', 'lr': 0.00012123567350640214, 'weight_decay': 0.005004304918035022}. 
[I 2024-04-21 01:00:08,456] Trial 9 finished with values: [5.293413081911847, 0.18725867897289242, -0.014575997294977272, 67.67504130981263] and parameters: {'dropout': 0.264360828881129, 'num_heads': 8, 'bias': True, 'loss_fn': 'MAE', 'optimizer': 'Adam', 'lr': 0.00010447899875809218, 'weight_decay': 6.016476080954159e-05}. 
[I 2024-04-21 01:00:40,959] Trial 10 finished with values: [5.382425916692609, -0.14095394412929638, -0.10072244032765965, 73.4212486974049] and parameters: {'dropout': 0.3925153981680115, 'num_heads': 8, 'bias': True, 'loss_fn': 'MSE', 'optimizer': 'RMSprop', 'lr': 0.004625216270471414, 'weight_decay': 0.02198797503321524}. 
[I 2024-04-21 01:00:50,172] Trial 11 finished with values: [5.3350725756091775, 0.23717424608344845, -0.06386714004857219, 70.9628976467959] and parameters: {'dropout': 0.372748256545408, 'num_heads': 2, 'bias': False, 'loss_fn': 'MAE', 'optimizer': 'Adam', 'lr': 0.0009399903820514661, 'weight_decay': 0.0008491623090035901}. 
[I 2024-04-21 01:01:24,536] Trial 12 finished with values: [5.3318238991684614, -0.20184151578850243, -0.05196883086323134, 70.16924732608882] and parameters: {'dropout': 0.5920559493808034, 'num_heads': 2, 'bias': True, 'loss_fn': 'MSE', 'optimizer': 'RMSprop', 'lr': 0.009504751143757678, 'weight_decay': 0.013371783342168934}. 
[I 2024-04-21 01:01:47,442] Trial 13 finished with values: [5.279072744166912, 0.22816812172208206, -0.03416534116214209, 68.9817050382835] and parameters: {'dropout': 0.601322534865889, 'num_heads': 1, 'bias': False, 'loss_fn': 'MAE', 'optimizer': 'RMSprop', 'lr': 0.00037518143649159464, 'weight_decay': 0.0027296084983015347}. 
[W 2024-04-21 01:01:57,623] Trial 14 failed with parameters: {'dropout': 0.3236798693141071, 'num_heads': 4, 'bias': False, 'loss_fn': 'MSE', 'optimizer': 'Adam', 'lr': 0.07398782433439852, 'weight_decay': 1.3799075077779549e-05} because of the following error: The value nan is not acceptable.
[W 2024-04-21 01:01:57,623] Trial 14 failed with value [5.632098918756798, nan, -0.18061981052902087, 78.75062554383001].
[W 2024-04-21 01:05:33,448] Trial 15 failed with parameters: {'dropout': 0.6665274764437199, 'num_heads': 8, 'bias': False, 'loss_fn': 'MAE', 'optimizer': 'SGD', 'lr': 0.043071397217814195, 'weight_decay': 0.0007146174965874767} because of the following error: The value nan is not acceptable.
[W 2024-04-21 01:05:33,448] Trial 15 failed with value [nan, nan, nan, nan].
[I 2024-04-21 01:05:55,790] Trial 16 finished with values: [5.377647449248496, 0.23104065044891045, -0.07352518146261211, 71.60711587530677] and parameters: {'dropout': 0.6843836269030925, 'num_heads': 8, 'bias': False, 'loss_fn': 'MAE', 'optimizer': 'Adam', 'lr': 0.00019290042098284114, 'weight_decay': 9.862400533423962e-05}. 
[I 2024-04-21 01:06:07,625] Trial 17 finished with values: [5.332075799107585, 0.2025996431945776, -0.06823203255141297, 71.25404811874695] and parameters: {'dropout': 0.6628261506342109, 'num_heads': 1, 'bias': False, 'loss_fn': 'MAE', 'optimizer': 'RMSprop', 'lr': 0.0011218242088903074, 'weight_decay': 0.06851951865397855}. 
[W 2024-04-21 01:09:49,620] Trial 18 failed with parameters: {'dropout': 0.4967270886086022, 'num_heads': 8, 'bias': False, 'loss_fn': 'MSE', 'optimizer': 'SGD', 'lr': 0.0006856773358511882, 'weight_decay': 0.00019108670120190658} because of the following error: The value nan is not acceptable.
[W 2024-04-21 01:09:49,620] Trial 18 failed with value [nan, nan, nan, nan].
[I 2024-04-21 01:09:56,485] Trial 19 finished with values: [5.396944574791025, -0.14047869503457666, -0.1082457694112946, 73.92307567525552] and parameters: {'dropout': 0.21394355875372933, 'num_heads': 4, 'bias': True, 'loss_fn': 'MAE', 'optimizer': 'SGD', 'lr': 0.005872983613013404, 'weight_decay': 8.944419014093568e-05}. 
[W 2024-04-21 01:13:34,038] Trial 20 failed with parameters: {'dropout': 0.2514291362170797, 'num_heads': 1, 'bias': False, 'loss_fn': 'MSE', 'optimizer': 'SGD', 'lr': 0.00018663110949908925, 'weight_decay': 0.00025951146124466657} because of the following error: The value nan is not acceptable.
[W 2024-04-21 01:13:34,038] Trial 20 failed with value [nan, nan, nan, nan].
[W 2024-04-21 01:13:41,826] Trial 21 failed with parameters: {'dropout': 0.29574491834855754, 'num_heads': 1, 'bias': False, 'loss_fn': 'MAE', 'optimizer': 'SGD', 'lr': 0.01989466640442361, 'weight_decay': 0.002909498729117387} because of the following error: The value nan is not acceptable.
[W 2024-04-21 01:13:41,826] Trial 21 failed with value [5.3986889973283, nan, -0.10910411909800422, 73.98032998706776].
[I 2024-04-21 01:13:55,645] Trial 22 finished with values: [5.335589422029623, -0.20184151578850243, -0.045785417827139296, 69.75679647591214] and parameters: {'dropout': 0.4883674448810711, 'num_heads': 8, 'bias': False, 'loss_fn': 'MSE', 'optimizer': 'SGD', 'lr': 0.0012198738677096403, 'weight_decay': 8.39687182179285e-05}. 
[I 2024-04-21 01:14:10,701] Trial 23 finished with values: [5.342797358270606, 0.18615892505398107, -0.029727983802322333, 68.6857209587933] and parameters: {'dropout': 0.33379122370013237, 'num_heads': 2, 'bias': False, 'loss_fn': 'MSE', 'optimizer': 'RMSprop', 'lr': 0.0001729280367416899, 'weight_decay': 0.0007384679430791242}. 
[I 2024-04-21 01:14:26,879] Trial 24 finished with values: [5.376236689111, 0.14047869503457666, -0.09739913618501994, 73.19957506651097] and parameters: {'dropout': 0.5835200435917196, 'num_heads': 2, 'bias': True, 'loss_fn': 'MAE', 'optimizer': 'SGD', 'lr': 0.0005450143920376156, 'weight_decay': 0.005178616054476774}. 
[I 2024-04-21 01:14:38,788] Trial 25 finished with values: [5.319940257101687, 0.1433246476074308, -0.06416008000537188, 70.98243755679827] and parameters: {'dropout': 0.2456843607562728, 'num_heads': 8, 'bias': False, 'loss_fn': 'MAE', 'optimizer': 'RMSprop', 'lr': 0.047344979731837045, 'weight_decay': 0.0009885700957659859}. 
