nohup: ignoring input
Some weights of EsmModel were not initialized from the model checkpoint at DeepLearning/EmbeddingModels/ESM-2/esm2_t33_650M_UR50D and are newly initialized: ['esm.pooler.dense.bias', 'esm.pooler.dense.weight']
You should probably TRAIN this model on a down-stream task to be able to use it for predictions and inference.
NVIDIA A100-PCIE-40GB
===正在从训练集版本为ProThermDB_Common、训练集版本为ProThermDBTest_Common的原始数据集中进行数据清洗和生物特征提取工作===
1.预处理训练集数据...
删除数据缺失行及非法行共计0行
丢弃pH/Tm的缺失值
前一数据集采用了后一数据集中的0条数据，现已删除
获取[序列]信息.....该数据集已经经过处理，直接使用缓存文件
删除了0个非法长度的蛋白质，当前蛋白质长度被限制在(0, 5000)
不针对突变位点上下文进行截取
2.预处理测试集数据...
删除数据缺失行及非法行共计0行
丢弃pH/Tm的缺失值
获取[序列]信息.....该数据集已经经过处理，直接使用缓存文件
删除了0个非法长度的蛋白质，当前蛋白质长度被限制在(0, 5000)
不针对突变位点上下文进行截取
3.为训练集数据提取生物特征...
获取[neighbor特征].....该数据集已经经过处理，直接使用缓存文件
获取[aaindex特征].....该数据集已经经过处理，直接使用缓存文件
4.为测试集数据提取生物特征...
获取[neighbor特征].....该数据集已经经过处理，直接使用缓存文件
获取[aaindex特征].....该数据集已经经过处理，直接使用缓存文件
6.从全数据集中提取生物特征集、标签集和基本信息集...
7.数据清洗和生物特征提取工作完成==>
Acting on ESM650M...
  0%|          | 0/4 [00:00<?, ?it/s] 25%|██▌       | 1/4 [04:15<12:45, 255.11s/it] 50%|█████     | 2/4 [04:43<04:02, 121.47s/it] 75%|███████▌  | 3/4 [08:58<03:02, 182.69s/it]100%|██████████| 4/4 [09:26<00:00, 121.52s/it]100%|██████████| 4/4 [09:26<00:00, 141.58s/it]
[I 2024-04-20 19:25:35,214] A new study created in RDB with name: ESM650M-Conv-BioInfo-Subtration
/public/home/yyang/anaconda3/envs/Pon-DT/lib/python3.11/site-packages/torch/nn/modules/lazy.py:180: UserWarning: Lazy modules are a new feature under heavy development so changes to the API or functionality can happen at any moment.
  warnings.warn('Lazy modules are a new feature under heavy development '
[I 2024-04-20 19:28:24,381] Trial 0 finished with values: [4.571734865599002, 0.5581626597104661, 0.2694018421380371, 48.73292946610706] and parameters: {'dropout': 0.6682161638904962, 'loss_fn': 'MSE', 'optimizer': 'Adam', 'lr': 0.0012768966648359554, 'weight_decay': 0.0051005641935645525}. 
[I 2024-04-20 19:29:25,393] Trial 1 finished with values: [5.13098308394553, 0.4456334761079415, 0.09754214676476403, 60.19644921710368] and parameters: {'dropout': 0.4133409388264626, 'loss_fn': 'MSE', 'optimizer': 'Adam', 'lr': 0.0007818019996068532, 'weight_decay': 5.669059377844915e-05}. 
[I 2024-04-20 19:30:21,621] Trial 2 finished with values: [5.310459367253064, 0.1969069961350005, -0.03126715037278016, 68.78838765060952] and parameters: {'dropout': 0.3077096503625599, 'loss_fn': 'MSE', 'optimizer': 'SGD', 'lr': 0.004774746875441888, 'weight_decay': 0.0002061139957334052}. 
[I 2024-04-20 19:32:11,472] Trial 3 finished with values: [5.1812884175153116, 0.5447569612865939, 0.24184158342647233, 50.571275387740364] and parameters: {'dropout': 0.30637133564849045, 'loss_fn': 'MSE', 'optimizer': 'RMSprop', 'lr': 0.000335245518363157, 'weight_decay': 0.00035756652600816603}. 
[I 2024-04-20 19:34:02,233] Trial 4 finished with values: [4.7013501397473325, 0.5127649298516231, 0.21412452953224015, 52.42007998422158] and parameters: {'dropout': 0.45902369848893865, 'loss_fn': 'MAE', 'optimizer': 'Adam', 'lr': 0.0009494654229585645, 'weight_decay': 0.0008187484524651352}. 
[I 2024-04-20 19:35:24,221] Trial 5 finished with values: [5.3562827658642815, -0.1712980079365296, -0.08386406487243714, 72.29674815886436] and parameters: {'dropout': 0.3097257679554582, 'loss_fn': 'MAE', 'optimizer': 'SGD', 'lr': 0.08819356173496519, 'weight_decay': 0.07629243966416224}. 
[I 2024-04-20 19:37:32,418] Trial 6 finished with values: [4.869139357098644, 0.4941958877876854, 0.23302507632343394, 51.1593609367748] and parameters: {'dropout': 0.20145961770575083, 'loss_fn': 'MSE', 'optimizer': 'Adam', 'lr': 0.016032538889276752, 'weight_decay': 0.0001736787544116205}. 
[I 2024-04-20 19:39:56,045] Trial 7 finished with values: [5.015695108310381, 0.532918672973662, 0.2525474587024825, 49.85716372583098] and parameters: {'dropout': 0.4651931475616005, 'loss_fn': 'MSE', 'optimizer': 'RMSprop', 'lr': 0.007530349214979006, 'weight_decay': 5.109206988900057e-05}. 
[I 2024-04-20 19:41:38,809] Trial 8 finished with values: [5.336054200918115, 0.4294271580511405, 0.16800930233708156, 55.49609391887452] and parameters: {'dropout': 0.3918045610036479, 'loss_fn': 'MSE', 'optimizer': 'Adam', 'lr': 0.07252830485477423, 'weight_decay': 0.0006741230273414688}. 
[I 2024-04-20 19:42:52,619] Trial 9 finished with values: [4.826105342720089, 0.4974660820925525, 0.2100298173753271, 52.69320867552682] and parameters: {'dropout': 0.37540140564797586, 'loss_fn': 'MSE', 'optimizer': 'Adam', 'lr': 0.004271805895111922, 'weight_decay': 0.0007978568032095472}. 
[I 2024-04-20 19:43:22,909] Trial 10 finished with values: [5.297075802663035, 0.46323093861947573, 0.1740324883371719, 55.094330657709676] and parameters: {'dropout': 0.38677756745419856, 'loss_fn': 'MSE', 'optimizer': 'RMSprop', 'lr': 0.0011875097927099526, 'weight_decay': 1.6681546913192385e-05}. 
[I 2024-04-20 19:43:42,291] Trial 11 finished with values: [5.3130158773292635, 0.17901508785778167, -0.03297132223183219, 68.90206065417738] and parameters: {'dropout': 0.44344323444821954, 'loss_fn': 'MSE', 'optimizer': 'SGD', 'lr': 0.005744073025284157, 'weight_decay': 0.07227786718068017}. 
[I 2024-04-20 19:44:36,562] Trial 12 finished with values: [5.3183334699683265, 0.06049033407056192, -0.043687715155720896, 69.61687387245766] and parameters: {'dropout': 0.5456338042884479, 'loss_fn': 'MSE', 'optimizer': 'SGD', 'lr': 0.00028782062355277164, 'weight_decay': 1.2366679138067711e-05}. 
[I 2024-04-20 19:45:29,760] Trial 13 finished with values: [5.320764861920664, 0.2084763632189898, -0.06625480195886735, 71.1221613380757] and parameters: {'dropout': 0.4708150479611862, 'loss_fn': 'MAE', 'optimizer': 'SGD', 'lr': 0.0009661989983343902, 'weight_decay': 0.024733800779132235}. 
[I 2024-04-20 19:46:05,152] Trial 14 finished with values: [5.312449363311966, 0.17374048916898835, -0.02129212085715637, 68.12302543394338] and parameters: {'dropout': 0.6310881657361713, 'loss_fn': 'MSE', 'optimizer': 'SGD', 'lr': 0.0132955668746334, 'weight_decay': 0.0007146500136965313}. 
[I 2024-04-20 19:46:43,520] Trial 15 finished with values: [5.298812530258833, 0.2045475197089347, -0.040778080542914985, 69.42279314992618] and parameters: {'dropout': 0.4938251829506093, 'loss_fn': 'MSE', 'optimizer': 'SGD', 'lr': 0.001788195274478175, 'weight_decay': 0.03556672834682334}. 
[I 2024-04-20 19:47:08,976] Trial 16 finished with values: [5.343698213388407, 0.18660134943811355, -0.05314252255394991, 70.24753582676904] and parameters: {'dropout': 0.6232563347468021, 'loss_fn': 'MAE', 'optimizer': 'SGD', 'lr': 0.007141614081850959, 'weight_decay': 0.0004627267791225377}. 
[I 2024-04-20 19:48:18,540] Trial 17 finished with values: [4.900603051218605, 0.4784723599389969, 0.22646730464136788, 51.596782550007696] and parameters: {'dropout': 0.48376583850520444, 'loss_fn': 'MSE', 'optimizer': 'Adam', 'lr': 0.035262766304496984, 'weight_decay': 0.014833918258703328}. 
[I 2024-04-20 19:48:55,436] Trial 18 finished with values: [5.260842484422718, 0.19693430583730093, -0.0083212141778648, 67.25782987669864] and parameters: {'dropout': 0.2010056393485714, 'loss_fn': 'MSE', 'optimizer': 'SGD', 'lr': 0.00019876631534858678, 'weight_decay': 0.0002871738767609456}. 
[I 2024-04-20 19:49:42,187] Trial 19 finished with values: [5.338159485291657, 0.20183937748812, -0.07570766304398391, 71.75269346788835] and parameters: {'dropout': 0.26996855002078957, 'loss_fn': 'MAE', 'optimizer': 'SGD', 'lr': 0.02598365330339729, 'weight_decay': 0.00302025256057403}. 
[I 2024-04-20 19:50:15,446] Trial 20 finished with values: [5.296107349572672, 0.20238377597946666, -0.04942600770788874, 69.99963394814556] and parameters: {'dropout': 0.6043148734461228, 'loss_fn': 'MAE', 'optimizer': 'RMSprop', 'lr': 0.006708796619262194, 'weight_decay': 0.003425512443848347}. 
[I 2024-04-20 19:50:58,986] Trial 21 finished with values: [5.344799311578277, 0.17617084432570945, -0.07594429333601038, 71.7684773666113] and parameters: {'dropout': 0.34638492969192647, 'loss_fn': 'MAE', 'optimizer': 'RMSprop', 'lr': 0.08898217224925614, 'weight_decay': 0.000445889185084419}. 
[I 2024-04-20 19:51:32,471] Trial 22 finished with values: [4.872195833405333, 0.49997721465808187, 0.23925638390804138, 50.7437153869818] and parameters: {'dropout': 0.24062853366310138, 'loss_fn': 'MSE', 'optimizer': 'RMSprop', 'lr': 0.00040567077706396527, 'weight_decay': 1.809829017769436e-05}. 
[I 2024-04-20 19:52:17,743] Trial 23 finished with values: [5.320664787828341, 0.17605501643255786, -0.07556150225181035, 71.74294413646852] and parameters: {'dropout': 0.3751869231292828, 'loss_fn': 'MAE', 'optimizer': 'RMSprop', 'lr': 0.0017093855081342613, 'weight_decay': 0.0054901195460671185}. 
[I 2024-04-20 19:53:41,071] Trial 24 finished with values: [4.778222785360831, 0.5036469575301035, 0.22430725019772824, 51.74086419011598] and parameters: {'dropout': 0.6429336265507928, 'loss_fn': 'MSE', 'optimizer': 'Adam', 'lr': 0.00021670629740501015, 'weight_decay': 0.05801942307059556}. 
[I 2024-04-20 19:54:24,147] Trial 25 finished with values: [4.737919375429723, 0.4720066105561415, 0.17364465847183364, 55.12019998857097] and parameters: {'dropout': 0.20547500706126287, 'loss_fn': 'MAE', 'optimizer': 'RMSprop', 'lr': 0.0006275517683350238, 'weight_decay': 0.005991336114926054}. 
[I 2024-04-20 19:55:06,254] Trial 26 finished with values: [5.341932158280647, 0.18501397211991896, -0.07486307469632769, 71.69635707567149] and parameters: {'dropout': 0.6058998462307807, 'loss_fn': 'MAE', 'optimizer': 'Adam', 'lr': 0.03042785871429854, 'weight_decay': 0.014275911878362564}. 
[I 2024-04-20 19:55:35,519] Trial 27 finished with values: [5.372241128941941, 0.19090581884607966, -0.020214760354259065, 68.05116249145951] and parameters: {'dropout': 0.5221658412437753, 'loss_fn': 'MAE', 'optimizer': 'RMSprop', 'lr': 0.03618229495635002, 'weight_decay': 0.0018938568977027715}. 
[I 2024-04-20 19:56:44,790] Trial 28 finished with values: [4.608216270028628, 0.528350139684751, 0.22459587802800673, 51.7216119109478] and parameters: {'dropout': 0.263009311272169, 'loss_fn': 'MAE', 'optimizer': 'Adam', 'lr': 0.006324594413501705, 'weight_decay': 0.001063154140458134}. 
[I 2024-04-20 19:57:37,563] Trial 29 finished with values: [4.802457247508037, 0.48327853751912947, 0.21569454343164574, 52.31535568975519] and parameters: {'dropout': 0.4514832749907628, 'loss_fn': 'MSE', 'optimizer': 'Adam', 'lr': 0.004015528416214386, 'weight_decay': 0.00037248615020422644}. 
[I 2024-04-20 19:58:12,363] Trial 30 finished with values: [4.811829143338789, 0.4683312988612028, 0.18944285106694692, 54.06641659595654] and parameters: {'dropout': 0.6032520316374994, 'loss_fn': 'MSE', 'optimizer': 'RMSprop', 'lr': 0.00013031592875001013, 'weight_decay': 0.027760248809972944}. 
[I 2024-04-20 19:59:24,027] Trial 31 finished with values: [4.48731845170709, 0.5461409156555221, 0.27287309220511136, 48.501387430505716] and parameters: {'dropout': 0.47140953338649033, 'loss_fn': 'MAE', 'optimizer': 'Adam', 'lr': 0.000141601199311595, 'weight_decay': 0.019071566191676756}. 
[I 2024-04-20 19:59:46,251] Trial 32 finished with values: [5.405813225797957, 0.177994559264101, 0.0018325618510462993, 66.58054477036927] and parameters: {'dropout': 0.31377357982385545, 'loss_fn': 'MSE', 'optimizer': 'SGD', 'lr': 0.015476053074104126, 'weight_decay': 1.4907661237417258e-05}. 
[I 2024-04-20 20:00:21,419] Trial 33 finished with values: [4.946145566619742, 0.484744237817621, 0.171654396017766, 55.252956030657025] and parameters: {'dropout': 0.6309276073069563, 'loss_fn': 'MSE', 'optimizer': 'RMSprop', 'lr': 0.0001929641914798421, 'weight_decay': 0.003176918725306032}. 
[I 2024-04-20 20:00:49,792] Trial 34 finished with values: [5.34844013492079, 0.05170438780531676, -0.08498621220498492, 72.3715985074714] and parameters: {'dropout': 0.5088406456812999, 'loss_fn': 'MAE', 'optimizer': 'SGD', 'lr': 0.0025324322131314797, 'weight_decay': 1.1839450554192218e-05}. 
[I 2024-04-20 20:01:47,694] Trial 35 finished with values: [4.8531212925531815, 0.44375768246150443, 0.15682921693822727, 56.24183671510856] and parameters: {'dropout': 0.20380061983350556, 'loss_fn': 'MSE', 'optimizer': 'SGD', 'lr': 0.003257742482901628, 'weight_decay': 0.0031762291847041175}. 
[I 2024-04-20 20:02:20,353] Trial 36 finished with values: [4.988392158069286, 0.48329217309223493, 0.17922082819145457, 54.748253956798095] and parameters: {'dropout': 0.28295843110109903, 'loss_fn': 'MSE', 'optimizer': 'Adam', 'lr': 0.0008016721638355649, 'weight_decay': 0.001585478962444657}. 
[I 2024-04-20 20:03:09,181] Trial 37 finished with values: [4.64347918649609, 0.5026752352978191, 0.20149174848340923, 53.262721621335814] and parameters: {'dropout': 0.343986897604069, 'loss_fn': 'MAE', 'optimizer': 'RMSprop', 'lr': 0.0017630080456605044, 'weight_decay': 0.0015147055767583942}. 
[I 2024-04-20 20:03:37,135] Trial 38 finished with values: [5.337596503301334, 0.2012501389887965, -0.0730435196628838, 71.57498769340529] and parameters: {'dropout': 0.6435909446026579, 'loss_fn': 'MAE', 'optimizer': 'SGD', 'lr': 0.03450118248249677, 'weight_decay': 2.5532759735823727e-05}. 
[I 2024-04-20 20:04:23,951] Trial 39 finished with values: [4.897103453526913, 0.42546850251655105, 0.16386401932999028, 55.772595826561776] and parameters: {'dropout': 0.526660392404668, 'loss_fn': 'MSE', 'optimizer': 'RMSprop', 'lr': 0.020168932117098554, 'weight_decay': 0.00014161304527529484}. 
[I 2024-04-20 20:05:37,694] Trial 40 finished with values: [4.812167377388297, 0.47306420513579633, 0.1292928771051267, 58.07858718101212] and parameters: {'dropout': 0.3562044399774459, 'loss_fn': 'MAE', 'optimizer': 'RMSprop', 'lr': 0.0001491541885129046, 'weight_decay': 0.08243878440771317}. 
[I 2024-04-20 20:06:07,120] Trial 41 finished with values: [5.382827085343658, 0.17545358542794795, 0.01395086784862043, 65.77222005031152] and parameters: {'dropout': 0.3214067934193068, 'loss_fn': 'MSE', 'optimizer': 'SGD', 'lr': 0.015291577557021704, 'weight_decay': 0.0016670019172018119}. 
[I 2024-04-20 20:06:54,856] Trial 42 finished with values: [5.2981255372102956, 0.20939658552158302, -0.04879300723750135, 69.95741105592573] and parameters: {'dropout': 0.39194832009245817, 'loss_fn': 'MAE', 'optimizer': 'SGD', 'lr': 0.001710457429478698, 'weight_decay': 7.047973805145223e-05}. 
[I 2024-04-20 20:07:27,043] Trial 43 finished with values: [5.317526152983769, 0.19214903687416524, -0.049538400186958986, 70.0071308391466] and parameters: {'dropout': 0.4773211130217321, 'loss_fn': 'MAE', 'optimizer': 'SGD', 'lr': 0.014438792443322607, 'weight_decay': 2.015378107650812e-05}. 
[I 2024-04-20 20:07:59,243] Trial 44 finished with values: [4.756540177522122, 0.4705087481920703, 0.1667579362255095, 55.579563519495984] and parameters: {'dropout': 0.2773570889704213, 'loss_fn': 'MAE', 'optimizer': 'RMSprop', 'lr': 0.0012784886404818834, 'weight_decay': 0.0018853361751123058}. 
[I 2024-04-20 20:09:02,005] Trial 45 finished with values: [4.9409110168658446, 0.4743668525863462, 0.14265944969743805, 57.186999606727845] and parameters: {'dropout': 0.3757170916790723, 'loss_fn': 'MSE', 'optimizer': 'Adam', 'lr': 0.0012729923166016706, 'weight_decay': 0.0273395069607594}. 
[I 2024-04-20 20:09:45,203] Trial 46 finished with values: [5.491636382237324, 0.20912330916856692, -0.12279726735939622, 74.89370106692948] and parameters: {'dropout': 0.556339606855222, 'loss_fn': 'MAE', 'optimizer': 'SGD', 'lr': 0.00010440892559825105, 'weight_decay': 4.073746503510113e-05}. 
[I 2024-04-20 20:10:42,856] Trial 47 finished with values: [4.896179233802645, 0.4477286026431552, 0.1846813941435903, 54.38401901789652] and parameters: {'dropout': 0.5559011883106756, 'loss_fn': 'MSE', 'optimizer': 'RMSprop', 'lr': 0.05127977898604099, 'weight_decay': 0.0018781857112234338}. 
[I 2024-04-20 20:11:31,305] Trial 48 finished with values: [5.034006968551211, 0.456974339853267, 0.12882965489369702, 58.10948539107988] and parameters: {'dropout': 0.4724304458856708, 'loss_fn': 'MSE', 'optimizer': 'Adam', 'lr': 0.005001505136543228, 'weight_decay': 0.00015241729655882263}. 
[I 2024-04-20 20:12:01,403] Trial 49 finished with values: [5.322128087051597, 0.1950880088232856, -0.07127141699199102, 71.45678351572157] and parameters: {'dropout': 0.5959150761201568, 'loss_fn': 'MAE', 'optimizer': 'RMSprop', 'lr': 0.0021861592219046596, 'weight_decay': 0.02248335925970062}. 
[I 2024-04-20 20:12:58,519] Trial 50 finished with values: [4.878484365025465, 0.49561134048128636, 0.2120984889079598, 52.55522252978652] and parameters: {'dropout': 0.6435909446026579, 'loss_fn': 'MSE', 'optimizer': 'Adam', 'lr': 0.004271805895111922, 'weight_decay': 0.0007978568032095472}. 
[I 2024-04-20 20:14:09,736] Trial 51 finished with values: [4.626651090788231, 0.5118926219801452, 0.2204231063737957, 51.99994738786431] and parameters: {'dropout': 0.47140953338649033, 'loss_fn': 'MAE', 'optimizer': 'Adam', 'lr': 0.000141601199311595, 'weight_decay': 0.05801942307059556}. 
[I 2024-04-20 20:14:46,645] Trial 52 finished with values: [5.3221734535411755, 0.20388695909902774, -0.06336723173992609, 70.92955237199249] and parameters: {'dropout': 0.4651931475616005, 'loss_fn': 'MAE', 'optimizer': 'SGD', 'lr': 0.007530349214979006, 'weight_decay': 0.000421118105337719}. 
[I 2024-04-20 20:15:41,219] Trial 53 finished with values: [4.712844527895648, 0.5119035863565822, 0.23717750735862364, 50.882382235729395] and parameters: {'dropout': 0.47140953338649033, 'loss_fn': 'MSE', 'optimizer': 'Adam', 'lr': 0.004015528416214386, 'weight_decay': 0.00037248615020422644}. 
[I 2024-04-20 20:16:35,909] Trial 54 finished with values: [4.822438755357423, 0.5111151067473702, 0.1324222576388684, 57.86984879427743] and parameters: {'dropout': 0.4813206621533961, 'loss_fn': 'MAE', 'optimizer': 'Adam', 'lr': 0.00021670629740501015, 'weight_decay': 0.05801942307059556}. 
[I 2024-04-20 20:17:36,766] Trial 55 finished with values: [4.635341453270195, 0.5282321114423886, 0.24381548073851012, 50.439610946151326] and parameters: {'dropout': 0.20547500706126287, 'loss_fn': 'MAE', 'optimizer': 'Adam', 'lr': 0.00045399421120754873, 'weight_decay': 0.005991336114926054}. 
[I 2024-04-20 20:18:07,356] Trial 56 finished with values: [5.175774551739179, 0.43832447549284415, 0.12176240226640134, 58.58089080060492] and parameters: {'dropout': 0.4651931475616005, 'loss_fn': 'MSE', 'optimizer': 'RMSprop', 'lr': 0.009466435587522058, 'weight_decay': 0.0015147055767583942}. 
