[I 2024-04-20 21:59:23,066] Trial 149 finished with values: [5.513282195786295, 0.18693082326111074, 0.006004229788277082, 66.3022829144456] and parameters: {'dropout': 0.20380061983350556, 'loss_fn': 'MSE', 'optimizer': 'SGD', 'lr': 0.003257742482901628, 'weight_decay': 0.014833918258703328}. 
[I 2024-04-20 22:00:12,713] Trial 150 finished with values: [5.28689893550648, 0.21446462878366251, -0.04200069166473597, 69.50434471274224] and parameters: {'dropout': 0.6682161638904962, 'loss_fn': 'MAE', 'optimizer': 'RMSprop', 'lr': 0.00434129612374402, 'weight_decay': 0.0051005641935645525}. 
[I 2024-04-20 22:00:44,965] Trial 151 finished with values: [4.732275705564264, 0.4684525079334747, 0.16858915103662642, 55.45741639762449] and parameters: {'dropout': 0.30637133564849045, 'loss_fn': 'MAE', 'optimizer': 'RMSprop', 'lr': 0.0017630080456605044, 'weight_decay': 0.000445889185084419}. 
[I 2024-04-20 22:01:26,193] Trial 152 finished with values: [4.565277414741875, 0.512631446068292, 0.24099726200333482, 50.62759397534931] and parameters: {'dropout': 0.20547500706126287, 'loss_fn': 'MAE', 'optimizer': 'RMSprop', 'lr': 0.0006275517683350238, 'weight_decay': 5.669059377844915e-05}. 
[I 2024-04-20 22:02:29,263] Trial 153 finished with values: [4.5311393485548335, 0.5486167264245025, 0.2702729658264197, 48.67482309284924] and parameters: {'dropout': 0.6045490532618478, 'loss_fn': 'MAE', 'optimizer': 'RMSprop', 'lr': 0.000335245518363157, 'weight_decay': 0.008799634114614038}. 
[I 2024-04-20 22:03:09,044] Trial 154 finished with values: [4.964512743660787, 0.4454817823703503, 0.10243927343139325, 59.86979724588899] and parameters: {'dropout': 0.4773211130217321, 'loss_fn': 'MAE', 'optimizer': 'Adam', 'lr': 0.0001929641914798421, 'weight_decay': 0.00030768246874286195}. 
[I 2024-04-20 22:04:05,497] Trial 155 finished with values: [4.830086167880758, 0.4824570562104071, 0.2068772409208368, 52.903494294700536] and parameters: {'dropout': 0.5617665243506511, 'loss_fn': 'MSE', 'optimizer': 'RMSprop', 'lr': 0.004271805895111922, 'weight_decay': 0.01201817631407562}. 
[I 2024-04-20 22:05:21,635] Trial 156 finished with values: [4.5122761502181366, 0.5456600305757382, 0.25213447298437075, 49.88471102204939] and parameters: {'dropout': 0.4133409388264626, 'loss_fn': 'MAE', 'optimizer': 'Adam', 'lr': 0.0001929641914798421, 'weight_decay': 5.669059377844915e-05}. 
[I 2024-04-20 22:07:19,288] Trial 157 finished with values: [4.570181906394907, 0.5452747548348491, 0.2507755606499035, 49.975354254903976] and parameters: {'dropout': 0.6429336265507928, 'loss_fn': 'MAE', 'optimizer': 'Adam', 'lr': 0.00013031592875001013, 'weight_decay': 0.05801942307059556}. 
[I 2024-04-20 22:08:19,637] Trial 158 finished with values: [4.818148669090735, 0.4740056330758869, 0.20676313057249762, 52.911105772360486] and parameters: {'dropout': 0.47140953338649033, 'loss_fn': 'MAE', 'optimizer': 'Adam', 'lr': 0.000141601199311595, 'weight_decay': 0.019071566191676756}. 
[I 2024-04-20 22:09:53,175] Trial 159 finished with values: [4.899888359847767, 0.5052876401923503, 0.173910766230158, 55.102449860847194] and parameters: {'dropout': 0.4386621786091557, 'loss_fn': 'MSE', 'optimizer': 'RMSprop', 'lr': 0.0006275517683350238, 'weight_decay': 2.6486795874956545e-05}. 
[I 2024-04-20 22:11:19,209] Trial 160 finished with values: [4.897225526506357, 0.4871463403631357, 0.22920833902382098, 51.41394793184336] and parameters: {'dropout': 0.47140953338649033, 'loss_fn': 'MSE', 'optimizer': 'Adam', 'lr': 0.007530349214979006, 'weight_decay': 5.109206988900057e-05}. 
[I 2024-04-20 22:13:39,263] Trial 161 finished with values: [4.8718261195166335, 0.5043996426519682, 0.16015079288499035, 56.02027835968699] and parameters: {'dropout': 0.4133409388264626, 'loss_fn': 'MSE', 'optimizer': 'Adam', 'lr': 0.0017630080456605044, 'weight_decay': 5.669059377844915e-05}. 
[I 2024-04-20 22:14:30,309] Trial 162 finished with values: [4.774820729740854, 0.48243087043372523, 0.18756590066399204, 54.19161440902831] and parameters: {'dropout': 0.47140953338649033, 'loss_fn': 'MAE', 'optimizer': 'RMSprop', 'lr': 0.015601647094364027, 'weight_decay': 1.809829017769436e-05}. 
[I 2024-04-20 22:16:03,255] Trial 163 finished with values: [4.6441112936360645, 0.4928223263219624, 0.21017481426763096, 52.68353697946598] and parameters: {'dropout': 0.6058998462307807, 'loss_fn': 'MAE', 'optimizer': 'Adam', 'lr': 0.000141601199311595, 'weight_decay': 0.003425512443848347}. 
[I 2024-04-20 22:17:15,678] Trial 164 finished with values: [4.9275782290685175, 0.4872091394190793, 0.2206860319386137, 51.98240952129946] and parameters: {'dropout': 0.6682161638904962, 'loss_fn': 'MSE', 'optimizer': 'Adam', 'lr': 0.0017630080456605044, 'weight_decay': 0.0051005641935645525}. 
[I 2024-04-20 22:18:45,798] Trial 165 finished with values: [4.595461252960387, 0.5216827680610232, 0.24401386162592786, 50.42637838911581] and parameters: {'dropout': 0.27454880379716917, 'loss_fn': 'MAE', 'optimizer': 'Adam', 'lr': 0.000141601199311595, 'weight_decay': 0.019071566191676756}. 
[I 2024-04-20 22:20:59,962] Trial 166 finished with values: [4.381725400315187, 0.5726268424565935, 0.3118974521029877, 45.89835406955588] and parameters: {'dropout': 0.39194832009245817, 'loss_fn': 'MAE', 'optimizer': 'Adam', 'lr': 0.00013031592875001013, 'weight_decay': 7.047973805145223e-05}. 
[I 2024-04-20 22:22:28,529] Trial 167 finished with values: [4.630381216178681, 0.4858608160139741, 0.19490253272651403, 53.702240641829164] and parameters: {'dropout': 0.47140953338649033, 'loss_fn': 'MAE', 'optimizer': 'Adam', 'lr': 0.00014946544100267602, 'weight_decay': 0.019071566191676756}. 
[I 2024-04-20 22:24:16,668] Trial 168 finished with values: [4.584438751097027, 0.5201680449276824, 0.2416266553110089, 50.58561169091667] and parameters: {'dropout': 0.3757170916790723, 'loss_fn': 'MAE', 'optimizer': 'Adam', 'lr': 0.0012729923166016706, 'weight_decay': 0.005991336114926054}. 
[I 2024-04-20 22:26:29,082] Trial 169 finished with values: [4.689752182119133, 0.49544137304643926, 0.22295996768550608, 51.83073168147563] and parameters: {'dropout': 0.32081949913925195, 'loss_fn': 'MAE', 'optimizer': 'Adam', 'lr': 0.00013031592875001013, 'weight_decay': 0.027760248809972944}. 
[I 2024-04-20 22:27:51,826] Trial 170 finished with values: [4.699223591214465, 0.5174397570790942, 0.25996290831311, 49.36253260892299] and parameters: {'dropout': 0.20145961770575083, 'loss_fn': 'MSE', 'optimizer': 'RMSprop', 'lr': 0.016032538889276752, 'weight_decay': 0.0001736787544116205}. 
[I 2024-04-20 22:28:38,994] Trial 171 finished with values: [5.105075090410326, 0.41949549925980617, 0.07089419655283735, 61.97394162400284] and parameters: {'dropout': 0.3757170916790723, 'loss_fn': 'MSE', 'optimizer': 'Adam', 'lr': 0.0001929641914798421, 'weight_decay': 0.00030768246874286195}. 
[I 2024-04-20 22:30:10,018] Trial 172 finished with values: [5.260245701234966, 0.19451081194737646, -0.016565543626164025, 67.80774958451046] and parameters: {'dropout': 0.28295843110109903, 'loss_fn': 'MSE', 'optimizer': 'SGD', 'lr': 0.00012206461266414429, 'weight_decay': 0.0018853361751123058}. 
[I 2024-04-20 22:31:08,134] Trial 173 finished with values: [4.783071262602201, 0.43548015095749415, 0.1401547667435894, 57.3540689271352] and parameters: {'dropout': 0.31377357982385545, 'loss_fn': 'MAE', 'optimizer': 'Adam', 'lr': 0.0001491541885129046, 'weight_decay': 1.4907661237417258e-05}. 
[I 2024-04-20 22:32:02,684] Trial 174 finished with values: [4.930212249651463, 0.48732465362772676, 0.22799480547463746, 51.49489399531302] and parameters: {'dropout': 0.4133409388264626, 'loss_fn': 'MSE', 'optimizer': 'Adam', 'lr': 0.0001929641914798421, 'weight_decay': 5.669059377844915e-05}. 
Training finished at Epoch 75, with validation result for [5.362743464021645, 0.32298878637965894, 0.08151473327419723, 99.750430001724]
Training finished at Epoch 60, with validation result for [5.726253490459418, -0.0035658389225615298, -0.06510366271549395, 111.3508697703207]
Training finished at Epoch 43, with validation result for [4.538020839612618, 0.6074912056801345, 0.3674011745961262, 54.51338310667623]
Training finished at Epoch 82, with validation result for [4.836819394699202, 0.5326065484783287, 0.2825556650371466, 69.34514705265379]
Training finished at Epoch 31, with validation result for [4.782382517065321, 0.4710614891666772, 0.15940286069622334, 71.3438208682082]
Training finished at Epoch 78, with validation result for [5.07805455409916, 0.5613118732146962, 0.26545606423142565, 78.29215040300612]
Training finished at Epoch 49, with validation result for [5.0535503837116655, 0.5886659051027647, 0.2949357160912266, 70.20933458630269]
Training finished at Epoch 81, with validation result for [4.532729104617148, 0.583513322608423, 0.3304325484242705, 63.82845671185658]
Training finished at Epoch 42, with validation result for [4.694113095676628, 0.5543303091752522, 0.2647220347905519, 57.12207279325449]
Training finished at Epoch 72, with validation result for [5.189897456955223, 0.5440310031034677, 0.29430039726918333, 75.2496906513259]
Training finished at Epoch 38, with validation result for [5.536825462627408, 0.5078492285150096, 0.23219400334098383, 67.70513138100272]
Training finished at Epoch 105, with validation result for [5.176386270856848, -0.15190944017983182, -0.027809421880831353, 98.34996720839565]
Training finished at Epoch 56, with validation result for [6.274858103843461, 0.5360669630561654, 0.11528625150696992, 95.47760392133758]
Training finished at Epoch 113, with validation result for [5.266883833029611, 0.46024359588828845, 0.10466281279261447, 79.54092079140709]
Training finished at Epoch 64, with validation result for [4.96259416194643, -0.012476924470751962, -0.026395969150686982, 77.08205880715244]
Training finished at Epoch 37, with validation result for [5.175899144215848, 0.6369871401948707, 0.35401787418997255, 69.9365924635605]
Training finished at Epoch 50, with validation result for [4.811203574642025, 0.485605877457951, 0.23001214617182886, 70.60938854217282]
Training finished at Epoch 40, with validation result for [5.726726201710932, -0.07120484613810386, -0.034501421642768815, 105.86897532189509]
Training finished at Epoch 64, with validation result for [5.1722542210658355, 0.4910476815062285, 0.20449534959386306, 74.54299157663654]
Training finished at Epoch 52, with validation result for [4.817386251268019, 0.6029469302221152, 0.3521681241546545, 69.26546339306287]
Training finished at Epoch 87, with validation result for [4.833296245105141, 0.450928084801479, 0.16238824408100316, 76.22562614122715]
Training finished at Epoch 35, with validation result for [5.030460343506157, 0.42315596788604454, 0.16786937306972727, 86.36300859972174]
Training finished at Epoch 84, with validation result for [4.639734960120965, 0.47646997992225526, 0.162324209006122, 73.18498089575381]
Training finished at Epoch 52, with validation result for [4.944568594613199, 0.5577940124282532, 0.27462122100526387, 71.10766777765963]
Training finished at Epoch 56, with validation result for [4.794202240138053, 0.43169603581400573, 0.18456167752557873, 79.99028105438079]
Training finished at Epoch 46, with validation result for [4.927567954768489, 0.4361358677131012, 0.1642820405507247, 71.30447123389776]
Training finished at Epoch 40, with validation result for [5.474772877377068, 0.5564078300655808, 0.30698898690497667, 73.09731564997088]
Training finished at Epoch 41, with validation result for [4.951368286580714, 0.6425328764402713, 0.406358568865935, 65.40661393773334]
Training finished at Epoch 34, with validation result for [5.182854435863008, 0.5933944928628045, 0.31640070563662714, 75.91744121224168]
Training finished at Epoch 52, with validation result for [5.038227402424316, 0.37519014518580557, 0.12053911204039847, 89.4617149914048]
Training finished at Epoch 45, with validation result for [5.143470123810638, 0.4661375938514208, 0.15359912127589115, 84.74388235303277]
Training finished at Epoch 76, with validation result for [4.661333931151922, 0.440831447413196, 0.18973198793841595, 70.28117837374187]
Training finished at Epoch 58, with validation result for [5.350446975264251, 0.03276725182800031, -0.025242451386742637, 84.84703352648516]
Training finished at Epoch 37, with validation result for [6.108810282594312, -0.1602686929692644, -0.03718484135791811, 115.10708637216408]
Training finished at Epoch 64, with validation result for [5.654980309359186, 0.03103240632312835, -0.028533481645686587, 109.96592344548465]
Training finished at Epoch 37, with validation result for [4.827204570006315, 0.44306582589212434, 0.17764869910914527, 80.10079265290919]
Training finished at Epoch 48, with validation result for [4.9527501525279725, 0.4182231067657513, 0.15803080955861082, 76.04106497401546]
Training finished at Epoch 77, with validation result for [4.8973447083686406, 0.40174224810777603, 0.14126510827129724, 79.16112457668208]
Training finished at Epoch 37, with validation result for [5.173929781376919, 0.40827161188265704, 0.13125213141301284, 89.17467250578288]
Training finished at Epoch 65, with validation result for [4.681922100493865, 0.506986294870392, 0.23988239595525895, 61.5323300028389]
Training finished at Epoch 74, with validation result for [5.063050503701525, 0.43328642195253636, 0.18299805103051603, 86.30722553590141]
Training finished at Epoch 122, with validation result for [4.715809119944481, 0.49478071786887984, 0.17836004775772318, 72.90040350286806]
Training finished at Epoch 49, with validation result for [4.722084453529724, 0.4282894932688087, 0.15269056836968087, 81.35208719812313]
Training finished at Epoch 74, with validation result for [7.931310064788225, 0.5409634438796851, -0.0007207915144138433, 102.16998850271894]
Training finished at Epoch 66, with validation result for [5.214826242325749, 0.5961046488571566, 0.3456141276792437, 66.24753930991302]
Training finished at Epoch 107, with validation result for [4.680978269047908, 0.5987512140718438, 0.3334322042182508, 70.02677390716629]
Training finished at Epoch 43, with validation result for [4.589536674939637, 0.4508137543205198, 0.18741317351693298, 76.90502049154786]
Training finished at Epoch 65, with validation result for [4.459234874294784, 0.5272968338814806, 0.23499214063206864, 58.22414312056742]
Training finished at Epoch 52, with validation result for [5.671365154922666, 0.539612507051141, 0.28795873786704584, 75.82761410738553]
Training finished at Epoch 69, with validation result for [4.481398494804069, 0.48880945999309333, 0.18003976355538553, 62.961461079741845]
Training finished at Epoch 107, with validation result for [4.8334885863559975, 0.438466968106294, 0.18043284472875432, 83.06731457565859]
Training finished at Epoch 66, with validation result for [4.725588384581352, 0.44468448951351514, 0.1568061770894431, 82.44975990117571]
Training finished at Epoch 89, with validation result for [5.033626337354501, 0.43100515320636434, 0.15744672034782226, 87.29259460157071]
Training finished at Epoch 99, with validation result for [4.68909827518283, 0.39742450036318816, 0.14581812637860958, 83.94407357886124]
Training finished at Epoch 80, with validation result for [5.3992991744166074, 0.5657804311296776, 0.258478673223168, 80.07780227288298]
Training finished at Epoch 33, with validation result for [5.441634460050452, 0.48504128503512617, 0.07900855690881325, 80.81757772220413]
Training finished at Epoch 104, with validation result for [5.91257192830912, -0.0391284733587756, -0.052119539779599044, 112.31103385517054]
Training finished at Epoch 41, with validation result for [5.158736180006007, 0.4190377657508424, 0.12319871511536962, 92.3823391410799]
Training finished at Epoch 44, with validation result for [4.932917244752013, 0.5385719661275118, 0.2665857962356182, 65.32366059688803]
[I 2024-04-20 22:33:13,068] Trial 175 finished with values: [5.321839329386891, 0.18099311733463275, -0.07079043941585517, 71.42470097343704] and parameters: {'dropout': 0.47140953338649033, 'loss_fn': 'MAE', 'optimizer': 'RMSprop', 'lr': 0.0017630080456605044, 'weight_decay': 0.019071566191676756}. 
[I 2024-04-20 22:34:19,933] Trial 176 finished with values: [5.280668080887549, 0.22127987668115653, -0.03992541751878953, 69.36591815432715] and parameters: {'dropout': 0.30637133564849045, 'loss_fn': 'MAE', 'optimizer': 'RMSprop', 'lr': 0.012823337009159063, 'weight_decay': 0.000445889185084419}. 
[I 2024-04-20 22:35:03,274] Trial 177 finished with values: [4.941453322427676, 0.41683097343675996, 0.10915839235799785, 59.42161332261872] and parameters: {'dropout': 0.47140953338649033, 'loss_fn': 'MAE', 'optimizer': 'RMSprop', 'lr': 0.016032538889276752, 'weight_decay': 1.809829017769436e-05}. 
[I 2024-04-20 22:36:21,059] Trial 178 finished with values: [4.5858601256373115, 0.5228019342316439, 0.23741908332970674, 50.866268446455756] and parameters: {'dropout': 0.20145961770575083, 'loss_fn': 'MAE', 'optimizer': 'Adam', 'lr': 0.0001929641914798421, 'weight_decay': 0.00030768246874286195}. 
[I 2024-04-20 22:38:03,190] Trial 179 finished with values: [4.454463620206931, 0.5518589876762016, 0.27089735294579176, 48.63317473510227] and parameters: {'dropout': 0.6038554864781569, 'loss_fn': 'MAE', 'optimizer': 'Adam', 'lr': 0.000141601199311595, 'weight_decay': 5.669059377844915e-05}. 
[I 2024-04-20 22:39:08,619] Trial 180 finished with values: [5.269500847604307, 0.17890861345785758, -0.023953986503644442, 68.30057927719173] and parameters: {'dropout': 0.31377357982385545, 'loss_fn': 'MSE', 'optimizer': 'SGD', 'lr': 0.0001491541885129046, 'weight_decay': 1.4907661237417258e-05}. 
[I 2024-04-20 22:40:34,828] Trial 181 finished with values: [4.595682125654326, 0.515531052957756, 0.25799355146401426, 49.49389418900339] and parameters: {'dropout': 0.39194832009245817, 'loss_fn': 'MAE', 'optimizer': 'Adam', 'lr': 0.004271805895111922, 'weight_decay': 7.047973805145223e-05}. 
[I 2024-04-20 22:41:13,272] Trial 182 finished with values: [5.680884489558084, 0.23249910706067187, -0.18095560371532438, 78.773023883447] and parameters: {'dropout': 0.3757170916790723, 'loss_fn': 'MAE', 'optimizer': 'Adam', 'lr': 0.000141601199311595, 'weight_decay': 0.0015147055767583942}. 
[I 2024-04-20 22:42:09,683] Trial 183 finished with values: [4.762369221187685, 0.4978115939213621, 0.2273626585885946, 51.537059951082604] and parameters: {'dropout': 0.4514832749907628, 'loss_fn': 'MSE', 'optimizer': 'Adam', 'lr': 0.00019711337282298693, 'weight_decay': 0.0051005641935645525}. 
[I 2024-04-20 22:42:57,419] Trial 184 finished with values: [5.53209242888959, 0.2036718216842491, -0.14672588185727076, 76.48980621720678] and parameters: {'dropout': 0.31377357982385545, 'loss_fn': 'MAE', 'optimizer': 'SGD', 'lr': 0.0001491541885129046, 'weight_decay': 1.4907661237417258e-05}. 
[I 2024-04-20 22:44:04,616] Trial 185 finished with values: [4.536350252078339, 0.5241742011468145, 0.2578920723276372, 49.500663129688675] and parameters: {'dropout': 0.30637133564849045, 'loss_fn': 'MAE', 'optimizer': 'RMSprop', 'lr': 0.0025780908544626364, 'weight_decay': 2.015378107650812e-05}. 
[I 2024-04-20 22:45:15,515] Trial 186 finished with values: [4.860962735919994, 0.5102983768851648, 0.17697557662611263, 54.89801848192047] and parameters: {'dropout': 0.3757170916790723, 'loss_fn': 'MSE', 'optimizer': 'Adam', 'lr': 0.0001929641914798421, 'weight_decay': 0.00030768246874286195}. 
[I 2024-04-20 22:46:15,507] Trial 187 finished with values: [5.314548294525335, 0.20864337495449214, -0.06475654273671627, 71.0222232801853] and parameters: {'dropout': 0.6682161638904962, 'loss_fn': 'MAE', 'optimizer': 'Adam', 'lr': 0.0012768966648359554, 'weight_decay': 0.027760248809972944}. 
[I 2024-04-20 22:48:12,886] Trial 188 finished with values: [4.535721093333461, 0.5277529235015924, 0.25074488421488716, 49.977400458453545] and parameters: {'dropout': 0.20547500706126287, 'loss_fn': 'MAE', 'optimizer': 'Adam', 'lr': 0.0011090204813870355, 'weight_decay': 5.669059377844915e-05}. 
[I 2024-04-20 22:49:58,472] Trial 189 finished with values: [4.579719435933261, 0.5075592626652486, 0.22947112972982353, 51.39641906073663] and parameters: {'dropout': 0.31377357982385545, 'loss_fn': 'MAE', 'optimizer': 'RMSprop', 'lr': 0.00045399421120754873, 'weight_decay': 0.005991336114926054}. 
[I 2024-04-20 22:50:40,058] Trial 190 finished with values: [4.866338390950967, 0.4223725957291347, 0.11544695636510649, 59.0021486101722] and parameters: {'dropout': 0.47140953338649033, 'loss_fn': 'MAE', 'optimizer': 'RMSprop', 'lr': 0.000335245518363157, 'weight_decay': 0.000445889185084419}. 
[I 2024-04-20 22:51:34,407] Trial 191 finished with values: [5.07073938843568, 0.43144518635930446, 0.17867935763359477, 54.78437154923957] and parameters: {'dropout': 0.4885373499829369, 'loss_fn': 'MSE', 'optimizer': 'Adam', 'lr': 0.039594764404659276, 'weight_decay': 2.015378107650812e-05}. 
[I 2024-04-20 22:52:22,463] Trial 192 finished with values: [5.207615016486872, 0.47873174442707117, 0.08896709752198606, 60.7684288551849] and parameters: {'dropout': 0.30637133564849045, 'loss_fn': 'MSE', 'optimizer': 'RMSprop', 'lr': 0.00010544036727004168, 'weight_decay': 5.669059377844915e-05}. 
[I 2024-04-20 22:53:19,245] Trial 193 finished with values: [4.923627784455935, 0.44493950745501365, 0.11452890836595142, 59.063384965489945] and parameters: {'dropout': 0.263009311272169, 'loss_fn': 'MAE', 'optimizer': 'Adam', 'lr': 0.000141601199311595, 'weight_decay': 0.001063154140458134}. 
[I 2024-04-20 22:54:15,700] Trial 194 finished with values: [5.191884387462983, 0.45382786490155613, 0.09594286031808008, 60.303126071902255] and parameters: {'dropout': 0.5378023914372095, 'loss_fn': 'MSE', 'optimizer': 'Adam', 'lr': 0.015601647094364027, 'weight_decay': 0.00037248615020422644}. 
