[I 2024-04-21 05:34:41,002] Trial 163 finished with values: [5.316428358437251, 0.25636447417075825, -0.04809089777060094, 69.910578401395] and parameters: {'dropout': 0.6124531667551212, 'num_heads': 4, 'bias': False, 'loss_fn': 'MAE', 'optimizer': 'RMSprop', 'lr': 0.0006958895879007777, 'weight_decay': 0.027048200471411765}. 
[I 2024-04-21 05:35:16,554] Trial 164 finished with values: [5.257050853856616, 0.19927185180302648, -0.04011907360451317, 69.37883555394647] and parameters: {'dropout': 0.6291352684393432, 'num_heads': 4, 'bias': True, 'loss_fn': 'MAE', 'optimizer': 'Adam', 'lr': 0.0020026931174657535, 'weight_decay': 0.00030304918584754363}. 
[I 2024-04-21 05:35:33,511] Trial 165 finished with values: [5.300190151673025, 0.21460244840898676, -0.039611006972469553, 69.3449460962781] and parameters: {'dropout': 0.3123871851320933, 'num_heads': 2, 'bias': True, 'loss_fn': 'MAE', 'optimizer': 'RMSprop', 'lr': 0.0014287209601462371, 'weight_decay': 0.0017662217759353337}. 
[W 2024-04-21 05:41:55,509] Trial 166 failed with parameters: {'dropout': 0.23263101391627533, 'num_heads': 1, 'bias': False, 'loss_fn': 'MAE', 'optimizer': 'SGD', 'lr': 0.0029330059977397314, 'weight_decay': 0.0010233492733634874} because of the following error: The value nan is not acceptable.
[W 2024-04-21 05:41:55,510] Trial 166 failed with value [nan, nan, nan, nan].
[I 2024-04-21 05:42:33,866] Trial 167 finished with values: [4.999875063456874, 0.39966656650061594, 0.13779380493406612, 57.511551647420696] and parameters: {'dropout': 0.6799331143119542, 'num_heads': 1, 'bias': False, 'loss_fn': 'MAE', 'optimizer': 'Adam', 'lr': 0.002295064068704125, 'weight_decay': 1.242118945501002e-05}. 
[I 2024-04-21 05:42:47,355] Trial 168 finished with values: [5.189151848273327, 0.2583525301333665, 0.016519021450082105, 65.6009170611493] and parameters: {'dropout': 0.49759713129295235, 'num_heads': 8, 'bias': True, 'loss_fn': 'MSE', 'optimizer': 'Adam', 'lr': 0.0029330059977397314, 'weight_decay': 0.0129197497864599}. 
[I 2024-04-21 05:43:13,410] Trial 169 finished with values: [8.548210654553644, 0.1819609492554753, -1.0817655215673705, 138.8595512263583] and parameters: {'dropout': 0.3523515642029993, 'num_heads': 2, 'bias': True, 'loss_fn': 'MAE', 'optimizer': 'RMSprop', 'lr': 0.0001083005560110781, 'weight_decay': 4.567853269399096e-05}. 
[W 2024-04-21 05:43:31,605] Trial 170 failed with parameters: {'dropout': 0.5039308466375886, 'num_heads': 2, 'bias': False, 'loss_fn': 'MAE', 'optimizer': 'SGD', 'lr': 0.003922468660665162, 'weight_decay': 0.00016092681250246313} because of the following error: The value nan is not acceptable.
[W 2024-04-21 05:43:31,605] Trial 170 failed with value [5.344166828989842, nan, -0.07510743860035318, 71.7126568278277].
[I 2024-04-21 05:44:06,015] Trial 171 finished with values: [5.7747780334339955, 0.002650378936331137, -0.21877112840864998, 81.29542457358376] and parameters: {'dropout': 0.23263101391627533, 'num_heads': 8, 'bias': True, 'loss_fn': 'MSE', 'optimizer': 'RMSprop', 'lr': 0.0029330059977397314, 'weight_decay': 0.04302132200345548}. 
[I 2024-04-21 05:44:22,333] Trial 172 finished with values: [5.467051905258674, 0.05092558943543854, -0.1303066930328345, 75.39460064864424] and parameters: {'dropout': 0.23263101391627533, 'num_heads': 8, 'bias': True, 'loss_fn': 'MAE', 'optimizer': 'RMSprop', 'lr': 0.0029330059977397314, 'weight_decay': 0.04302132200345548}. 
[I 2024-04-21 05:45:07,250] Trial 173 finished with values: [4.833966829996452, 0.5002886318112311, 0.24250340498609213, 50.52713004869587] and parameters: {'dropout': 0.6122433820616829, 'num_heads': 8, 'bias': False, 'loss_fn': 'MAE', 'optimizer': 'Adam', 'lr': 0.0003198372259492811, 'weight_decay': 1.242118945501002e-05}. 
[I 2024-04-21 05:45:51,941] Trial 174 finished with values: [4.8042885063034815, 0.47737985684810785, 0.19313485702043565, 53.82014952864509] and parameters: {'dropout': 0.4934354255005909, 'num_heads': 8, 'bias': False, 'loss_fn': 'MAE', 'optimizer': 'RMSprop', 'lr': 0.0016801200246028194, 'weight_decay': 1.3344143820661265e-05}. 
[I 2024-04-21 05:46:09,521] Trial 175 finished with values: [5.223880953657721, 0.24744032347340275, -0.003433303131083587, 66.93179261296329] and parameters: {'dropout': 0.39240749140537745, 'num_heads': 2, 'bias': False, 'loss_fn': 'MAE', 'optimizer': 'Adam', 'lr': 0.0004595462048380458, 'weight_decay': 0.008697054954754082}. 
[I 2024-04-21 05:46:24,102] Trial 176 finished with values: [5.086975998471143, 0.31488363914239864, 0.04209659904909613, 63.894821485033525] and parameters: {'dropout': 0.652434859026344, 'num_heads': 1, 'bias': True, 'loss_fn': 'MAE', 'optimizer': 'RMSprop', 'lr': 0.0007652007103363772, 'weight_decay': 3.8599792229348496e-05}. 
[I 2024-04-21 05:46:51,236] Trial 177 finished with values: [5.019578632383978, 0.39797074352444656, 0.1078969798506152, 59.505753045787245] and parameters: {'dropout': 0.6661280330898132, 'num_heads': 4, 'bias': True, 'loss_fn': 'MAE', 'optimizer': 'RMSprop', 'lr': 0.00018565247131226996, 'weight_decay': 4.1451227238323664e-05}. 
[I 2024-04-21 05:47:19,583] Trial 178 finished with values: [4.884961834464303, 0.5027302308787952, 0.18678985306767748, 54.243378942467885] and parameters: {'dropout': 0.3523515642029993, 'num_heads': 2, 'bias': False, 'loss_fn': 'MAE', 'optimizer': 'RMSprop', 'lr': 0.0020026931174657535, 'weight_decay': 0.00016092681250246313}. 
[I 2024-04-21 05:47:42,201] Trial 179 finished with values: [5.195787686893482, 0.48804047220118396, -0.0020904232878193874, 66.84221879187022] and parameters: {'dropout': 0.5323331816379571, 'num_heads': 4, 'bias': False, 'loss_fn': 'MAE', 'optimizer': 'RMSprop', 'lr': 0.002295064068704125, 'weight_decay': 6.24075916043652e-05}. 
[I 2024-04-21 05:48:01,455] Trial 180 finished with values: [8.56215367611433, 0.116330465905657, -1.159898135919927, 144.07121394856992] and parameters: {'dropout': 0.5874682842915022, 'num_heads': 2, 'bias': False, 'loss_fn': 'MSE', 'optimizer': 'RMSprop', 'lr': 0.00010423634674715621, 'weight_decay': 0.004256857040692242}. 
[I 2024-04-21 05:48:29,295] Trial 181 finished with values: [6.475844355798799, 0.20549119576348268, -0.25660510122914637, 83.81905580512077] and parameters: {'dropout': 0.3629852321658984, 'num_heads': 4, 'bias': False, 'loss_fn': 'MAE', 'optimizer': 'Adam', 'lr': 0.0004595462048380458, 'weight_decay': 6.0239055358915006e-05}. 
[I 2024-04-21 05:49:10,160] Trial 182 finished with values: [5.38302998194696, 0.3703210222231081, 0.008354887757999307, 66.14548748893748] and parameters: {'dropout': 0.6743190118008842, 'num_heads': 8, 'bias': False, 'loss_fn': 'MAE', 'optimizer': 'RMSprop', 'lr': 0.0001083005560110781, 'weight_decay': 4.567853269399096e-05}. 
[I 2024-04-21 05:49:26,037] Trial 183 finished with values: [5.251331021216437, 0.24550027679808845, 0.012630778253485797, 65.86027369845772] and parameters: {'dropout': 0.23263101391627533, 'num_heads': 4, 'bias': True, 'loss_fn': 'MAE', 'optimizer': 'RMSprop', 'lr': 0.0029330059977397314, 'weight_decay': 0.04302132200345548}. 
[I 2024-04-21 05:49:45,671] Trial 184 finished with values: [4.903789513230838, 0.4674481065474309, 0.13166074261407779, 57.92064396477048] and parameters: {'dropout': 0.3523515642029993, 'num_heads': 8, 'bias': False, 'loss_fn': 'MAE', 'optimizer': 'RMSprop', 'lr': 0.00028094742988670466, 'weight_decay': 1.3344143820661265e-05}. 
[I 2024-04-21 05:50:06,202] Trial 185 finished with values: [7.831695598967341, 0.16224767023903722, -0.8866530348398403, 125.8450056087303] and parameters: {'dropout': 0.6743190118008842, 'num_heads': 8, 'bias': False, 'loss_fn': 'MSE', 'optimizer': 'RMSprop', 'lr': 0.0003198372259492811, 'weight_decay': 1.242118945501002e-05}. 
[I 2024-04-21 05:50:58,712] Trial 186 finished with values: [5.429256589815576, 0.40989635872706004, 0.10078071213919437, 59.98042789777083] and parameters: {'dropout': 0.6799331143119542, 'num_heads': 8, 'bias': False, 'loss_fn': 'MAE', 'optimizer': 'Adam', 'lr': 0.0003198372259492811, 'weight_decay': 1.242118945501002e-05}. 
[I 2024-04-21 05:51:36,495] Trial 187 finished with values: [5.212777655931664, 0.25866444905900643, 0.04227994976293947, 63.882591482385514] and parameters: {'dropout': 0.39044445188888177, 'num_heads': 1, 'bias': True, 'loss_fn': 'MAE', 'optimizer': 'RMSprop', 'lr': 0.0014938197620523084, 'weight_decay': 4.221917657289298e-05}. 
[I 2024-04-21 05:52:04,683] Trial 188 finished with values: [5.211689516000936, 0.3670064418259006, 0.11871298276709663, 58.78429556391157] and parameters: {'dropout': 0.6661280330898132, 'num_heads': 2, 'bias': True, 'loss_fn': 'MAE', 'optimizer': 'RMSprop', 'lr': 0.00018565247131226996, 'weight_decay': 4.1451227238323664e-05}. 
[I 2024-04-21 05:52:21,014] Trial 189 finished with values: [7.1888044381200755, -0.03635577085938607, -0.6246350785393291, 108.36767905672599] and parameters: {'dropout': 0.507115799196707, 'num_heads': 2, 'bias': True, 'loss_fn': 'MSE', 'optimizer': 'RMSprop', 'lr': 0.0014938197620523084, 'weight_decay': 0.00034527556480358935}. 
[I 2024-04-21 05:52:46,954] Trial 190 finished with values: [6.703927239138222, 0.3124959604931884, -0.269852716781642, 84.70270861394137] and parameters: {'dropout': 0.3523515642029993, 'num_heads': 2, 'bias': False, 'loss_fn': 'MAE', 'optimizer': 'RMSprop', 'lr': 0.00028094742988670466, 'weight_decay': 1.242118945501002e-05}. 
[I 2024-04-21 05:53:10,020] Trial 191 finished with values: [5.1698234315930565, 0.26804706511017123, 0.012328430324559547, 65.8804411463715] and parameters: {'dropout': 0.6799331143119542, 'num_heads': 8, 'bias': False, 'loss_fn': 'MAE', 'optimizer': 'RMSprop', 'lr': 0.002295064068704125, 'weight_decay': 1.242118945501002e-05}. 
[I 2024-04-21 05:53:44,416] Trial 192 finished with values: [5.897034836369522, 0.29583372584132095, -0.07863985320589939, 71.94827870828918] and parameters: {'dropout': 0.6291352684393432, 'num_heads': 2, 'bias': False, 'loss_fn': 'MAE', 'optimizer': 'RMSprop', 'lr': 0.0002316368618636525, 'weight_decay': 4.820429182972681e-05}. 
[I 2024-04-21 05:54:02,117] Trial 193 finished with values: [7.343705169789741, 0.17754838354642183, -0.5078698619694713, 100.57911430062828] and parameters: {'dropout': 0.3523515642029993, 'num_heads': 8, 'bias': False, 'loss_fn': 'MAE', 'optimizer': 'RMSprop', 'lr': 0.00036501068151543, 'weight_decay': 4.567853269399096e-05}. 
[I 2024-04-21 05:54:39,578] Trial 194 finished with values: [5.291882337043342, 0.30646961711380233, 0.06343423025192318, 62.471542127986964] and parameters: {'dropout': 0.3523515642029993, 'num_heads': 2, 'bias': False, 'loss_fn': 'MSE', 'optimizer': 'RMSprop', 'lr': 0.0014938197620523084, 'weight_decay': 1.3344143820661265e-05}. 
[I 2024-04-21 05:55:00,116] Trial 195 finished with values: [5.176072148122472, 0.385047139466275, 0.0776350807616707, 61.52430589586248] and parameters: {'dropout': 0.3344998495842664, 'num_heads': 1, 'bias': False, 'loss_fn': 'MAE', 'optimizer': 'RMSprop', 'lr': 0.0011480397613471813, 'weight_decay': 3.8599792229348496e-05}. 
[I 2024-04-21 05:55:19,320] Trial 196 finished with values: [5.29578517164695, 0.25286680924986127, -0.032994993061195466, 68.90363956434207] and parameters: {'dropout': 0.6799331143119542, 'num_heads': 1, 'bias': False, 'loss_fn': 'MAE', 'optimizer': 'Adam', 'lr': 0.002295064068704125, 'weight_decay': 0.00219078254882845}. 
[I 2024-04-21 05:56:00,085] Trial 197 finished with values: [8.16105126988603, 0.2601904386143981, -1.1548351657067748, 143.73349975146792] and parameters: {'dropout': 0.4591224360083581, 'num_heads': 2, 'bias': True, 'loss_fn': 'MSE', 'optimizer': 'Adam', 'lr': 0.0014938197620523084, 'weight_decay': 0.0009823700199596424}. 
[I 2024-04-21 05:56:16,910] Trial 198 finished with values: [5.352100998355901, -0.14095394412929638, -0.08089457300764114, 72.09867479111762] and parameters: {'dropout': 0.4934354255005909, 'num_heads': 1, 'bias': True, 'loss_fn': 'MAE', 'optimizer': 'SGD', 'lr': 0.018352723501727505, 'weight_decay': 0.00016092681250246313}. 
[I 2024-04-21 05:56:55,645] Trial 199 finished with values: [9.522985432079933, 0.2044431777749455, -2.0403225502088067, 202.79797149657492] and parameters: {'dropout': 0.4244817098248359, 'num_heads': 2, 'bias': False, 'loss_fn': 'MSE', 'optimizer': 'Adam', 'lr': 0.00015587385647697547, 'weight_decay': 0.00219078254882845}. 
[I 2024-04-21 05:57:24,001] Trial 200 finished with values: [5.1118776555729495, 0.3744364900442401, 0.12840490824534256, 58.13781717406137] and parameters: {'dropout': 0.6036800503860398, 'num_heads': 2, 'bias': True, 'loss_fn': 'MAE', 'optimizer': 'Adam', 'lr': 0.0009964606938187815, 'weight_decay': 2.4265340760230575e-05}. 
[I 2024-04-21 05:58:12,390] Trial 201 finished with values: [5.393627405290845, 0.19708855078351836, -0.08399082375433675, 72.30520332889776] and parameters: {'dropout': 0.4763883818109295, 'num_heads': 8, 'bias': True, 'loss_fn': 'MSE', 'optimizer': 'RMSprop', 'lr': 0.0029330059977397314, 'weight_decay': 0.04302132200345548}. 
[I 2024-04-21 05:58:31,908] Trial 202 finished with values: [15.366857835746911, 0.1215809048587083, -7.589264671847928, 572.927846743867] and parameters: {'dropout': 0.3123871851320933, 'num_heads': 2, 'bias': True, 'loss_fn': 'MSE', 'optimizer': 'RMSprop', 'lr': 0.0001387213039796065, 'weight_decay': 0.04024928206152939}. 
[I 2024-04-21 05:59:05,249] Trial 203 finished with values: [5.362022771509006, -0.14047869503457666, -0.08819403774781098, 72.58556939452592] and parameters: {'dropout': 0.6799331143119542, 'num_heads': 2, 'bias': False, 'loss_fn': 'MAE', 'optimizer': 'Adam', 'lr': 0.002295064068704125, 'weight_decay': 6.24075916043652e-05}. 
[I 2024-04-21 05:59:28,018] Trial 204 finished with values: [5.317211064102605, 0.1928788112432627, -0.01238460945469666, 67.52886964498693] and parameters: {'dropout': 0.570948598139843, 'num_heads': 8, 'bias': False, 'loss_fn': 'MAE', 'optimizer': 'Adam', 'lr': 0.002127848460471393, 'weight_decay': 0.06669533406194808}. 
