[I 2024-04-20 20:19:20,977] Trial 57 finished with values: [4.366304538569817, 0.5591517515143407, 0.29764252658496215, 46.84919725515531] and parameters: {'dropout': 0.31377357982385545, 'loss_fn': 'MAE', 'optimizer': 'RMSprop', 'lr': 0.0001491541885129046, 'weight_decay': 1.4907661237417258e-05}. 
Training finished at Epoch 98, with validation result for [5.240537537467714, 0.6265338143469343, 0.35370926555985993, 66.88149122803107]
Training finished at Epoch 34, with validation result for [4.717063013985688, 0.6037245046608087, 0.3475353199194997, 64.5894547748464]
Training finished at Epoch 43, with validation result for [6.101024937750693, -0.12359723864117667, -0.06556279356262329, 112.29398266280316]
Training finished at Epoch 78, with validation result for [5.020951705128536, 0.5625198220680775, 0.29739090248474964, 76.99502915508306]
Training finished at Epoch 62, with validation result for [4.487074584379971, 0.5058802876205458, 0.16366856810726782, 53.458809361175184]
Training finished at Epoch 67, with validation result for [5.3567397676504385, -0.15642202540924285, -0.046922125715699314, 104.33574895424191]
Training finished at Epoch 77, with validation result for [5.1113067973596555, 0.6058235328005842, 0.36429001745635425, 60.06751710041604]
Training finished at Epoch 107, with validation result for [4.570122637203249, 0.587613867238821, 0.3326368477989283, 49.13901081580551]
Training finished at Epoch 80, with validation result for [5.143567050434254, 0.5559845764507726, 0.2719810320948738, 77.00160721472473]
Training finished at Epoch 90, with validation result for [5.972358984597929, 0.5117681979049264, 0.18517890684804783, 70.04788334552696]
Training finished at Epoch 37, with validation result for [4.355510845327387, 0.5691731322413225, 0.2921161603800493, 51.97864649672777]
Training finished at Epoch 34, with validation result for [5.974594768681311, -0.17328371673176765, -0.029825259012961736, 114.42417134861925]
Training finished at Epoch 105, with validation result for [5.6996208664010695, -0.05866804692240837, -0.039722560764853476, 102.14362055047998]
Training finished at Epoch 84, with validation result for [5.301442892496555, 0.14689612170143515, -0.011919918918170014, 93.12095886370473]
Training finished at Epoch 55, with validation result for [5.247170491105318, -0.07827040893338456, -0.04055265583687384, 78.60970610518086]
Training finished at Epoch 56, with validation result for [5.619052115464757, -0.12729482751564028, -0.03950688472090702, 109.26766334299128]
Training finished at Epoch 39, with validation result for [5.071125930551963, 0.09079102889342217, -0.03411325454313996, 81.02305982422219]
Training finished at Epoch 82, with validation result for [5.091058815416033, 0.5504047621811591, 0.28428770495191924, 63.23603654024598]
Training finished at Epoch 67, with validation result for [5.763844509896832, 0.012116151989809788, -0.0225140486672728, 110.86039596093757]
Training finished at Epoch 76, with validation result for [5.446405159025992, -0.12210348952328327, -0.04414726341519648, 97.95604696407577]
Training finished at Epoch 51, with validation result for [5.645561572450116, 0.0734114228289215, -0.02410920264231975, 109.08149521104126]
Training finished at Epoch 67, with validation result for [5.403471184538677, -0.1533578638723167, -0.004245966225388198, 94.43539793912431]
Training finished at Epoch 48, with validation result for [4.8953994861244245, 0.5580944500659873, 0.31023943163911805, 70.39480391445483]
Training finished at Epoch 66, with validation result for [5.558932879198076, 0.06258140134131815, -0.05505490566371041, 99.3300153886558]
Training finished at Epoch 105, with validation result for [4.86631055215316, 0.5536275279437092, 0.30140509203698007, 57.95924944535511]
Training finished at Epoch 55, with validation result for [4.952147339767821, 0.3283555415383261, 0.09743018477174836, 88.11254548430423]
Training finished at Epoch 57, with validation result for [5.417556516374803, -0.053683595592064565, -0.02874463147164641, 100.00129271031676]
Training finished at Epoch 43, with validation result for [5.417669007262764, -0.15434069973283462, -0.04562292440417237, 97.59064348880388]
Training finished at Epoch 85, with validation result for [4.906565386241913, 0.4959078812202725, 0.21654889790084286, 82.52364038043707]
Training finished at Epoch 55, with validation result for [4.443711923066858, 0.5654459285893138, 0.2810825145742619, 63.14500959726993]
Training finished at Epoch 41, with validation result for [5.021995060651071, 0.556378610768209, 0.264469352504898, 72.11820972288417]
Training finished at Epoch 87, with validation result for [5.098719879615692, 0.40034285898485666, 0.13100682210262882, 79.58708859447232]
Training finished at Epoch 37, with validation result for [5.619495445921751, -0.09419128509368299, -0.03990318136300375, 88.92490937639218]
Training finished at Epoch 47, with validation result for [5.0110864380766795, 0.47831481064145165, 0.1820587718465161, 68.92831459421654]
Training finished at Epoch 43, with validation result for [5.368001099212271, -0.011343630376906068, -0.02322504001225867, 98.68693152870412]
Training finished at Epoch 96, with validation result for [4.968845637964527, 0.5798088121925898, 0.24158332891359602, 74.0210497109539]
Training finished at Epoch 39, with validation result for [4.978202602528681, 0.5271000492670643, 0.2661097259748739, 62.35702366309375]
Training finished at Epoch 66, with validation result for [5.4572072506379925, 0.3426058504582536, 0.11470618710971414, 95.28947436887881]
Training finished at Epoch 42, with validation result for [5.763225672651679, -0.15599037704368554, -0.03904590305890454, 112.05705374843211]
Training finished at Epoch 55, with validation result for [5.07862459775741, 0.625025251310577, 0.3759770763067125, 59.89850740454606]
Training finished at Epoch 107, with validation result for [5.026302112889231, 0.36635981723032157, 0.11297681754559641, 93.40840936655822]
Training finished at Epoch 49, with validation result for [6.1858122358518735, -0.1384198279909669, -0.10536431863529083, 119.50543149196277]
Training finished at Epoch 84, with validation result for [5.399776833439229, -0.033246221121809603, -0.03415239653673119, 99.47436845215746]
Training finished at Epoch 56, with validation result for [5.4313265950722736, -0.15782741715979756, -0.048804598831446944, 97.82471548848275]
Training finished at Epoch 39, with validation result for [4.984735954116744, 0.48528178092460733, 0.1652650859465774, 82.5749644802383]
Training finished at Epoch 67, with validation result for [5.01349940113191, 0.5540682834696691, 0.2810804857393181, 71.57033252381645]
Training finished at Epoch 73, with validation result for [5.685326590943927, -0.024465350330142004, -0.09473629322118504, 103.60643196958387]
Training finished at Epoch 79, with validation result for [5.561823588789205, 0.5309210864339431, 0.2762113944594662, 74.74206542863335]
Training finished at Epoch 56, with validation result for [4.892576705731265, 0.5717411370388782, 0.24342568866044056, 61.75170388510973]
Training finished at Epoch 44, with validation result for [5.406501584984961, 0.07862322075943841, -0.02830573065811115, 92.3765750610197]
Training finished at Epoch 66, with validation result for [5.225922969987841, 0.5390122137894985, 0.19229589132309266, 87.27229369168414]
Training finished at Epoch 83, with validation result for [5.456320416621575, 0.417029321854034, 0.1216894614724473, 97.82106715200683]
Training finished at Epoch 64, with validation result for [5.804658145967804, -0.10273649228515834, -0.032414734488780406, 113.19916639933399]
Training finished at Epoch 66, with validation result for [4.833296966298087, 0.5968056040303299, 0.3344331587766649, 61.56315237877167]
Training finished at Epoch 63, with validation result for [4.676464440587842, 0.468108580473497, 0.15259161471701832, 69.39972212969757]
Training finished at Epoch 70, with validation result for [4.5501799247370585, 0.46672957056762776, 0.18698399674114563, 64.25497297338269]
Training finished at Epoch 39, with validation result for [4.826617031884985, 0.5050068560004456, 0.2430489002271785, 49.403554299698264]
Training finished at Epoch 112, with validation result for [4.876175982869079, 0.3828926900208245, 0.12502648512023884, 78.78941727579037]
[I 2024-04-20 20:20:09,918] Trial 58 finished with values: [5.319652512785843, 0.1927180641327593, -0.05413523846526269, 70.31375273953468] and parameters: {'dropout': 0.6043148734461228, 'loss_fn': 'MAE', 'optimizer': 'SGD', 'lr': 0.006708796619262194, 'weight_decay': 0.00037248615020422644}. 
[I 2024-04-20 20:21:33,456] Trial 59 finished with values: [4.978442553478119, 0.5131075234603892, 0.23556034842363693, 50.99025123521445] and parameters: {'dropout': 0.5359315389247657, 'loss_fn': 'MSE', 'optimizer': 'Adam', 'lr': 0.03013995500819378, 'weight_decay': 0.00015241729655882263}. 
[I 2024-04-20 20:22:10,173] Trial 60 finished with values: [5.30709806816039, 0.19969851542187475, -0.01947004407751618, 68.00148784419105] and parameters: {'dropout': 0.6682161638904962, 'loss_fn': 'MSE', 'optimizer': 'SGD', 'lr': 0.00021670629740501015, 'weight_decay': 0.0051005641935645525}. 
[I 2024-04-20 20:22:45,300] Trial 61 finished with values: [4.825125555538053, 0.4515307831337569, 0.17228284727326793, 55.21103658372482] and parameters: {'dropout': 0.3757170916790723, 'loss_fn': 'MAE', 'optimizer': 'Adam', 'lr': 0.014438792443322607, 'weight_decay': 2.015378107650812e-05}. 
[I 2024-04-20 20:23:53,376] Trial 62 finished with values: [4.525333356534116, 0.5549513811203687, 0.27168732453853195, 48.58048143236812] and parameters: {'dropout': 0.4133409388264626, 'loss_fn': 'MSE', 'optimizer': 'Adam', 'lr': 0.0001929641914798421, 'weight_decay': 5.669059377844915e-05}. 
[I 2024-04-20 20:24:25,559] Trial 63 finished with values: [5.3234963493500285, 0.143245539853376, -0.04276434008194219, 69.55528218644396] and parameters: {'dropout': 0.47140953338649033, 'loss_fn': 'MAE', 'optimizer': 'Adam', 'lr': 0.06827138940203921, 'weight_decay': 0.001117831550446904}. 
[I 2024-04-20 20:25:01,363] Trial 64 finished with values: [5.340416203776417, 0.22021294745166264, -0.07761961836643949, 71.88022620646552] and parameters: {'dropout': 0.2823453507187392, 'loss_fn': 'MAE', 'optimizer': 'RMSprop', 'lr': 0.0008016721638355649, 'weight_decay': 0.07227786718068017}. 
[I 2024-04-20 20:25:44,200] Trial 65 finished with values: [5.3377458237808755, 0.1766155291276956, -0.08185909755996312, 72.16301126181746] and parameters: {'dropout': 0.6232563347468021, 'loss_fn': 'MAE', 'optimizer': 'RMSprop', 'lr': 0.007141614081850959, 'weight_decay': 0.0015147055767583942}. 
[I 2024-04-20 20:26:22,503] Trial 66 finished with values: [5.3544589015132855, -0.023823122257998597, -0.08844227972827179, 72.60212782516818] and parameters: {'dropout': 0.556339606855222, 'loss_fn': 'MAE', 'optimizer': 'SGD', 'lr': 0.001710457429478698, 'weight_decay': 7.047973805145223e-05}. 
[I 2024-04-20 20:27:42,694] Trial 67 finished with values: [4.621578194747886, 0.5346579816901095, 0.2747577520020539, 48.37567537940941] and parameters: {'dropout': 0.6682161638904962, 'loss_fn': 'MSE', 'optimizer': 'Adam', 'lr': 0.0017630080456605044, 'weight_decay': 0.0051005641935645525}. 
[I 2024-04-20 20:28:12,323] Trial 68 finished with values: [5.391817787115138, 0.4309547830267799, 0.09785438288379955, 60.1756221994032] and parameters: {'dropout': 0.5964440428462197, 'loss_fn': 'MSE', 'optimizer': 'Adam', 'lr': 0.004774746875441888, 'weight_decay': 0.0001736787544116205}. 
[I 2024-04-20 20:29:01,705] Trial 69 finished with values: [5.061132761964518, 0.4340293571454745, 0.07674821935001264, 61.583462019041086] and parameters: {'dropout': 0.20547500706126287, 'loss_fn': 'MAE', 'optimizer': 'Adam', 'lr': 0.0003013348185610749, 'weight_decay': 0.019071566191676756}. 
[I 2024-04-20 20:29:51,022] Trial 70 finished with values: [4.473062994964799, 0.5457986451624258, 0.2663789249050301, 48.93456645452914] and parameters: {'dropout': 0.20547500706126287, 'loss_fn': 'MAE', 'optimizer': 'RMSprop', 'lr': 0.0006275517683350238, 'weight_decay': 5.669059377844915e-05}. 
[I 2024-04-20 20:30:44,978] Trial 71 finished with values: [5.023021098516405, 0.5099609467923455, 0.04654917493064825, 63.597822287809755] and parameters: {'dropout': 0.47140953338649033, 'loss_fn': 'MAE', 'optimizer': 'Adam', 'lr': 0.0017630080456605044, 'weight_decay': 0.019071566191676756}. 
[I 2024-04-20 20:31:25,350] Trial 72 finished with values: [5.044733314122805, 0.43334037722931323, 0.042318176705833044, 63.88004163895696] and parameters: {'dropout': 0.5680348289444859, 'loss_fn': 'MAE', 'optimizer': 'Adam', 'lr': 0.00013031592875001013, 'weight_decay': 0.0026590320386047504}. 
[I 2024-04-20 20:32:13,545] Trial 73 finished with values: [4.661723522618166, 0.5066480256807055, 0.2491882880134466, 50.081229755141074] and parameters: {'dropout': 0.5250684878848557, 'loss_fn': 'MSE', 'optimizer': 'RMSprop', 'lr': 0.014438792443322607, 'weight_decay': 2.015378107650812e-05}. 
[I 2024-04-20 20:33:21,260] Trial 74 finished with values: [4.955963013540502, 0.4621174786195236, 0.14076163222718785, 57.31358931123504] and parameters: {'dropout': 0.20380061983350556, 'loss_fn': 'MSE', 'optimizer': 'SGD', 'lr': 0.003257742482901628, 'weight_decay': 0.0001736787544116205}. 
[I 2024-04-20 20:34:19,702] Trial 75 finished with values: [4.417021843628325, 0.5547319937552265, 0.26710033929643584, 48.88644610783255] and parameters: {'dropout': 0.6043148734461228, 'loss_fn': 'MAE', 'optimizer': 'RMSprop', 'lr': 0.000141601199311595, 'weight_decay': 0.003425512443848347}. 
[I 2024-04-20 20:35:33,520] Trial 76 finished with values: [5.289012026642153, 0.22615744091870998, -0.04290251766965558, 69.56449901591905] and parameters: {'dropout': 0.39194832009245817, 'loss_fn': 'MAE', 'optimizer': 'RMSprop', 'lr': 0.001710457429478698, 'weight_decay': 0.014275911878362564}. 
[I 2024-04-20 20:36:25,825] Trial 77 finished with values: [4.863241527506159, 0.42881906065824926, 0.1263036621310657, 58.277976135011464] and parameters: {'dropout': 0.343986897604069, 'loss_fn': 'MAE', 'optimizer': 'RMSprop', 'lr': 0.0001491541885129046, 'weight_decay': 0.0015147055767583942}. 
[I 2024-04-20 20:38:29,928] Trial 78 finished with values: [4.669675339640202, 0.5052836838665649, 0.20316218422788623, 53.15129891045534] and parameters: {'dropout': 0.45902369848893865, 'loss_fn': 'MAE', 'optimizer': 'Adam', 'lr': 0.006324594413501705, 'weight_decay': 0.0008187484524651352}. 
[I 2024-04-20 20:39:34,738] Trial 79 finished with values: [5.427774699794071, 0.12427419999247442, -0.12320075852696655, 74.92061505021537] and parameters: {'dropout': 0.40075659260750807, 'loss_fn': 'MAE', 'optimizer': 'RMSprop', 'lr': 0.018089952717467436, 'weight_decay': 0.000445889185084419}. 
[I 2024-04-20 20:41:10,262] Trial 80 finished with values: [5.074689795927545, 0.43913854128210633, 0.14749937574211525, 56.864163076114814] and parameters: {'dropout': 0.667312924057412, 'loss_fn': 'MSE', 'optimizer': 'Adam', 'lr': 0.035262766304496984, 'weight_decay': 3.433949399908561e-05}. 
[I 2024-04-20 20:42:51,337] Trial 81 finished with values: [4.702125774380844, 0.510151548430085, 0.239693998445766, 50.714525279984144] and parameters: {'dropout': 0.4514832749907628, 'loss_fn': 'MSE', 'optimizer': 'Adam', 'lr': 0.0008016721638355649, 'weight_decay': 0.00037248615020422644}. 
[I 2024-04-20 20:44:32,156] Trial 82 finished with values: [4.60111247619163, 0.5387536474269531, 0.27432618135105624, 48.40446234234983] and parameters: {'dropout': 0.39194832009245817, 'loss_fn': 'MAE', 'optimizer': 'Adam', 'lr': 0.004271805895111922, 'weight_decay': 7.047973805145223e-05}. 
[I 2024-04-20 20:46:08,004] Trial 83 finished with values: [4.77829524670025, 0.49112691132837416, 0.22925366902545652, 51.41092429463783] and parameters: {'dropout': 0.4773211130217321, 'loss_fn': 'MSE', 'optimizer': 'Adam', 'lr': 0.0001929641914798421, 'weight_decay': 0.00030768246874286195}. 
[I 2024-04-20 20:47:48,011] Trial 84 finished with values: [5.4812335269187935, 0.17663258242430924, 0.005588611724304693, 66.33000579545542] and parameters: {'dropout': 0.343986897604069, 'loss_fn': 'MSE', 'optimizer': 'SGD', 'lr': 0.0132955668746334, 'weight_decay': 0.0007146500136965313}. 
[I 2024-04-20 20:49:07,841] Trial 85 finished with values: [4.972374614474975, 0.4994763382456836, 0.233052892732176, 51.157505504933596] and parameters: {'dropout': 0.4514832749907628, 'loss_fn': 'MSE', 'optimizer': 'RMSprop', 'lr': 0.00019711337282298693, 'weight_decay': 0.00037248615020422644}. 
[I 2024-04-20 20:50:28,231] Trial 86 finished with values: [5.341380178447736, 0.2074951357328442, -0.07786725567866637, 71.89674430405455] and parameters: {'dropout': 0.4938251829506093, 'loss_fn': 'MAE', 'optimizer': 'SGD', 'lr': 0.001788195274478175, 'weight_decay': 0.03556672834682334}. 
[I 2024-04-20 20:52:10,214] Trial 87 finished with values: [4.790773664582672, 0.5111968825671978, 0.1331356423366169, 57.82226405048432] and parameters: {'dropout': 0.30637133564849045, 'loss_fn': 'MAE', 'optimizer': 'RMSprop', 'lr': 0.014438792443322607, 'weight_decay': 2.015378107650812e-05}. 
[I 2024-04-20 20:53:02,914] Trial 88 finished with values: [5.3538853128039365, 0.18769809074275132, -0.007242028012844459, 67.18584515747261] and parameters: {'dropout': 0.6429336265507928, 'loss_fn': 'MSE', 'optimizer': 'SGD', 'lr': 0.00021670629740501015, 'weight_decay': 0.000259833166377187}. 
[I 2024-04-20 20:54:29,915] Trial 89 finished with values: [5.278664898554313, 0.2100540883036706, -0.011326334350273415, 67.45827975167194] and parameters: {'dropout': 0.30637133564849045, 'loss_fn': 'MSE', 'optimizer': 'SGD', 'lr': 0.0002925198647073443, 'weight_decay': 1.2366679138067711e-05}. 
[I 2024-04-20 20:56:18,812] Trial 90 finished with values: [4.588817759968773, 0.5292469326348093, 0.27588330735355726, 48.30059770645779] and parameters: {'dropout': 0.6058998462307807, 'loss_fn': 'MAE', 'optimizer': 'Adam', 'lr': 0.0017630080456605044, 'weight_decay': 1.7247938315021415e-05}. 
[I 2024-04-20 20:57:45,187] Trial 91 finished with values: [4.707102114068597, 0.5393052757076375, 0.2389448654557279, 50.76449453431555] and parameters: {'dropout': 0.343986897604069, 'loss_fn': 'MAE', 'optimizer': 'RMSprop', 'lr': 0.0017630080456605044, 'weight_decay': 0.0015147055767583942}. 
[I 2024-04-20 20:59:05,255] Trial 92 finished with values: [5.061013263917887, 0.5230399646980438, 0.24252053409710272, 50.52598748934267] and parameters: {'dropout': 0.28295843110109903, 'loss_fn': 'MSE', 'optimizer': 'Adam', 'lr': 0.00012206461266414429, 'weight_decay': 0.0018853361751123058}. 
[I 2024-04-20 21:00:07,030] Trial 93 finished with values: [5.050897217526845, 0.5125405108911034, 0.24860851161596287, 50.119902453642496] and parameters: {'dropout': 0.20145961770575083, 'loss_fn': 'MSE', 'optimizer': 'RMSprop', 'lr': 0.016032538889276752, 'weight_decay': 1.809829017769436e-05}. 
[I 2024-04-20 21:01:21,077] Trial 94 finished with values: [5.368746352152733, 0.20906957841765203, -0.09164988936038965, 72.81608431037786] and parameters: {'dropout': 0.26996855002078957, 'loss_fn': 'MAE', 'optimizer': 'SGD', 'lr': 0.00021670629740501015, 'weight_decay': 0.0012954553462921545}. 
[I 2024-04-20 21:01:58,243] Trial 95 finished with values: [4.779353314395239, 0.494826124491369, 0.22759785391206722, 51.52137176875391] and parameters: {'dropout': 0.47140953338649033, 'loss_fn': 'MSE', 'optimizer': 'RMSprop', 'lr': 0.000335245518363157, 'weight_decay': 0.00035756652600816603}. 
[I 2024-04-20 21:02:59,871] Trial 96 finished with values: [4.984052880425825, 0.4529982158922326, 0.19865711632203165, 53.45179947171944] and parameters: {'dropout': 0.6032520316374994, 'loss_fn': 'MSE', 'optimizer': 'RMSprop', 'lr': 0.016328628361308568, 'weight_decay': 0.027760248809972944}. 
[I 2024-04-20 21:04:30,312] Trial 97 finished with values: [5.317078860624755, 0.1373017490564463, -0.06900810744379093, 71.30581447290989] and parameters: {'dropout': 0.6043148734461228, 'loss_fn': 'MAE', 'optimizer': 'RMSprop', 'lr': 0.006708796619262194, 'weight_decay': 0.003425512443848347}. 
[I 2024-04-20 21:05:20,551] Trial 98 finished with values: [5.043375501180249, 0.446352054606328, 0.197512458279145, 53.52815134732511] and parameters: {'dropout': 0.37540140564797586, 'loss_fn': 'MSE', 'optimizer': 'Adam', 'lr': 0.004271805895111922, 'weight_decay': 0.05801942307059556}. 
[I 2024-04-20 21:06:01,236] Trial 99 finished with values: [4.823072849583455, 0.45905713431279305, 0.12793948256569254, 58.168862361588914] and parameters: {'dropout': 0.30637133564849045, 'loss_fn': 'MAE', 'optimizer': 'RMSprop', 'lr': 0.000335245518363157, 'weight_decay': 0.000445889185084419}. 
[I 2024-04-20 21:07:27,537] Trial 100 finished with values: [4.970340264048256, 0.5012893009460345, 0.20069023237410588, 53.31618497543862] and parameters: {'dropout': 0.20380842558468565, 'loss_fn': 'MSE', 'optimizer': 'Adam', 'lr': 0.0001929641914798421, 'weight_decay': 2.015378107650812e-05}. 
[I 2024-04-20 21:09:02,508] Trial 101 finished with values: [4.5894067702379395, 0.5161810112619938, 0.23648075445773087, 50.928857592406835] and parameters: {'dropout': 0.38677756745419856, 'loss_fn': 'MAE', 'optimizer': 'Adam', 'lr': 0.0009494654229585645, 'weight_decay': 0.006883981599367302}. 
[I 2024-04-20 21:09:45,343] Trial 102 finished with values: [5.080848604666359, 0.5145840585200655, 0.2299379625082052, 51.36528001580951] and parameters: {'dropout': 0.343986897604069, 'loss_fn': 'MSE', 'optimizer': 'RMSprop', 'lr': 0.0011875097927099526, 'weight_decay': 1.6681546913192385e-05}. 
