[I 2024-04-21 01:14:50,833] Trial 26 finished with values: [5.342998318332551, 0.06858149213163216, -0.07093381650729103, 71.4342646242741] and parameters: {'dropout': 0.22519233998110277, 'num_heads': 2, 'bias': True, 'loss_fn': 'MAE', 'optimizer': 'Adam', 'lr': 0.06266263176737731, 'weight_decay': 1.7259304738591127e-05}. 
[W 2024-04-21 01:18:29,825] Trial 27 failed with parameters: {'dropout': 0.4460684723215964, 'num_heads': 8, 'bias': True, 'loss_fn': 'MAE', 'optimizer': 'SGD', 'lr': 0.00439189019233081, 'weight_decay': 0.006488571278278801} because of the following error: The value nan is not acceptable.
[W 2024-04-21 01:18:29,825] Trial 27 failed with value [nan, nan, nan, nan].
[W 2024-04-21 01:18:47,223] Trial 28 failed with parameters: {'dropout': 0.4760189677168219, 'num_heads': 1, 'bias': False, 'loss_fn': 'MAE', 'optimizer': 'Adam', 'lr': 0.020586908864276623, 'weight_decay': 1.1046167743209243e-05} because of the following error: The value nan is not acceptable.
[W 2024-04-21 01:18:47,223] Trial 28 failed with value [5.349079418774001, nan, -0.07866533174797974, 71.94997819792071].
[I 2024-04-21 01:19:06,228] Trial 29 finished with values: [5.2840760922182834, 0.20822347179961875, -0.022338378139181048, 68.19281370507387] and parameters: {'dropout': 0.4175623535922639, 'num_heads': 8, 'bias': False, 'loss_fn': 'MSE', 'optimizer': 'RMSprop', 'lr': 0.0003464779303760371, 'weight_decay': 0.0037168330157469373}. 
[W 2024-04-21 01:19:25,323] Trial 30 failed with parameters: {'dropout': 0.40866451969991135, 'num_heads': 1, 'bias': False, 'loss_fn': 'MSE', 'optimizer': 'Adam', 'lr': 0.02483276255843442, 'weight_decay': 0.003136836565994983} because of the following error: The value nan is not acceptable.
[W 2024-04-21 01:19:25,323] Trial 30 failed with value [5.476725381032457, nan, -0.13908011008532029, 75.97981197144136].
[W 2024-04-21 01:19:33,541] Trial 31 failed with parameters: {'dropout': 0.359865636462809, 'num_heads': 8, 'bias': True, 'loss_fn': 'MSE', 'optimizer': 'Adam', 'lr': 0.08414131949687723, 'weight_decay': 0.008639625812587549} because of the following error: The value nan is not acceptable.
[W 2024-04-21 01:19:33,541] Trial 31 failed with value [5.932589580203002, nan, -0.2531170902587254, 83.58639577064167].
[I 2024-04-21 01:19:41,001] Trial 32 finished with values: [5.461345102312479, 0.1651616763080583, -0.07816900039840924, 71.91687151623783] and parameters: {'dropout': 0.4622029983473447, 'num_heads': 1, 'bias': True, 'loss_fn': 'MAE', 'optimizer': 'SGD', 'lr': 0.00020297059819746375, 'weight_decay': 0.003006198705678768}. 
[I 2024-04-21 01:19:56,802] Trial 33 finished with values: [5.431228294540982, 0.1654018233184757, -0.0954587928912094, 73.07014877127637] and parameters: {'dropout': 0.6398739387450053, 'num_heads': 4, 'bias': False, 'loss_fn': 'MSE', 'optimizer': 'RMSprop', 'lr': 0.003732613088530846, 'weight_decay': 6.336536341307612e-05}. 
[I 2024-04-21 01:20:18,309] Trial 34 finished with values: [5.2268153324433815, 0.21318772679317938, 0.015201729795314534, 65.68878407888987] and parameters: {'dropout': 0.5308643758909863, 'num_heads': 1, 'bias': True, 'loss_fn': 'MSE', 'optimizer': 'Adam', 'lr': 0.0008974375358981978, 'weight_decay': 0.009624118486563455}. 
[I 2024-04-21 01:20:30,961] Trial 35 finished with values: [5.573705983576318, 0.1379022109068575, -0.11974715145000925, 74.6902498511331] and parameters: {'dropout': 0.31408093469772713, 'num_heads': 1, 'bias': True, 'loss_fn': 'MSE', 'optimizer': 'Adam', 'lr': 0.0003388715864629326, 'weight_decay': 0.03024930306661498}. 
[I 2024-04-21 01:20:44,881] Trial 36 finished with values: [5.406461137408902, -0.20184151578850243, -0.11282514622602746, 74.22853284745013] and parameters: {'dropout': 0.6374826674935149, 'num_heads': 1, 'bias': False, 'loss_fn': 'MAE', 'optimizer': 'Adam', 'lr': 0.013006190876014222, 'weight_decay': 0.08706296017842331}. 
[I 2024-04-21 01:21:03,633] Trial 37 finished with values: [5.354089210145468, 0.06300140504916574, -0.09463326277491979, 73.01508361610676] and parameters: {'dropout': 0.40230299146194626, 'num_heads': 4, 'bias': False, 'loss_fn': 'MSE', 'optimizer': 'Adam', 'lr': 0.0046679055443659585, 'weight_decay': 1.6705751204827076e-05}. 
[I 2024-04-21 01:21:15,094] Trial 38 finished with values: [5.391928153558039, 0.16962781359958698, -0.008216066564383784, 67.25081623838575] and parameters: {'dropout': 0.553678472298213, 'num_heads': 2, 'bias': False, 'loss_fn': 'MSE', 'optimizer': 'RMSprop', 'lr': 0.0008967339544398752, 'weight_decay': 0.006515187092911549}. 
[I 2024-04-21 01:21:33,197] Trial 39 finished with values: [5.325675403409699, 0.2339412419087097, 0.006067725873077245, 66.2980475489596] and parameters: {'dropout': 0.27365393415702083, 'num_heads': 2, 'bias': True, 'loss_fn': 'MSE', 'optimizer': 'RMSprop', 'lr': 0.004378149122665535, 'weight_decay': 0.0001004548037454834}. 
[I 2024-04-21 01:21:53,294] Trial 40 finished with values: [5.340007076054581, 0.14095394412929638, -0.07160723933952129, 71.47918380047349] and parameters: {'dropout': 0.22784278806787983, 'num_heads': 8, 'bias': True, 'loss_fn': 'MAE', 'optimizer': 'RMSprop', 'lr': 0.03360303094363604, 'weight_decay': 0.00554928351169453}. 
[I 2024-04-21 01:22:02,710] Trial 41 finished with values: [5.3281593056102015, 0.20829684815321212, -0.004863505782391364, 67.02719110826253] and parameters: {'dropout': 0.250127375517484, 'num_heads': 8, 'bias': True, 'loss_fn': 'MSE', 'optimizer': 'RMSprop', 'lr': 0.00012653702848240087, 'weight_decay': 0.00014714370666574225}. 
[I 2024-04-21 01:22:12,809] Trial 42 finished with values: [5.381621076962638, -0.14095394412929638, -0.10030148846024312, 73.39317003686809] and parameters: {'dropout': 0.6291092209134173, 'num_heads': 2, 'bias': True, 'loss_fn': 'MAE', 'optimizer': 'SGD', 'lr': 0.0016843039792363457, 'weight_decay': 0.0035829163620928256}. 
[I 2024-04-21 01:22:29,385] Trial 43 finished with values: [5.306545919200449, 0.20092165691754785, -0.059626176265333175, 70.6800135651802] and parameters: {'dropout': 0.564828765402576, 'num_heads': 1, 'bias': False, 'loss_fn': 'MAE', 'optimizer': 'RMSprop', 'lr': 0.001259987046706076, 'weight_decay': 0.0008862509658684476}. 
[W 2024-04-21 01:25:50,605] Trial 44 failed with parameters: {'dropout': 0.3489950939306745, 'num_heads': 4, 'bias': False, 'loss_fn': 'MSE', 'optimizer': 'SGD', 'lr': 0.004771990331220608, 'weight_decay': 3.593338407294597e-05} because of the following error: The value nan is not acceptable.
[W 2024-04-21 01:25:50,605] Trial 44 failed with value [nan, nan, nan, nan].
[I 2024-04-21 01:26:18,140] Trial 45 finished with values: [5.345675026631282, 0.20184151578850243, -0.07619097726173818, 71.78493187066876] and parameters: {'dropout': 0.30284491979918227, 'num_heads': 2, 'bias': True, 'loss_fn': 'MAE', 'optimizer': 'SGD', 'lr': 0.03874246436974225, 'weight_decay': 2.6677748090372356e-05}. 
[I 2024-04-21 01:26:33,890] Trial 46 finished with values: [5.288706385652079, 0.20095879099018849, -0.01839319540332629, 67.92965904210574] and parameters: {'dropout': 0.5356496528379955, 'num_heads': 2, 'bias': False, 'loss_fn': 'MSE', 'optimizer': 'Adam', 'lr': 0.0008974100862471255, 'weight_decay': 0.0012646218294935334}. 
[I 2024-04-21 01:26:54,540] Trial 47 finished with values: [5.415056166295789, -0.19863680846115128, -0.11633251523126265, 74.46248411670042] and parameters: {'dropout': 0.6295910824141683, 'num_heads': 4, 'bias': True, 'loss_fn': 'MAE', 'optimizer': 'Adam', 'lr': 0.027580569093660495, 'weight_decay': 0.09821930503107756}. 
[W 2024-04-21 01:30:12,746] Trial 48 failed with parameters: {'dropout': 0.6239961004324892, 'num_heads': 8, 'bias': False, 'loss_fn': 'MSE', 'optimizer': 'SGD', 'lr': 0.054649711511415885, 'weight_decay': 0.0021206793728471922} because of the following error: The value nan is not acceptable.
[W 2024-04-21 01:30:12,746] Trial 48 failed with value [nan, nan, nan, nan].
[I 2024-04-21 01:30:34,744] Trial 49 finished with values: [5.441322534152611, -0.20184151578850243, -0.12675522378095128, 75.15770777026695] and parameters: {'dropout': 0.6656253300902314, 'num_heads': 4, 'bias': False, 'loss_fn': 'MAE', 'optimizer': 'SGD', 'lr': 0.00022777207533889764, 'weight_decay': 0.03507001355426416}. 
[I 2024-04-21 01:30:49,809] Trial 50 finished with values: [5.556602406808157, 0.19863680846115128, -0.16150570195742397, 77.47566133155625] and parameters: {'dropout': 0.4647322490943846, 'num_heads': 2, 'bias': True, 'loss_fn': 'MAE', 'optimizer': 'SGD', 'lr': 0.00018822359170770343, 'weight_decay': 0.007426643828704221}. 
[W 2024-04-21 01:31:02,195] Trial 51 failed with parameters: {'dropout': 0.3007600316127121, 'num_heads': 1, 'bias': True, 'loss_fn': 'MAE', 'optimizer': 'RMSprop', 'lr': 0.0069547723874899756, 'weight_decay': 0.017126739331670113} because of the following error: The value nan is not acceptable.
[W 2024-04-21 01:31:02,195] Trial 51 failed with value [5.385087625260086, nan, -0.10212086040416701, 73.51452720655398].
[W 2024-04-21 01:34:21,679] Trial 52 failed with parameters: {'dropout': 0.5085390295247321, 'num_heads': 2, 'bias': False, 'loss_fn': 'MSE', 'optimizer': 'SGD', 'lr': 0.00012074483188061502, 'weight_decay': 0.0195162984494365} because of the following error: The value nan is not acceptable.
[W 2024-04-21 01:34:21,679] Trial 52 failed with value [nan, nan, nan, nan].
[W 2024-04-21 01:34:43,068] Trial 53 failed with parameters: {'dropout': 0.6989374373853124, 'num_heads': 8, 'bias': False, 'loss_fn': 'MSE', 'optimizer': 'Adam', 'lr': 0.02836585438338769, 'weight_decay': 0.0006315519981244595} because of the following error: The value nan is not acceptable.
[W 2024-04-21 01:34:43,068] Trial 53 failed with value [5.505970324341771, nan, -0.14793249565290822, 76.57029071386594].
[I 2024-04-21 01:34:55,118] Trial 54 finished with values: [5.336930156615446, 0.1328766033611714, -0.06804190417663802, 71.24136602726108] and parameters: {'dropout': 0.4953786927067213, 'num_heads': 2, 'bias': True, 'loss_fn': 'MAE', 'optimizer': 'RMSprop', 'lr': 0.006796980793649618, 'weight_decay': 0.009158463724496873}. 
[I 2024-04-21 01:35:13,088] Trial 55 finished with values: [5.306715753397552, 0.25100086088377793, -0.04433526317804515, 69.66006712685922] and parameters: {'dropout': 0.6586733276831351, 'num_heads': 4, 'bias': True, 'loss_fn': 'MAE', 'optimizer': 'Adam', 'lr': 0.0004399465845986358, 'weight_decay': 0.0005832301624195837}. 
[W 2024-04-21 01:38:33,359] Trial 56 failed with parameters: {'dropout': 0.6805307178698838, 'num_heads': 2, 'bias': False, 'loss_fn': 'MAE', 'optimizer': 'SGD', 'lr': 0.05828072615153949, 'weight_decay': 0.0017869428770986126} because of the following error: The value nan is not acceptable.
[W 2024-04-21 01:38:33,359] Trial 56 failed with value [nan, nan, nan, nan].
[I 2024-04-21 01:38:45,296] Trial 57 finished with values: [5.45161432205051, 0.15643521248968578, -0.11044349713056412, 74.0696702276457] and parameters: {'dropout': 0.593387585451479, 'num_heads': 2, 'bias': False, 'loss_fn': 'MAE', 'optimizer': 'RMSprop', 'lr': 0.00012567878255108258, 'weight_decay': 8.309376072809093e-05}. 
[W 2024-04-21 01:42:03,318] Trial 58 failed with parameters: {'dropout': 0.551639559924983, 'num_heads': 4, 'bias': True, 'loss_fn': 'MSE', 'optimizer': 'SGD', 'lr': 0.009130429648922274, 'weight_decay': 0.006771470660806155} because of the following error: The value nan is not acceptable.
[W 2024-04-21 01:42:03,318] Trial 58 failed with value [nan, nan, nan, nan].
[I 2024-04-21 01:42:22,513] Trial 59 finished with values: [5.405732377853689, 0.23344991252556407, -0.014022979290333248, 67.6381534705486] and parameters: {'dropout': 0.4520295257103348, 'num_heads': 1, 'bias': True, 'loss_fn': 'MSE', 'optimizer': 'RMSprop', 'lr': 0.0005763062233516245, 'weight_decay': 0.0002587068960219466}. 
[W 2024-04-21 01:42:33,784] Trial 60 failed with parameters: {'dropout': 0.4220105789537574, 'num_heads': 4, 'bias': False, 'loss_fn': 'MAE', 'optimizer': 'SGD', 'lr': 0.0008629683509050782, 'weight_decay': 0.00012887909691486728} because of the following error: The value nan is not acceptable.
[W 2024-04-21 01:42:33,784] Trial 60 failed with value [5.420604597847093, nan, -0.11862517464025157, 74.61541087687051].
[W 2024-04-21 01:42:50,400] Trial 61 failed with parameters: {'dropout': 0.3180558672615532, 'num_heads': 4, 'bias': False, 'loss_fn': 'MAE', 'optimizer': 'Adam', 'lr': 0.018857426799268995, 'weight_decay': 0.0037265276358524695} because of the following error: The value nan is not acceptable.
[W 2024-04-21 01:42:50,400] Trial 61 failed with value [5.343557222436542, nan, -0.07461597777859996, 71.67987502389879].
[I 2024-04-21 01:43:08,650] Trial 62 finished with values: [5.4626541996993865, 0.2054688539350365, -0.07034845988164462, 71.39521970903148] and parameters: {'dropout': 0.2864316147243036, 'num_heads': 4, 'bias': False, 'loss_fn': 'MSE', 'optimizer': 'Adam', 'lr': 0.0003759394711991868, 'weight_decay': 1.7389381795975686e-05}. 
[W 2024-04-21 01:46:25,015] Trial 63 failed with parameters: {'dropout': 0.36358754696108275, 'num_heads': 1, 'bias': True, 'loss_fn': 'MSE', 'optimizer': 'SGD', 'lr': 0.00011139162299502507, 'weight_decay': 0.025701351511337362} because of the following error: The value nan is not acceptable.
[W 2024-04-21 01:46:25,015] Trial 63 failed with value [nan, nan, nan, nan].
[W 2024-04-21 01:49:38,431] Trial 64 failed with parameters: {'dropout': 0.30667657750617366, 'num_heads': 4, 'bias': False, 'loss_fn': 'MSE', 'optimizer': 'SGD', 'lr': 0.007163501531869472, 'weight_decay': 0.06479030586905747} because of the following error: The value nan is not acceptable.
[W 2024-04-21 01:49:38,431] Trial 64 failed with value [nan, nan, nan, nan].
[W 2024-04-21 01:49:48,293] Trial 65 failed with parameters: {'dropout': 0.4396020802137798, 'num_heads': 4, 'bias': True, 'loss_fn': 'MAE', 'optimizer': 'Adam', 'lr': 0.0621322823828788, 'weight_decay': 0.0024456361610545314} because of the following error: The value nan is not acceptable.
[W 2024-04-21 01:49:48,293] Trial 65 failed with value [5.343983467040944, nan, -0.07497623442735879, 71.70390514451262].
[I 2024-04-21 01:49:58,254] Trial 66 finished with values: [5.322335828169029, 0.15837870504165913, -0.03641179245018211, 69.13154958824715] and parameters: {'dropout': 0.28060307774751625, 'num_heads': 2, 'bias': False, 'loss_fn': 'MAE', 'optimizer': 'Adam', 'lr': 0.0009181384288823589, 'weight_decay': 0.06365096467069543}. 
[W 2024-04-21 01:50:28,816] Trial 67 failed with parameters: {'dropout': 0.34456870349046664, 'num_heads': 1, 'bias': False, 'loss_fn': 'MSE', 'optimizer': 'RMSprop', 'lr': 0.06561667777312186, 'weight_decay': 0.001946661150223292} because of the following error: The value nan is not acceptable.
[W 2024-04-21 01:50:28,816] Trial 67 failed with value [5.381259819316201, nan, -0.01941920463820801, 67.99809671216691].
[W 2024-04-21 01:50:43,877] Trial 68 failed with parameters: {'dropout': 0.5935718611247882, 'num_heads': 8, 'bias': True, 'loss_fn': 'MSE', 'optimizer': 'SGD', 'lr': 0.014312780833682632, 'weight_decay': 7.448759350842964e-05} because of the following error: The value nan is not acceptable.
[W 2024-04-21 01:50:43,877] Trial 68 failed with value [5.345163203856956, nan, -0.0758223971174945, 71.76034654975227].
[I 2024-04-21 01:50:54,554] Trial 69 finished with values: [5.34586911589826, 0.14095394412929638, -0.0763309809280388, 71.7942705046653] and parameters: {'dropout': 0.6130479149065349, 'num_heads': 2, 'bias': False, 'loss_fn': 'MAE', 'optimizer': 'Adam', 'lr': 0.027778190725525887, 'weight_decay': 0.0010044386872116438}. 
[I 2024-04-21 01:51:02,971] Trial 70 finished with values: [5.73877945203391, 0.025048845611711404, -0.206325034840523, 80.46523551074917] and parameters: {'dropout': 0.25399504942965284, 'num_heads': 4, 'bias': False, 'loss_fn': 'MSE', 'optimizer': 'Adam', 'lr': 0.005652710045244624, 'weight_decay': 0.09030204573952524}. 
[I 2024-04-21 01:51:27,101] Trial 71 finished with values: [5.36720229867002, 0.20288988110710854, -0.00876832264141747, 67.28765325495868] and parameters: {'dropout': 0.35678171751055654, 'num_heads': 2, 'bias': True, 'loss_fn': 'MSE', 'optimizer': 'RMSprop', 'lr': 0.002159091901219909, 'weight_decay': 0.026150240107081776}. 
